MovieId;Title;Character1;PersonName1;Sex1;ActorId1;Character2;PersonName2;Sex2;ActorId2;Character3;PersonName3;Sex3;ActorId3;Character4;PersonName4;Sex4;ActorId4;Overview
318917;Look Who's Back;Adolf Hitler;Oliver Masucci;Male;213581;Fabian Sawatzki;Fabian Busch;Male;17543;Bellini;Katja Riemann;Female;1874;Sensenbrink;Christoph Maria Herbst;Male;5649;Adolf Hitler wakes up in a vacant lot in Berlin, with no knowledge of anything that happened after 1945. Homeless and destitute. Although everyone recognizes him, nobody believes that he is Hitler, instead, they think he is either a comedian, or a method actor.
283350;Before We Go;Nick Vaughan;Chris Evans;Male;16828;Brooke Dalton;Alice Eve;Female;59860;Hannah Dempsey;Emma Fitzpatrick;Female;1011107;Danny;Mark Kassen;Unknown;176557;A woman who is robbed on her way to catch the 1:30 train to Boston is left stranded in New York City. She meets a man who helps her during the course of the night and the two form a romance.
265208;Wild Card;Nick Wild;Jason Statham;Male;976;Cyrus Kinnick;Michael Angarano;Male;11665;Holly;Dominik Garcia;Female;58635;Danny DeMarco;Milo Ventimiglia;Male;16501;When a Las Vegas bodyguard with lethal skills and a gambling problem gets in trouble with the mob, he has one last play… and it's all or nothing.
291270;Anomalisa;Michael Stone (voice);David Thewlis;Male;11207;Lisa Hesselman (voice);Jennifer Jason Leigh;Female;10431;Everyone Else (voice);Tom Noonan;Male;119232;;;Unknown;0;An inspirational speaker becomes reinvigorated after meeting a lively woman who shakes up his mundane existence.
268920;Hot Pursuit;Cooper;Reese Witherspoon;Female;368;Daniella;Sofía Vergara;Female;63522;Dixon;Michael Mosley;Male;72994;Captain Emmett;John Carroll Lynch;Male;3911;An uptight by-the-book cop must protect the widow of a drug boss from crooked cops and gunmen.
245168;Suffragette;Maud Watts;Carey Mulligan;Female;36662;Edith Ellyn;Helena Bonham Carter;Female;1283;Arthur Steed;Brendan Gleeson;Male;2039;Violet Cambridge;Anne-Marie Duff;Female;37058;Based on true events about the foot soldiers of the early feminist movement who were forced underground to evade the State.
314405;Tale of Tales;Queen of Longtrellis;Salma Hayek;Female;3136;King of Strongcliff;Vincent Cassel;Male;1925;King of Highhills;Toby Jones;Male;13014;Imma;Shirley Henderson;Female;1834;The Queen of Selvascura risks everything to be a mother, the King of Roccaforte falls in love with the voice of a mysterious girl, the King of Altomonte becomes obsessed with a flea and neglects his daughter.
283587;Beasts of No Nation;Agu;Abraham Attah;Male;1421427;Commandant;Idris Elba;Male;17605;Strika;Emmanuel Nii Adom Quaye;Unknown;2427355;Sergeant Gaz;Opeyemi Fagbohungbe;Male;1345967;Based on the experiences of Agu, a child fighting in the civil war of an unnamed, fictional West African country. Follows Agu's journey as he's forced to join a group of soldiers. While he fears his commander and many of the men around him, his fledgling childhood has been brutally shattered by the war raging through his country, and he is at first torn between conflicting revulsion and fascination.
296100;The Night Before;Ethan;Joseph Gordon-Levitt;Male;24045;Isaac;Seth Rogen;Male;19274;Chris;Anthony Mackie;Male;53650;Diana;Lizzy Caplan;Female;51988;In New York City for their annual tradition of Christmas Eve debauchery, three lifelong best friends set out to find the Holy Grail of Christmas parties since their yearly reunion might be coming to an end.
303857;Dragon Ball Z: Resurrection 'F';Son Goku / Son Gohan / Son Goten (voice);Masako Nozawa;Female;90496;Vegeta (voice);Ryou Horikawa;Male;122501;Frieza (voice);Ryusei Nakao;Male;115305;Beerus (voice);Koichi Yamadera;Male;20664;One peaceful day on Earth, two remnants of Frieza's army named Sorbet and Tagoma arrive searching for the Dragon Balls with the aim of reviving Frieza. They succeed, and Frieza subsequently seeks revenge on the Saiyans.
287424;Maggie;Wade Vogel;Arnold Schwarzenegger;Male;1100;Maggie Vogel;Abigail Breslin;Female;17140;Caroline;Joely Richardson;Female;20810;Ray;Douglas M. Griffin;Male;60881;There's a deadly zombie epidemic threatening humanity, but Wade, a small-town farmer and family man, refuses to accept defeat even when his daughter Maggie becomes infected. As Maggie's condition worsens and the authorities seek to eradicate those with the virus, Wade is pushed to the limits in an effort to protect her. Joely Richardson co-stars in this post-apocalyptic thriller.
298382;The Dressmaker;"Myrtle ""Tilly"" Dunnage";Kate Winslet;Female;204;Teddy McSwiney;Liam Hemsworth;Male;96066;Elsbeth;Caroline Goodall;Female;6692;Molly Dunnage;Judy Davis;Female;351;In 1950s Australia, beautiful, talented dressmaker Tilly returns to her tiny hometown to right wrongs from her past. As she tries to reconcile with her mother, she starts to fall in love while transforming the fashion of the town.
181283;Child 44;Leo Demidov;Tom Hardy;Male;2524;General Mikhail Nesterov;Gary Oldman;Male;64;Raisa Demidov;Noomi Rapace;Female;87722;Alexei Andreyev;Fares Fares;Male;57012;Set in Stalin-era Soviet Union, a disgraced MGB agent is dispatched to investigate a series of child murders -- a case that begins to connect with the very top of party leadership.
330764;The Brand New Testament;Ea;Pili Groyne;Female;1381361;God;Benoît Poelvoorde;Male;47820;God's Wife;Yolande Moreau;Female;2415;Martine;Catherine Deneuve;Female;50;God lives in Brussels. On Earth though, God is a coward, with pathetical morals and being odious with his family. His daughter, Ea, is bored at home and can't stand being locked up in a small apartment in ordinary Brussels, until the day she decides to revolt against her dad...
258509;Alvin and the Chipmunks: The Road Chip;Dave;Jason Lee;Male;11662;Alvin (voice);Justin Long;Male;15033;Ashley Grey;Bella Thorne;Female;98285;Simon (voice);Matthew Gray Gubler;Male;5661;Through a series of misunderstandings, Alvin, Simon and Theodore come to believe that Dave is going to propose to his new girlfriend in New York City - and dump them. They have three days to get to him and stop the proposal.
252838;The Wedding Ringer;Jimmy Callahan / Bic;Kevin Hart;Male;55638;Doug Harris;Josh Gad;Male;54415;Gretchen Palmer;Kaley Cuoco;Female;53862;Reggie / DrysDale;Affion Crockett;Male;98394;"Doug Harris is a loveable but socially awkward groom-to-be with a problem: he has no best man.  With less than two weeks to go until he marries the girl of his dreams, Doug is referred to Jimmy Callahan, owner and CEO of Best Man, Inc., a company that provides flattering best men for socially challenged guys in need.  What ensues is a hilarious wedding charade as they try to pull off the big con, and an unexpected budding bromance between Doug and his fake best man Jimmy."
294016;Trumbo;Dalton Trumbo;Bryan Cranston;Male;17419;Cleo Trumbo;Diane Lane;Female;2882;Hedda Hopper;Helen Mirren;Female;15735;Nikola Trumbo;Elle Fanning;Female;18050;The career of screenwriter Dalton Trumbo is halted by a witch hunt in the late 1940s when he defies the anti-communist HUAC committee and is blacklisted.
365222;Ip Man 3;Ip Man;Donnie Yen;Male;1341;Cheung Wing-Sing;Lynn Hung;Female;117760;Cheung Tin-chi;Zhang Jin;Male;1183808;Ma King-Sang;Patrick Tam;Male;80374;When a band of brutal gangsters led by a crooked property developer make a play to take over the city, Master Ip is forced to take a stand.
227973;The Peanuts Movie;Charlie Brown (voice);Noah Schnapp;Male;1393177;Snoopy / Woodstock (voice);Bill Melendez;Male;94011;Franklin Armstrong (voice);Marleik 'Mar Mar' Walker;Unknown;1393184;Linus (voice);Alex Garfin;Male;1393181;Snoopy embarks upon his greatest mission as he and his team take to the skies to pursue their arch-nemesis, while his best pal Charlie Brown begins his own epic quest.
256961;Paul Blart: Mall Cop 2;Paul Blart;Kevin James;Male;32895;Divina Martinez;Daniella Alonso;Female;59296;Vincent Sofel;Neal McDonough;Male;2203;Lane;David Henrie;Male;95136;Security guard Paul Blart is headed to Las Vegas to attend a Security Guard Expo with his teenage daughter Maya before she departs for college. While at the convention, he inadvertently discovers a heist - and it's up to Blart to apprehend the criminals.
287948;The Transporter Refueled;Frank Martin Jr.;Ed Skrein;Male;1047649;Frank Martin Sr.;Ray Stevenson;Male;56614;Anna;Loan Chabanol;Female;1381175;Gina;Gabriella Wright;Female;118200;The fast-paced action movie is again set in the criminal underworld in France, where Frank Martin is known as The Transporter, because he is the best driver and mercenary money can buy. In this installment, he meets Anna and they attempt to take down a group of ruthless Russian human traffickers who also have kidnapped Frank’s father.
225728;Macbeth;Macbeth;Michael Fassbender;Male;17288;Lady Macbeth;Marion Cotillard;Female;8293;Banquo;Paddy Considine;Male;14887;Macduff;Sean Harris;Male;16702;Feature film adaptation of Shakespeare's Scottish play about General Macbeth whose ambitious wife urges him to use wicked means in order to gain power of the throne over the sitting king, Duncan.
308639;Dope;Malcolm Adekanbi;Shameik Moore;Male;587506;Cassandra 'Diggy' Andrews;Kiersey Clemons;Female;1253355;James 'Jib' Caldones;Tony Revolori;Male;1291350;Nakia;Zoë Kravitz;Female;37153;Malcolm is carefully surviving life in a tough neighborhood in Los Angeles while juggling college applications, academic interviews, and the SAT. A chance invitation to an underground party leads him into an adventure that could allow him to go from being a geek, to being dope, to ultimately being himself.
266294;Sisters;Maura Ellis;Amy Poehler;Female;56322;Kate Ellis;Tina Fey;Female;56323;Brinda;Maya Rudolph;Female;52792;Deana Ellis;Dianne Wiest;Female;1902;Two disconnected sisters are summoned to clean out their childhood bedrooms before their parents sell their family home.
301875;Equals;Silas;Nicholas Hoult;Male;3292;Nia;Kristen Stewart;Female;37917;Jonas;Guy Pearce;Male;529;Bess;Jacki Weaver;Female;67837;A futuristic love story set in a world where emotions have been eradicated.
243940;The Lazarus Effect;Eva;Sarah Bolger;Female;33397;President Dalley;Amy Aquino;Female;33457;Zoe McConnell;Olivia Wilde;Female;59315;Clay;Evan Peters;Male;55089;Medical researcher Frank, his fiancee Zoe and their team have achieved the impossible: they have found a way to revive the dead. After a successful, but unsanctioned, experiment on a lifeless animal, they are ready to make their work public. However, when their dean learns what they've done, he shuts them down. Zoe is killed during an attempt to recreate the experiment, leading Frank to test the process on her. Zoe is revived -- but something evil is within her.
315465;The Boy and the Beast;Kumatetsu (voice);Koji Yakusho;Male;18056;Kyuta (Young) (voice);Aoi Miyazaki;Female;104522;Kyuta (Teen) (voice);Shota Sometani;Male;1018944;Kaede (voice);Suzu Hirose;Female;1454976;Kyuta, a boy living in Shibuya, and Kumatetsu, a lonesome beast from Jutengai, an imaginary world. One day, Kyuta forays into the imaginary world and, as he's looking for his way back, meets Kumatetsu who becomes his spirit guide. That encounter leads them to many adventures.
336804;Mustang;Lale;Güneş Nezihe Şensoy;Female;1481832;Nur;Doğa Zeynep Doğuşlu;Female;1481833;Ece;Elit İşcan;Female;46063;Selma;Tuğba Sunguroğlu;Female;1481835;In a Turkish village, five orphaned sisters live under strict rule while members of their family prepare their arranged marriages.
304357;Woman in Gold;Maria Altmann;Helen Mirren;Female;15735;Randol Schoenberg;Ryan Reynolds;Male;10859;Young Maria Altmann;Tatiana Maslany;Female;61134;Pam Schoenberg;Katie Holmes;Female;3897;Maria Altmann, an octogenarian Jewish refugee, takes on the Austrian government to recover a world famous painting of her aunt plundered by the Nazis during World War II, she believes rightfully belongs to her family. She did so not just to regain what was rightfully hers, but also to obtain some measure of justice for the death, destruction, and massive art theft perpetrated by the Nazis.
335578;Land of Mine;Sgt. Carl Rasmussen;Roland Møller;Male;141876;Lt. Ebbe Jensen;Mikkel Boe Følsgaard;Male;1013156;Karin;Laura Bro;Female;34867;Sebastian Schumann;Louis Hofmann;Male;1037348;In the days following the surrender of Germany in May 1945, a group of young German prisoners of war is handed over to the Danish authorities and subsequently sent to the West Coast, where they are ordered to remove the more than two million mines that the Germans had placed in the sand along the coast. With their bare hands, crawling around in the sand, the boys are forced to perform the dangerous work under the leadership of a Danish sergeant.
331836;Babysitting 2;Franck;Philippe Lacheau;Male;1186076;Sonia;Alice David;Female;1306309;Ernest;Vincent Desagnat;Male;76825;Sam;Tarek Boudali;Male;1186075;Franck and his girlfriend Sonya, plus some of their friends go on holiday in Brazil. Franck, his friends, two girls and Sonya's grandmother leave to visit a cave, but everything goes wrong and their crazy adventures begin.
146301;Paranormal Activity: The Ghost Dimension;Laura;Cara Pifko;Female;265855;Skyler;Olivia Taylor Dudley;Female;999817;Emily;Brit Shaw;Female;1386222;Katie;Chloe Csengery;Female;995457;Using a special camera that can see spirits, a family must protect their daughter from an evil entity with a sinister plan.
290751;Secret in Their Eyes;Ray;Chiwetel Ejiofor;Male;5294;Claire;Nicole Kidman;Female;2227;Jess;Julia Roberts;Female;1204;Bumpy;Dean Norris;Male;14329;A tight-knit team of FBI investigators, along with their District Attorney supervisor, is suddenly torn apart when they discover that one of their own teenage daughters has been brutally murdered.
347969;The Ridiculous 6;Tommy aka White Knife;Adam Sandler;Male;19292;Lil' Pete;Taylor Lautner;Male;84214;Doc Griffin;Steve Buscemi;Male;884;Clem;Steve Zahn;Male;18324;"When his long-lost outlaw father returns, Tommy ""White Knife"" Stockburn goes on an adventure-filled journey across the Old West with his five brothers."
86828;Absolutely Anything;Neil Clarke;Simon Pegg;Male;11108;Catherine;Kate Beckinsale;Female;3967;Grant;Rob Riggle;Male;71403;Ray;Sanjeev Bhaskar;Male;145997;Eccentric aliens give a man the power to do anything he wants to determine if Earth is worth saving.
263109;Shaun the Sheep Movie;Shaun / Timmy (voice);Justin Fletcher;Male;224354;Trumper (voice);Omid Djalili;Male;41379;Shirley (voice);Richard Webber;Unknown;1043416;Timmy's Mum / Meryl (voice);Kate Harbour;Unknown;124557;When Shaun decides to take the day off and have some fun, he gets a little more action than he bargained for. A mix up with the Farmer, a caravan and a very steep hill lead them all to the Big City and it's up to Shaun and the flock to return everyone safely to the green grass of home.
356296;Suburra;Filippo Malgradi;Pierfrancesco Favino;Male;17839;Samurai;Claudio Amendola;Male;23961;Numero 8;Alessandro Borghi;Male;1395660;Sebastiano;Elio Germano;Male;59269;"A gangster known as ""Samurai"" wants to turn the waterfront of Rome into a new Las Vegas. All the local mob bosses have agreed to work for this common goal. But peace is not to last long."
182560;Dark Places;Libby Day;Charlize Theron;Female;6885;Lyle Wirth;Nicholas Hoult;Male;3292;Young Diondra Wertzner;Chloë Grace Moretz;Female;56734;Patty Day;Christina Hendricks;Female;110014;A woman who survived the brutal killing of her family as a child is forced to confront the events of that day.
336882;The Wave;Kristian Eikjord;Kristoffer Joner;Male;7742;Idun Karlsen;Ane Dahl Torp;Female;63769;Sondre Eikjord;Jonas Hoff Oftebro;Male;937065;Julia Eikjord;Edith Haagenrud-Sande;Female;1544539;Although theorised, no one is really ready when a mountain pass above the scenic and narrow Geiranger fjord in Norway collapses and creates a tsunami over 300 feet high. A geologist is one of those caught in the middle of it.
347201;Boruto: Naruto the Movie;Boruto Uzumaki (voice);Yuko Sanpei;Female;1201637;Sarada Uchiha (voice);Kokoro Kikuchi;Female;1246233;Naruto Uzumaki (voice);Junko Takeuchi;Female;82055;Sasuke Uchiha (voice);Noriaki Sugiyama;Male;82056;The spirited Boruto Uzumaki, son of Seventh Hokage Naruto, is a skilled ninja who possesses the same brashness and passion his father once had. However, the constant absence of his father, who is busy with his Hokage duties, puts a damper on Boruto's fire. He ends up meeting his father's friend Sasuke, and requests to become... his apprentice!? The curtain on the story of the new generation rises!
306952;Naomi and Ely's No Kiss List;Naomi Mills;Victoria Justice;Female;191228;Ely Diamond;Pierson Fodé;Male;1310521;Gabriel;Matthew Daddario;Male;1272291;Bruce 2;Ryan Ward;Unknown;1391765;The bonds between Naomi and Ely are tested when they fall for the same guy.
331781;Amy;Herself (archive footage);Amy Winehouse;Female;558820;Himself;Mark Ronson;Male;77071;Himself;Tony Bennett;Male;138986;Himself;Pete Doherty;Male;208635;A documentary on the life of Amy Winehouse, the immensely talented yet doomed songstress. We see her from her teen years, where she already showed her singing abilities, to her finding success and then her downward spiral into alcoholism and drugs.
293970;The Final Girls;Max Cartwright;Taissa Farmiga;Female;527313;Nancy / Amanda Cartwright;Malin Åkerman;Female;50463;Vicki Summers;Nina Dobrev;Female;19961;Chris Briggs;Alexander Ludwig;Male;23498;A young woman grieving the loss of her mother, a famous scream queen from the 1980s, finds herself pulled into the world of her mom's most famous movie. Reunited, the women must fight off the film's maniacal killer.
271674;Suite Française;Lucille Angellier;Michelle Williams;Female;1812;Madame Angellier;Kristin Scott Thomas;Female;5470;Lieutenant Bruno Von Falk;Matthias Schoenaerts;Male;73381;Benoit Labarie;Sam Riley;Male;32987;France, 1940. In the first days of occupation, beautiful Lucile Angellier is trapped in a stifled existence with her controlling mother-in-law as they both await news of her husband: a prisoner of war. Parisian refugees start to pour into their small town, soon followed by a regiment of German soldiers who take up residence in the villagers' own homes. Lucile initially tries to ignore Bruno von Falk, the handsome and refined German officer staying with them. But soon, a powerful love draws them together and leads them into the tragedy of war.
290764;Tracers;Cam;Taylor Lautner;Male;84214;Nikki;Marie Avgeropoulos;Female;140114;Miller;Adam Rayner;Male;144292;Dylan;Rafi Gavron;Male;21660;Wanted by the mafia, a New York City bike messenger escapes into the world of parkour after meeting a beautiful stranger.
320007;Victoria;Victoria;Laia Costa;Female;1425019;Sonne;Frederick Lau;Male;49767;Boxer;Franz Rogowski;Male;1285450;Blinker;Burak Yiğit;Male;520561;A young Spanish woman who has newly moved to Berlin finds her flirtation with a local guy turn potentially deadly as their night out with his friends reveals a dangerous secret.
254302;High-Rise;Dr. Robert Laing;Tom Hiddleston;Male;91606;Helen Wilder;Elisabeth Moss;Female;32798;Charlotte Melville;Sienna Miller;Female;23459;Anthony Royal;Jeremy Irons;Male;16940;Life for the residents of a tower block begins to run out of control.
319341;Daddy or Mommy;Florence Leroy;Marina Foïs;Female;76820;Vincent Leroy;Laurent Lafitte;Male;93532;Mathias Leroy;Alexandre Desrousseaux;Male;1422336;Emma Leroy;Anna Lemarchand;Female;1139386;Florence and Vincent Leroy are a model couple. They have great jobs, a perfect marriage and delightful children. And now they want their divorce to be an equal success. But when they are both simultaneously promoted to their dream jobs, their relationship becomes a nightmare. From that moment on, the gloves are off, the two exes declare war and will do everything in their power to NOT have custody of their children.
252512;While We're Young;Josh Schrebnick;Ben Stiller;Male;7399;Cornelia Schrebnick;Naomi Watts;Female;3489;Jamie Massey;Adam Driver;Male;1023139;Darby Massey;Amanda Seyfried;Female;71070;An uptight documentary filmmaker and his wife find their lives loosened up a bit after befriending a free-spirited younger couple.
248574;Barely Lethal;Megan Walsh;Hailee Steinfeld;Female;130640;Heather;Sophie Turner;Female;1001657;Victoria Knox;Jessica Alba;Female;56731;Hardman;Samuel L. Jackson;Male;2231;"A 16-year-old international assassin yearning for a ""normal"" adolescence fakes her own death and enrolls as a senior in a suburban high school. She quickly learns that being popular can be more painful than getting water-boarded."
342878;One Wild Moment;Laurent;Vincent Cassel;Male;1925;Antoine;François Cluzet;Male;33161;Marie;Alice Isaaz;Female;1288047;Louna;Lola Le Lann;Female;1473238;Antoine and Laurent, old friends, spend their vacation in Corsica with their respective daughters: seventeen-year-old Louna and eighteen-year-old Marie. One evening at the beach, Louna seduces Laurent. Louna is in love, but for Laurent it was nothing more than a momentary distraction. Without revealing her lover's name, Louna confides in her father, who tries by any means to discover who his daughter's lover is. How long will the secret be able to be kept hidden?
308504;Last Knights;Raiden;Clive Owen;Male;2296;Bartok;Morgan Freeman;Male;192;Gezza Mott;Aksel Hennie;Male;76547;Maria;Shohreh Aghdashloo;Female;21041;When an evil emperor executes their leader, his band of knights – bound by duty and honour – embarks on a journey of vengeance that will not come to an end until they've destroyed their mortal foe.
250734;Far from the Madding Crowd;Bathsheba Everdene;Carey Mulligan;Female;36662;Gabriel Oak;Matthias Schoenaerts;Male;73381;William Boldwood;Michael Sheen;Male;3968;Sergeant Francis Troy;Tom Sturridge;Male;90451;Based on the literary classic by Thomas Hardy. Bathsheba Everdene, attracts three very different suitors: Gabriel Oak, a sheep farmer, captivated by her fetching willfulness, Frank Troy, a handsome and reckless Sergeant, and William Boldwood, a prosperous and mature bachelor. This timeless story of Bathsheba's choices and passions explores the nature of relationships and love – as well as the human ability to overcome hardships through resilience and perseverance.
254172;Fathers and Daughters;Katie Davis;Amanda Seyfried;Female;71070;Jake Davis;Russell Crowe;Male;934;Cameron;Aaron Paul;Male;84497;Elizabeth;Diane Kruger;Female;9824;A Pulitzer-winning writer grapples with being a widower and father after a mental breakdown, while, 27 years later, his grown daughter struggles to forge connections of her own.
336050;Son of Saul;Saul Ausländer;Géza Röhrig;Male;1454942;Abraham;Levente Molnár;Male;1454944;Eli Biedermann (Oberkapo);Urs Rechn;Male;1457026;Bearded Prisoner;Todd Charmont;Male;1550426;In the horror of 1944 Auschwitz, a prisoner forced to burn the corpses of his own people finds moral survival trying to save from the flames the body of a boy he takes for his son.
334074;Survivor;Nash;Pierce Brosnan;Male;517;Kate Abbott;Milla Jovovich;Female;63;Sam Parker;Dylan McDermott;Male;32597;Maureen Cranepaul;Angela Bassett;Female;9780;A Foreign Service Officer in London tries to prevent a terrorist attack set to hit New York, but is forced to go on the run when she is framed for crimes she did not commit.
188222;Entourage;Ari Gold;Jeremy Piven;Male;12799;Vincent Chase;Adrian Grenier;Male;5090;Turtle;Jerry Ferrara;Male;98953;Eric Murphy;Kevin Connolly;Male;16666;Movie star Vincent Chase, together with his boys, Eric, Turtle and Johnny, are back…and back in business with super agent-turned-studio head Ari Gold. Some of their ambitions have changed, but the bond between them remains strong as they navigate the capricious and often cutthroat world of Hollywood.
359983;The Lion Guard: Return of the Roar;Kion (voice);Max Charles;Male;558928;Zazu (voice);Jeff Bennett;Male;34982;Beshte (voice);Dusan Brown;Male;973334;Tiifu (voice);Sarah Hyland;Female;91351;Set in the African savannah, the film follows Kion as he assembles the members of the 'Lion Guard'. Throughout the film, the diverse team of young animals will learn how to utilize each of their unique abilities to solve problems and accomplish tasks to maintain balance within the Circle of Life, while also introducing viewers to the vast array of animals that populate the prodigious African landscape.
325844;Serial Teachers 2;Boulard;Kev Adams;Male;1165008;Gladys;Isabelle Nanty;Female;2412;Cutiro;Didier Bourdon;Male;59031;Antoine Polochon;Pierre-François Martin-Laval;Male;35968;The worst teachers of France landed in England for an ultra-secret mission. With Boulard, the King of the Dunces, they are parachuted in the best school of the country, and they will apply their famous methods on the future of the nation.
333381;Return to Sender;Miranda Wells;Rosamund Pike;Female;10882;William Finn;Shiloh Fernandez;Male;79795;Darlene;Rumer Willis;Female;20848;Tony Desantos;Keir O'Donnell;Male;39213;A nurse living in a small town goes on a blind date with a man who is not the person he says he is.
299245;The Gallows;Cassidy;Cassidy Gifford;Female;1357480;Ryan;Ryan Shoos;Male;1354870;Pfeifer;Pfeifer Brown;Female;1401536;Reese;Reese Mishler;Male;1401537;20 years after a horrific accident during a small town school play, students at the school resurrect the failed show in a misguided attempt to honor the anniversary of the tragedy - but soon discover that some things are better left alone.
223485;Slow West;Silas;Michael Fassbender;Male;17288;Jay Cavendish;Kodi Smit-McPhee;Male;113505;Payne;Ben Mendelsohn;Male;77335;Rose Ross;Caren Pistorius;Female;1046903;In the Old West, a 17-year-old Scottish boy teams up with a mysterious gunman to find the woman with whom he is infatuated.
