MovieId;Title;Character1;PersonName1;Sex1;ActorId1;Character2;PersonName2;Sex2;ActorId2;Character3;PersonName3;Sex3;ActorId3;Character4;PersonName4;Sex4;ActorId4;Overview
2054;Mr. Holland's Opus;Glenn Holland;Richard Dreyfuss;Male;3037;Iris Holland;Glenne Headly;Female;21104;Bill Meister;Jay Thomas;Male;21105;Principal Jacobs;Olympia Dukakis;Female;3019;In 1965, passionate musician Glenn Holland takes a day job as a high school music teacher, convinced it's just a small obstacle on the road to his true calling: writing a historic opus. As the decades roll by with the composition unwritten but generations of students inspired through his teaching, Holland must redefine his life's purpose.
400;Things to Do in Denver When You're Dead;Jimmy 'The Saint' Tosnia;Andy García;Male;1271;Pieces;Christopher Lloyd;Male;1062;Franchise;William Forsythe;Male;4520;Easy Wind;Bill Nunn;Male;5502;Five different criminals face imminent death after botching a job quite badly.
15602;Grumpier Old Men;Max Goldman;Walter Matthau;Male;6837;John Gustafson;Jack Lemmon;Male;3151;Ariel Gustafson;Ann-Margret;Female;13567;Maria Sophia Coletta Ragetti;Sophia Loren;Female;16757;A family wedding reignites the ancient feud between next-door neighbors and fishing buddies John and Max. Meanwhile, a sultry Italian divorcée opens a restaurant at the local bait shop, alarming the locals who worry she'll scare the fish away. But she's less interested in seafood than she is in cooking up a hot time with Max.
14819;Heavyweights;Tony Perkis / Tony Perkis Sr.;Ben Stiller;Male;7399;"Gerald ""Gerry"" Garner";Aaron Schwartz;Male;77337;Roy;Kenan Thompson;Male;77330;Harvey Bushkin;Jerry Stiller;Male;26042;"Camp Hope is a summer retreat for overweight boys run by a kindly couple who make the campers feel comfortable with their extra pounds. But when tyrannical fitness guru Tony buys the camp, he puts the kids on a cruel regimen that goes too far. Sick of the endless weeks of ""all work and no play,"" the kids stage a coup and reclaim their summer of fun."
8512;Devil in a Blue Dress;Easy Rawlins;Denzel Washington;Male;5292;DeWitt Albright;Tom Sizemore;Male;3197;Daphne Monet;Jennifer Beals;Female;3130;Mouse Alexander;Don Cheadle;Male;1896;In late 1940s Los Angeles, Easy Rawlins is an unemployed black World War II veteran with few job prospects. At a bar, Easy meets DeWitt Albright, a mysterious white man looking for someone to investigate the disappearance of a missing white woman named Daphne Monet, who he suspects is hiding out in one of the city's black jazz clubs. Strapped for money and facing house payments, Easy takes the job, but soon finds himself in over his head.
10858;Nixon;Richard Nixon;Anthony Hopkins;Male;4173;Pat Nixon;Joan Allen;Female;11148;Alexander Haig;Powers Boothe;Male;6280;E. Howard Hunt;Ed Harris;Male;228;A look at President Richard M. Nixon—a man carrying the fate of the world on his shoulders while battling the self-destructive demands from within—spanning his troubled boyhood in California to the shocking Watergate scandal that would end his Presidency.
10824;Candyman: Farewell to the Flesh;Candyman / Daniel Robitaille;Tony Todd;Male;19384;Annie Tarrant;Kelly Rowan;Female;47757;Ethan Tarrant;William O'Leary;Male;4041;Reverend Ellis;Bill Nunn;Male;5502;The Candyman moves on to New Orleans and starts his horrific murders once more. This time, his intended victim is a school teacher. Her father was killed by the Candyman, and brother wrongly accused of the murders.
42994;Memories;Heinz Beckner (voice);Tsutomu Isobe;Male;20661;Miguel Costrela (voice);Koichi Yamadera;Male;20664;Ivanov (voice);Shozo Iizuka;Male;223309;Aoshima (voice);Shigeru Chiba;Male;105816;"In this anime anthology, a salvage ship crew happens upon a haunted vessel in ""Magnetic Rose"", a cold tablet turns a lab worker into a biological weapon in ""Stink Bomb"", and an urban populace carries on an endless war with an unseen foe in ""Cannon Fodder."""
4482;French Twist;Loli;Victoria Abril;Female;25256;Marijo;Josiane Balasko;Female;35137;Laurent Lafaye;Alain Chabat;Male;4275;Antoine;Ticky Holgado;Male;13689;After learning of her husband's infidelities, a housewife invites an itinerant lesbian to move in with them. None of their lives will ever be the same again.
6071;Kiss of Death;Jimmy Kilmartin;David Caruso;Male;16560;Calvin Hart;Samuel L. Jackson;Male;2231;Little Junior Brown;Nicolas Cage;Male;2963;Bev Kilmartin;Helen Hunt;Female;9994;Jimmy Kilmartin is an ex-con trying to stay clean and raise a family. When his cousin Ronnie causes him to take a fall for driving an illegal transport of stolen cars, Detective Calvin Hart is injured and Jimmy lands back in prison. In exchange for an early release, he is asked to help bring down a local crime boss named 'Little Junior' Brown. However, he's also sent undercover by Detective Hart to work with Little Junior and infiltrate his operations. As soon as Little Junior kills an undercover Federal agent with Jimmy watching, the unscrupulous DA and the Feds further complicate his life.
20649;Clockers;Det. Rocco Klein;Harvey Keitel;Male;1037;Det. Larry Mazilli;John Turturro;Male;1241;Rodney Little;Delroy Lindo;Male;18792;Ronald 'Strike' Dunham;Mekhi Phifer;Male;327;Strike is a young city drug pusher under the tutelage of drug lord Rodney Little. When a night manager at a fast-food restaurant is found with four bullets in his body, Strike’s older brother turns himself in as the killer. Det. Rocco Klein doesn’t buy the story, however, setting out to find the truth, and it seems that all the fingers point toward Strike & Rodney.
6715;The Cure;Erik;Brad Renfro;Male;51214;Dexter;Joseph Mazzello;Male;4787;Linda;Annabella Sciorra;Female;18750;Pony;Nicky Katt;Male;18070;Erik, a loner, finds a friend in Dexter, an eleven-year-old boy with AIDS. They vow to find a cure for AIDS together and save Dexter's life in an eventful summer.
8973;Lord of Illusions;Harry D'Amour;Scott Bakula;Male;2154;Philip Swann;Kevin J. O'Connor;Male;18916;Dorothea Swann;Famke Janssen;Female;10696;Valentin;Joel Swetow;Male;156136;During a routine case in L.A., NY private investigator Harry D'Amour stumbles over members of a fanatic cult who are preparing for the resurrection of their leader Nix, a powerful magician who was killed 13 years earlier.
10348;Thunderbolt;Chan Foh To;Jackie Chan;Male;18897;Amy Yip;Anita Yuen;Female;64895;Steve Cannon;Michael Wong Man-Tak;Male;64896;Illegal Racer;Shing Fui-On;Male;119447;In order to release his kidnapped sister, sports car mechanic Jackie Chan has to beat a super-criminal street racer.
11859;Fair Game;Max Kirkpatrick;William Baldwin;Male;13021;Kate McQueen;Cindy Crawford;Female;33665;Colonel Ilya Kazak;Steven Berkoff;Male;782;Lieutenant Meyerson;Christopher McDonald;Male;4443;Max Kirkpatrick is a cop who protects Kate McQuean, a civil law attorney, from a renegade KGB team out to terminate her
10612;The Englishman Who Went Up a Hill But Came Down a Mountain;Reginald Anson;Hugh Grant;Male;3291;Betty;Tara Fitzgerald;Female;47615;Morgan the Goat;Colm Meaney;Male;17782;George Garrad;Ian McNeice;Male;3547;When an English cartographer arrives in Wales to tell the residents of the Welsh village of Ffynnon Garw  that their 'mountain' is only a hill, the offended community sets out to remedy the situation.
9501;Crying Freeman;Yo Hinomura / Freeman;Mark Dacascos;Male;18702;Koh;Byron Mann;Male;57748;Ryuji Hanada;Masaya Kato;Male;4989;Detective Netah;Tchéky Karyo;Male;10698;A lethal assassin for a secret Chinese organisation, who sheds tears of regret each time he kills, is seen swiftly and mercilessly executing three Yakuza gangsters by a beautiful artist. She is captivated by the grace of his kill and later falls in love with him. An intense power struggle for the leadership of the Yakuza Clans ensues as they seek vengeance for the death of their leader.
79178;Savages;Mario Nardone;Antonello Fassari;Male;134538;Bebo;Ezio Greggio;Male;52329;Cinzia Nardone;Cinzia Leone;Female;134539;Jimmy;Franco Oppini;Male;78715;A group of Italian tourists on holiday in the Caribbean are stranded on a desert island when their small airplane is forced to an emergency landing. How will they manage to survive?
19286;Leprechaun 3;Leprechaun;Warwick Davis;Male;11184;Scott McCoy;John Gatins;Male;53176;Tammy Larsen;Lee Armstrong;Female;86922;Fazio;John DeMita;Male;56348;It was a normal night in Las Vegas, Nevada, all the lights were flashing brightly, until a man with one hand, one eye, and one leg walks into a pawn shop with a statue of a hideous looking Leprechaun. The owner claims it's a good luck charm. The statue also wore a medallion around it's neck. The careless pawn shop owner took off the medallion setting the Leprechaun free...
1802;La Cérémonie;Jeanne;Isabelle Huppert;Female;17882;Sophie Bonhomme;Sandrine Bonnaire;Female;19161;Catherine Lelièvre;Jacqueline Bisset;Female;14061;Georges Lelièvre;Jean-Pierre Cassel;Male;19162;Sophie, a quiet and shy maid working for an upper-class French family, finds a friend in the energetic and uncompromising postmaster Jeanne, who encourages her to stand up against her bourgeois employers.
9066;The Brady Bunch Movie;Carol Brady;Shelley Long;Female;56881;Mike Brady;Gary Cole;Male;21163;Marcia Brady;Christine Taylor;Female;15286;Greg Brady;Christopher Daniel Barnes;Male;31468;The original '70s TV family is now placed in the 1990s, where they're even more square and out of place than ever.
12554;Citizen X;Lt. Viktor Burakov;Stephen Rea;Male;9029;Col. Mikhail Fetisov;Donald Sutherland;Male;55636;Dr. Alexandr Bukhanovsky;Max von Sydow;Male;2201;Andrei Chikatilo;Jeffrey DeMunn;Male;12645;Based on the true story of a Russian serial killer who, over many years, claimed victim to over 50 people. His victims were mostly under the age of 17. In what was then a communists state, the police investigations were hampered by bureaucracy, incompetence and those in power. The story is told from the viewpoint of the detective in charge of the case.
11443;Dead Presidents;Anthony Curtis;Larenz Tate;Male;18291;Kirby;Keith David;Male;65827;Skip;Chris Tucker;Male;66;Jose;Freddy Rodríguez;Male;6862;On the streets they call cash dead presidents. And that's just what a Vietnam veteran is after when he returns home from the war only to find himself drawn into a life of crime. With the aid of his fellow vets he plans the ultimate heist -- a daring robbery of an armored car filled with unmarked U.S. currency!
21183;Fluke;Thomas P. Johnson / Voice of Fluke;Matthew Modine;Male;8654;Carol Johnson;Nancy Travis;Female;18331;Jeff Newman;Eric Stoltz;Male;7036;Brian Johnson;Max Pomeranc;Male;85313;Workaholic Thomas Johnson dies in an auto accident and comes back to life as a dog. Remembering some of who he was, he returns to his wife and son to protect them from the man who caused his accident. But, as time goes by, he remembers more of his life, and realizes he wasn't such a good husband and father.
56374;I laureati;Pino Noferini;Massimo Ceccherini;Male;120274;Rocco;Rocco Papaleo;Male;120135;Leonardo Pace;Leonardo Pieraccioni;Male;120271;Bruno Dallai;Gianmarco Tognazzi;Male;78538;Four thirtysomething university students share a flat in Florence: Leonardo pursues beautiful Letizia, her brother Rocco works night shifts to pay for his rent, Bruno has to graduate to inherit his father-in-law's business (while cheating on his wife with her sister), and Pino dreams of becoming a stand-up comedian.
12520;The Last Supper;Jude;Cameron Diaz;Female;6941;Pete;Ron Eldard;Male;12260;Luke;Courtney B. Vance;Male;24047;Zachary Cody;Bill Paxton;Male;2053;A group of idealistic, but frustrated, liberals succumb to the temptation of murdering rightwing pundits for their political beliefs.
32646;Safe;Carol White;Julianne Moore;Female;1231;Peter Dunning;Peter Friedman;Male;54246;Greg White;Xander Berkeley;Male;3982;Chris;James Le Gros;Male;6474;"Carol, a typical upper middle-class housewife, begins to complain of vague symptoms of illness. She ""doesn't feel right,"" has unexplained headaches, congestion, a dry cough, nosebleeds, vomiting, and trouble breathing. Her family doctor treats her concerns dismissively and suggests a psychiatrist. Eventually, an allergist tells her that she has Environmental Illness."
51191;Guardian Angels;Antoine Carco / His guardian angel;Gérard Depardieu;Male;16927;Père Hervé Tarain / His guardian angel;Christian Clavier;Male;28781;Regina Podium;Eva Grimaldi;Female;103160;Yvon Radmilo said 'la pince';Yves Rénier;Male;24781;A sleazy Paris nightclub owner and ex-detective flies to Hong Kong to rescue the young son of a friend murdered by the Chinese mob.
27526;The Crossing Guard;Freddy Gale;Jack Nicholson;Male;514;John Booth;David Morse;Male;52;Mary;Anjelica Huston;Female;5657;Jojo;Robin Wright;Female;32;After his daughter died in a hit and run, Freddy Gale has waited six years for John Booth, the man responsible, to be released from prison. On the day of release, Gale visits Booth and announces that he will kill him in one week. Booth uses his time to try and make peace with himself and his entourage, and even finds romance. Gale, whose life is spiraling down because of his obsession towards Booth, will bring himself on the very edge of sanity. At he end of the week, both men will find themselves on a collision course with each other.
9071;Living in Oblivion;Nick Reve;Steve Buscemi;Male;884;Nicole Springer;Catherine Keener;Female;2229;Wolf;Dermot Mulroney;Male;20212;Wanda;Danielle von Zerneck;Female;82220;Nick is the director of a low-budget indie film. He tries to keep everything together as his production is plagued with an insecure actress, a megalomaniac star, a pretentious, beret-wearing director of photography, and lousy catering.
38884;Land and Freedom;David Carr;Ian Hart;Male;10985;Blanca;Rosana Pastor;Female;125486;Bernard;Frédéric Pierrot;Male;9005;Maite;Icíar Bollaín;Female;16973;David Carr is a British Communist who is unemployed. In 1936, when the Spanish Civil War begins, he decides to fight for the Republican side, a coalition of liberals, communists and anarchists, so he joins the POUM militia and witnesses firsthand the betrayal of the Spanish revolution by Stalin's followers and Moscow's orders.
18402;Something to Talk About;Grace King Bichon;Julia Roberts;Female;1204;Eddie Bichon;Dennis Quaid;Male;6065;Wyly King;Robert Duvall;Male;3087;Georgia King;Gena Rowlands;Female;4800;Grace Bichon, who is managing her father's riding-stable, discovers that her husband Eddie is deceiving her with another woman. After confronting him in the middle of the night on the streets of their small home town, she decides to stay at her sister Emma Rae's house for a while to make up her mind. Breaking out of her everyday life, she starts to question the authority of everyone.
34996;The Addiction;Kathleen Conklin;Lili Taylor;Female;3127;Peina;Christopher Walken;Male;4690;Casanova;Annabella Sciorra;Female;18750;Jean;Edie Falco;Female;36190;A vampiric doctoral student tries to follow the philosophy of a nocturnal comrade and control her thirst for blood.
18998;Darkman II: The Return of Durant;Darkman / Peyton Westlake;Arnold Vosloo;Male;16743;Robert G. Durant;Larry Drake;Male;16476;Jill Randall;Kim Delaney;Female;21216;Laurie Brinkman;Renee O'Connor;Female;77624;Darkman and Durant return and they hate each other as much as ever. This time, Durant has plans to take over the city's drug trade using high-tech weaponry. Darkman must step in and try to stop Durant once and for all.
13552;The Doom Generation;Amy Blue;Rose McGowan;Female;16850;Jordan White;James Duval;Male;1582;Xavier Red;Johnathon Schaech;Male;51670;Peanut;Cress Williams;Male;157847;Jordan White and Amy Blue, two troubled teens, pick up an adolescent drifter, Xavier Red. Together, the threesome embarks on a sex and violence-filled journey through an United States of psychos and quickie marts.
11863;Jade;David Corelli;David Caruso;Male;16560;Trina Gavin;Linda Fiorentino;Female;9625;Matt Gavin;Chazz Palminteri;Male;9046;Bob Hargrove;Michael Biehn;Male;2712;Someone does a nasty hatchet job on a San Francisco big shot and the Assistant D.A. takes charge of the investigation. Through a web of blackmail and prostitution involving the Governor, an old lover of the law man emerges as a prime suspect and he has to deal with his personal feelings as well as the case.
42445;Christmas Vacation '95;Lorenzo Colombo;Massimo Boldi;Male;69037;Remo Proietti;Christian De Sica;Male;69036;Luke Perry;Luke Perry;Male;8395;"Kelly; Michelle";Elizabeth Nottoli;Female;1874589;Two Italians are on holiday in Aspen in Colorado. The first one is Lorenzo whose daughter is crazy about Luke Perry (Beverly Hills 90210 actor) and wants to meet him at all costs. The second one wants to win back his wife who has left him because of his gambling problem.
13559;The Mangler;Officer John Hunton;Ted Levine;Male;15854;William 'Bill' Gartley;Robert Englund;Male;5139;Mark Jackson;Daniel Matmor;Unknown;1066795;Sherry Ouelette;Vanessa Pike;Unknown;1541036;When an accident involving a folding machine at an old laundry happens, detective John Hunton investigates. While he tries to solve the mystery, Bill Gartley, the owner, wants to find new victims for his machine.
33095;Good Old Daze;Tomasi;Romain Duris;Male;17497;Alain Chabert;Vincent Elbaz;Male;54918;Maurice 'Momo' Zareba;Nicolas Koretzky;Male;252263;Bruno Tourette;Julien Lambroschini;Male;180892;"Ten years after their Upper Sixth, Bruno, Momo, Leon and Alain meet together in the waiting room of a maternity hospital. The father of the awaited baby is Tomasi, their best friend at that time, who died one month before due to an overdose. They remember their teenage, their laughs, their dreams, their stupid pranks... a description of the French youth in the middle of the seventies. Part of ARTE's series ""The high school years""."
12561;Godzilla vs. Destoroyah;Dr. Kensaku Ijuin;Takuro Tatsumi;Male;72817;Yukari Yamane;Yôko Ishino;Unknown;72818;Kenichi Yamane;Yasufumi Hayashi;Male;72819;Miki Saegusa;Megumi Odaka;Female;50655;A burning Godzilla, on the verge of meltdown, emerges to lay siege to Hong Kong. At the same time horrifying new organisms are discovered in Japan. These crustacean-like beings are seemingly born of the Oxygen Destroyer, the weapon that killed the original Godzilla.
16295;Higher Learning;Malik Williams;Omar Epps;Male;4987;Kristen Connor;Kristy Swanson;Female;56128;Remy;Michael Rapaport;Male;4688;Taryn;Jennifer Connelly;Female;6161;"Malik is an African-American student attending on a track scholarship, academics are not his strong suit, and he goes in thinking that his athletic abilities will earn him a free ride through college. Fudge, a ""professional student"" who has been at Columbus for six years so far, becomes friendly with Malik and challenges his views about race and politics in America."
1775;Canadian Bacon;U.S. President;Alan Alda;Male;21278;Deputy Honey;Rhea Perlman;Female;24203;Sheriff Bud B. Boomer;John Candy;Male;7180;Stuart Smiley, National Security Advisor;Kevin Pollak;Male;7166;The U.S. President, low in the opinion polls, gets talked into raising his popularity by trying to start a cold war with Canada.
9382;Boys on the Side;Jane Deluca;Whoopi Goldberg;Female;2395;Robin;Mary-Louise Parker;Female;18248;Holly Pulchik-Lincoln;Drew Barrymore;Female;69597;Abe Lincoln;Matthew McConaughey;Male;10297;After breaking up with her girlfriend, a nightclub singer, Jane, answers a personal ad from Robin, a real estate agent with AIDS, seeking a cross-country travel partner. On their journey from New York City to Los Angeles, the two stop by Pittsburgh to pick up Robin's friend Holly, who is trying to escape an abusive relationship. With three distinct personalities, the women must overcome their differences to help one another.
4307;The Flower of My Secret;Leo Macías;Marisa Paredes;Female;954;Ángel;Juan Echanove;Male;36277;Betty;Carme Elias;Female;36278;Rosa;Rossy de Palma;Female;25258;"Marisa Paredes is Leocadia (""Leo"") Macias, a woman writing “pink” romance novels under the alias of Amanda Gris that are very popular all across Spain. Unlike her romantic novels, her own love life is troubled. Leo has a less than happy relationship with her husband Paco, a military officer stationed in Brussels then later in Bosnia, who is distant both physically and emotionally."
28601;Problem Child 3: Junior in Love;Ben Healy;William Katt;Male;45415;Junior Healy;Justin Chapman;Unknown;101285;Scoutmaster Phlim;Sherman Howard;Male;54859;Dr. Gray;Carolyn Lowery;Female;101286;Chapter 3 of the Problem Child trilogy features pre-teened Junior in love with a classmate that won't even notice him, but does notice three other boys who are rivals to Junior. This means war!
13345;A Chinese Odyssey Part One: Pandora's Box;Chi Juen Bo/ Suen Ng Hung / Joker;Stephen Chow;Male;57607;Jue Baat Gaai / Assistant Master;Ng Man-tat;Male;70437;Spider Devil / Spider Web Immortal;Athena Chu;Female;87942;Tong Chang / Longevity Monk;Law Kar-Ying;Male;87944;When the Goddess of Happiness tosses the Longevity Monk and his disciples out of heaven (because the Monkey King tried to attain immortality), the Monkey King is reincarnated as the Joker. He now spends his time chasing two jealous women. When one of them is dying, the Joker goes back in time in an attempt to save her.
26441;The Big Green;Larry Musgrove;Patrick Renna;Male;69740;Miss Anna Mongomery;Olivia d'Abo;Female;46423;Sheriff Tom Palmer;Steve Guttenberg;Male;26472;Newt Shaw;Bug Hall;Male;69395;In a depressed Texas town, British foreign exchange teacher Anna attempts to inject some life into her hopeless kids by introducing them to soccer. They're terrible at first, but Anna and her football-hero assistant whip them into shape. As they work overtime, the pair help kids build their self-esteem and also get involved in solving family squabbles.
45325;Tom and Huck;Tom Sawyer;Jonathan Taylor Thomas;Male;53283;Huck Finn;Brad Renfro;Male;51214;Becky Thatcher;Rachael Leigh Cook;Female;38581;Muff Potter;Michael McShane;Male;8316;A mischievous young boy, Tom Sawyer, witnesses a murder by the deadly Injun Joe. Tom becomes friends with Huckleberry Finn, a boy with no future and no family. Tom has to choose between honoring a friendship or honoring an oath because the town alcoholic is accused of the murder. Tom and Huck go through several adventures trying to retrieve evidence.
40490;Man of the House;Sandy Archer;Farrah Fawcett;Female;28768;Jack Sturgess (Squatting Dog);Chevy Chase;Male;54812;Ben Archer (Little Wing);Jonathan Taylor Thomas;Male;53283;Chet Bronski (Chief Running Horse);George Wendt;Male;66606;"Ben Archer is not happy. His mother, Sandy, has just met a man, and it looks like things are pretty serious. Driven by a fear of abandonment, Ben tries anything and everything to ruin the ""love bubble"" which surrounds his mom. However, after Ben and Jack's experiences in the Indian Guides, the two become much closer."
11861;How to Make an American Quilt;Finn Dodd;Winona Ryder;Female;1920;Glady Joe Cleary;Anne Bancroft;Female;10774;Hy Dodd;Ellen Burstyn;Female;9560;Constance Saunders;Kate Nelligan;Female;18794;Soon-to-be-wed graduate student Finn Dodd develops cold feet when she suspects her fiancé is cheating on her. In order to clear her head, Finn visits her grandmother, Hy, and great aunt, Glady Joe Cleary, in Grasse, Calif. There, Finn learns that Hy and Glady Joe are members of a group of passionate quilters, and over the course of her visit she is regaled with tales of love and life by women who have collected rich experiences and much wisdom.
37975;The Star Maker;Joe Morelli (Giuseppe Romolo);Sergio Castellitto;Male;2166;Beata;Tiziana Lodato;Female;258039;Brigadier Mastropaolo;Franco Scaldati;Unknown;592480;Mute;Leopoldo Trieste;Male;14151;The adventures and deceptions of a photographer who travels through small villages of 1950s Sicily pretending to work for the big film studios in Rome.
28387;Kicking and Screaming;Grover;Josh Hamilton;Male;52419;Jane;Olivia d'Abo;Female;46423;Max;Chris Eigeman;Male;78190;Miami;Parker Posey;Female;7489;After college graduation, Grover's girlfriend Jane tells him she's moving to Prague to study writing. Grover declines to accompany her, deciding instead to move in with several friends, all of whom can't quite work up the inertia to escape their university's pull. Nobody wants to make any big decisions that would radically alter his life, yet none of them wants to end up like Chet, the professional student who tends bar and is in his tenth year of university studies.
18256;Castle Freak;John Reilly;Jeffrey Combs;Male;27993;Susan Reilly;Barbara Crampton;Female;27995;Giorgio;Jonathan Fuller;Male;80291;Rebecca Reilly;Jessica Dollarhide;Female;105645;John has inherited a castle in Italy and he moves there with his wife Susan and their blind daughter Rebecca. What they don't realize is that there is somebody else in the castle--an abused child left to die in the basement who has now become the castle freak and is out to wreak havoc.
31174;Richard III;Richard III;Ian McKellen;Male;1327;Queen Elizabeth;Annette Bening;Female;516;The Duke of Buckingham;Jim Broadbent;Male;388;Earl Rivers;Robert Downey Jr.;Male;3223;A murderous lust for the British throne sees Richard III descend into madness. Though the setting is transposed to the 1930s, England is torn by civil war, split between the rivaling houses of York and Lancaster. Richard aspires to a fascist dictatorship, but must first remove the obstacles to his ascension—among them his brother, his nephews and his brother's wife. When the Duke of Buckingham deserts him, Richard's plans are compromised.
