MovieId;Title;Character1;PersonName1;Sex1;ActorId1;Character2;PersonName2;Sex2;ActorId2;Character3;PersonName3;Sex3;ActorId3;Character4;PersonName4;Sex4;ActorId4;Overview
807;Se7en;Detective David Mills;Brad Pitt;Male;287;Detective Lt. William Somerset;Morgan Freeman;Male;192;Tracy Mills;Gwyneth Paltrow;Female;12052;John Doe;Kevin Spacey;Male;1979;"Two homicide detectives are on a desperate hunt for a serial killer whose crimes are based on the ""seven deadly sins"" in this dark and haunting film that takes viewers from the tortured remains of one victim to the next. The seasoned Det. Sommerset researches each sin in an effort to get inside the killer's mind, while his novice partner, Mills, scoffs at his efforts to unravel the case."
862;Toy Story;Woody (voice);Tom Hanks;Male;31;Buzz Lightyear (voice);Tim Allen;Male;12898;Mr. Potato Head (voice);Don Rickles;Male;7167;Slinky Dog (voice);Jim Varney;Male;12899;Led by Woody, Andy's toys live happily in his room until Andy's birthday brings Buzz Lightyear onto the scene. Afraid of losing his place in Andy's heart, Woody plots against Buzz. But when circumstances separate Buzz and Woody from their owner, the duo eventually learns to put aside their differences.
8844;Jumanji;Alan Parrish;Robin Williams;Male;2157;Judy Shepherd;Kirsten Dunst;Female;205;Peter Shepherd;Bradley Pierce;Male;145151;Sarah Whittle;Bonnie Hunt;Female;5149;When siblings Judy and Peter discover an enchanted board game that opens the door to a magical world, they unwittingly invite Alan -- an adult who's been trapped inside the game for 26 years -- into their living room. Alan's only hope for freedom is to finish the game, which proves risky as all three find themselves running from giant rhinoceroses, evil monkeys and other terrifying creatures.
629;The Usual Suspects;Dean Keaton;Gabriel Byrne;Male;5168;Michael McManus;Stephen Baldwin;Male;9045;Roger 'Verbal' Kint;Kevin Spacey;Male;1979;US Customs Agent Dave Kujan;Chazz Palminteri;Male;9046;Held in an L.A. interrogation room, Verbal Kint attempts to convince the feds that a mythic crime lord, Keyser Soze, not only exists, but was also responsible for drawing him and his four partners into a multi-million dollar heist that ended with an explosion in San Pedro harbor – leaving few survivors. Verbal lures his interrogators with an incredible story of the crime lord's almost supernatural prowess.
197;Braveheart;William Wallace;Mel Gibson;Male;2461;Murron MacClannough;Catherine McCormack;Female;2462;Princess Isabelle;Sophie Marceau;Female;1957;King Edward;Patrick McGoohan;Male;2463;Enraged at the slaughter of Murron, his new bride and childhood love, Scottish warrior William Wallace slays a platoon of the local English lord's soldiers. This leads the village to revolt and, eventually, the entire country to rise up against English rule.
63;Twelve Monkeys;James Cole;Bruce Willis;Male;62;Dr. Kathryn Railly;Madeleine Stowe;Female;289;Jeffrey Goines;Brad Pitt;Male;287;Dr. Goines;Christopher Plummer;Male;290;In the year 2035, convict James Cole reluctantly volunteers to be sent back in time to discover the origin of a deadly virus that wiped out nearly all of the earth's population and forced the survivors into underground communities. But when Cole is mistakenly sent to 1990 instead of 1996, he's arrested and locked up in a mental hospital. There he meets psychiatrist Dr. Kathryn Railly, and patient Jeffrey Goines, the son of a famous virus expert, who may hold the key to the mysterious rogue group, the Army of the 12 Monkeys, thought to be responsible for unleashing the killer disease.
949;Heat;Lt. Vincent Hanna;Al Pacino;Male;1158;Neil McCauley;Robert De Niro;Male;380;Chris Shiherlis;Val Kilmer;Male;5576;Nate;Jon Voight;Male;10127;Obsessive master thief Neil McCauley leads a top-notch crew on various daring heists throughout Los Angeles while determined detective Vincent Hanna pursues him without rest. Each man recognizes and respects the ability and the dedication of the other even though they are aware their cat-and-mouse game may end in violence.
9737;Bad Boys;Marcus Burnett;Martin Lawrence;Male;78029;Mike Lowrey;Will Smith;Male;2888;Julie Mott;Téa Leoni;Female;4939;Fouchet;Tchéky Karyo;Male;10698;Marcus Burnett is a hen-pecked family man. Mike Lowry is a foot-loose and fancy free ladies' man. Both are Miami policemen, and both have 72 hours to reclaim a consignment of drugs stolen from under their station's nose. To complicate matters, in order to get the assistance of the sole witness to a murder, they have to pretend to be each other.
1572;Die Hard: With a Vengeance;John McClane;Bruce Willis;Male;62;Simon Peter Gruber;Jeremy Irons;Male;16940;Zeus Carver;Samuel L. Jackson;Male;2231;Joe Lambert;Graham Greene;Male;6804;"New York detective John McClane is back and kicking bad-guy butt in the third installment of this action-packed series, which finds him teaming with civilian Zeus Carver to prevent the loss of innocent lives. McClane thought he'd seen it all, until a genius named Simon engages McClane, his new ""partner"" -- and his beloved city -- in a deadly game that demands their concentration."
10530;Pocahontas;Pocahontas (voice);Irene Bedard;Female;65529;John Smith (voice);Mel Gibson;Male;2461;Governor Ratcliffe (voice);David Ogden Stiers;Male;28010;Meeko (voice);John Kassir;Male;31365;Pocahontas, daughter of a Native American tribe chief, falls in love with an English soldier as colonists invade 17th century Virginia.
524;Casino;Sam 'Ace' Rothstein;Robert De Niro;Male;380;Ginger McKenna;Sharon Stone;Female;4430;Nicky Santoro;Joe Pesci;Male;4517;Lester Diamond;James Woods;Male;4512;"In early-1970s Las Vegas, low-level mobster Sam ""Ace"" Rothstein gets tapped by his bosses to head the Tangiers Casino. At first, he's a great success in the job, but over the years, problems with his loose-cannon enforcer Nicky Santoro, his ex-hustler wife Ginger, her con-artist ex Lester Diamond and a handful of corrupt politicians put Sam in ever-increasing danger."
568;Apollo 13;Jim Lovell;Tom Hanks;Male;31;Fred Haise;Bill Paxton;Male;2053;Jack Swigert;Kevin Bacon;Male;4724;Ken Mattingly;Gary Sinise;Male;33;The true story of technical troubles that scuttle the Apollo 13 lunar mission in 1970, risking the lives of astronaut Jim Lovell and his crew, with the failed journey turning into a thrilling saga of heroism. Drifting more than 200,000 miles from Earth, the astronauts work furiously with the ground crew to avert tragedy.
414;Batman Forever;Bruce Wayne / Batman;Val Kilmer;Male;5576;Harvey Dent / Two-Face;Tommy Lee Jones;Male;2176;Edward Nygma / The Riddler;Jim Carrey;Male;206;Dr. Chase Meridian;Nicole Kidman;Female;2227;Batman must battle a disfigured district attorney and a disgruntled former employee with help from an amorous psychologist and a young circus acrobat.
8839;Casper;Kathleen 'Kat' Harvey;Christina Ricci;Female;6886;Dr. James Harvey;Bill Pullman;Male;8984;Casper (voice);Malachi Pearson;Male;56057;Carrigan Crittenden;Cathy Moriarty;Female;14702;Casper is a kind young ghost who peacefully haunts a mansion in Maine. When specialist James Harvey arrives to communicate with Casper and his fellow spirits, he brings along his teenage daughter, Kat. Casper quickly falls in love with Kat, but their budding relationship is complicated not only by his transparent state, but also by his troublemaking apparition uncles and their mischievous antics.
19404;Dilwale Dulhania Le Jayenge;Raj Malhotra;Shah Rukh Khan;Male;35742;Simran Singh;Kajol;Female;55061;Chaudhry Baldev Singh;Amrish Puri;Male;691;Dharamvir Malhotra;Anupam Kher;Male;6217;Raj is a rich, carefree, happy-go-lucky second generation NRI. Simran is the daughter of Chaudhary Baldev Singh, who in spite of being an NRI is very strict about adherence to Indian values. Simran has left for India to be married to her childhood fiancé. Raj leaves for India with a mission at his hands, to claim his lady love under the noses of her whole family. Thus begins a saga.
9603;Clueless;Cher Horowitz;Alicia Silverstone;Female;5588;Dionne Davenport;Stacey Dash;Female;58150;Tai Frasier;Brittany Murphy;Female;328;Josh Lucas;Paul Rudd;Male;22226;Shallow, rich and socially successful Cher is at the top of her Beverly Hills high school's pecking scale. Seeing herself as a matchmaker, Cher first coaxes two teachers into dating each other. Emboldened by her success, she decides to give hopelessly klutzy new student Tai a makeover. When Tai becomes more popular than she is, Cher realizes that her disapproving ex-stepbrother was right about how misguided she was -- and falls for him.
9273;Ace Ventura: When Nature Calls;Ace Ventura;Jim Carrey;Male;206;Fulton Greenwall;Ian McNeice;Male;3547;Vincent Cadby;Simon Callow;Male;4001;Burton Quinn;Bob Gunton;Male;4029;Summoned from an ashram in Tibet, Ace finds himself on a perilous journey into the jungles of Africa to find Shikaka, the missing sacred animal of the friendly Wachati tribe. He must accomplish this before the wedding of the Wachati's Princess to the prince of the warrior Wachootoos. If Ace fails, the result will be a vicious tribal war.
76;Before Sunrise;Jesse;Ethan Hawke;Male;569;Céline;Julie Delpy;Female;1146;Wife on Train;Andrea Eckert;Female;571;Husband on Train;Hanno Pöschl;Male;572;On his way to Vienna, American Jesse meets Céline, a student returning to Paris. After long conversations forge a surprising connection between them, Jesse convinces Celine to get off the train with him in Vienna. Since his flight to the U.S. departs the next morning and he has no money for lodging, they wander the city together, taking in the experiences of Vienna and each other.
710;GoldenEye;James Bond;Pierce Brosnan;Male;517;Natalya Fyodorovna Simonova;Izabella Scorupco;Female;10695;Xenia Onatopp;Famke Janssen;Female;10696;Alec Trevelyan;Sean Bean;Male;48;When a powerful Russian satellite weapon is hijacked by a mysterious crime syndicate, it's up to James Bond, with the help of programmer Natalya Simonova, to find the culprits and save the world from disaster.
406;La Haine;Vinz;Vincent Cassel;Male;1925;Hubert;Hubert Koundé;Male;5418;Saïd;Saïd Taghmaoui;Male;5419;Abdel;Abdel Ahmed Ghili;Male;5420;After a chaotic night of rioting in a marginal suburb of Paris, three young friends, Vinz, Hubert and Saïd, wander around unoccupied waiting for news about the state of health of a mutual friend who has been seriously injured when confronting the police.
9804;Waterworld;Mariner;Kevin Costner;Male;1269;Deacon;Dennis Hopper;Male;2778;Helen;Jeanne Tripplehorn;Female;10478;Enola;Tina Majorino;Female;53930;In a futuristic world where the polar ice caps have melted and made Earth a liquid planet, a beautiful barmaid rescues a mutant seafarer from a floating island prison. They escape, along with her young charge, Enola, and sail off aboard his ship.
9323;Ghost in the Shell;Motoko Kusanagi (voice);Atsuko Tanaka;Female;34923;Batou (voice);Akio Otsuka;Male;40451;Puppetmaster (voice);Iemasa Kayumi;Male;625;Togusa (voice);Koichi Yamadera;Male;20664;In the year 2029, the barriers of our world have been broken down by the net and by cybernetics, but this brings new vulnerability to humans in the form of brain-hacking. When a highly-wanted hacker known as 'The Puppetmaster' begins involving them in politics, Section 9, a group of cybernetically enhanced cops, are called in to investigate and stop the Puppetmaster.
9598;Babe;Babe the Gallant Pig (voice);Christine Cavanaugh;Female;58136;Fly the Female Sheepdog (voice);Miriam Margolyes;Female;6199;Ferdinand the Duck (voice);Danny Mann;Male;52699;Rex the Male Sheepdog (voice);Hugo Weaving;Male;1331;Babe is a little pig who doesn't quite know his place in the world. With a bunch of odd friends, like Ferdinand the duck who thinks he is a rooster and Fly the dog he calls mum, Babe realises that he has the makings to become the greatest sheep pig of all time, and Farmer Hogget knows it. With the help of the sheep dogs, Babe learns that a pig can be anything that he wants to be.
8068;Desperado;El Mariachi;Antonio Banderas;Male;3131;Carolina;Salma Hayek;Female;3136;Bucho;Joaquim de Almeida;Male;22462;Buscemi;Steve Buscemi;Male;884;Mariachi plunges headfirst into the dark border underworld when he follows a trail of blood to the last of the infamous Mexican drug lords, Bucho, for an action-packed, bullet-riddled showdown. With the help of his best friend and a beautiful bookstore owner, the Mariachi tracks Bucho, takes on his army of desperados, and leaves a trail of blood of his own.
5;Four Rooms;Ted the Bellhop;Tim Roth;Male;3129;Angela;Jennifer Beals;Female;3130;Man;Antonio Banderas;Male;3131;Athena;Valeria Golino;Female;3124;It's Ted the Bellhop's first night on the job...and the hotel's very unusual guests are about to place him in some outrageous predicaments. It seems that this evening's room service is serving up one unbelievable happening after another.
9482;Judge Dredd;Judge Joseph Dredd;Sylvester Stallone;Male;16483;Judge Hershey;Diane Lane;Female;2882;Rico;Armand Assante;Male;23346;Herman 'Fergee' Ferguson;Rob Schneider;Male;60949;In a dystopian future, Dredd, the most famous judge (a cop with instant field judiciary powers) is convicted for a crime he did not commit while his murderous counterpart escapes.
6950;Outbreak;Sam Daniels;Dustin Hoffman;Male;4483;Robby Keough;Rene Russo;Female;14343;Billy Ford;Morgan Freeman;Male;192;Casey Schuler;Kevin Spacey;Male;1979;A deadly airborne virus finds its way into the USA and starts killing off people at an epidemic rate. Col Sam Daniels' job is to stop the virus spreading from a small town, which must be quarantined, and to prevent an over reaction by the White House.
9312;Mortal Kombat;Lord Raiden;Christophe Lambert;Male;38559;Liu Kang;Robin Shou;Male;57250;Johnny Cage;Linden Ashby;Male;57251;Shang Tsung;Cary-Hiroyuki Tagawa;Male;11398;For nine generations an evil sorcerer has been victorious in hand-to-hand battle against his mortal enemies. If he wins a tenth Mortal Kombat tournament, desolation and evil will reign over the multiverse forever. To save Earth, three warriors must overcome seemingly insurmountable odds, their own inner demons, and superhuman foes in this action/adventure movie based on one of the most popular video games of all time.
21032;Balto;Balto (voice);Kevin Bacon;Male;4724;Boris the Goose (voice);Bob Hoskins;Male;382;Jenna (voice);Bridget Fonda;Female;2233;Steele the Sled Dog (voice);Jim Cummings;Male;12077;An outcast half-wolf risks his life to prevent a deadly epidemic from ravaging Nome, Alaska.
688;The Bridges of Madison County;Robert Kincaid;Clint Eastwood;Male;190;Francesca Johnson;Meryl Streep;Female;5064;Caroline Johnson;Annie Corley;Female;6907;Michael Johnson;Victor Slezak;Male;10379;Photographer Robert Kincaid wanders into the life of housewife Francesca Johnson for four days in the 1960s.
10474;The Basketball Diaries;Jim Carroll;Leonardo DiCaprio;Male;6193;Mickey;Mark Wahlberg;Male;13240;Jim's Mother;Lorraine Bracco;Female;11478;Bobby;Michael Imperioli;Male;11486;A high school basketball player’s life turns upside down after free-falling into the harrowing world of drug addiction.
37797;Whisper of the Heart;Shizuku Tsukishima (voice);Yoko Honna;Female;119263;Seiji Amasawa (voice);Issey Takahashi;Male;87662;Seiya Tsukishima (voice);Takashi Tachibana;Unknown;555255;Asako Tsukishima (voice);Shigeru Muroi;Female;135025;Shizuku lives a simple life, dominated by her love for stories and writing. One day she notices that all the library books she has have been previously checked out by the same person: 'Seiji Amasawa'.
15789;A Goofy Movie;Goofy Goof (voice);Bill Farmer;Male;84213;Max Goof (voice);Jason Marsden;Male;61983;P.J. Pete (voice);Rob Paulsen;Male;43125;Peter Pete (voice);Jim Cummings;Male;12077;Though Goofy always means well, his amiable cluelessness and klutzy pratfalls regularly embarrass his awkward adolescent son, Max. When Max's lighthearted prank on his high-school principal finally gets his longtime crush, Roxanne, to notice him, he asks her on a date. Max's trouble at school convinces Goofy that he and the boy need to bond over a cross-country fishing trip like the one he took with his dad when he was Max's age, which throws a kink in his son's plans to impress Roxanne.
10634;Friday;Craig Jones;Ice Cube;Male;9778;Smokey;Chris Tucker;Male;66;Debbie;Nia Long;Female;9781;Deebo;Tom 'Tiny' Lister Jr.;Male;8396;Craig and Smokey are two guys in Los Angeles hanging out on their porch on a Friday afternoon, smoking and drinking, looking for something to do.
2064;While You Were Sleeping;Lucy Eleanor Moderatz;Sandra Bullock;Female;18277;Jack Callaghan;Bill Pullman;Male;8984;Peter Callaghan;Peter Gallagher;Male;8212;Ox Callaghan;Peter Boyle;Male;1039;A transit worker pulls commuter Peter off railway tracks after he's mugged, but—while he's in a coma—his family mistakenly thinks she's Peter's fiancée, and she doesn't correct them. Things get more complicated when she falls for his brother, who's not quite sure that she's who she claims to be.
8963;Crimson Tide;Hunter;Denzel Washington;Male;5292;Ramsey;Gene Hackman;Male;193;Zimmer;Matt Craven;Male;13525;Cob;George Dzundza;Male;10477;On a US nuclear missile sub, a young first officer stages a mutiny to prevent his trigger happy captain from launching his missiles before confirming his orders to do so.
12106;The Quick and the Dead;Ellen 'The Lady';Sharon Stone;Female;4430;John Herod;Gene Hackman;Male;193;Cort;Russell Crowe;Male;934;Fee Herod 'The Kid';Leonardo DiCaprio;Male;6193;A mysterious woman comes to compete in a quick-draw elimination tournament, in a town taken over by a notorious gunman.
4584;Sense and Sensibility;Elinor Dashwood;Emma Thompson;Female;7056;Colonel Christopher Brandon;Alan Rickman;Male;4566;Marianne Dashwood;Kate Winslet;Female;204;Edward Ferrars;Hugh Grant;Male;3291;Rich Mr. Dashwood dies, leaving his second wife and her daughters poor by the rules of inheritance. Two daughters are the titular opposites.
11017;Billy Madison;Billy Madison;Adam Sandler;Male;19292;Eric Gordon;Bradley Whitford;Male;11367;Principal Max Anderson;Josh Mostel;Male;33489;Veronica Vaughn;Bridgette Wilson;Female;20751;Billy Madison is the 27 year-old son of Bryan Madison, a very rich man who has made his living in the hotel industry. Billy stands to inherit his father's empire, but only if he can make it through all 12 grades, 2 weeks per grade, to prove that he has what it takes to run the family business.
9348;Species;Sil;Natasha Henstridge;Female;57395;Xavier Fitch;Ben Kingsley;Male;2282;Preston Lennox;Michael Madsen;Male;147;Dr. Laura Baker;Marg Helgenberger;Female;19838;In 1993, the Search for Extra Terrestrial Intelligence Project receives a transmission detailing an alien DNA structure, along with instructions on how to splice it with human DNA. The result is Sil, a sensual but deadly creature who can change from a beautiful woman to an armour-plated killing machine in the blink of an eye.
9691;Assassins;Robert Rath;Sylvester Stallone;Male;16483;Miguel Bain;Antonio Banderas;Male;3131;Electra;Julianne Moore;Female;1231;Nicolai Tashlinkov;Anatoli Davydov;Unknown;58556;Assassin Robert Rath arrives at a funeral to kill a prominent mobster, only to witness a rival hired gun complete the job for him -- with grisly results. Horrified by the murder of innocent bystanders, Rath decides to take one last job and then return to civilian life. But finding his way out of the world of contract killing grows ever more dangerous as Rath falls for his female target and becomes a marked man himself.
2654;In the Mouth of Madness;John Trent;Sam Neill;Male;4783;Linda Styles;Julie Carmen;Female;27584;Sutter Cane;Jürgen Prochnow;Male;920;Dr. Wrenn;David Warner;Male;2076;An insurance investigator begins discovering that the impact a horror writer's books have on his fans is more than inspirational.
922;Dead Man;William Blake;Johnny Depp;Male;85;Nobody;Gary Farmer;Male;15439;Train Fireman;Crispin Glover;Male;1064;Cole Wilson;Lance Henriksen;Male;2714;Wounded and branded an outlaw, a young accountant named William Blake flees gunmen and travels the frontier. Nobody, an outcast Native American, aides Blake along a journey beyond the frailty of life as his physical existence grows thin.
451;Leaving Las Vegas;Ben Sanderson;Nicolas Cage;Male;2963;Sera;Elisabeth Shue;Female;1951;Yuri;Julian Sands;Male;6104;Peter;Richard Lewis;Male;6105;Ben Sanderson, an alcoholic Hollywood screenwriter who lost everything because of his drinking, arrives in Las Vegas to drink himself to death. There, he meets and forms an uneasy friendship and non-interference pact with prostitute Sera.
687;Dead Man Walking;Sister Helen Prejean;Susan Sarandon;Female;4038;Matthew Poncelet;Sean Penn;Male;2228;Hilton Barber;Robert Prosky;Male;10360;Earl Delacroix;Raymond J. Barry;Male;10361;A justice drama based on a true story about a man on death row who, in his last days, forms a strong relationship with a nun who teaches him forgiveness and gives him spirituality, as she accompanies him to his execution.
9886;Johnny Mnemonic;Johnny Mnemonic;Keanu Reeves;Male;6384;Jane;Dina Meyer;Female;2133;Takahashi;Takeshi Kitano;Male;3317;J-Bone;Ice-T;Male;21411;In a dystopian 2021, Johnny is a data trafficker who has an implant that allows him to securely store data too sensitive for regular computer networks. On one delivery run, he accepts a package that not only exceeds the implant's safety limits—and will kill him if the data is not removed in time—but also contains information far more important and valuable than he had ever imagined. On a race against time, he must avoid the assassins sent to kill him and remove the data before it, too, ends his life.
1642;The Net;Angela Bennett / Ruth Marx;Sandra Bullock;Female;18277;Jack Devlin;Jeremy Northam;Male;18325;Dr. Alan Champion;Dennis Miller;Male;18326;Ruth Marx;Wendy Gazelle;Female;18327;Angela Bennett is a freelance software engineer who lives in a world of computer technology. When a cyber friend asks Bennett to debug a new game, she inadvertently becomes involved in a conspiracy that will soon turn her life upside down and make her the target of an assassination.
281;Strange Days;Lenny Nero;Ralph Fiennes;Male;5469;Lornette 'Mace' Mason;Angela Bassett;Female;9780;Max Peltier;Tom Sizemore;Male;3197;Faith Justin;Juliette Lewis;Female;3196;Set in the year 1999 during the last days of the old millennium, the movie tells the story of Lenny Nero, an ex-cop who now deals with data-discs containing recorded memories and emotions. One day he receives a disc which contains the memories of a murderer killing a prostitute. Lenny investigates and is pulled deeper and deeper in a whirl of blackmail, murder and rape. Will he survive and solve the case?
10428;Hackers;Dade Murphy / 'Crash Override' / 'Zero Cool';Jonny Lee Miller;Male;9012;Kate Libby / 'Acid Burn';Angelina Jolie;Female;11701;Joey Pardella;Jesse Bradford;Male;17772;Emmanuel Goldstein / 'Cereal Killer';Matthew Lillard;Male;26457;Along with his new friends, a teenager who was arrested by the US Secret Service and banned from using a computer for writing a computer virus discovers a plot by a nefarious hacker, but they must use their computer skills to find the evidence while being pursued by the Secret Service and the evil computer genius behind the virus.
2293;Mallrats;Brodie Bruce;Jason Lee;Male;11662;T.S. Quint;Jeremy London;Male;23646;Rene Mosier;Shannen Doherty;Female;19144;Brandi Svenning;Claire Forlani;Female;4174;Both dumped by their girlfriends, two best friends seek refuge in the local mall.
6520;First Knight;King Arthur;Sean Connery;Male;738;Lancelot;Richard Gere;Male;1205;Guinevere;Julia Ormond;Female;15887;Prince Malagant;Ben Cross;Male;29068;The timeless tale of King Arthur and the legend of Camelot are retold in this passionate period drama. Arthur is reluctant to hand the crown to Lancelot, and Guinevere is torn between her loyalty to her husband and her growing love for his rival. But Lancelot must balance his loyalty to the throne with the rewards of true love.
10802;Showgirls;Nomi Malone;Elizabeth Berkley;Female;19189;Zack Carey;Kyle MacLachlan;Male;6677;Cristal Connors;Gina Gershon;Female;11150;James Smith;Glenn Plummer;Male;2683;A young drifter named Nomi arrives in Las Vegas to become a dancer and soon sets about clawing and pushing her way to become a top showgirl.
9909;Dangerous Minds;Louanne Johnson;Michelle Pfeiffer;Female;1160;Hal Griffith;George Dzundza;Male;10477;George Grandey;Courtney B. Vance;Male;24047;Carla Nichols;Robin Bartlett;Female;11902;Former Marine Louanne Johnson lands a gig teaching in a pilot program for bright but underachieving teens at a notorious inner-city high school. After having a terrible first day, she decides she must throw decorum to the wind. When Johnson returns to the classroom, she does so armed with a no-nonsense attitude informed by her military training and a fearless determination to better the lives of her students -- no matter what the cost.
9344;Kids;Telly;Leo Fitzpatrick;Male;57387;Casper;Justin Pierce;Male;57389;Jennie;Chloë Sevigny;Female;2838;Ruby;Rosario Dawson;Female;5916;"Telly makes it his goal to have sex with as many different girls as he can. Jenny, a girl who has had sex only once, with Telly, tests positive for HIV. When Jenny discovers that Telly's idea of ""safe sex"" is to only have sex with virgins, and is continuing to pass the disease onto other unsuspecting girls, Jenny makes it her business to try to stop him."
902;The City of Lost Children;One;Ron Perlman;Male;2372;Le Scaphandrier / Les Clones;Dominique Pinon;Male;2413;Miette;Judith Vittet;Unknown;13842;Krank;Daniel Emilfork;Male;13843;A scientist in a surrealist society kidnaps children to steal their dreams, hoping that they slow his aging process.
