MovieId;Title;Character1;PersonName1;Sex1;ActorId1;Character2;PersonName2;Sex2;ActorId2;Character3;PersonName3;Sex3;ActorId3;Character4;PersonName4;Sex4;ActorId4;Overview
19101;A Little Princess;Sara Crewe;Liesel Matthews;Female;84093;Miss Minchin;Eleanor Bron;Female;45453;Capt. Crewe / Prince Rama;Liam Cunningham;Male;15498;Amelia Minchin;Rusty Schwimmer;Female;34407;When her father enlists to fight for the British in WWI, young Sara Crewe goes to New York to attend the same boarding school her late mother attended. She soon clashes with the severe headmistress, Miss Minchin, who attempts to stifle Sara's creativity and sense of self- worth.
8012;Get Shorty;Chili Palmer;John Travolta;Male;8891;Harry Zimm;Gene Hackman;Male;193;Karen Flores;Rene Russo;Female;14343;Martin Weir;Danny DeVito;Male;518;"Chili Palmer is a Miami mobster who gets sent by his boss, the psychopathic ""Bones"" Barboni, to collect a bad debt from Harry Zimm, a Hollywood producer who specializes in cheesy horror films. When Chili meets Harry's leading lady, the romantic sparks fly. After pitching his own life story as a movie idea, Chili learns that being a mobster and being a Hollywood producer really aren't all that different."
10987;Halloween: The Curse of Michael Myers;Dr. Sam Loomis;Donald Pleasence;Male;9221;Tommy Doyle;Paul Rudd;Male;22226;Kara Strode;Marianne Hagan;Female;67838;Dr. Terence Wynn;Mitchell Ryan;Male;14312;Six years ago, Michael Myers terrorized the town of Haddonfield, Illinois. He and his niece, Jamie Lloyd, have disappeared. Jamie was kidnapped by a bunch of evil druids who protect Michael Myers. And now, six years later, Jamie has escaped after giving birth to Michael's child. She runs to Haddonfield to get Dr. Loomis to help her again.
11381;Tommy Boy;Thomas 'Tommy' Callahan III;Chris Farley;Male;58198;Richard Hayden;David Spade;Male;60950;Thomas 'Big Tom' Callahan;Brian Dennehy;Male;6197;Beverly Barish, aka Beverly Burns;Bo Derek;Female;37995;To save the family business, two ne’er-do-well traveling salesmen hit the road with disastrously funny consequences.
12110;Dracula: Dead and Loving It;Count Dracula;Leslie Nielsen;Male;7633;Prof. Abraham Van Helsing;Mel Brooks;Male;14639;Mina Seward;Amy Yasbeck;Female;1219;Thomas Renfield;Peter MacNicol;Male;12688;When a lawyer shows up at the vampire's doorstep, he falls prey to his charms and joins him in his search for fresh blood. Enter Professor Van Helsing, who may be the only one able to vanquish the Count.
9560;A Walk in the Clouds;Paul Sutton;Keanu Reeves;Male;6384;Victoria Aragón;Aitana Sánchez-Gijón;Female;37946;Don Pedro Aragón;Anthony Quinn;Male;5401;María José Aragón;Angélica Aragón;Female;7353;World War II vet Paul Sutton falls for a pregnant and unwed woman who persuades him -- during their first encounter -- to pose as her husband so she can face her family.
33689;It Takes Two;Diane Barrows;Kirstie Alley;Female;1796;Roger Callaway;Steve Guttenberg;Male;26472;Alyssa Callaway / Amanda Lemmon;Ashley Olsen;Female;67848;Amanda Lemmon / Alyssa Callaway;Mary-Kate Olsen;Female;67849;Identical 9-year-olds from very different backgrounds: orphaned Amanda and wealthy Alyssa meet at summer camp and decide to switch places -- and play matchmaker between Alyssa's dad, Roger, and the kind social worker who cares for Amanda.
33542;Rumble in the Bronx;Keung;Jackie Chan;Male;18897;Elaine;Anita Mui;Female;44917;Nancy;Françoise Yip;Female;10875;Uncle Bill;Bill Tung;Male;44922;Keong comes from Hong Kong to visit New York for his uncle's wedding. His uncle runs a market in the Bronx and Keong offers to help out while Uncle is on his honeymoon. During his stay in the Bronx, Keong befriends a neighbor kid and beats up some neighborhood thugs who cause problems at the market. One of those petty thugs in the local gang stumbles into a criminal situation way over his head.
1710;Copycat;Helen Hudson;Sigourney Weaver;Female;10205;M.J. Monahan;Holly Hunter;Female;18686;Nicoletti;Will Patton;Male;883;Peter Foley;William McNamara;Male;18687;An agoraphobic psychologist and a female detective must work together to take down a serial killer who copies serial killers from the past.
10329;Congo;Dr. Karen Ross;Laura Linney;Female;350;Dr. Peter Elliot;Dylan Walsh;Male;21043;Captain Munro Kelly;Ernie Hudson;Male;8874;Herkermer Homolka;Tim Curry;Male;13472;Eight people embark on an expedition into the Congo, a mysterious expanse of unexplored Africa where human greed and the laws of nature have gone berserk. When the thrill-seekers -- some with ulterior motives -- stumble across a race of killer apes.
3512;Under Siege 2: Dark Territory;Casey Ryback;Steven Seagal;Male;23880;Travis Dane;Eric Bogosian;Male;10866;Sarah Ryback;Katherine Heigl;Female;25541;Bobby Zachs;Morris Chestnut;Male;9779;A passenger train has been hijacked by an electronics expert and turned into an untraceable command center for a weapons satellite. He has planned to blow up Washington DC and only one man can stop him, former Navy SEAL Casey Ryback.
39107;Dragon Ball Z: Fusion Reborn;Son Gokû / Son Gohan / Son Goten / Gogeta / Veku / Gotenks (voice);Masako Nozawa;Female;90496;Vegeta / Gogeta / Veku (voice);Ryou Horikawa;Male;122501;Trunks / Gotenks (voice);Takeshi Kusao;Male;1686;Enma Daiou / Mr. Satan (voice);Daisuke Gouri;Male;122191;Not paying attention to his job, a young demon allows the evil cleansing machine to overflow and explode, turning the young demon into the infamous monster Janemba. Goku and Vegeta make solo attempts to defeat the monster, but realize their only option is fusion.
12122;Village of the Damned;Dr. Alan Chaffee;Christopher Reeve;Male;20006;Dr. Susan Verner;Kirstie Alley;Female;1796;Jill McGowan;Linda Kozlowski;Female;57166;Frank McGowan;Michael Paré;Male;60650;"An American village is visited by some unknown life form which leaves the women of the village pregnant. Nine months later, the babies are born, and they all look normal, but it doesn't take the ""parents"" long to realize that the kids are not human or humane."
37653;The Three Brothers;Pascal Latour;Pascal Légitimus;Male;41878;Didier Latour;Didier Bourdon;Male;59031;Bernard Latour;Bernard Campan;Male;41029;Michael;Antoine du Merle;Male;583401;Three half-brothers are reunited at their mother's funeral. After being told of their inheritance they quickly spend the money, only to find out that they will not receive it after all. The men grow closer while deciding how to proceed.
11517;Money Train;John;Wesley Snipes;Male;10814;Charlie;Woody Harrelson;Male;57755;Grace Santiago;Jennifer Lopez;Female;16866;Donald Patterson;Robert Blake;Male;9287;When a vengeful New York transit cop decides to steal a trainload of subway fares, his foster brother—a fellow cop—tries to protect him.
577;To Die For;Suzanne Stone;Nicole Kidman;Female;2227;Larry Maretto;Matt Dillon;Male;2876;Jimmy Emmett;Joaquin Phoenix;Male;73421;Russel Hines;Casey Affleck;Male;1893;Suzanne Stone wants to be a world-famous news anchor and she is willing to do anything to get what she wants. What she lacks in intelligence, she makes up for in cold determination and diabolical wiles. As she pursues her goal with relentless focus, she is forced to destroy anything and anyone that may stand in her way, regardless of the ultimate cost or means necessary.
11220;Fallen Angels;Wong Chi-Ming;Leon Lai;Male;66761;Charlie;Charlie Yeung;Female;66762;Ho Chi-mo;Takeshi Kaneshiro;Male;43661;Blondie;Karen Mok;Female;57831;In this bifurcated crime narrative, a disillusioned hitman attempts to escape from his violent lifestyle against the wishes of his partner, who is infatuated with him, and an eccentric mute repeatedly encounters, then subsequently falls for a depressed woman looking for the prostitute who supposedly stole her ex-boyfriend's affections.
11008;Major Payne;Maj. Benson Payne;Damon Wayans;Male;22675;Emily Walburn;Karyn Parsons;Female;80987;Dr. Phillips;William Hickey;Male;21282;Lt. Col. Stone;Michael Ironside;Male;11086;Major Benson Winifred Payne is being discharged from the Marines. Payne is a killin' machine, but the wars of the world are no longer fought on the battlefield. A career Marine, he has no idea what to do as a civilian, so his commander finds him a job - commanding officer of a local school's JROTC program, a bunch of ragtag losers with no hope.
532;A Close Shave;Wallace (voice);Peter Sallis;Male;7317;Wendolene (voice);Anne Reid;Female;77287;Gromit (voice);Peter Hawkins;Male;1215088;Shaun (voice);Justin Fletcher;Male;224354;Wallace's whirlwind romance with the proprietor of the local wool shop puts his head in a spin, and Gromit is framed for sheep-rustling in a fiendish criminal plot.
397;French Kiss;Kate;Meg Ryan;Female;5344;Luc Teyssier;Kevin Kline;Male;8945;Charlie;Timothy Hutton;Male;16327;Inspector Jean-Paul Cardon;Jean Reno;Male;1003;After her fiancee admits to infidelity while on a business trip in France, a woman attempts to get her lover back and marry him by traveling to Paris despite her crippling fear of flying.  On the way she unwittingly smuggles something of value that has a charming crook chasing her across France as she chases after her future husband.
11862;Father of the Bride Part II;George Banks;Steve Martin;Male;67773;Nina Banks;Diane Keaton;Female;3092;Franck Eggelhoffer;Martin Short;Male;519;Annie Banks-MacKenzie;Kimberly Williams-Paisley;Female;70696;Just when George Banks has recovered from his daughter's wedding, he receives the news that she's pregnant ... and that George's wife is expecting too. He was planning on selling their home, but that's a plan that—like George—will have to change with the arrival of both a grandchild and a kid of his own.
11929;Dolores Claiborne;Dolores Claiborne;Kathy Bates;Female;8534;Selena St. George;Jennifer Jason Leigh;Female;10431;Vera Donovan;Judy Parfitt;Female;33448;John Mackey;Christopher Plummer;Male;290;Dolores Claiborne was accused of killing her abusive husband twenty years ago, but the court's findings were inconclusive and she was allowed to walk free. Now she has been accused of killing her employer, Vera Donovan, and this time there is a witness who can place her at the scene of the crime. Things look bad for Dolores when her daughter Selena, a successful Manhattan magazine writer, returns to cover the story.
2086;Nick of Time;Gene Watson;Johnny Depp;Male;85;Lynn Watson;Courtney Chase;Female;21365;Hucy;Charles S. Dutton;Male;17764;Mr. Smith;Christopher Walken;Male;4690;An unimpressive, every-day man is forced into a situation where he is told to kill a politician to save his kidnapped daughter.
9087;The American President;Andrew Shepherd;Michael Douglas;Male;3392;Sydney Ellen Wade;Annette Bening;Female;516;A.J. MacInerney;Martin Sheen;Male;8349;Leon Kodak;David Paymer;Male;19839;Widowed U.S. president Andrew Shepherd, one of the world's most powerful men, can have anything he wants -- and what he covets most is Sydney Ellen Wade, a Washington lobbyist. But Shepherd's attempts at courting her spark wild rumors and decimate his approval ratings.
13531;Empire Records;Joe Reaves;Anthony LaPaglia;Male;57829;Jane;Debi Mazar;Female;5578;Rex Manning;Maxwell Caulfield;Male;101908;Corey Mason;Liv Tyler;Female;882;The employees of an independent music store learn about each other as they try anything to stop the store being absorbed by a large chain.
9091;Sudden Death;Darren Francis Thomas McCord;Jean-Claude Van Damme;Male;15111;Joshua Foss;Powers Boothe;Male;6280;Vice President Daniel Bender;Raymond J. Barry;Male;10361;Emily McCord;Whittni Wright;Female;79088;When a man's daughter is suddenly taken during a championship hockey game – with the captors demanding a billion dollars by game's end – he frantically sets a plan in motion to rescue her and abort an impending explosion before the final buzzer.
9070;Mighty Morphin Power Rangers: The Movie;Tommy Oliver / White Ranger;Jason David Frank;Male;50098;Rocky DeSantos / Red Ranger;Steve Cardenas;Male;56897;Kimberly Hart / Pink Ranger;Amy Jo Johnson;Female;56895;Billy Cranston / Blue Ranger;David Yost;Male;56896;Power up with six incredible teens who out-maneuver and defeat evil everywhere as the Mighty Morphin Power Ranger, But this time the Power Rangers may have met their match, when they face off with the most sinister monster the galaxy has ever seen.
11472;Nine Months;Samuel Faulkner;Hugh Grant;Male;3291;Rebecca Taylor;Julianne Moore;Female;1231;Marty Dwyer;Tom Arnold;Male;74036;Gail Dwyer;Joan Cusack;Female;3234;When he finds out his longtime girlfriend is pregnant, a commitment-phobe realizes he might have to change his lifestyle for better or much, much worse.
11448;Mighty Aphrodite;Lenny;Woody Allen;Male;1243;Linda Ash;Mira Sorvino;Female;23931;Amanda;Helena Bonham Carter;Female;1283;Chorleiter;F. Murray Abraham;Male;1164;When Lenny and his wife, Amanda, adopt a baby, Lenny realizes that his son is a genius and becomes obsessed with finding the boy's biological mother in hopes that she will be brilliant too. But when he learns that Max's mother is Linda Ash, a kindhearted prostitute and porn star, Lenny is determined to reform her immoral lifestyle. A Greek chorus chimes in to relate the plot to Greek mythology in this quirky comedy.
39108;Dragon Ball Z: Wrath of the Dragon;Son Gokû / Son Gohan / Son Goten / Gotenks (voice);Masako Nozawa;Female;90496;Trunks / Gotenks (voice);Takeshi Kusao;Male;1686;Kuririn / Minoshia (voice);Mayumi Tanaka;Female;65510;Bulma (voice);Hiromi Tsuru;Female;122193;The Z Warriors discover an unopenable music box and are told to open it with the Dragon Balls. The contents turn out to be a warrior named Tapion who had sealed himself inside along with a monster called Hildegarn. Goku must now perfect a new technique to defeat the evil monster.
11780;Rob Roy;Robert Roy MacGregor (Rob Roy);Liam Neeson;Male;3896;Mary MacGregor;Jessica Lange;Female;4431;John Graham (Marquis of Montrose);John Hurt;Male;5049;Archibald Cunningham;Tim Roth;Male;3129;In the highlands of Scotland in the 1700s, Rob Roy tries to lead his small town to a better future, by borrowing money from the local nobility to buy cattle to herd to market. When the money is stolen, Rob is forced into a Robin Hood lifestyle to defend his family and honour.
9090;To Wong Foo, Thanks for Everything! Julie Newmar;Noxeema Jackson;Wesley Snipes;Male;10814;Vida Boheme;Patrick Swayze;Male;723;Chi-Chi Rodriguez;John Leguizamo;Male;5723;Carol Ann;Stockard Channing;Female;8893;Three New York drag queens on their way to Hollywood for a beauty pageant get stranded in a small Midwestern town for the entire weekend when their car breaks down. While waiting for parts for their Cadillac convertible, the flamboyant trio shows the local homophobic rednecks that appearing different doesn't mean they don't have humanity in common.
11902;Underground;Marko Dren;Miki Manojlović;Male;48791;"Petar ""Blacky"" Popara";Lazar Ristovski;Male;70874;Natalija Zovkov;Mirjana Joković;Female;70875;Ivan Dren;Slavko Štimac;Male;70876;Black marketeers Marko and Blacky manufacture and sell weapons to the Communist resistance in WWII Belgrade, living the good life along the way. Marko's surreal duplicity propels him up the ranks of the Communist Party, and he eventually abandons Blacky and steals his girlfriend. After a lengthy stay in a below-ground shelter, the couple reemerges during the Yugoslavian Civil War of the 1990s as Marko realizes that the situation is ripe for exploitation.
11359;The Indian in the Cupboard;Omri;Hal Scardino;Male;69301;Little Bear;Litefoot;Male;69302;Jane;Lindsay Crouse;Female;32225;Victor;Richard Jenkins;Male;28633;A nine-year-old boy gets a plastic Indian and a cupboard for his birthday and finds himself involved in adventure when the Indian comes to life and befriends him.
9073;Free Willy 2: The Adventure Home;Jesse;Jason James Richter;Male;18259;Glen Greenwood;Michael Madsen;Male;147;Annie Greenwood;Jayne Atkinson;Female;18261;Randolph Johnson;August Schellenberg;Male;18260;Jesse becomes reunited with Willy three years after the whale's jump to freedom as the teenager tries to rescue the killer whale and other orcas from an oil spill.
11860;Sabrina;Linus Larrabee;Harrison Ford;Male;3;Sabrina Fairchild;Julia Ormond;Female;15887;David Larrabee;Greg Kinnear;Male;17141;Maude Larrabee;Nancy Marchand;Female;12957;An ugly duckling having undergone a remarkable change, still harbors feelings for her crush: a carefree playboy, but not before his business-focused brother has something to say about it.
12665;Powder;Jessie Caldwell;Mary Steenburgen;Female;2453;Jeremy 'Powder' Reed;Sean Patrick Flanery;Male;54789;Sheriff Doug Barnum;Lance Henriksen;Male;2714;Donald Ripley;Jeff Goldblum;Male;4785;"Harassed by classmates who won't accept his shocking appearance, a shy young man known as ""Powder"" struggles to fit in. But the cruel taunts stop when Powder displays a mysterious power that allows him to do incredible things. This phenomenon changes the lives of all those around him in ways they never could have imagined."
8438;Murder in the First;James Stamphill;Christian Slater;Male;2224;Henri Young;Kevin Bacon;Male;4724;Glenn;Gary Oldman;Male;64;Mary McCasslin;Embeth Davidtz;Female;6368;Inspired by a true story. A petty criminal sent to Alcatraz in the 1930s is caught attempting to make an escape. As punishment he is put in solitary confinement. The maximum stay is supposed to be 19 days, but Henri spends years alone, cold and in complete darkness, only to emerge a madman and soon to be a murderer. The story follows a rookie lawyer attempting to prove that Alcatraz was to blame.
56804;Viaggi di nozze;Raniero, Giovannino, Ivano;Carlo Verdone;Male;89193;Fosca;Veronica Pivetti;Female;227909;Jessica;Claudia Gerini;Female;8776;Mara;Manuela Arcuri;Female;1007522;The vicissitudes of three couples of newlyweds from the celebration of weddings to their respective honeymoons.
12158;Vampire in Brooklyn;Maximillian / Pauly / Guido;Eddie Murphy;Male;776;Detective Rita Veder;Angela Bassett;Female;9780;Detective Justice;Allen Payne;Male;32486;Julius Jones;Kadeem Hardison;Male;66554;Maximillian, the lone survivor of a race of vampires, comes to Brooklyn in search of a way to live past the next full moon. His ticket to survival is Rita, a NYPD detective who doesn't know she's half vampire -- and Maximillian will do whatever's necessary to put her under his spell.
9271;Virtuosity;Lt. Parker Barnes;Denzel Washington;Male;5292;SID 6.7;Russell Crowe;Male;934;Madison Carter;Kelly Lynch;Female;6473;Eila;Alanna Ubach;Female;10402;The Law Enforcement Technology Advancement Centre (LETAC) has developed SID version 6.7: a Sadistic, Intelligent, and Dangerous virtual reality entity which is synthesized from the personalities of more than 150 serial killers, and only one man can stop him.
16780;The Return of the Texas Chainsaw Massacre;Jenny;Renée Zellweger;Female;9137;Vilmer;Matthew McConaughey;Male;10297;Leatherface;Robert Jacks;Male;934061;Darla;Tonie Perensky;Female;975230;Everyone's favorite chainsaw-wielding psychopath, Leatherface, is back for more prom-night gore, and this time he's joined by his bloodthirsty family. Four stranded yet carefree teens are taken in by a backwoods family, clueless of their host family's grisly habits. The terrified youths, including sweet Jenny, try to escape from Leatherface and his crazed clan, including the bionic Vilmer.
36834;Total Eclipse;Arthur Rimbaud;Leonardo DiCaprio;Male;6193;Paul Verlaine;David Thewlis;Male;11207;Mathilde Maute;Romane Bohringer;Female;40938;Isabelle Rimbaud;Dominique Blanc;Female;19068;Young, wild poet Arthur Rimbaud and his mentor Paul Verlaine engage in a fierce, forbidden romance while feeling the effects of a hellish artistic lifestyle.
1408;Cutthroat Island;Morgan Adams;Geena Davis;Female;16935;William Shaw;Matthew Modine;Male;8654;Dawg;Frank Langella;Male;8924;John Reed;Maury Chaykin;Male;7868;Morgan Adams and her slave, William Shaw, are on a quest to recover the three portions of a treasure map. Unfortunately, the final portion is held by her murderous uncle, Dawg. Her crew is skeptical of her leadership abilities, so she must complete her quest before they mutiny against her. This is made yet more difficult by the efforts of the British crown to end her pirate raids.
9102;Screamers;Colonel Hendricksson;Peter Weller;Male;27811;Becker;Roy Dupuis;Male;56977;Jessica;Jennifer Rubin;Female;56978;Ace Jefferson;Andrew Lauer;Male;56979;SIRIUS 6B, Year 2078. On a distant mining planet ravaged by a decade of war, scientists have created the perfect weapon: a blade-wielding, self-replicating race of killing devices known as Screamers designed for one purpose only -- to hunt down and destroy all enemy life forms.
10722;The Day of the Beast;Ángel Berriatua;Álex Angulo;Male;3813;Profesor Cavan;Armando De Razza;Unknown;66815;José María;Santiago Segura;Male;10847;Rosario;Terele Pávez;Female;66816;"The story revolves around a Basque Roman Catholic priest dedicated to committing as many sins as possible (Angulo), a death metal salesman from Carabanchel (Segura), and the Italian host of a TV show on the occult (De Razza). These go on a literal ""trip"" through Christmas-time Madrid to hunt for and prevent the reincarnation of the Antichrist."
9061;Just Cause;Paul Armstrong;Sean Connery;Male;738;Sheriff Tanny Brown;Laurence Fishburne;Male;2975;Bobby Earl Ferguson;Blair Underwood;Male;56871;Laurie Armstrong;Kate Capshaw;Female;689;A Harvard professor is lured back into the courtroom after twenty-five years to take the case of a young black man condemned to death for the horrific murder of a child.
11980;The Prophecy;Gabriel;Christopher Walken;Male;4690;Thomas Daggett;Elias Koteas;Male;13550;Katherine Henley;Virginia Madsen;Female;12519;Simon;Eric Stoltz;Male;7036;The angel Gabriel comes to Earth to collect a soul which will end the stalemated war in Heaven, and only a former priest and a little girl can stop him.
10533;The Scarlet Letter;Hester Prynne;Demi Moore;Female;3416;Rev. Arthur Dimmesdale;Gary Oldman;Male;64;Roger Chillingworth;Robert Duvall;Male;3087;Horace Stonehall;Robert Prosky;Male;10360;"Set in puritanical Boston in the mid 1600s, the story of seamstress Hester Prynne, who is outcast after she becomes pregnant by a respected reverend. She refuses to divulge the name of the father, is ""convicted"" of adultery and forced to wear a scarlet ""A"" until an Indian attack unites the Puritans and leads to a reevaluation of their laws and morals."
9059;Tales from the Crypt: Demon Knight;The Collector;Billy Zane;Male;1954;Frank Brayker;William Sadler;Male;6573;Jeryline;Jada Pinkett Smith;Female;9575;Cordelia;Brenda Bakke;Female;32290;Ex-soldier Frank Brayker is the guardian of an ancient key that can unlock tremendous evil, the sinister Collector is a demon who wants the key so he can initiate the apocalypse. On the run from wicked mercenaries for almost 90 years, Brayker finally stops in at a boarding house in New Mexico where -- with the help of its residents -- he plans to face off against the Collector and his band of ghouls, preventing them from ever seizing the key.
9067;Tank Girl;Rebecca (Tank Girl);Lori Petty;Female;15309;T-Saint;Ice-T;Male;21411;Jet Girl;Naomi Watts;Female;3489;Kesslee;Malcolm McDowell;Male;56890;Based on the British cult comic-strip, our tank-riding anti-heroine fights a mega-corporation, which controls the world's water supply.
10149;Smoke;Augustus 'Auggie' Wren;Harvey Keitel;Male;1037;Paul Benjamin;William Hurt;Male;227;Ruby McNutt;Stockard Channing;Female;8893;Thomas 'Rashid' Cole;Harold Perrineau;Male;6195;Writer Paul Benjamin is nearly hit by a bus when he leaves Auggie Wren's smoke shop. Stranger Rashid Cole  saves his life, and soon middle-aged Paul tells homeless Rashid that he wouldn't mind a short-term housemate. Still grieving over his wife's murder, Paul is moved by both Rashid's quest to reconnect with his father and Auggie's discovery that a woman who might be his daughter is about to give birth.
9263;Now and Then;Young Roberta Martin;Christina Ricci;Female;6886;Dr. Roberta Martin;Rosie O'Donnell;Female;12929;Teeny;Thora Birch;Female;2155;Tina 'Teeny' Tercell;Melanie Griffith;Female;29369;Waxing nostalgic about the bittersweet passage from childhood to puberty in this tender coming-of-age tale, four childhood girlfriends -- Teeny, Chrissy, Samantha and Roberta -- recall the magical summer of 1970. During their walk down memory lane, they reconcile experiences with boys, secrets, bullies and more.
38288;I corti;Aldo;Aldo Baglio;Male;120019;Giacomo;Giacomo Poretti;Male;120025;Giovanni;Giovanni Storti;Male;120020;Marina;Marina Massironi;Female;7543;"I corti (""shorts"") by Aldo, Giovanni & Giacomo was the first stage show of the comedy trio, with the participation of Marina Massironi. It was recorded live at the Teatro Nuovo in Ferrara on 28 and 29 March 1996. Produced by Agidi, with the theatre direction of Arturo Brachetti."
19004;The Land Before Time III: The Time of the Great Giving;Littlefoot (voice);Scott McAfee;Male;79020;Cera (voice);Candace Hutson;Female;71447;Ducky (voice);Heather Hogan;Female;79021;Petrie / Mutt / Iguanadon (voice);Jeff Bennett;Male;34982;Littlefoot and his young friends Cera, Ducky and Spike are being harassed by a group of older dinosaurs led by Hyp. When a meteorite strikes nearby, it causes a drought. The resulting scarcity of resources creates animosity among the different species in the Great Valley. Littlefoot and his crew resolve to venture forth to find a solution - as does Hyp and his gang. Will the groups learn to cooperate, or will their rivalry destroy them?
