MovieId;Title;Character1;PersonName1;Sex1;ActorId1;Character2;PersonName2;Sex2;ActorId2;Character3;PersonName3;Sex3;ActorId3;Character4;PersonName4;Sex4;ActorId4;Overview
99861;Avengers: Age of Ultron;Tony Stark / Iron Man;Robert Downey Jr.;Male;3223;Thor Odinson;Chris Hemsworth;Male;74568;Bruce Banner / The Hulk;Mark Ruffalo;Male;103;Steve Rogers / Captain America;Chris Evans;Male;16828;When Tony Stark tries to jumpstart a dormant peacekeeping program, things go awry and Earth’s Mightiest Heroes are put to the ultimate test as the fate of the planet hangs in the balance. As the villainous Ultron emerges, it is up to The Avengers to stop him from enacting his terrible plans, and soon uneasy alliances and unexpected action pave the way for an epic and unique global adventure.
76341;Mad Max: Fury Road;Max Rockatansky;Tom Hardy;Male;2524;Imperator Furiosa;Charlize Theron;Female;6885;Nux;Nicholas Hoult;Male;3292;Immortan Joe;Hugh Keays-Byrne;Male;26060;An apocalyptic story set in the furthest reaches of our planet, in a stark desert landscape where humanity is broken, and most everyone is crazed fighting for the necessities of life. Within this world exist two rebels on the run who just might be able to restore order.
135397;Jurassic World;Owen Grady;Chris Pratt;Male;73457;Claire Dearing;Bryce Dallas Howard;Female;18997;Gray Mitchell;Ty Simpkins;Male;17181;Zach Mitchell;Nick Robinson;Male;1108907;Twenty-two years after the events of Jurassic Park, Isla Nublar now features a fully functioning dinosaur theme park, Jurassic World, as originally envisioned by John Hammond.
150540;Inside Out;Joy (voice);Amy Poehler;Female;56322;Sadness (voice);Phyllis Smith;Female;169200;Fear (voice);Bill Hader;Male;19278;Riley (voice);Kaitlyn Dias;Female;1371894;Growing up can be a bumpy road, and it's no exception for Riley, who is uprooted from her Midwest life when her father starts a new job in San Francisco. Riley's guiding emotions— Joy, Fear, Anger, Disgust and Sadness—live in Headquarters, the control centre inside Riley's mind, where they help advise her through everyday life and tries to keep things positive, but the emotions conflict on how best to navigate a new city, house and school.
102899;Ant-Man;Scott Lang / Ant-Man;Paul Rudd;Male;22226;Dr. Hank Pym;Michael Douglas;Male;3392;Hope van Dyne;Evangeline Lilly;Female;19034;Paxton;Bobby Cannavale;Male;21127;Armed with the astonishing ability to shrink in scale but increase in strength, master thief Scott Lang must embrace his inner-hero and help his mentor, Doctor Hank Pym, protect the secret behind his spectacular Ant-Man suit from a new generation of towering threats. Against seemingly insurmountable obstacles, Pym and Lang must plan and pull off a heist that will save the world.
140607;Star Wars: The Force Awakens;Han Solo;Harrison Ford;Male;3;Luke Skywalker;Mark Hamill;Male;2;General Leia Organa;Carrie Fisher;Female;4;Kylo Ren / Ben Solo;Adam Driver;Male;1023139;Thirty years after defeating the Galactic Empire, Han Solo and his allies face a new threat from the evil Kylo Ren and his army of Stormtroopers.
286217;The Martian;Mark Watney;Matt Damon;Male;1892;Melissa Lewis;Jessica Chastain;Female;83002;Annie Montrose;Kristen Wiig;Female;41091;Teddy Sanders;Jeff Daniels;Male;8447;During a manned mission to Mars, Astronaut Mark Watney is presumed dead after a fierce storm and left behind by his crew. But Watney has survived and finds himself stranded and alone on the hostile planet. With only meager supplies, he must draw upon his ingenuity, wit and spirit to subsist and find a way to signal to Earth that he is alive.
281957;The Revenant;Hugh Glass;Leonardo DiCaprio;Male;6193;John Fitzgerald;Tom Hardy;Male;2524;Captain Andrew Henry;Domhnall Gleeson;Male;93210;Jim Bridger;Will Poulter;Male;93491;In the 1820s, a frontiersman, Hugh Glass, sets out on a path of vengeance against those who left him for dead after a bear mauling.
207703;Kingsman: The Secret Service;Gary 'Eggsy' Unwin;Taron Egerton;Male;1303037;Harry Hart / Galahad;Colin Firth;Male;5472;Merlin;Mark Strong;Male;2983;Valentine;Samuel L. Jackson;Male;2231;The story of a super-secret spy organization that recruits an unrefined but promising street kid into the agency's ultra-competitive training program just as a global threat emerges from a twisted tech genius.
273248;The Hateful Eight;Major Marquis Warren;Samuel L. Jackson;Male;2231;John 'The Hangman' Ruth;Kurt Russell;Male;6856;Daisy Domergue;Jennifer Jason Leigh;Female;10431;Sheriff Chris Mannix;Walton Goggins;Male;27740;Bounty hunters seek shelter from a raging blizzard and get caught up in a plot of betrayal and deception.
264660;Ex Machina;Caleb Smith;Domhnall Gleeson;Male;93210;Ava;Alicia Vikander;Female;227454;Nathan Bateman;Oscar Isaac;Male;25072;Kyoko;Sonoya Mizuno;Female;1457238;Caleb, a coder at the world's largest internet company, wins a competition to spend a week at a private mountain retreat belonging to Nathan, the reclusive CEO of the company. But when Caleb arrives at the remote location he finds that he will have to participate in a strange and fascinating experiment in which he must interact with the world's first true artificial intelligence, housed in the body of a beautiful robot girl.
131634;The Hunger Games: Mockingjay - Part 2;Katniss Everdeen;Jennifer Lawrence;Female;72129;Peeta Mellark;Josh Hutcherson;Male;27972;Gale Hawthorne;Liam Hemsworth;Male;96066;Haymitch Abernathy;Woody Harrelson;Male;57755;With the nation of Panem in a full scale war, Katniss confronts President Snow in the final showdown. Teamed with a group of her closest friends – including Gale, Finnick, and Peeta – Katniss goes off on a mission with the unit from District 13 as they risk their lives to stage an assassination attempt on President Snow who has become increasingly obsessed with destroying her. The mortal traps, enemies, and moral choices that await Katniss will challenge her more than any arena she faced in The Hunger Games.
216015;Fifty Shades of Grey;Anastasia Steele;Dakota Johnson;Female;118545;Christian Grey;Jamie Dornan;Male;1254583;Carla Wilks;Jennifer Ehle;Female;49971;Kate Kavanagh;Eloise Mumford;Female;222130;When college senior Anastasia Steele steps in for her sick roommate to interview prominent businessman Christian Grey for their campus paper, little does she realize the path her life will take. Christian, as enigmatic as he is rich and powerful, finds himself strangely drawn to Ana, and she to him. Though sexually inexperienced, Ana plunges headlong into an affair -- and learns that Christian's true sexual proclivities push the boundaries of pain and pleasure.
211672;Minions;Scarlet Overkill (voice);Sandra Bullock;Female;18277;Herb Overkill (voice);Jon Hamm;Male;65717;Walter Nelson (voice);Michael Keaton;Male;2232;Madge Nelson (voice);Allison Janney;Female;19;Minions Stuart, Kevin and Bob are recruited by Scarlet Overkill, a super-villain who, alongside her inventor husband Herb, hatches a plot to take over the world.
168259;Furious 7;Dominic Toretto;Vin Diesel;Male;12835;Brian O'Conner;Paul Walker;Male;8167;Luke Hobbs;Dwayne Johnson;Male;18918;Leticia 'Letty' Ortiz;Michelle Rodriguez;Female;17647;Deckard Shaw seeks revenge against Dominic Toretto and his family for his comatose brother.
206647;Spectre;James Bond;Daniel Craig;Male;8784;Franz Oberhauser / Ernst Stavro Blofeld;Christoph Waltz;Male;27319;Dr. Madeleine Swann;Léa Seydoux;Female;121529;M;Ralph Fiennes;Male;5469;A cryptic message from Bond’s past sends him on a trail to uncover a sinister organization. While M battles political forces to keep the secret service alive, Bond peels back the layers of deceit to reveal the terrible truth behind SPECTRE.
262500;Insurgent;"Beatrice ""Tris"" Prior";Shailene Woodley;Female;94185;"Tobias ""Four"" Eaton";Theo James;Male;587020;Johanna Reyes;Octavia Spencer;Female;6944;Eric Coulter;Jai Courtney;Male;224181;Beatrice Prior must confront her inner demons and continue her fight against a powerful alliance which threatens to tear her society apart.
294254;Maze Runner: The Scorch Trials;Thomas;Dylan O'Brien;Male;527393;Minho;Ki Hong Lee;Male;1310760;Teresa Agnes;Kaya Scodelario;Female;115150;Newt;Thomas Brodie-Sangster;Male;25663;Thomas and his fellow Gladers face their greatest challenge yet: searching for clues about the mysterious and powerful organization known as WCKD. Their journey takes them to the Scorch, a desolate landscape filled with unimaginable obstacles. Teaming up with resistance fighters, the Gladers take on WCKD’s vastly superior forces and uncover its shocking plans for them all.
264644;Room;"Joy ""Ma"" Newsome";Brie Larson;Female;60073;Jack Newsome;Jacob Tremblay;Male;1277188;Nancy Newsome;Joan Allen;Female;11148;Robert Newsome;William H. Macy;Male;3905;Held captive for 7 years in an enclosed space, a woman and her young son finally gain their freedom, allowing the boy to experience the outside world for the first time.
318846;The Big Short;Michael Burry;Christian Bale;Male;3894;Mark Baum;Steve Carell;Male;4495;Jared Vennett;Ryan Gosling;Male;30614;Ben Rickert;Brad Pitt;Male;287;The men who made millions from a global economic meltdown.
177677;Mission: Impossible - Rogue Nation;Ethan Hunt;Tom Cruise;Male;500;William Brandt;Jeremy Renner;Male;17604;"Benjamin ""Benji"" Dunn";Simon Pegg;Male;11108;Ilsa Faust;Rebecca Ferguson;Female;933238;Ethan and team take on their most impossible mission yet—eradicating 'The Syndicate', an International and highly-skilled rogue organisation committed to destroying the IMF.
87101;Terminator Genisys;Guardian;Arnold Schwarzenegger;Male;1100;John Connor;Jason Clarke;Male;76512;Sarah Connor;Emilia Clarke;Female;1223786;Kyle Reese;Jai Courtney;Male;224181;The year is 2029. John Connor, leader of the resistance continues the war against the machines. At the Los Angeles offensive, John's fears of the unknown future begin to emerge when TECOM spies reveal a new plot by SkyNet that will attack him from both fronts, past and future, and will ultimately change warfare forever.
254128;San Andreas;Ray Gaines;Dwayne Johnson;Male;18918;Blake Gaines;Alexandra Daddario;Female;109513;Emma Gaines;Carla Gugino;Female;17832;Daniel Riddick;Ioan Gruffudd;Male;65524;In the aftermath of a massive earthquake in California, a rescue-chopper pilot makes a dangerous journey across the state in order to rescue his estranged daughter.
314365;Spotlight;Michael Rezendes;Mark Ruffalo;Male;103;"Walter ""Robby"" Robinson";Michael Keaton;Male;2232;Sacha Pfeiffer;Rachel McAdams;Female;53714;Marty Baron;Liev Schreiber;Male;23626;The true story of how the Boston Globe uncovered the massive scandal of child molestation and cover-up within the local Catholic Archdiocese, shaking the entire Catholic Church to its core.
273481;Sicario;Kate Macer;Emily Blunt;Female;5081;Alejandro Gillick;Benicio del Toro;Male;1121;Matt Graver;Josh Brolin;Male;16851;Reggie Wayne;Daniel Kaluuya;Male;206919;An idealistic FBI agent is enlisted by a government task force to aid in the escalating war against drugs at the border area between the U.S. and Mexico.
198184;Chappie;Chappie;Sharlto Copley;Male;82191;Deon Wilson;Dev Patel;Male;76788;Vincent Moore;Hugh Jackman;Male;6968;Ninja;Ninja;Male;985041;Every child comes into the world full of promise, and none more so than Chappie: he is gifted, special, a prodigy. Like any child, Chappie will come under the influence of his surroundings—some good, some bad—and he will rely on his heart and soul to find his way in the world and become his own man. But there's one thing that makes Chappie different from any one else: he is a robot.
256591;Focus;Nicky Spurgeon;Will Smith;Male;2888;Jess Barrett;Margot Robbie;Female;234352;Garriga;Rodrigo Santoro;Male;17289;Owens;Gerald McRaney;Male;29512;Nicky, an accomplished con artist, gets romantically involved with his disciple Jess but later ends their relationship. Years later, she returns as a femme fatale to spoil his plans.
257344;Pixels;Sam Brenner;Adam Sandler;Male;19292;President Will Cooper;Kevin James;Male;32895;Violet Van Patten;Michelle Monaghan;Female;11705;Eddie Plant;Peter Dinklage;Male;22970;Video game experts are recruited by the military to fight 1980s-era video game characters who've attacked New York.
150689;Cinderella;Cinderella;Lily James;Female;1016168;Stepmother, Lady Tremaine;Cate Blanchett;Female;112;Prince;Richard Madden;Male;512991;Grand Duke;Stellan Skarsgård;Male;1640;When her father unexpectedly passes away, young Ella finds herself at the mercy of her cruel stepmother and her daughters. Never one to give up hope, Ella's fortunes begin to change after meeting a dashing stranger in the woods.
214756;Ted 2;John Bennett;Mark Wahlberg;Male;13240;Ted (voice);Seth MacFarlane;Male;52139;Samantha Jackson;Amanda Seyfried;Female;71070;Patrick Meighan;Morgan Freeman;Male;192;Newlywed couple Ted and Tami-Lynn want to have a baby, but in order to qualify to be a parent, Ted will have to prove he's a person in a court of law.
158852;Tomorrowland;Frank Walker;George Clooney;Male;1461;David Nix;Hugh Laurie;Male;41419;Casey Newton;Britt Robertson;Female;52018;Athena;Raffey Cassidy;Female;1055230;"Bound by a shared destiny, a bright, optimistic teen bursting with scientific curiosity and a former boy-genius inventor jaded by disillusionment embark on a danger-filled mission to unearth the secrets of an enigmatic place somewhere in time and space that exists in their collective memory as ""Tomorrowland."""
312221;Creed;Adonis Johnson;Michael B. Jordan;Male;135651;Rocky Balboa;Sylvester Stallone;Male;16483;Bianca;Tessa Thompson;Female;62561;Mary Anne Creed;Phylicia Rashād;Female;119598;The former World Heavyweight Champion Rocky Balboa serves as a trainer and mentor to Adonis Johnson, the son of his late friend and former rival Apollo Creed.
296098;Bridge of Spies;James B. Donovan;Tom Hanks;Male;31;Rudolf Abel;Mark Rylance;Male;40900;Mary Donovan;Amy Ryan;Female;39388;Thomas Watters Jr.;Alan Alda;Male;21278;During the Cold War, the Soviet Union captures U.S. pilot Francis Gary Powers after shooting down his U-2 spy plane. Sentenced to 10 years in prison, Powers' only hope is New York lawyer James Donovan, recruited by a CIA operative to negotiate his release. Donovan boards a plane to Berlin, hoping to win the young man's freedom through a prisoner exchange. If all goes well, the Russians would get Rudolf Abel, the convicted spy who Donovan defended in court.
76757;Jupiter Ascending;Caine Wise;Channing Tatum;Male;38673;Jupiter Jones;Mila Kunis;Female;18973;Stinger Apini;Sean Bean;Male;48;Balem Abrasax;Eddie Redmayne;Male;37632;In a universe where human genetic material is the most precious commodity, an impoverished young Earth woman becomes the key to strategic maneuvers and internal strife within a powerful dynasty…
257211;The Intern;Ben;Robert De Niro;Male;380;Jules;Anne Hathaway;Female;1813;Fiona;Rene Russo;Female;14343;Matt;Anders Holm;Male;521563;70-year-old widower Ben Whittaker has discovered that retirement isn't all it's cracked up to be. Seizing an opportunity to get back in the game, he becomes a senior intern at an online fashion site, founded and run by Jules Ostin.
293863;The Age of Adaline;Adaline Bowman;Blake Lively;Female;59175;Ellis Jones;Michiel Huisman;Male;91520;William Jones;Harrison Ford;Male;3;Flemming;Ellen Burstyn;Female;9560;After 29-year-old Adaline recovers from a nearly lethal accident, she inexplicably stops growing older. As the years stretch on and on, Adaline keeps her secret to herself  until she meets a man who changes her life.
310131;The Witch;Thomasin;Anya Taylor-Joy;Female;1397778;William;Ralph Ineson;Male;202032;Katherine;Kate Dickie;Female;71083;Caleb;Harvey Scrimshaw;Male;1397779;In 1630s New England, William and Katherine lead a devout Christian life with five children, homesteading on the edge of an impassable wilderness, exiled from their settlement when William defies the local church. When their newborn son vanishes and crops mysteriously fail, the family turns on one another.
203801;The Man from U.N.C.L.E.;Napoleon Solo;Henry Cavill;Male;73968;Illya Kuryakin;Armie Hammer;Male;53807;Gaby Teller;Alicia Vikander;Female;227454;Victoria Vinciguerra;Elizabeth Debicki;Female;1133349;At the height of the Cold War, a mysterious criminal organization plans to use nuclear weapons and technology to upset the fragile balance of power between the United States and Soviet Union. CIA agent Napoleon Solo and KGB agent Illya Kuryakin are forced to put aside their hostilities and work together to stop the evildoers in their tracks. The duo's only lead is the daughter of a missing German scientist, whom they must find soon to prevent a global catastrophe.
238713;Spy;Susan Cooper;Melissa McCarthy;Female;55536;Rick Ford;Jason Statham;Male;976;Raina Boyanov;Rose Byrne;Female;9827;Bradley Fine;Jude Law;Male;9642;A desk-bound CIA analyst volunteers to go undercover to infiltrate the world of a deadly arms dealer, and prevent diabolical global disaster.
270303;It Follows;Jay Height;Maika Monroe;Female;1094091;Paul;Keir Gilchrist;Male;132712;Greg Hannigan;Daniel Zovatto;Male;1172147;Hugh;Jake Weary;Male;133980;After a seemingly innocent sexual encounter, Jay finds herself plagued by strange visions and the inescapable sense that someone, something, is following her.
306819;The Danish Girl;Einar Wegener / Lili Elbe;Eddie Redmayne;Male;37632;Gerda Wegener;Alicia Vikander;Female;227454;Hans Axgil;Matthias Schoenaerts;Male;73381;Henrik Sandahl;Ben Whishaw;Male;17064;When Gerda Wegener asks her husband Einar to fill in as a portrait model, Einar discovers the person she's meant to be and begins living her life as Lili Elbe. Having realized her true self and with Gerda's love and support, Lili embarks on a groundbreaking journey as a transgender pioneer.
166424;Fantastic Four;Reed Richards / Mr. Fantastic;Miles Teller;Male;996701;Johnny Storm / The Human Torch;Michael B. Jordan;Male;135651;Sue Storm / Invisible Woman;Kate Mara;Female;51072;Ben Grimm / The Thing;Jamie Bell;Male;478;Four young outsiders teleport to a dangerous universe, which alters their physical form in shocking ways. Their lives irrevocably upended, the team must learn to harness their daunting new abilities and work together to save Earth from a former friend turned enemy.
254320;The Lobster;David;Colin Farrell;Male;72466;Short Sighted Woman;Rachel Weisz;Female;3293;Loner Leader;Léa Seydoux;Female;121529;John;Ben Whishaw;Male;17064;In a dystopian near future, single people, according to the laws of The City, are taken to The Hotel, where they are obliged to find a romantic partner in forty-five days or are transformed into animals and sent off into The Woods.
159824;Hotel Transylvania 2;Dracula (voice);Adam Sandler;Male;19292;Johnny Loughran (voice);Andy Samberg;Male;62861;Mavis Dracula (voice);Selena Gomez;Female;77948;Frankenstein (voice);Kevin James;Male;32895;When the old-old-old-fashioned vampire Vlad arrives at the hotel for an impromptu family get-together, Hotel Transylvania is in for a collision of supernatural old-school and modern day cool.
254470;Pitch Perfect 2;Beca;Anna Kendrick;Female;84223;Chloe;Brittany Snow;Female;29221;Fat Amy;Rebel Wilson;Female;221581;Emily;Hailee Steinfeld;Female;130640;The Bellas are back, and they are better than ever. After being humiliated in front of none other than the President of the United States of America, the Bellas are taken out of the Aca-Circuit. In order to clear their name, and regain their status, the Bellas take on a seemingly impossible task: winning an international competition no American team has ever won. In order to accomplish this monumental task, they need to strengthen the bonds of friendship and sisterhood and blow away the competition with their amazing aca-magic! With all new friends and old rivals tagging along for the trip, the Bellas can hopefully accomplish their dreams.
307081;Southpaw;Billy 'The Great'  Hope;Jake Gyllenhaal;Male;131;Maureen Hope;Rachel McAdams;Female;53714;Titus 'Tick' Wills;Forest Whitaker;Male;2178;Leila Hope;Oona Laurence;Female;1423519;"Billy ""The Great"" Hope, the reigning junior middleweight boxing champion, has an impressive career, a loving wife and daughter, and a lavish lifestyle. However, when tragedy strikes, Billy hits rock bottom, losing his family, his house and his manager. He soon finds an unlikely savior in Tick Willis, a former fighter who trains the city's toughest amateur boxers. With his future on the line, Hope fights to reclaim the trust of those he loves the most."
286565;Paper Towns;Quentin Jacobsen;Nat Wolff;Male;232006;Margo Roth Spiegelman;Cara Delevingne;Female;1289968;Marcus 'Radar' Lincoln;Justice Smith;Male;1029934;Ben Starling;Austin Abrams;Male;148992;Quentin Jacobsen has spent a lifetime loving the magnificently adventurous Margo Roth Spiegelman from afar. So when she cracks open a window and climbs back into his life-dressed like a ninja and summoning him for an ingenious campaign of revenge-he follows. After their all-nighter ends and a new day breaks, Q arrives at school to discover that Margo, always an enigma, has now become a mystery. But Q soon learns that there are clues-and they're for him. Urged down a disconnected path, the closer he gets, the less Q sees of the girl he thought he knew.
105864;The Good Dinosaur;Momma (voice);Frances McDormand;Female;3910;Arlo (voice);Raymond Ochoa;Male;963134;Poppa (voice);Jeffrey Wright;Male;2954;Thunderclap (voice);Steve Zahn;Male;18324;An epic journey into the world of dinosaurs where an Apatosaurus named Arlo makes an unlikely human friend.
201085;Crimson Peak;Edith Cushing;Mia Wasikowska;Female;76070;Lady Lucille Sharpe;Jessica Chastain;Female;83002;Sir Thomas Sharpe;Tom Hiddleston;Male;91606;Dr. Alan McMichael;Charlie Hunnam;Male;56365;In the aftermath of a family tragedy, an aspiring author is torn between love for her childhood friend and the temptation of a mysterious outsider. Trying to escape the ghosts of her past, she is swept away to a house that breathes, bleeds… and remembers.
253412;Everest;Rob Hall;Jason Clarke;Male;76512;Beck Weathers;Josh Brolin;Male;16851;Scott Fischer;Jake Gyllenhaal;Male;131;Doug Hansen;John Hawkes;Male;16861;"Inspired by the incredible events surrounding a treacherous attempt to reach the summit of the world's highest mountain, ""Everest"" documents the awe-inspiring journey of two different expeditions challenged beyond their limits by one of the fiercest snowstorms ever encountered by mankind. Their mettle tested by the harshest of elements found on the planet, the climbers will face nearly impossible obstacles as a lifelong obsession becomes a breathtaking struggle for survival."
272693;The DUFF;Bianca Piper;Mae Whitman;Female;52404;Wesley Rush;Robbie Amell;Male;1223726;Madison Morgan;Bella Thorne;Female;98285;Jess Harris;Skyler Samuels;Female;110930;Bianca's universe turns upside down when she learns that her high school refers to her as a ‘DUFF' (Designated Ugly Fat Friend). Hoping to erase that label, she enlists the help of a charming jock and her favorite teacher. Together they'll face the school's mean girl and remind everyone that we are all someone's DUFF… and that's totally fine.
298312;The Visit;Rebecca Jamison;Olivia DeJonge;Female;1385063;Tyler Jamison;Ed Oxenbould;Male;1198286;Nana;Deanna Dunagan;Female;204271;Pop Pop;Peter McRobbie;Male;19489;A brother and sister are sent to their grandparents' remote Pennsylvania farm for a week, where they discover that the elderly couple is involved in something deeply disturbing.
274479;Joy;Joy Mangano;Jennifer Lawrence;Female;72129;Neil Walker;Bradley Cooper;Male;51329;Rudy;Robert De Niro;Male;380;Jackie;Dascha Polanco;Female;1026947;A story based on the life of a struggling Long Island single mom who became one of the country's most successful entrepreneurs.
321697;Steve Jobs;Steve Jobs;Michael Fassbender;Male;17288;Joanna Hoffman;Kate Winslet;Female;204;Steve Wozniak;Seth Rogen;Male;19274;John Sculley;Jeff Daniels;Male;8447;Set backstage at three iconic product launches and ending in 1998 with the unveiling of the iMac, Steve Jobs takes us behind the scenes of the digital revolution to paint an intimate portrait of the brilliant man at its epicenter.
205775;In the Heart of the Sea;Owen Chase;Chris Hemsworth;Male;74568;George Pollard;Benjamin Walker;Male;239996;Matthew Joy;Cillian Murphy;Male;2037;Old Thomas Nickerson;Brendan Gleeson;Male;2039;In the winter of 1820, the New England whaling ship Essex is assaulted by something no one could believe—a whale of mammoth size and will, and an almost human sense of vengeance.
228161;Home;Oh (voice);Jim Parsons;Male;5374;Gratuity 'Tip' Tucci (voice);Rihanna;Female;131519;Capitain Smek (voice);Steve Martin;Male;67773;Lucy Tucci (voice);Jennifer Lopez;Female;16866;When Earth is taken over by the overly-confident Boov, an alien race in search of a new place to call home, all humans are promptly relocated, while all Boov get busy reorganizing the planet. But when one resourceful girl, Tip, manages to avoid capture, she finds herself the accidental accomplice of a banished Boov named Oh. The two fugitives realize there’s a lot more at stake than intergalactic relations as they embark on the road trip of a lifetime.
257445;Goosebumps;R.L. Stine;Jack Black;Male;70851;Zach Cooper;Dylan Minnette;Male;112476;Hannah Fairchild;Odeya Rush;Female;1121786;Gale Cooper;Amy Ryan;Female;39388;After moving to a small town, Zach Cooper finds a silver lining when he meets next door neighbor Hannah, the daughter of bestselling Goosebumps series author R.L. Stine. When Zach unintentionally unleashes real monsters from their manuscripts and they begin to terrorize the town, it’s suddenly up to Stine, Zach and Hannah to get all of them back in the books where they belong.
