MovieId;Title;Character1;PersonName1;Sex1;ActorId1;Character2;PersonName2;Sex2;ActorId2;Character3;PersonName3;Sex3;ActorId3;Character4;PersonName4;Sex4;ActorId4;Overview
53319;What a Beautiful Day;Checco;Checco Zalone;Male;114366;Farah;Nabiha Akkari;Female;147832;Nicola;Rocco Papaleo;Male;120135;Cardinale Rosselli;Tullio Solenghi;Male;147833;Checco, an uneducated but self-satisfied fellow from Milan, who has always dreamed of becoming a police officer, fails his entrance exam for the third time. It must be said that at the oral examination Checco said that the reason why he wanted to join the police was benefits in kind and cronyism! But the young man has connections and he soon finds himself a security agent at the Milan Cathedral. Of course the bumbling idiot proves a living catastrophe! Spotted by Sufien, an Arab terrorist who is preparing an attack against the cathedral, Checco appears as the perfect sucker. To manipulate him, he sends his charming sister Farah to him, with the mission to seduce him...
64720;Take Shelter;Curtis LaForche;Michael Shannon;Male;335;Samantha LaForche;Jessica Chastain;Female;83002;Nat;Katy Mixon;Female;59450;Dewart;Shea Whigham;Male;74242;Plagued by a series of apocalyptic visions, a young husband and father questions whether to shelter his family from a coming storm, or from himself.
50839;Margin Call;Sam Rogers;Kevin Spacey;Male;1979;Peter Sullivan;Zachary Quinto;Male;17306;Jared Cohen;Simon Baker;Male;1284159;Will Emerson;Paul Bettany;Male;6162;A thriller that revolves around the key people at an investment bank over a 24-hour period during the early stages of the financial crisis.
55420;Another Earth;Rhoda Williams;Brit Marling;Female;222330;John Burroughs;William Mapother;Male;15338;Alex;Matthew-Lee Erlbach;Male;1114903;Maya Burroughs;Meggan Lennon;Female;1114904;On the night of the discovery of a duplicate Earth in the Solar system, an ambitious young student and an accomplished composer cross paths in a tragic accident.
60243;A Separation;Simin;Leila Hatami;Female;240240;Nader;Payman Maadi;Male;559566;Hojjat;Shahab Hosseini;Male;229933;Razieh;Sare Bayat;Female;559567;A married couple are faced with a difficult decision - to improve the life of their child by moving to another country or to stay in Iran and look after a deteriorating parent who has Alzheimer's disease.
55846;Blitz;Tom Brant;Jason Statham;Male;976;Porter Nash;Paddy Considine;Male;14887;Barry Weiss;Aidan Gillen;Male;49735;Elizabeth Falls;Zawe Ashton;Female;118034;A tough cop is dispatched to take down a serial killer who has been targeting police officers.
83389;From Up on Poppy Hill;Umi Matsuzaki (voice);Masami Nagasawa;Female;87637;Shun Kazama / Yuichiro Sawamura (voice);Junichi Okada;Male;119241;Hana Matsuzaki (voice);Keiko Takeshita;Female;548758;Miki Hokuto (voice);Yuriko Ishida;Female;20330;A group of Yokohama students fight to save their school's clubhouse from the wrecking ball during preparations for the 1964 Tokyo Olympic Games. While working there, Umi and Shun gradually become attracted to each other but have to face a sudden trial. Even so, they keep going without fleeing the difficulties of reality.
64328;The Muppets;Gary;Jason Segel;Male;41088;Mary;Amy Adams;Female;9273;Tex Richman;Chris Cooper;Male;2955;CDE Executive;Rashida Jones;Female;80591;When Kermit the Frog and the Muppets learn that their beloved theater is slated for demolition, a sympathetic human, Gary, and his puppet brother, Walter, swoop in to help the gang put on a show and raise the $10 million they need to save the day.
65759;Happy Feet Two;Mumble (voice);Elijah Wood;Male;109;Ramon / Lovelace (voice);Robin Williams;Male;2157;Gloria (voice);Pink;Female;77271;Erik (voice);Elizabeth Daily;Female;15274;Mumble the penguin has a problem: his son Erik, who is reluctant to dance, encounters The Mighty Sven, a penguin who can fly! Things get worse for Mumble when the world is shaken by powerful forces, causing him to brings together the penguin nations and their allies to set things right.
38684;Jane Eyre;Jane Eyre;Mia Wasikowska;Female;76070;Edward Rochester;Michael Fassbender;Male;17288;St. John;Jamie Bell;Male;478;Mrs. Reed;Sally Hawkins;Female;39658;After a bleak childhood, Jane Eyre goes out into the world to become a governess. As she lives happily in her new position at Thornfield Hall, she meet the dark, cold, and abrupt master of the house, Mr. Rochester. Jane and her employer grow close in friendship and she soon finds herself falling in love with him. Happiness seems to have found Jane at last, but could Mr. Rochester's terrible secret be about to destroy it forever?
49020;Submarine;Lloyd Tate;Noah Taylor;Male;1284;Graham Purvis;Paddy Considine;Male;14887;Oliver Tate;Craig Roberts;Male;104561;Jordana Bevan;Yasmin Paige;Female;81571;15-year-old deep-thinking Welsh schoolboy Oliver Tate struggles to initiate and maintain a relationship with Jordana, his devilish, dark-haired classmate at their Swansea high school. As his parents' marriage begins to fall apart, similar problems arise in his relationship with Jordana.
71469;The Darkest Hour;Sean;Emile Hirsch;Male;46593;Anne;Rachael Taylor;Female;19538;Natalie;Olivia Thirlby;Female;52442;Skyler;Joel Kinnaman;Male;92404;In Moscow, five young people lead the charge against an alien race which has attacked Earth via our power supply.
77949;The Awakening;Florence Cathcart;Rebecca Hall;Female;15556;Robert Mallory;Dominic West;Male;17287;Maud Hill;Imelda Staunton;Female;11356;Tom;Isaac Hempstead-Wright;Male;239020;1921 England is overwhelmed by the loss and grief of World War I. Hoax exposer Florence Cathcart (Hall) visits a boarding school to explain sightings of a child ghost.
50698;Grave Encounters;Lance;Sean Rogerson;Male;169747;Matt;Juan Riedinger;Male;85613;Sasha;Ashleigh Gryzko;Female;239150;Houston Gray;Mackenzie Gray;Male;37698;A crew from a paranormal reality television show lock themselves in a haunted psychiatric hospital. They search for evidence of paranormal activity as they shoot what ends up becoming their final episode.
69668;Dream House;Will Atenton;Daniel Craig;Male;8784;Ann Patterson;Naomi Watts;Female;3489;Libby Atenton;Rachel Weisz;Female;3293;Jack Patterson;Márton Csókás;Male;20982;Publisher Will Atenton quits a lucrative job in New York to relocate his wife, Libby, and their daughters to a quaint town in New England. However, as they settle into their home the Atentons discover that a woman and her children were murdered there, and the surviving husband is the town's prime suspect. With help from a neighbor who was close to the murdered family, Will pieces together a horrifying chain of events.
64678;The Art of Getting By;George Zinavoy;Freddie Highmore;Male;1281;Sally Howe;Emma Roberts;Female;34847;Dustin;Michael Angarano;Male;11665;Charlotte Howe;Elizabeth Reaser;Female;53755;George, a lonely and fatalistic teen who's made it all the way to his senior year without ever having done a real day of work, is befriended by Sally, a popular but complicated girl who recognizes in him a kindred spirit.
51052;Arthur Christmas;Arthur (voice);James McAvoy;Male;5530;Steve (voice);Hugh Laurie;Male;41419;Grandsanta (voice);Bill Nighy;Male;2440;Santa (voice);Jim Broadbent;Male;388;Each Christmas, Santa and his vast army of highly trained elves produce gifts and distribute them around the world in one night. However, when one of 600 million children to receive a gift from Santa on Christmas Eve is missed, it is deemed ‘acceptable’ to all but one—Arthur. Arthur Claus is Santa’s misfit son who executes an unauthorised rookie mission to get the last present half way around the globe before dawn on Christmas morning.
74534;The Best Exotic Marigold Hotel;Douglas Ainslie;Bill Nighy;Male;2440;Muriel Donnelly;Maggie Smith;Female;10978;Graham Dashwood;Tom Wilkinson;Male;207;Evelyn Greenslade;Judi Dench;Female;5309;British retirees travel to India to take up residence in what they believe is a newly restored hotel. Less luxurious than its advertisements, the Marigold Hotel nevertheless slowly begins to charm in unexpected ways as the residents find new purpose in their old age.
66129;The Tuche Family;Jeff Tuche;Jean-Paul Rouve;Male;16922;Cathy Tuche;Isabelle Nanty;Female;2412;Mamie Suze;Claire Nadeau;Female;73264;Donald Tuche;Théo Fernandez;Male;544683;"Everyone in the village of Bouzolles knows the Tuche family, who live by the philosophy ""Man is not made to work."" Despite their lack of money, they strive to be happy... that is, until their hand-to-mouth existence is turned on its head. After winning the lottery, the Tuches get rich beyond their wildest dreams and move to Monaco. And while attempting to fit in in their swanky new homeland, they struggle to stay true to the same principles by which they've always lived."
74308;Detachment;Henry Barthes;Adrien Brody;Male;3490;Erica;Sami Gayle;Female;506085;Ms. Sarah Madison;Christina Hendricks;Female;110014;Grampa;Louis Zorich;Male;73210;A chronicle of three weeks in the lives of several high school teachers, administrators and students through the eyes of substitute teacher, Henry Barthes. Henry roams from school to school, imparting modes of knowledge, but never staying long enough to form any semblance of sentient attachment.
70435;Haywire;Mallory Kane;Gina Carano;Female;78452;Paul;Michael Fassbender;Male;17288;Kenneth;Ewan McGregor;Male;3061;John Kane;Bill Paxton;Male;2053;A black ops soldier seeks payback after she is betrayed and left for dead.
73567;Killer Joe;Det. Joe 'Killer Joe' Cooper;Matthew McConaughey;Male;10297;Chris Smith;Emile Hirsch;Male;46593;Ansel Smith;Thomas Haden Church;Male;19159;Sharla Smith;Gina Gershon;Female;11150;A cop who moonlights as a hit man agrees to kill the hated mother of a desperate drug dealer in exchange for a tumble with the young man's virginal sister.
75900;My Week With Marilyn;Marilyn Monroe;Michelle Williams;Female;1812;Sir Laurence Olivier;Kenneth Branagh;Male;11181;Colin Clark;Eddie Redmayne;Male;37632;Milton Greene;Dominic Cooper;Male;55470;London, 1956. Genius actor and film director Laurence Olivier is about to begin the shooting of his upcoming movie, premiered in 1957 as The Prince and the Showgirl, starring Marilyn Monroe. Young Colin Clark, who dreams on having a career in movie business, manages to get a job on the set as third assistant director.
38319;Your Highness;Thadeous;Danny McBride;Male;62862;Fabious;James Franco;Male;17051;Isabel;Natalie Portman;Female;524;Belladonna;Zooey Deschanel;Female;11664;A fantasy movie about an arrogant, lazy prince and his more heroic brother who must complete a quest in order to save their father's kingdom.
59861;Larry Crowne;Larry Crowne;Tom Hanks;Male;31;Mercedes Tainot;Julia Roberts;Female;1204;Dean Tainot;Bryan Cranston;Male;17419;Lamar;Cedric the Entertainer;Male;5726;When he suddenly finds himself without his long-standing blue-collar job, Larry Crowne enrolls at his local college to start over. There, he becomes part of an eclectic community of students and develops a crush on his teacher.
49494;The Eagle;Marcus Aquila;Channing Tatum;Male;38673;Guern;Mark Strong;Male;2983;Esca;Jamie Bell;Male;478;Aquila;Donald Sutherland;Male;55636;In 140 AD, twenty years after the unexplained disappearance of the entire Ninth Legion in the mountains of Scotland, young centurion Marcus Aquila arrives from Rome to solve the mystery and restore the reputation of his father, the commander of the Ninth. Accompanied only by his British slave Esca, Marcus sets out across Hadrian's Wall into the uncharted highlands of Caledonia - to confront its savage tribes, make peace with his father's memory, and retrieve the lost legion's golden emblem, the Eagle of the Ninth.
51481;Mean Girls 2;"Johanna ""Jo"" Mitchell";Meaghan Jette Martin;Female;130567;Abby Hanover;Jennifer Stone;Female;142108;Mandi Weatherly;Maiara Walsh;Female;144288;Hope Plotkin;Nicole Gale Anderson;Female;1032810;After a clique of girls makes life difficult, a new student forms a rival group to take control of the school's corridors.
53487;This Must Be the Place;Cheyenne;Sean Penn;Male;2228;Mary's Mother;Olwen Fouéré;Female;933272;Mary;Eve Hewson;Female;933271;Steven;Johnny Ward;Unknown;218984;A bored, retired rock star sets out to find his father's executioner, an ex-Nazi war criminal who is a refugee in the U.S.
43959;Soul Surfer;Bethany Hamilton;AnnaSophia Robb;Female;1285;Cheri Hamilton;Helen Hunt;Female;9994;Tom Hamilton;Dennis Quaid;Male;6065;Sarah Hill;Carrie Underwood;Female;96091;The true story of teen surfer Bethany Hamilton, who lost her arm in a shark attack and courageously overcame all odds to become a champion again, through her sheer determination and unwavering faith.
77459;A Monster in Paris;Lucille (voice);Vanessa Paradis;Female;65007;Francœur (voice);Matthieu Chedid;Male;66841;Raoul (voice);Gad Elmaleh;Male;51100;Le préfet Maynott (voice);François Cluzet;Male;33161;Paris, 1910. Emile, a shy movie projectionist, and Raoul, a colourful inventor, find themselves embarked on the hunt for a monster terrorizing citizens. They join forces with Lucille, the big-hearted star of the Bird of Paradise cabaret, an eccentric scientist and his irascible monkey to save the monster, who turns out to be an oversized but harmless flea, from the city's ruthlessly ambitious police chief.
74997;The Human Centipede 2 (Full Sequence);Martin;Laurence R. Harvey;Male;573773;Miss Yennie;Ashlynn Yennie;Female;121575;Paul;Dominic Borrelli;Unknown;1236882;Valerie;Georgia Goodrick;Unknown;560872;Inspired by the fictional Dr. Heiter, disturbed loner Martin dreams of creating a 12-person centipede and sets out to realize his sick fantasy.
57157;Young Adult;Mavis Gary;Charlize Theron;Female;6885;Matt Freehauf;Patton Oswalt;Male;10872;Buddy Slade;Patrick Wilson;Male;17178;Beth Slade;Elizabeth Reaser;Female;53755;A divorced writer from the Midwest returns to her hometown to reconnect with an old flame, who's now married with a family.
50359;Hop;Easter Bunny (voice);Russell Brand;Male;59919;Fred;James Marsden;Male;11006;Samantha O'Hare;Kaley Cuoco;Female;53862;Carlos / Phil (voice);Hank Azaria;Male;5587;E.B., the Easter Bunny's teenage son, heads to Hollywood, determined to become a drummer in a rock 'n' roll band. In L.A., he's taken in by Fred after the out-of-work slacker hits E.B. with his car.
38322;Big Mommas: Like Father, Like Son;Malcolm / Big Momma;Martin Lawrence;Male;78029;Trent / Charmaine;Brandon T. Jackson;Male;53336;Jasmine Lee;Portia Doubleday;Female;117669;Dance Instructor;Mari Morrow;Female;42743;FBI agent Malcolm Turner and his 17-year-old son, Trent, go undercover at an all-girls performing arts school after Trent witnesses a murder. Posing as Big Momma and Charmaine, they must find the murderer before he finds them.
71157;Polisse;Baloo;Frédéric Pierrot;Male;9005;Fred;JoeyStarr;Male;51508;Mathieu;Nicolas Duvauchelle;Male;81054;Nadine;Karin Viard;Female;13688;Paris, France. Fred and his colleagues, members of the BPM, the Police Child Protection Unit, dedicated to pursuing all sorts of offenses committed against the weakest, must endure the scrutiny of Melissa, a photographer commissioned to graphically document the daily routine of the team.
70670;Headhunters;Roger Brown;Aksel Hennie;Male;76547;Clas Greve;Nikolaj Coster-Waldau;Male;12795;Diana Brown;Synnøve Macody Lund;Female;559207;Lotte;Julie R. Ølgaard;Female;558205;An accomplished headhunter risks everything to obtain a valuable painting owned by a former mercenary.
23514;The Rum Diary;Paul Kemp;Johnny Depp;Male;85;Chenault;Amber Heard;Female;55085;Sanderson;Aaron Eckhart;Male;6383;Sala;Michael Rispoli;Male;18313;Tired of the noise and madness of New York and the crushing conventions of late Eisenhower-era America, itinerant journalist Paul Kemp travels to the pristine island of Puerto Rico to write for a local San Juan newspaper run by the downtrodden editor Lotterman. Adopting the rum-soaked lifestyle of the late ‘50s version of Hemingway’s 'The Lost Generation', Paul soon becomes entangled with a very attractive American woman and her fiancée, a businessman involved in shady property development deals.  It is within this world that Kemp ultimately discovers his true voice as a writer and integrity as a man.
70578;Trespass;Kyle Miller;Nicolas Cage;Male;2963;Sarah Miller;Nicole Kidman;Female;2227;Elias Collins;Ben Mendelsohn;Male;77335;Avery Miller;Liana Liberato;Female;60458;Kyle and Sarah Miller have it all: a huge gated house on the water, fancy cars, and the potential for romance in their relationship. He's just back from a business trip and their teen daughter Avery is sneaking out to a party, when four thugs in security uniforms and ski masks stage a home invasion. They want what's in the safe: cash and diamonds. As Kyle stalls them, trying to negotiate for Sarah's freedom, the fault lines in Kyle and Sarah's marriage and the pasts of the four robbers come into play. Is there room here for heroism?
74018;A Cinderella Story: Once Upon a Song;Katie Gibbs;Lucy Hale;Female;205307;Luke Morgan;Freddie Stroma;Male;234934;Gail Van Ravensway;Missi Pyle;Female;1294;Bev Van Ravensway;Megan Park;Female;55615;In this modern telling of the classic tale, aspiring singer Katie Gibbs falls for the new boy at her performing arts high school. But Katie's wicked stepmother and stepsister are scheming to crush her dream before she can sing her way into his heart.
60420;Like Crazy;Jacob Helm;Anton Yelchin;Male;21028;Anna Gardner;Felicity Jones;Female;72855;Sam;Jennifer Lawrence;Female;72129;Simon;Charlie Bewley;Male;84221;A British college student falls for an American student, only to be separated from him when she's banned from the U.S. after overstaying her visa.
51999;Perfect Sense;Michael;Ewan McGregor;Male;3061;Susan;Eva Green;Female;10912;James;Ewen Bremner;Male;1125;Stephen;Stephen Dillane;Male;8435;In Glasgow, Scotland, while a mysterious pandemic begins to spread around the world, Susan, a brilliant epidemiologist, falls in love with Michael, a skillful cook.
65218;Lemonade Mouth;Olivia;Bridgit Mendler;Female;85176;Wen;Adam Hicks;Male;137167;Stella;Hayley Kiyoko;Unknown;89109;Mo;Naomi Scott;Female;240724;The story follows five disparate high school students - Olivia, Mo, Charlie, Stella, and Wen who meet in detention. They realize they are destined to rock, and ultimately form a band that becomes a champion for students sidelined by the high school elite.
67913;The Guard;Sergeant Gerry Boyle;Brendan Gleeson;Male;2039;FBI agent Wendell Everett;Don Cheadle;Male;1896;Francis Sheehy;Liam Cunningham;Male;15498;Clive Cornell;Mark Strong;Male;2983;When a small-town Irish cop with a crass personality is partnered with a straight-laced FBI agent to bust an international drug-trafficking ring, they must settle their differences in order to take down a dangerous gang.
49022;Something Borrowed;Rachel;Ginnifer Goodwin;Female;417;Darcy;Kate Hudson;Female;11661;Dex;Colin Egglesfield;Male;83225;Ethan;John Krasinski;Male;17697;Though Rachel is a successful attorney and a loyal, generous friend, she is still single. After one drink too many at her 30th-birthday celebration, Rachel unexpectedly falls into bed with her longtime crush, Dex -- who happens to be engaged to her best friend, Darcy. Ramifications of the liaison threaten to destroy the women's lifelong friendship, while Ethan, Rachel's confidant, harbors a potentially explosive secret of his own.
71670;Hostel: Part III;Carter McMullen;Kip Pardue;Male;65561;Scott;Brian Hallisay;Male;207396;Justin;John Hensley;Male;74427;Kendra;Sarah Habel;Female;87444;Set in Las Vegas, the film centers on a man who attends his best friend's bachelor party, unaware of an insidious agenda that plays into hunting humans.
60307;Diary of a Wimpy Kid: Rodrick Rules;Greg Heffley;Zachary Gordon;Male;89819;Rodrick Heffley;Devon Bostick;Male;90498;Rowley Jefferson;Robert Capron;Male;111922;Frank Heffley;Steve Zahn;Male;18324;Wimpy Greg Heffley, now in seventh grade, thinks he has it all together. He has mastered middle school and gotten rid of the Cheese Touch. However, Greg's older brother, Rodrick, is itching to cut him down to size. He gets the perfect opportunity when their mother tries to force the boys to bond. Rodrick may be Greg's chief tormentor, but he feels his constant pranks are just what his little brother needs to prepare him for life's hard knocks.
55347;Beginners;Oliver Fields;Ewan McGregor;Male;3061;Hal Fields;Christopher Plummer;Male;290;Anna Wallace;Mélanie Laurent;Female;19119;Arthur;Cosmo;Unknown;2063103;Oliver meets the irreverent and unpredictable Anna only months after his father Hal Fields has passed away. This new love floods Oliver with memories of his father, who, following the death of his wife of 44 years, came out of the closet at age 75 to live a full, energized, and wonderfully tumultuous gay life – which included a younger boyfriend.
77495;Sleep Tight;César;Luis Tosar;Male;16867;Clara;Marta Etura;Female;34019;Marcos;Alberto San Juan;Male;27462;Miss Verónica;Petra Martínez;Female;132999;César, an unhappy concierge, maintains a peculiar relationship with the very diverse inhabitants of the upper-class apartment building where he works in Barcelona.
74998;Seeking Justice;Will Gerard;Nicolas Cage;Male;2963;Laura Gerard;January Jones;Female;31717;Simon;Guy Pearce;Male;529;Jimmy;Harold Perrineau;Male;6195;After his wife is assaulted, a husband enlists the services of a vigilante group to help him settle the score.
48340;Sanctum;Frank;Richard Roxburgh;Male;12206;Carl;Ioan Gruffudd;Male;65524;Josh;Rhys Wakefield;Male;55899;Victoria;Alice Parkinson;Female;144286;Master diver Frank McGuire (Richard Roxburgh) has explored the South Pacific's Esa-ala Caves for months.  But when his exit is cut off in a flash flood, Frank's team—including 17-year-old son Josh (Rhys Wakefield) and financier Carl Hurley (Ioan Gruffudd)—are forced to radically alter plans.  With dwindling supplies, the crew must navigate an underwater labyrinth to make it out.  Soon, they are confronted with the unavoidable question: Can they survive, or will they be trapped forever?
45610;Machine Gun Preacher;Sam Childers;Gerard Butler;Male;17276;Lynn;Michelle Monaghan;Female;11705;Daisy;Kathy Baker;Female;1907;Gun Shop Owner;Richard Goteri;Unknown;133284;The true story of Sam Childers, a former drug-dealing biker who finds God and became a crusader for hundreds of Sudanese children who've been kidnapped and pressed into duty as soldiers.
71672;Wrong Turn 4: Bloody Beginnings;Kenia;Jennifer Pudavick;Female;116931;Sara;Tenika Davis;Female;563644;Jenna;Terra Vnesa;Female;64305;Dr. Annmarie McQuaid;Kristen Harris;Female;212141;A group of friends take refuge in a deserted sanatorium after they are left stranded in a snowstorm. Later, the place becomes a death trap when man-eating cannibals surround them.
50357;Apollo 18;Lt. Col. John Grey;Ryan Robbins;Male;77164;Capt. Benjamin Anderson;Warren Christie;Male;232525;Cdr. Nathan Walker;Lloyd Owen;Male;172935;Mission Control;Andrew Airlie;Male;41436;Officially, Apollo 17 was the last manned mission to the moon. But a year later in 1973, three American astronauts were sent on a secret mission to the moon funded by the US Department of Defense. What you are about to see is the actual footage which the astronauts captured on that mission. While NASA denies its authenticity, others say it's the real reason we've never gone back to the moon.
56288;Spy Kids: All the Time in the World;Marissa Wilson;Jessica Alba;Female;56731;Wilbur Wilson;Joel McHale;Male;74949;Rebecca Wilson;Rowan Blanchard;Female;1257205;Cecil Wilson;Mason Cook;Male;583040;Eight years after the third film, the OSS has become the world's top spy agency, while the Spy Kids department has since become defunct. A retired spy Marissa is thrown back into the action along with her stepchildren when a maniacal Timekeeper attempts to take over the world. In order to save the world, Rebecca and Cecil must team up with their hated stepmother. Carmen and Juni have since also grown up and will provide gadgets to them.
80184;The Hidden Face;Adrián;Quim Gutiérrez;Male;34018;Fabiana;Martina García;Female;233278;Belén;Clara Lago;Female;224731;Emma;Alexandra Stewart;Female;18765;A Spanish orchestra conductor deals with the mysterious disappearance of his girlfriend.
74306;God Bless America;Morning Show Host;Alexie Gilmore;Female;87669;Roxy;Tara Lynne Barr;Female;183926;Frank;Joel Murray;Male;155649;Ava;Mackenzie Brooke Smith;Female;107777;Fed up with the cruelty and stupidity of American culture, an unlikely duo goes on a killing spree, killing reality TV stars, bigots and others they find repugnant in this black comedy.
49950;The Roommate;Rebecca Evans;Leighton Meester;Female;85825;Sara Matthews;Minka Kelly;Female;96625;Stephen;Cam Gigandet;Male;55086;Tracy;Aly Michalka;Female;90033;When Sara, a young design student from Iowa, arrives for college in Los Angeles, she is eager to fit in and get to know the big city. Her wealthy roommate, Rebecca, is more than eager to take Sara under her wing and show her the ropes. The two become close, but when Sara begins to branch out and make more friends on campus, Rebecca becomes resentful. Alarmed, Sara moves in with her new boyfriend, causing Rebecca's behavior to take a violent turn.
59968;Our Idiot Brother;Ned;Paul Rudd;Male;22226;Miranda;Elizabeth Banks;Female;9281;Natalie;Zooey Deschanel;Female;11664;Liz;Emily Mortimer;Female;1246;Everybody has one—the sibling who is always just a little bit behind the curve when it comes to getting his life together. For sisters Liz, Miranda and Natalie, that person is their perennially upbeat brother, Ned. But as each of their lives begins to unravel, Ned's family comes to realise that Ned isn't such an idiot after all.
