MovieId;Title;Character1;PersonName1;Sex1;ActorId1;Character2;PersonName2;Sex2;ActorId2;Character3;PersonName3;Sex3;ActorId3;Character4;PersonName4;Sex4;ActorId4;Overview
11543;Kingpin;Roy Munson;Woody Harrelson;Male;57755;Ishmael Boorg;Randy Quaid;Male;1811;Claudia;Vanessa Angel;Female;25308;Ernie McCracken;Bill Murray;Male;1532;After bowler Roy Munson swindles the wrong crowd and is left with a hook for a hand, he settles into impoverished obscurity. That is, until he uncovers the next big thing: an Amish kid named Ishmael. So, the corrupt and the hopelessly naïve hit the circuit intent on settling an old score with Big Ern.
9303;Bound;Violet;Jennifer Tilly;Female;7906;Corky;Gina Gershon;Female;11150;Caesar;Joe Pantoliano;Male;532;Mickey Malnato;John P. Ryan;Male;15213;Corky, a tough female ex-convict working on an apartment renovation in a Chicago building, meets a couple living next door, Caesar, a paranoid mobster, and Violet, his seductive girlfriend, who is immediately attracted to her.
9591;That Thing You Do!;Mr. White;Tom Hanks;Male;31;Guy Patterson;Tom Everett Scott;Male;16857;Faye Dolan;Liv Tyler;Female;882;Jimmy Mattingly;Johnathon Schaech;Male;51670;A Pennsylvania band scores a hit in 1964 and rides the star-making machinery as long as it can, with lots of help from its manager.
38366;Il ciclone;Levante;Leonardo Pieraccioni;Male;120271;Caterina;Lorena Forteza;Female;120272;Selvaggia;Barbara Enrichi;Female;120273;Libero;Massimo Ceccherini;Male;120274;The everyday life of accountant Levante, his family and the other people of a small town in the Tuscan countryside is taken by storm by the serendipitous arrival of five beautiful flamenco dancers from Spain.
2925;The First Wives Club;Elise Elliot Atchison;Goldie Hawn;Female;18892;Brenda Morelli Cushman;Bette Midler;Female;73931;Annie MacDuggan Paradis;Diane Keaton;Female;3092;Gunilla Garson Goldberg;Maggie Smith;Female;10978;After years of helping their hubbies climb the ladder of success, three mid-life Manhattanites have been dumped for a newer, curvier model. But the trio is determined to turn their pain into gain. They come up with a cleverly devious plan to hit their exes where it really hurts - in the wallet!
9566;The Fan;Gil Renard;Robert De Niro;Male;380;Bobby Rayburn;Wesley Snipes;Male;10814;Jewel Stern;Ellen Barkin;Female;6913;Manny;John Leguizamo;Male;5723;When the San Francisco Giants pay center-fielder, Bobby Rayburn $40 million to lead their team to the World Series, no one is happier or more supportive than #1 fan, Gil Renard.  When Rayburn becomes mired in the worst slump of his career, the obsessed Renard decides to stop at nothing to help his idol regain his former glory—not even murder.
9299;Thesis;Ángela;Ana Torrent;Female;24976;Chema;Fele Martínez;Male;1602;Bosco;Eduardo Noriega;Male;17093;Castro;Xabier Elorriaga;Male;30357;While doing a thesis about violence, Ángela finds a snuff video where a girl is tortured until death. Soon she discovers that the girl was a former student in her faculty...
12498;Sling Blade;Karl Childers;Billy Bob Thornton;Male;879;Doyle Hargraves;Dwight Yoakam;Male;20309;Charles Bushman;J. T. Walsh;Male;22131;Vaughan Cunningham;John Ritter;Male;27772;Karl Childers is a mentally disabled man who has been in the custody of the state mental hospital since the age of 12 for killing his mother and her lover. Although thoroughly institutionalized, Karl is deemed fit to be released into the outside world.
10547;The Arrival;Zane Zaminski;Charlie Sheen;Male;6952;Ilana Green;Lindsay Crouse;Female;32225;Calvin;Richard Schiff;Male;31028;Phil Gordian;Ron Silver;Male;21399;Zane Ziminski is an astrophysicist who receives a message that seems to have extraterrestrial origins. Eerily soon after his discovery, Zane is fired. He then embarks on a search to determine the origins of the transmission that leads him into a Hitchcockian labyrinth of paranoia and intrigue.
10543;Fear;David McCall;Mark Wahlberg;Male;13240;Nicole Walker;Reese Witherspoon;Female;368;Steve Walker;William Petersen;Male;52267;Laura Walker;Amy Brenneman;Female;15851;Nicole Walker always dreamed of being swept away by someone special — someone strong, sexy and sensitive who would care for her more than anything else in the world. David is all that and more: a modern-day knight who charms and seduces her, body and soul. But her perfect boyfriend is not all he seems to be. His sweet facade masks a savage, dark side that will soon transform Nicole's dream into a nightmare.
10218;Swingers;Trent Walker;Vince Vaughn;Male;4937;Mike Peters;Jon Favreau;Male;15277;Lorraine;Heather Graham;Female;69122;Sue;Patrick Van Horn;Male;64715;After 6 years together, Mike's girlfriend leaves him, so he travels to LA to be a star. Six months on, he's still not doing very well— so a few of his friends try to reconnect him to the social scene and hopefully help him forget his failed relationship.
2061;Pusher;Frank;Kim Bodnia;Male;3398;Tonny;Mads Mikkelsen;Male;1019;Vic;Laura Drasbæk;Female;21192;Milo;Zlatko Burić;Male;31960;A drug pusher grows increasingly desperate after a botched deal leaves him with a large debt to a ruthless drug lord.
9103;The Quest;Christopher Dubois;Jean-Claude Van Damme;Male;15111;Lord Edgar Dobbs;Roger Moore;Male;10222;Maxie Devine;James Remar;Male;1736;Harry Smythe;Jack McGee;Male;10489;Ghang-gheng, the ancient winner-take-all competition in which the deadliest fighters from around the world employ the most spectacular feats of martial arts skills ever displayed in order to win the prized Golden Dragon. But fighting prowess alone will not be enough for Chris to triumph over such daunting foes.
7300;One Fine Day;Melanie Parker;Michelle Pfeiffer;Female;1160;Jack Taylor;George Clooney;Male;1461;Maggie Taylor;Mae Whitman;Female;52404;Sammy Parker;Alex D. Linz;Male;15789;Melanie Parker, an architect and mother of Sammy, and Jack Taylor, a newspaper columnist and father of Maggie, are both divorced. They meet one morning when overwhelmed Jack is left unexpectedly with Maggie and forgets that Melanie was to take her to school. As a result, both children miss their school field trip and are stuck with the parents. The two adults project their negative stereotypes of ex-spouses on each other, but end up needing to rely on each other to watch the children as each must save his job. Humor is added by Sammy's propensity for lodging objects in his nose and Maggie's tendency to wander.
7863;Shine;David Helfgott;Geoffrey Rush;Male;118;Peter Helfgott;Armin Mueller-Stahl;Male;12647;David Helfgott - Adolescent;Noah Taylor;Male;1284;Ben Rosen;Nicholas Bell;Male;15340;Pianist David Helfgott, driven by his father and teachers, has a breakdown. Years later he returns to the piano, to popular if not critical acclaim.
9716;Everyone Says I Love You;Skylar Dandridge;Drew Barrymore;Female;69597;Holden Spence;Edward Norton;Male;819;Bob Danridge;Alan Alda;Male;21278;Von Sidell;Julia Roberts;Female;1204;A New York girl sets her father up with a beautiful woman in a shaky marriage while her half sister gets engaged.
3179;Beavis and Butt-Head Do America;Beavis / Butt-Head / Tom Anderson / Mr. Van Driessen / Principal McVicker (voice);Mike Judge;Male;17403;Muddy Grimes (voice);Bruce Willis;Male;62;Dallas Grimes (voice);Demi Moore;Female;3416;ATF Agent Flemming (voice);Robert Stack;Male;2493;Mike Judge's slacker duo, Beavis and Butt-Head, wake to discover their TV has been stolen. Their search for a new one takes them on a clueless adventure across America where they manage to accidentally become America's most wanted.
9819;Marvin's Room;Lee Wakefield Lacker;Meryl Streep;Female;5064;Bessie Wakefield;Diane Keaton;Female;3092;Hank Lacker;Leonardo DiCaprio;Male;6193;"Wallace ""Wally"" Carter";Robert De Niro;Male;380;A leukemia patient attempts to end a 20-year feud with her sister to get her bone marrow.
2928;Michael;Michael;John Travolta;Male;8891;Dorothy Winters;Andie MacDowell;Female;1533;Frank Quinlan;William Hurt;Male;227;Vartan Malt;Bob Hoskins;Male;382;Tabloid reporters are sent by their editor to investigate after the paper recieves a letter from a woman claiming an angel is living with her.
3573;Emma;Emma Woodhouse;Gwyneth Paltrow;Female;12052;Harriet Smith;Toni Collette;Female;3051;Mr. Elton;Alan Cumming;Male;10697;Frank Churchill;Ewan McGregor;Male;3061;Emma Woodhouse is a congenial young lady who delights in meddling in other people’s affairs. She is perpetually trying to unite men and women who are utterly wrong for each other. Despite her interest in romance, Emma is clueless about her own feelings, and her relationship with gentle Mr. Knightly.
10535;Spy Hard;Dick Steele;Leslie Nielsen;Male;7633;Veronique Ukrinsky;Nicollette Sheridan;Female;37045;The Director;Charles Durning;Male;1466;Miss Cheevus;Marcia Gay Harden;Female;4726;The evil Gen. Rancor has his sights set on world domination, and only one man can stop him: Dick Steele, also known as Agent WD-40. Rancor needs to obtain a computer circuit for the missile that he is planning to fire, so Steele teams up with Veronique Ukrinsky, a KGB agent whose father designed the chip. Together they try to locate the evil mastermind's headquarters, where Veronique's father and several other hostages are being held.
10723;Bulletproof;Rock Keats / Jack Carter;Damon Wayans;Male;22675;Archie Moses;Adam Sandler;Male;19292;Frank Colton;James Caan;Male;3085;Bledsoe;Jeep Swenson;Male;66813;An undercover police officer named Rock Keats befriends a drug dealer and car thief named Archie Moses in a bid to catch the villainous drug lord Frank Coltan. But the only problem is that Keats is a cop, his real name is Jack Carter, and he is working undercover with the LAPD to bust Moses and Colton at a sting operation the LAPD has set up.
11159;Secrets & Lies;Cynthia Rose Purley;Brenda Blethyn;Female;4154;Hortense Cumberbatch;Marianne Jean-Baptiste;Female;17352;Maurice Purley;Timothy Spall;Male;9191;Monica Purley;Phyllis Logan;Female;127164;With both her adoptive parents now dead, a black optometrist decides to make contact with her birth mother, but is shocked to find out that she is white.
10280;Thinner;Billy Halleck;Robert John Burke;Male;31512;Heidi Halleck;Lucinda Jenney;Female;5148;Linda Halleck;Bethany Joy Lenz;Female;1118081;Richie Ginelli;Joe Mantegna;Male;3266;"A fat lawyer finds himself growing ""Thinner"" when an old gypsy man places a hex on him. Now the lawyer must call upon his friends in organized crime to help him persuade the gypsy to lift the curse. Time is running out for the desperate lawyer as he draws closer to his own death, and grows ever thinner."
9826;The Phantom;The Phantom / Kit Walker;Billy Zane;Male;1954;Diana Palmer;Kristy Swanson;Female;56128;Xander Drax;Treat Williams;Male;4515;Sala;Catherine Zeta-Jones;Female;1922;The 21st successor to the role of Bengalla's resident superhero must travel to New York to prevent a rich madman from obtaining three magic skulls that would give him the secret to ultimate power.
14553;Stealing Beauty;Lucy Harmon;Liv Tyler;Female;882;Diana Grayson;Sinéad Cusack;Female;11281;Alex Parrish;Jeremy Irons;Male;16940;Gregory;Jason Flemyng;Male;973;Lucy Harmon, an American teenager is arriving in the lush Tuscan countryside to be sculpted by a family friend who lives in a beautiful villa. Lucy visited there four years earlier and exchanged a kiss with an Italian boy with whom she hopes to become reacquainted.
9304;Multiplicity;Doug Kinney;Michael Keaton;Male;2232;Laura Kinney;Andie MacDowell;Female;1533;Leeds;Harris Yulin;Male;1166;Vic;Eugene Levy;Male;26510;Construction worker Doug Kinney finds that the pressures of his working life, combined with his duties to his wife Laura and daughter Jennifer leaves him with little time for himself. However, he is approached by geneticist Dr. Owen Leeds, who offers Doug a rather unusual solution to his problems: cloning.
9306;The Island of Dr. Moreau;Dr. Moreau;Marlon Brando;Male;3084;Montgomery;Val Kilmer;Male;5576;Edward Douglas;David Thewlis;Male;11207;Aissa;Fairuza Balk;Female;826;A shipwrecked sailor stumbles upon a mysterious island and is shocked to discover that a brilliant scientist and his lab assistant have found a way to combine human and animal DNA—with horrific results.
20539;The Crucible;John Proctor;Daniel Day-Lewis;Male;11856;Abigail Williams;Winona Ryder;Female;1920;Elizabeth Proctor;Joan Allen;Female;11148;Judge Thomas Danforth;Paul Scofield;Male;13324;A Salem resident attempts to frame her ex-lover's wife for being a witch in the middle of the 1692 witchcraft trials.
10478;Tin Cup;Roy 'Tin Cup' McAvoy;Kevin Costner;Male;1269;Dr. Molly Griswold;Rene Russo;Female;14343;David Simms;Don Johnson;Male;25129;Romeo Posar;Cheech Marin;Male;11159;A washed up golf pro working at a driving range tries to qualify for the US Open in order to win the heart of his succesful rival's girlfriend.
10546;The Crow: City of Angels;Ashe Corven;Vincent Perez;Male;20239;Sarah;Mia Kirshner;Female;18658;Curve;Iggy Pop;Male;13604;Nemo;Thomas Jane;Male;11155;After Ashe and his little son are murdered violently for no reason by Judah's men, he returns from the dead to take revenge. One after one, Judah's people face the power of the dark angel. The second film based on James O'Barr's cult comic.
10549;Hamlet;Prince Hamlet;Kenneth Branagh;Male;11181;King Claudius;Derek Jacobi;Male;937;Ophelia;Kate Winslet;Female;204;Gertrude;Julie Christie;Female;1666;Hamlet, Prince of Denmark, returns home to find his father murdered and his mother now marrying the murderer... his uncle. Meanwhile, war is brewing.
8818;Evita;Eva Perón;Madonna;Female;3125;Ché;Antonio Banderas;Male;3131;Juan Perón;Jonathan Pryce;Male;378;Agustín Magaldi;Jimmy Nail;Male;18065;The hit musical based on the life of Evita Duarte, a B-movie Argentinian actress who eventually became the wife of Argentinian president and dictator Juan Perón, and the most beloved and hated woman in Argentina.
25059;Homeward Bound II: Lost in San Francisco;Chance (voice);Michael J. Fox;Male;521;Sassy (voice);Sally Field;Female;35;Shadow (voice);Ralph Waite;Male;8853;Bob Seaver;Robert Hays;Male;14416;When the pets accidentally get separated from their vacationing owners, Chance, Shadow, and Sassy navigate the mean streets of San Francisco, trying to find their home across the Golden Gate Bridge. But the road is blocked by a series of hazards, both man and beast.
8766;Hellraiser: Bloodline;Phillip L'Merchant / John Merchant / Dr. Paul Merchant;Bruce Ramsay;Male;7039;Angelique;Valentina Vargas;Female;2173;Pinhead;Doug Bradley;Male;73040;Genevieve L'Merchant;Charlotte Chatton;Female;55957;In the 22nd century, a scientist attempts to right the wrong his ancestor created: the puzzle box that opens the gates of Hell and unleashes Pinhead and his Cenobite legions.
11076;Fly Away Home;Thomas 'Tom' Alden;Jeff Daniels;Male;8447;Amy Alden;Anna Paquin;Female;10690;Susan Barnes;Dana Delany;Female;65002;David Alden;Terry Kinney;Male;11067;"Amy is only 13 years old when her mother is killed. She goes to Canada to live with her father, an eccentric inventor whom she barely knows. Amy is miserable in her new life... until she discovers a nest of goose eggs that were abandoned when a local forest is torn down. The eggs hatch and Amy becomes ""Mama Goose"". When Winter comes, Amy, and her dad must find a way to lead the birds South..."
1770;Michael Collins;Michael Collins;Liam Neeson;Male;3896;Harry Roland;Aidan Quinn;Male;18992;Ned Broy;Stephen Rea;Male;9029;Eamon de Valera;Alan Rickman;Male;4566;Michael Collins plays a crucial role in the establishment of the Irish Free State in the 1920s, but becomes vilified by those hoping to create a completely independent Irish republic.
10861;Maximum Risk;Alain Moreau / Mikhail Suverov;Jean-Claude Van Damme;Male;15111;Alex Minetti;Natasha Henstridge;Female;57395;Sebastien;Jean-Hugues Anglade;Male;7037;Ivan Dzasokhov;Zach Grenier;Male;7471;Alain Moreau's investigation into the death of his identical twin brother leads him from the beauty of the south of France to the mean streets of New York City and into the arms of his brother's beautiful girlfriend. Pursued by ruthless Russian mobsters and renegade FBI agents, the duo race against time to solve his brother's murder and expose an international conspiracy.
43629;Doodlebug;The Man;Jeremy Theobald;Male;70230;;;Unknown;0;;;Unknown;0;;;Unknown;0;In his squalid apartment, a man tries to squash with his shoe an insect of some kind that is moving around the room.
10680;D3: The Mighty Ducks;Gordon Bombay;Emilio Estevez;Male;2880;Ted Orion;Jeffrey Nordling;Male;24048;Dean Buckley;David Selby;Male;56930;Casey Conway;Heidi Kling;Female;65038;The Ducks are offered scholarships at Eden Hall Academy but struggle with their new coach's methods and come under pressure from the board to retain their scholarships before their big game against the Varsity team.
9404;First Strike;Insp. Chan Ka Kui;Jackie Chan;Male;18897;'Uncle' Bill Wong;Bill Tung;Male;44922;Jackson Tsui;Jackson Liu;Male;120418;Annie Tsui;Annie Wu;Female;120419;Hong Kong cop Chan Ka-Kui returns, working with Interpol to track down and arrest an illegal weapons dealer. Chan later realizes that things are not as simple as they appear and soon finds himself to be a pawn of an organization posing as Russian intelligence.
38288;I corti;Aldo;Aldo Baglio;Male;120019;Giacomo;Giacomo Poretti;Male;120025;Giovanni;Giovanni Storti;Male;120020;Marina;Marina Massironi;Female;7543;"I corti (""shorts"") by Aldo, Giovanni & Giacomo was the first stage show of the comedy trio, with the participation of Marina Massironi. It was recorded live at the Teatro Nuovo in Ferrara on 28 and 29 March 1996. Produced by Agidi, with the theatre direction of Arturo Brachetti."
9101;Down Periscope;"Lt. Commander Thomas ""Tom"" Dodge";Kelsey Grammer;Male;7090;Lt. Emily Lake;Lauren Holly;Female;34485;"Executive Officer Lt. Martin T. ""Marty"" Pascal";Rob Schneider;Male;60949;Lt. Howard;Harry Dean Stanton;Male;5048;Bumbling Navy lieutenant Tom Dodge has been given one last chance to clean up his record. But Admiral Graham, his nemesis, assigns Dodge to the Stingray, a submarine that can barely keep afloat. To add insult to injury, the Stingray is to be the enemy flagship in the upcoming war games … and to make matters even worse, Dodge's crew is a band of idiots even more incompetent that he is!
41668;Fantozzi The Return;Rag. Ugo Fantozzi;Paolo Villaggio;Male;27433;Pina Fantozzi;Milena Vukotić;Female;44104;Ragionier Filini;Gigi Reder;Male;106346;Mariangela Fantozzi / Uga;Maria Cristina Maccà;Female;1753667;Ugo Fantozzi has been ejected from Heaven and is sent back to Earth for a short period of time until the staff in Heaven can get Fantozzi a place there. Fantozzi goes through a variety of unfortunate experiences, such as rescuing his retro punk granddaughter Uga, and having to pay a vast telephone bill due to frequent chat line conversations. He ends up getting arrested instead of his ex-boss, who was originally charged with corruption. Just as he is about to enjoy the World Cup Final with Italy, he is called back into Heaven. Can he find peace once again?
11446;Welcome to the Dollhouse;Dawn Wiener;Heather Matarazzo;Female;33656;Mark Wiener;Matthew Faber;Male;80541;Missy Wiener;Daria Kalinina;Female;974425;Brandon McCarthy;Brendan Sexton III;Male;2839;An unattractive 7th grader struggles to cope with suburban life as the middle child with inattentive parents and bullies at school.
13997;Black Sheep;Mike Donnelly;Chris Farley;Male;58198;Steve Dodds;David Spade;Male;60950;Al Donnelly;Tim Matheson;Male;21561;Drake Sabitch;Gary Busey;Male;2048;When dignified Albert Donnelly runs for Governor, his team moves to keep his slow-witted and klutzy younger brother, Mike, out of the eye of the media. To baby-sit Mike, the campaign assigns sarcastic Steve, who gets the experience of a lifetime when he tries to take Mike out of town during the election.
20762;The Substitute;Jonathan Shale;Tom Berenger;Male;13022;Joey Six;Raymond Cruz;Male;58650;Juan Lacas;Marc Anthony;Male;47775;Hollan;William Forsythe;Male;4520;After he did some jobs for CIA, ex-marine John Shale is visiting his high school love Jane. She's now a teacher in Columbus High School in Miami. Soon after his arriving Jane has her knee cap broken while jogging. After that, John decides to go undercover as her substitute in high school. Very soon he finds out that gang named Kings of Destruction are terrorizing the school.
9625;The Glimmer Man;Lt. Jack Cole;Steven Seagal;Male;23880;Det. Jim Campbell;Keenen Ivory Wayans;Male;35689;Frank Deverell;Bob Gunton;Male;4029;Mr. Smith;Brian Cox;Male;1248;A former government operative renowned for his stealth, Jack Cole is now a Los Angeles police detective. When a series of horrible murders occurs in the metro area, Cole is assigned to the case, along with tough-talking fellow cop Jim Campbell. Although the two men clash, they gradually become effective partners as they uncover a conspiracy linked to the killings, which also involves terrorism and organized crime.
42425;A spasso nel tempo;Ascanio Colonna;Christian De Sica;Male;69036;Walter Colombo;Massimo Boldi;Male;69037;Professor Mortimer;Dean Jones;Male;40393;Lorenzo il Magnifico;Marco Messeri;Male;126986;While visiting Universal Studios in Hollywood along with their respective families, two Italian tourists get on a real time machine and got lost in time. Professor Mortimer effort to rescue them result in trips through various ages of ancient Italy.
10874;Muppet Treasure Island;Long John Silver;Tim Curry;Male;13472;Billy Bones;Billy Connolly;Male;9188;Mrs. Bluveridge;Jennifer Saunders;Female;12094;Jim Hawkins;Kevin Bishop;Male;19996;After telling the story of Flint's last journey to young Jim Hawkins, Billy Bones has a heart attack and dies just as Jim and his friends are attacked by pirates. The gang escapes into the town where they hire out a boat and crew to find the hidden treasure, which was revealed by Bones before he died. On their voyage across the seas, they soon find out that not everyone on board can be trusted.
11867;Barb Wire;Barbara Kopetski;Pamela Anderson;Female;6736;Axel Hood;Temuera Morrison;Male;7242;Dr. Corrina Devonshire;Victoria Rowell;Female;65020;Charlie Kopetski;Jack Noseworthy;Male;22133;A sexy nightclub owner, Barb Wire moonlights as a mercenary in Steel Harbor, one of the last free zones in the now fascist United States. When scientist Cora Devonshire wanders into Barb's establishment, she gets roped into a top-secret government plot involving biological weapons. Soon Barb is reunited with her old flame Axel Hood, who is now Cora's husband and a guerrilla fighter, resulting in plenty of tense action.
9623;The Juror;Annie Laird;Demi Moore;Female;3416;Teacher;Alec Baldwin;Male;7447;Oliver Laird;Joseph Gordon-Levitt;Male;24045;Juliet;Anne Heche;Female;8256;"With his gangster boss on trial for murder, a mob thug known as ""the Teacher"" tells Annie Laird she must talk her fellow jurors into a not-guilty verdict, implying that he'll kill her son Oliver if she fails. She manages to do this, but, when it becomes clear that the mobsters might want to silence her for good, she sends Oliver abroad and tries to gather evidence of the plot against her, setting up a final showdown."
19164;The Land Before Time IV: Journey Through the Mists;Narrator (voice);John Ingle;Male;44052;Cera (voice);Candace Hutson;Female;71447;Ducky (voice);Heather Hogan;Female;79021;Spike (voice);Rob Paulsen;Male;43125;Littlefoot and his dinosaur pals go in search of a medicinal flower that will cure his ailing grandfather.
9536;Bio-Dome;Bud Macintosh;Pauly Shore;Male;64998;Doyle Johnson;Stephen Baldwin;Male;9045;Dr. Noah Faulkner;William Atherton;Male;7676;Monique (as Joey Adams);Joey Lauren Adams;Female;16484;"Bud and Doyle are two losers who are doing nothing with their lives. Both of their girlfriends are actively involved in saving the environment, but the two friends couldn't care less about saving the Earth. One day, when a group of scientists begin a mission to live inside a ""Bio-Dome"" for a year without outside contact, Bud and Doyle mistakenly become part of the project themselves."
9283;Beautiful Girls;Willie Conway;Timothy Hutton;Male;16327;"Tommy ""Birdman"" Rowland";Matt Dillon;Male;2876;"Michael ""Mo"" Morris";Noah Emmerich;Male;11315;Tracy Stover;Annabeth Gish;Female;49425;During a snowy winter in the small fictional town of Knight's Ridge, Massachusetts, a group of lifelong buddies hang out, drink and struggle to connect with the women who affect their decisions, dreams and desires.
9431;Bordello of Blood;Rafe Guttman;Dennis Miller;Male;18326;Katherine Verdoux;Erika Eleniak;Female;23764;Lillith;Angie Everhart;Female;58312;Reverend Current;Chris Sarandon;Male;14541;Private eye Rafe Guttman is hired by repressed, born-again Katherine to find her missing bad-boy brother. The trail leads him to a whorehouse run by a thousand-year-old vampire and secretly backed by Katherine's boss, televangelist Jimmy Current.
9099;Sgt. Bilko;Master Sergeant Ernest G. Bilko;Steve Martin;Male;67773;Colonel John T. Hall;Dan Aykroyd;Male;707;Major Colin Thorn;Phil Hartman;Male;14104;Rita Robbins;Glenne Headly;Female;21104;The army is known for churning out lean mean fighting machines intent on protecting our great nation. Sergeant Ernie Bilko is the leader of a ragtag group of the sorriest soldiers ever to enlist in the armed forces.
