MovieId;Title;Character1;PersonName1;Sex1;ActorId1;Character2;PersonName2;Sex2;ActorId2;Character3;PersonName3;Sex3;ActorId3;Character4;PersonName4;Sex4;ActorId4;Overview
71676;Ghost Rider: Spirit of Vengeance;Johnny Blaze / Ghost Rider;Nicolas Cage;Male;2963;Roarke / The Devil;Ciarán Hinds;Male;8785;Nadya;Violante Placido;Female;44649;Ray Carrigan / Blackout;Johnny Whitworth;Male;73589;When the devil resurfaces with aims to take over the world in human form, Johnny Blaze reluctantly comes out of hiding to transform into the flame-spewing supernatural hero Ghost Rider -- and rescue a 10-year-old boy from an unsavory end.
44943;Battle: Los Angeles;Michael Nantz;Aaron Eckhart;Male;6383;William Martinez;Ramón Rodríguez;Male;72985;Cpl. Lee Imlay;Will Rothhaar;Male;149484;Joe Rincon;Michael Peña;Male;454;When once distant UFOs become a terrifying threat attacking Earth, a Marine staff sergeant and his team take it upon themselves to face the enemy and protect what remains of the planet.
57212;War Horse;Rose Narracott;Emily Watson;Female;1639;Lyons;David Thewlis;Male;11207;Ted Narracott;Peter Mullan;Male;3064;Grandfather;Niels Arestrup;Male;17498;Follows a young man named Albert and his horse, Joey, and how their bond is broken when Joey is sold to the cavalry and sent to the trenches of World War One. Despite being too young to enlist, Albert heads to France to save his friend.
50456;Hanna;Hanna Heller;Saoirse Ronan;Female;36592;Erik Heller;Eric Bana;Male;8783;Johanna Zadeck;Vicky Krieps;Female;1080195;Marissa Wiegler;Cate Blanchett;Female;112;Raised by her father, an ex-CIA agent, in the wilds of Finland, Hanna's upbringing has been geared to making her the perfect assassin. Sent into the world by her father on a mission, Hanna journeys across Europe, eluding agents dispatched after her by a ruthless intelligence operative. As she nears her ultimate target, Hanna faces startling revelations about her existence.
62215;Melancholia;Justine;Kirsten Dunst;Female;205;Claire;Charlotte Gainsbourg;Female;4273;John;Kiefer Sutherland;Male;2628;Gaby;Charlotte Rampling;Female;44079;Two sisters find their already strained relationship challenged as a mysterious new planet threatens to collide with Earth.
49730;Red Riding Hood;Valerie;Amanda Seyfried;Female;71070;Father Soloman;Gary Oldman;Male;64;Cesaire;Billy Burke;Male;21029;Peter;Shiloh Fernandez;Male;79795;Valerie is in love with a brooding outsider, Peter, but her parents have arranged for her to marry another man – who is wealthy. Unwilling to lose each other, Valerie and Peter plan to run away together when they learn that Valerie's older sister has been killed by a werewolf that prowls the dark forest surrounding their village. Hungry for revenge, the people call on famed werewolf hunter, Father Solomon, to help them kill the wolf. But Solomon's arrival brings unintended consequences as he warns that the wolf, who takes human form by day, could be any one of them.
40805;The Green Hornet;Britt Reid / Green Hornet;Seth Rogen;Male;19274;Kato;Jay Chou;Male;17380;Lenore Case;Cameron Diaz;Female;6941;James Reid;Tom Wilkinson;Male;207;Britt Reid, the heir to the largest newspaper fortune in Los Angeles, is a spoiled playboy who has been, thus far, happy to lead an aimless life. After his father dies, Britt meets Kato, a resourceful company employee. Realizing that they have the talent and resources to make something of their lives, Britt and Kato join forces as costumed crime-fighters to bring down the city's most-powerful criminal, Chudnofsky.
58233;Johnny English Reborn;Johnny English;Rowan Atkinson;Male;10730;"Pamela Thornton (""Pegasus"")";Gillian Anderson;Female;12214;Simon Ambrose;Dominic West;Male;17287;Kate Sumner;Rosamund Pike;Female;10882;The most prominent heads of state in the world begin gathering for a conference that could have a major impact on global politics. When MI-7 receives word that the Chinese premier has become the target of some high-powered killers, it falls on Johnny English to save the day. Armed with the latest high-tech weaponry and gadgets that would make even James Bond jealous, the once-disgraced agent uncovers evidence of a massive conspiracy involving some of the world's most powerful organisations, and vows to redeem his tarnished reputation by stopping the killers before they can strike.
74643;The Artist;George Valentin;Jean Dujardin;Male;56024;Peppy Miller;Bérénice Bejo;Female;82923;Al Zimmer;John Goodman;Male;1230;Clifton;James Cromwell;Male;2505;Hollywood, 1927: As silent movie star George Valentin wonders if the arrival of talking pictures will cause him to fade into oblivion, he sparks with Peppy Miller, a young dancer set for a big break.
55779;Final Destination 5;Sam;Nicholas D'Agosto;Male;37059;Molly;Emma Bell;Female;131820;Peter Friedkin;Miles Fisher;Male;1223185;Agent Block;Courtney B. Vance;Male;24047;In this fifth installment, Death is just as omnipresent as ever, and is unleashed after one man’s premonition saves a group of coworkers from a terrifying suspension bridge collapse. But this group of unsuspecting souls was never supposed to survive, and, in a terrifying race against time, the ill-fated group frantically tries to discover a way to escape Death’s sinister agenda.
41446;Scream 4;Dewey Riley;David Arquette;Male;15234;Sidney Prescott;Neve Campbell;Female;9206;Gale Weathers-Riley;Courteney Cox;Female;14405;Jill Roberts;Emma Roberts;Female;34847;Sidney Prescott, now the author of a self-help book, returns home to Woodsboro on the last stop of her book tour. There she reconnects with Sheriff Dewey and Gale, who are now married, as well as her cousin Jill and her Aunt Kate. Unfortunately, Sidney's appearance also brings about the return of Ghostface, putting Sidney, Gale, and Dewey, along with Jill, her friends, and the whole town of Woodsboro in danger.
27582;The Mechanic;Arthur Bishop;Jason Statham;Male;976;Steve Mckenna;Ben Foster;Male;11107;Harry Mckenna;Donald Sutherland;Male;55636;Sara;Mini Anden;Female;142953;Arthur Bishop is a 'mechanic' - an elite assassin with a strict code and unique talent for cleanly eliminating targets. It's a job that requires professional perfection and total detachment, and Bishop is the best in the business. But when he is ordered to take out his mentor and close friend Harry, Bishop is anything but detached.
76025;Shame;Brandon;Michael Fassbender;Male;17288;Sissy;Carey Mulligan;Female;36662;David;James Badge Dale;Male;18473;Marianne;Nicole Beharie;Female;87243;Brandon, a thirty-something man living in New York, eludes intimacy with women but feeds his deepest desires with a compulsive addiction to sex. When his younger sister temporarily moves into his apartment, stirring up bitter memories of their shared painful past, Brandon's life, like his fragile mind, gets out of control.
8967;The Tree of Life;Mr. O'Brien;Brad Pitt;Male;287;Jack O'Brien;Sean Penn;Male;2228;Mrs. O'Brien;Jessica Chastain;Female;83002;Young Jack O'Brien;Hunter McCracken;Male;1715121;The impressionistic story of a Texas family in the 1950s. The film follows the life journey of the eldest son, Jack, through the innocence of childhood to his disillusioned adult years as he tries to reconcile a complicated relationship with his father. Jack finds himself a lost soul in the modern world, seeking answers to the origins and meaning of life while questioning the existence of faith.
417859;Puss in Boots;Puss in Boots (voice);Antonio Banderas;Male;3131;Kitty Softpaws (voice);Salma Hayek;Female;3136;Humpty Dumpty (voice);Zach Galifianakis;Male;58225;Jack (voice);Billy Bob Thornton;Male;879;Long before he even met Shrek, the notorious fighter, lover and outlaw Puss in Boots becomes a hero when he sets off on an adventure with the tough and street smart Kitty Softpaws and the mastermind Humpty Dumpty to save his town. This is the true story of The Cat, The Myth, The Legend... The Boots.
59965;Abduction;Nathan Harper;Taylor Lautner;Male;84214;Karen Murphy;Lily Collins;Female;112561;Frank Burton;Alfred Molina;Male;658;Dr. Geraldine 'Geri' Bennett;Sigourney Weaver;Female;10205;A young man sets out to uncover the truth about his life after finding his baby photo on a missing persons website.
50348;The Lincoln Lawyer;Mickey Haller;Matthew McConaughey;Male;10297;Maggie McPherson;Marisa Tomei;Female;3141;Louis Roulet;Ryan Phillippe;Male;11864;Frank Levin;William H. Macy;Male;3905;A lawyer conducts business from the back of his Lincoln town car while representing a high-profile client in Beverly Hills.
38117;Beastly;Kyle Kingson;Alex Pettyfer;Male;61363;Lindy Taylor;Vanessa Hudgens;Female;67599;Kendra Hilferty;Mary-Kate Olsen;Female;67849;Zola Davies;LisaGay Hamilton;Female;64908;A curse transforms a handsome and arrogant young man into everything he detests in this contemporary retelling of Beauty and the Beast. Wealthy Kyle Kingson has everything a teenager could want in life, but he still gets off on humiliating the weaker and less attractive. When Kyle invites his misfit classmate Kendra to an environmental rally at their school, she questions his motivations but reluctantly accepts. Later, Kyle blows Kendra off, prompting the spurned goth girl to cast a dark spell on the swaggering egotist.
58224;Mr. Popper's Penguins;Tom Popper;Jim Carrey;Male;206;Amanda;Carla Gugino;Female;17832;Janie Popper;Madeline Carroll;Female;62564;Mrs. Van Gundy;Angela Lansbury;Female;14730;Jim Carrey stars as Tom Popper, a successful businessman who’s clueless when it comes to the really important things in life...until he inherits six “adorable” penguins, each with its own unique personality. Soon Tom’s rambunctious roommates turn his swank New York apartment into a snowy winter wonderland — and the rest of his world upside-down.
59108;Tower Heist;Josh Kovacs;Ben Stiller;Male;7399;Slide;Eddie Murphy;Male;776;Charlie Gibbs;Casey Affleck;Male;1893;Arthur Shaw;Alan Alda;Male;21278;A luxury condo manager leads a staff of workers to seek payback on the Wall Street swindler who defrauded them. With only days until the billionaire gets away with the perfect crime, the unlikely crew of amateur thieves enlists the help of petty crook Slide to steal the $20 million they’re sure is hidden in the penthouse.
72113;Carnage;Nancy Cowan;Kate Winslet;Female;204;Penelope Longstreet;Jodie Foster;Female;1038;Alan Cowan;Christoph Waltz;Male;27319;Michael Longstreet;John C. Reilly;Male;4764;After 11-year-old Zachary Cowan strikes his classmate across the face with a stick after an argument, the victim's parents invite Zachary's parents to their Brooklyn apartment to deal with the incident in a civilized manner.
60935;The Thing;Kate Lloyd;Mary Elizabeth Winstead;Female;17628;Sam Carter;Joel Edgerton;Male;33192;Dr. Sander Halvorson;Ulrich Thomsen;Male;4455;Adam Finch;Eric Christian Olsen;Male;29020;When paleontologist Kate Lloyd travels to an isolated outpost in Antarctica for the expedition of a lifetime, she joins an international team that unearths a remarkable discovery. Their elation quickly turns to fear as they realize that their experiment has freed a mysterious being from its frozen prison. Paranoia spreads like an epidemic as a creature that can mimic anything it touches will pit human against human as it tries to survive and flourish in this spine-tingling thriller.
65057;The Descendants;Matt King;George Clooney;Male;1461;Alexandra King;Shailene Woodley;Female;94185;Cousin Hugh;Beau Bridges;Male;2222;Scott Thorson;Robert Forster;Male;5694;With his wife Elizabeth on life support after a boating accident, Hawaiian land baron Matt King takes his daughters on a trip from Oahu to Kauai to confront a young real estate broker, who was having an affair with Elizabeth before her misfortune.
52451;The Three Musketeers;D'Artagnan;Logan Lerman;Male;33235;Milady de Winter;Milla Jovovich;Female;63;Athos;Matthew Macfadyen;Male;15576;Porthos;Ray Stevenson;Male;56614;The hot-headed young D'Artagnan along with three former legendary but now down on their luck Musketeers must unite and defeat a beautiful double agent and her villainous employer from seizing the French throne and engulfing Europe in war.
49520;The Change-Up;Dave Lockwood;Jason Bateman;Male;23532;Mitch Planko;Ryan Reynolds;Male;10859;Jamie Lockwood;Leslie Mann;Female;41087;Sabrina McArdle;Olivia Wilde;Female;59315;Dave is a married man with two kids and a loving wife, and Mitch is a single man who is at the prime of his sexual life. One fateful night while Mitch and Dave are peeing in a fountain when lightning strikes, they switch bodies.
74465;We Bought a Zoo;Benjamin Mee;Matt Damon;Male;1892;Kelly Foster;Scarlett Johansson;Female;1245;Duncan Mee;Thomas Haden Church;Male;19159;Robin Jones;Patrick Fugit;Male;11663;Benjamin has lost his wife and, in a bid to start his life over, purchases a large house that has a zoo – welcome news for his daughter, but his son is not happy about it. The zoo is in need of renovation and Benjamin sets about the work with the head keeper and the rest of the staff, but, the zoo soon runs into financial trouble.
55787;Water for Elephants;Jacob Jankowski;Robert Pattinson;Male;11288;Marlena Rosenbluth;Reese Witherspoon;Female;368;August Rosenbluth;Christoph Waltz;Male;27319;Charlie;Paul Schneider;Male;15684;In this captivating Depression-era melodrama, impetuous veterinary student Jacob Jankowski joins a celebrated circus as an animal caretaker but faces a wrenching dilemma when he's transfixed by angelic married performer Marlena.
71859;We Need to Talk About Kevin;Eva Khatchadourian;Tilda Swinton;Female;3063;Franklin Khatchadourian;John C. Reilly;Male;4764;Kevin Khatchadourian, Teenager;Ezra Miller;NonBinary;132157;Kevin Khatchadourian, 6-8 Years;Jasper Newell;Male;1431169;After her son Kevin commits a horrific act, troubled mother Eva reflects on her complicated relationship with her disturbed son as he grew from a toddler into a teenager.
37958;Immortals;Theseus;Henry Cavill;Male;73968;King Hyperion;Mickey Rourke;Male;2295;Stavros;Stephen Dorff;Male;10822;Phaedra;Freida Pinto;Female;76792;Theseus is a mortal man chosen by Zeus to lead the fight against the ruthless King Hyperion, who is on a rampage across Greece to obtain a weapon that can destroy humanity.
62835;Colombiana;Cataleya Restrepo;Zoe Saldana;Female;8691;Emilio;Cliff Curtis;Male;7248;Richard;Callum Blue;Male;68287;Danny Delanay;Michael Vartan;Male;15424;After witnessing her parents’ murder as a child in Bogota, Cataleya Restrepo grows up to be a stone-cold assassin. She works for her uncle as a hitman by day, but her personal time is spent engaging in vigilante murders that she hopes will lead her to her ultimate target: the mobster responsible for her parents' death.
49517;Tinker Tailor Soldier Spy;George Smiley;Gary Oldman;Male;64;Bill Haydon;Colin Firth;Male;5472;Ricki Tarr;Tom Hardy;Male;2524;Control;John Hurt;Male;5049;In the bleak days of the Cold War, espionage veteran George Smiley is forced from semi-retirement to uncover a Soviet mole within his former colleagues at the heart of MI6.
88794;J. Edgar;John Edgar Hoover;Leonardo DiCaprio;Male;6193;Helen Gandy;Naomi Watts;Female;3489;Clyde Tolson;Armie Hammer;Male;53807;Charles Lindbergh;Josh Lucas;Male;6164;As the face of law enforcement in the United States for almost 50 years, J. Edgar Hoover was feared and admired, reviled and revered. But behind closed doors, he held secrets that would have destroyed his image, his career, and his life.
23047;Season of the Witch;Behman;Nicolas Cage;Male;2963;Felson;Ron Perlman;Male;2372;Eckhardt;Ulrich Thomsen;Male;4455;Cardinal D'Ambroise;Christopher Lee;Male;113;A 14th century Crusader returns with his comrade to a homeland devastated by the Black Plague. The Church commands the two knights to transport a witch to a remote abbey, where monks will perform a ritual in hopes of ending the pestilence.
10316;The Ides of March;Stephen Meyers;Ryan Gosling;Male;30614;Mike Morris;George Clooney;Male;1461;Paul Zara;Philip Seymour Hoffman;Male;1233;Tom Duffy;Paul Giamatti;Male;13242;Dirty tricks stand to soil an ambitious young press spokesman's idealism in a cutthroat presidential campaign where 'victory' is relative.
63492;What's Your Number?;Ally Darling;Anna Faris;Female;1772;Colin Shea;Chris Evans;Male;16828;Daisy Darling;Ari Graynor;Female;71552;Ava Darling;Blythe Danner;Female;10401;Ally Darling is realizing she's a little lost in life. Her latest romance has just fizzled out, and she's just been fired from her marketing job. Then she reads an eye-opening magazine article that warns that 96 percent of women who've been with 20 or more lovers are unlikely to find a husband. Determined to turn her life around and prove the article wrong, Ally embarks on a mission to find the perfect mate from among her numerous ex-boyfriends.
83899;You're Next;Erin;Sharni Vinson;Female;138010;Felix Davison;Nicholas Tucci;Male;149966;Zee;Wendy Glenn;Female;168529;Drake Davison;Joe Swanberg;Male;40863;When the Davison family comes under attack during their wedding anniversary getaway, the gang of mysterious killers soon learns that one of their victims harbors a secret talent for fighting back.
62838;New Year's Eve;Stan Harris;Robert De Niro;Male;380;Ingrid Withers;Michelle Pfeiffer;Female;1160;Claire Morgan;Hilary Swank;Female;448;Tess Byrne;Jessica Biel;Female;10860;The lives of several couples and singles in New York intertwine over the course of New Year's Eve.
38321;Priest;Priest;Paul Bettany;Male;6162;Black Hat;Karl Urban;Male;1372;Lucy Pace;Lily Collins;Female;112561;Priestess;Maggie Q;Female;21045;In an alternate world, humanity and vampires have warred for centuries. After the last Vampire War, the veteran Warrior Priest lives in obscurity with other humans inside one of the Church's walled cities. When the Priest's niece is kidnapped by vampires, the Priest breaks his vows to hunt them down. He is accompanied by the niece's boyfriend, who is a wasteland sheriff, and a former Warrior Priestess.
59860;Monte Carlo;Grace /  Cordelia Winthrop Scott;Selena Gomez;Female;77948;Emma;Katie Cassidy;Female;55775;Meg;Leighton Meester;Female;85825;Owen;Cory Monteith;Male;33352;Three young women vacationing in Paris find themselves whisked away to Monte Carlo after one of the girls is mistaken for a British heiress.
72571;Paranormal Activity 3;Katie;Katie Featherston;Female;90596;Kristi Rey;Sprague Grayden;Female;118243;Julie;Lauren Bittner;Female;176748;Dennis;Christopher Nicholas Smith;Male;579064;In 1988, young sisters Katie and Kristi befriend an invisible entity who resides in their home.
55301;Alvin and the Chipmunks: Chipwrecked;David Seville;Jason Lee;Male;11662;Ian;David Cross;Male;212;Zoe;Jenny Slate;Female;213001;Alvin (voice);Justin Long;Male;15033;Playing around while aboard a cruise ship, the Chipmunks and Chipettes accidentally go overboard and end up marooned in a tropical paradise. They discover their new turf is not as deserted as it seems.
64685;Extremely Loud & Incredibly Close;Thomas Schell;Tom Hanks;Male;31;Linda Schell;Sandra Bullock;Female;18277;Oskar Schell;Thomas Horn;Male;929136;Abby Black;Viola Davis;Female;19492;A year after his father's death, Oskar, a troubled young boy, discovers a mysterious key he believes was left for him by his father and embarks on a scavenger hunt to find the matching lock.
71880;Jack and Jill;Jack / Jill;Adam Sandler;Male;19292;Erin;Katie Holmes;Female;3897;Himself;Al Pacino;Male;1158;Felipe;Eugenio Derbez;Male;239574;Jack Sadelstein, a successful advertising executive in Los Angeles with a beautiful wife and kids, dreads one event each year: the Thanksgiving visit of his twin sister Jill. Jill's neediness and passive-aggressiveness is maddening to Jack, turning his normally tranquil life upside down.
49021;Killer Elite;Danny;Jason Statham;Male;976;Spike;Clive Owen;Male;2296;Hunter;Robert De Niro;Male;380;Davies;Dominic Purcell;Male;10862;Based on a shocking true story, Killer Elite pits two of the world’s most elite operatives—Danny, an ex-special ops agent and Hunter, his longtime mentor—against the cunning leader of a secret military society. Covering the globe from Australia to Paris, London and the Middle East, Danny and Hunter are plunged into a highly dangerous game of cat and mouse—where the predators become the prey.
48171;The Rite;Father Lucas Trevant;Anthony Hopkins;Male;4173;Michael Kovak;Colin O'Donoghue;Male;235767;Angeline;Alice Braga;Female;8602;Istvan Kovak;Rutger Hauer;Male;585;Seminary student Michael Kovak reluctantly attends exorcism school at the Vatican. While he’s in Rome, Michael meets an unorthodox priest who introduces him to the darker side of his faith, uncovering the devil’s reach even to one of the holiest places on Earth.
48231;A Dangerous Method;Sabina Spielrein;Keira Knightley;Female;116;Sigmund Freud;Viggo Mortensen;Male;110;Carl Jung;Michael Fassbender;Male;17288;Emma Jung;Sarah Gadon;Female;190895;Seduced by the challenge of an impossible case, the driven Dr. Carl Jung takes the unbalanced yet beautiful Sabina Spielrein as his patient. Jung’s weapon is the method of his master, the renowned Sigmund Freud. Both men fall under Sabina’s spell.
59678;Attack the Block;Sam;Jodie Whittaker;Female;66431;Moses;John Boyega;Male;236695;Ron;Nick Frost;Male;11109;Pest;Alex Esmail;Male;972040;A teen gang in a South London housing estate must team up with the other residents to protect their neighbourhood from a terrifying alien invasion.
45772;Gnomeo & Juliet;Gnomeo (voice);James McAvoy;Male;5530;Juliet (voice);Emily Blunt;Female;5081;Lord Redbrick (voice);Michael Caine;Male;3895;Lady Bluebury (voice);Maggie Smith;Female;10978;A version of Shakespeare's play, set in the world of warring indoor and outdoor gnomes. Garden gnomes Gnomeo and Juliet have as many obstacles to overcome as their quasi namesakes when they are caught up in a feud between neighbors. But with plastic pink flamingos and lawnmower races in the mix, can this young couple find lasting happiness?
48988;Hall Pass;Rick Mills;Owen Wilson;Male;887;Fred Searing;Jason Sudeikis;Male;58224;Maggie Mills;Jenna Fischer;Female;51856;Coakley;Richard Jenkins;Male;28633;When best buds Rick and Fred begin to show signs of restlessness at home, their wives take a bold approach to revitalize their marriages, they grant the guys a 'hall pass'—one week of freedom to do whatever they want. At first, it seems like a dream come true, but they quickly discover that their expectations of the single life—and themselves—are completely and hilariously out of sync with reality.
58151;Fright Night;Charley Brewster;Anton Yelchin;Male;21028;Jerry Dandrige;Colin Farrell;Male;72466;Jane Brewster;Toni Collette;Female;3051;Peter Vincent;David Tennant;Male;20049;A teenager suspects his new neighbour is a vampire. Unable to convince anyone, he tries to enlist the help of a self-proclaimed vampire hunter and magician.
37430;Conan the Barbarian;Conan;Jason Momoa;Male;117642;Khalar Zym;Stephen Lang;Male;32747;Tamara;Rachel Nichols;Female;50347;Corin;Ron Perlman;Male;2372;A quest that begins as a personal vendetta for the fierce Cimmerian warrior soon turns into an epic battle against hulking rivals, horrific monsters, and impossible odds, as Conan realizes he is the only hope of saving the great nations of Hyboria from an encroaching reign of supernatural evil.
47327;Drive Angry;Milton;Nicolas Cage;Male;2963;Piper;Amber Heard;Female;55085;Accountant;William Fichtner;Male;886;Jonah King;Billy Burke;Male;21029;Milton is a hardened felon who has broken out of Hell, intent on finding the vicious cult who brutally murdered his daughter and kidnapped her baby. He joins forces with a sexy, tough-as-nails waitress, who's also seeking redemption of her own. Caught in a deadly race against time, Milton has three days to avoid capture, avenge his daughter's death, and save her baby before she's mercilessly sacrificed by the cult.
71688;The Iron Lady;Margaret Thatcher;Meryl Streep;Female;5064;Geoffrey Howe;Anthony Stewart Head;Male;34257;Young Denis Thatcher;Harry Lloyd;Male;205258;Denis Thatcher;Jim Broadbent;Male;388;A look at the life of Margaret Thatcher, the former Prime Minister of the United Kingdom, with a focus on the price she paid for power.
68817;Footloose;Rev. Shaw Moore;Dennis Quaid;Male;6065;Ren MacCormack;Kenny Wormald;Male;83276;Ariel Moore;Julianne Hough;Female;143240;Vi Moore;Andie MacDowell;Female;1533;Ren MacCormack is transplanted from Boston to the small southern town of Bomont where loud music and dancing are prohibited. Not one to bow to the status quo, Ren challenges the ban, revitalizing the town and falling in love with the minister’s troubled daughter Ariel in the process.
62206;30 Minutes or Less;Nick Davis;Jesse Eisenberg;Male;44735;Dwayne Mikowlski;Danny McBride;Male;62862;Chet Flanning;Aziz Ansari;Male;86626;Travis Cord;Nick Swardson;Male;32907;Two fledgling criminals kidnap a pizza delivery guy, strap a bomb to his chest, and advise him that he has mere hours to rob a bank or else...
38317;Zookeeper;Griffin Keyes;Kevin James;Male;32895;Kate;Rosario Dawson;Female;5916;Stephanie;Leslie Bibb;Female;57451;Venom;Ken Jeong;Male;83586;Kindhearted Griffin Keyes is one of the best-loved caretakers at the Franklin Park Zoo, but since he is more comfortable with the animals than with females of his own species, his love life is lacking. When Griffin decides that the only way to get a girlfriend is to find a more-glamorous career, the animals panic. To keep him from leaving, they reveal their secret ability to talk and offer to teach him the rules of courtship, animal-style.
