MovieId;Title;Character1;PersonName1;Sex1;ActorId1;Character2;PersonName2;Sex2;ActorId2;Character3;PersonName3;Sex3;ActorId3;Character4;PersonName4;Sex4;ActorId4;Overview
32685;Ernest Scared Stupid;Ernest P. Worrell;Jim Varney;Male;12899;"Francis ""Old Lady"" Hackmore";Eartha Kitt;Female;70243;Elizabeth;Shay Astar;Female;146564;Bobby Tulip;Bill Byrge;Unknown;147454;Well-intentioned, eternally bumbling Ernest P. Worrell accidentally releases an evil demon from its sacred tomb. As the demon flexes its power and goes on a ruinous rampage, good-guy Ernest tries to step in to save the town from mass destruction. Trouble is, a 200-year-old curse has scared Ernest stupid, and that means hilarity all around! So, kick back and let the laugh-ridden adventures begin.
24993;Kickboxer 2: The Road Back;David Sloan;Sasha Mitchell;Male;75312;Justin Maciah;Peter Boyle;Male;1039;Xian Chow;Dennis Chan Kwok-San;Male;64662;Sanga;Cary-Hiroyuki Tagawa;Male;11398;In this rousing sequel to Kickboxer, Tong Po broods about his defeat at the hands of Kurt Sloan. Po and his managers resort to drastic measures to goad Kurt into the ring for a rematch.
11504;Suburban Commando;Shep Ramsey;Hulk Hogan;Male;16620;Charlie Wilcox;Christopher Lloyd;Male;1062;Jenny Wilcox;Shelley Duvall;Female;10409;Adrian Beltz;Larry Miller;Male;1211;Shep Ramsey is an interstellar hero, righting wrongs, etc. His ship is damaged after a fight with an interstellar nasty and he must hide out on Earth until it can recharge. He leaves his power suit at home, but still finds himself unable to allow wrongs to go unrighted and so mixes it up with bad drivers, offensive paperboys, muggers and the like.
12627;La Belle Noiseuse;Edouard Frenhofer;Michel Piccoli;Male;3784;Liz;Jane Birkin;Female;15200;Marianne;Emmanuelle Béart;Female;4885;Julienne;Marianne Denicourt;Female;38877;The former famous painter Frenhofer lives quietly with his wife on a countryside residence in the French Provence. When the young artist Nicolas visits him with his girlfriend Marianne, Frenhofer decides to start again the work on a painting he long ago stopped: La Belle Noiseuse. And he wants Marianne as model.
443129;Reservoir Dogs;Joe Cabot;David Jensen;Male;60875;Mr. Pink;Steve Buscemi;Male;884;Mr. White;Quentin Tarantino;Male;138;;;Unknown;0;Short film made with the help of the Sundance Film Institute and serving as a proof-of-concept for the subsequent feature film.
21219;Mobsters;"Charlie ""Lucky"" Luciano";Christian Slater;Male;2224;Frank Costello;Costas Mandylor;Male;36055;"Benjamin ""Bugsy"" Siegel";Richard Grieco;Male;87295;Meyer Lansky;Patrick Dempsey;Male;18352;The story of a group of friends in turn of the century New York, from their early days as street hoods to their rise in the world of organized crime...
159704;The Cave of the Golden Rose;Fantaghirò;Alessandra Martines;Female;63895;The King;Mario Adorf;Male;10254;Romualdo;Kim Rossi Stuart;Male;66166;Cavaliere Bianco/Strega Bianca;Ángela Molina;Female;3822;In the middle of a war between two kingdoms queen died tragically while giving birth to her third daughter. The king wanted a male heir to his throne and torn by the death of his wife, decides to sacrifice the girl and leads to the Cave of the Golden Rose to give her to the monster. The child is saved by the White Witch who promises her a wonderful future. With a rebellious temperament, the princess, named by his father Fantaghiro behaves like a tomboy. But one day she must confront the enemy, the king Romualdo, which is in love with her.
30815;Mortal Thoughts;Cynthia Kellogg;Demi Moore;Female;3416;Joyce Urbanski;Glenne Headly;Female;21104;James Urbanski;Bruce Willis;Male;62;Arthur Kellogg;John Pankow;Male;59872;A loathsome man ends up dead, but it's not clear who's to blame. If ever a person got what he deserved, it's James Urbanksi, an abusive drunk who steals from his wife, Joyce, and promises her close friend Cynthia Kellogg that she'll be the next target of his rage. At a group outing, James bleeds to death after someone cuts his throat. But because he's such a terrible human being, police aren't sure which of his acquaintances decided to kill him.
42444;Vacanze di Natale '91;Enzo;Christian De Sica;Male;69036;Mimmo;Massimo Boldi;Male;69037;Rino;Nino Frassica;Male;120646;Leopoldo;Ezio Greggio;Male;52329;This coarse bedroom farce takes place at the St. Moritz ski resort over a Christmas vacation. Among the couples whose lives intersect are a widowed artist honeymooning with his second wife, a gay man traveling with his son and his lover (and hiding each from the other), a snobbish couple from Milan who have been forced to share a suite with a pair of crass Romans, etc.
22434;If Looks Could Kill;Michael Corben;Richard Grieco;Male;87295;Mariska;Gabrielle Anwar;Female;5503;Augustus Steranko;Roger Rees;Male;16407;Ilsa Grunt;Linda Hunt;Female;12516;Michael Corben, along with the rest of his high-school French class, sets out for a trip to France when he is mistaken for an agent of the same name. He is beseiged by both the good guys and the bad guys. British Intelligence outfits him with a series of James-Bond-like gizmos, and Steranko sends more would-be assassins after him. Can Michael stop the evil Steranko's plans for European domination?
41804;All the Mornings of the World;Monsieur de Sainte Colombe;Jean-Pierre Marielle;Male;20795;Marin Marais;Gérard Depardieu;Male;16927;Madeleine de Sainte Colombe;Anne Brochet;Female;70182;Young Marin Marais;Guillaume Depardieu;Male;35004;It's late 17th century. The viola da gamba player Monsieur de Sainte Colombe comes home to find that his wife died while he was away. In his grief he builds a small house in his garden into wich he moves to dedicate his life to music and his two young daughters Madeleine and Toinette, avoiding the outside world. Rumor about him and his music is widespread, and even reaches to the court of Louis XIV, who wants him at his court in Lully's orchestra, but Monsieur de Sainte Colombe refuses. One day a young man, Marin Marais, comes to see him with a request, he wants to be taught how to play the violin.
15026;The Guyver;Sean Barker / The Guyver;Jack Armstrong;Male;77741;Max Reed;Mark Hamill;Male;2;Dr. Tetsu Segawa;Greg Joung Paik;Male;191198;Striker;Jimmie Walker;Male;31366;"FBI agent Max Reed witnesses Dr. Tetsu Segawa - a researcher for the mysterious Chronos Corporation - being murdered. Dr. Segawa had stolen an alien device known as ""The Guyver"" from Chronos. College student Sean Barker, whose girlfriend's father was Dr. Segawa, finds the Guyver's hiding spot while watching the forensic team investigating the crime scene."
2611;Only the Lonely;Danny Muldoon;John Candy;Male;7180;Rose Muldoon;Maureen O'Hara;Female;70035;Theresa Luna;Ally Sheedy;Female;12851;Patrick Muldoon;Kevin Dunn;Male;14721;Danny Muldoon, a Chicago policeman, still lives with his overbearing mother Rose. He meets and falls in love with Theresa Luna , whose father owns the local funeral parlour. Naturally, his mother objects to the relationship, and Danny and Theresa must either overcome her objections or give up the romance.
30840;Robin Hood;Sir Robert Hode;Patrick Bergin;Male;29459;Maid Marian;Uma Thurman;Female;139;Sir Miles Folcanet;Jürgen Prochnow;Male;920;Prince John;Edward Fox;Male;9126;The Swashbuckling legend of Robin Hood unfolds in the 12th century when the mighty Normans ruled England with an iron fist.
34376;Mannequin Two: On the Move;Jessie;Kristy Swanson;Female;56128;Jason Williamson / Prince William;William Ragsdale;Male;31467;Hollywood Montrose / Doorman;Meshach Taylor;Male;101784;Count Spretzle / Sorcerer;Terry Kiser;Male;55267;Although Jason works as a department store clerk, he is also a reincarnated prince. Long ago, his beloved Jessie was snatched away from him by an evil wizard who used his powers to transform her into wooden statue. Now Jessie is in Jason's department store as a mannequin. When he encounters her, she awakens from her thousand-year sleep. They quickly revive their romance, but the evil wizard has been reincarnated as well, and he's up to no good.
21338;Stone Cold;Joe Huff / John Stone;Brian Bosworth;Male;87400;Chains Cooper;Lance Henriksen;Male;2714;Ice;William Forsythe;Male;4520;Nancy;Arabella Holzbog;Unknown;42967;"Joe Huff (Brian Bosworth) is a tough, loner cop with a flair for infiltrating dangerous biker gangs. The FBI blackmail Joe into an undercover operation that entails infiltrating ""The Brotherhood"" - a powerful Mississippi biker gang linked in the murder of government officials as well as dealing drugs with the mafia."
2071;Shattered;Dan Merrick;Tom Berenger;Male;13022;Gus Klein;Bob Hoskins;Male;382;Judith Merrick;Greta Scacchi;Female;21245;Jenny Scott;Joanne Whalley;Female;12656;Dan Merrick comes out from a shattering car accident with amnesia. He finds that he is married to Judith who is trying to help him start his life again. He keeps getting flashbacks about events and places that he can't remember. He meets pet shop owner and part time private detective Gus Klein who has supposedly done some work for him prior to the accident. Klein helps Merrick to find out more...
15771;Class Action;Jedediah Tucker Ward;Gene Hackman;Male;193;Maggie Ward;Mary Elizabeth Mastrantonio;Female;1161;Michael Grazier;Colin Friels;Male;27753;Estelle Ward;Joanna Merlin;Female;11903;A liberal activist lawyer alienated his daughter Maggie years ago when she discovered his many affairs. Now a conservative corporate lawyer, Maggie agrees to go up against her father in court. To gain promotion, she must defend an auto manufacturer against charges that their explosion-prone station wagons are unsafe. As her mother begs for peace, Maggie takes on her dad in a trial that turns increasingly personal and nasty.
65374;Samurai Cop;Joe Marshall;Mathew Karedas;Unknown;542269;Frank Washington;Mark Frazer;Male;542272;Fooj Fujiyama;Cranston Komuro;Unknown;1349398;Yamashita;Robert Z'Dar;Male;80579;"When Japanese organized crime imbeds itself within LA, the police turn to one man to take down the deadly Yakuza — Joe Marshall, aka ""The Samurai."" With his fearless swagger and rock hard jaw, The Samurai tears a two-fisted hole through the mob and doesn't stop until the job is done."
23606;A Scene at the Sea;Shigeru;Claude Maki;Male;4988;Takako;Hiroko Oshima;Female;90346;Takoh;Sabu Kawahara;Male;90347;Nakajima;Toshizo Fujiwara;Unknown;90348;The lives of a young, hearing-impaired and gloomy couple are fulfilled after the boy holds interest in surfboarding.
10174;Madonna: Truth or Dare;Self;Madonna;Female;3125;Self;Al Pacino;Male;1158;Self;Kevin Costner;Male;1269;Self;Donna DeLory;Female;116152;From the rain of Japan, through threats of arrest for 'public indecency' in Canada, and a birthday tribute to her father in Detroit, this documentary follows Madonna on her 1990 'Blond Ambition' concert tour. Filmed in black and white, with the concert pieces in glittering MTV color, it is an intimate look at the work of the music performer, from a prayer circle with the dancers before each performance to bed games with the dance troupe afterwards.
26956;Puppet Master III: Toulon's Revenge;Andre Toulon;Guy Rolfe;Male;44883;Major Krauss;Richard Lynch;Male;97878;Dr. Hess;Ian Abercrombie;Male;11764;Lt. Eric Stein;Kristopher Logan;Male;98554;In Berlin during WWII, the Nazi regime is attempting to develop a drug that will reanimate the dead in order to use them in the war effort. Toulon arouses suspicion as a Nazi dissident, and his secret is discovered. During a Nazi raid on his home, Toulon's beautiful wife is murdered. Toulon vows revenge, with the help of his animated puppets.
22423;Guilty by Suspicion;David Merrill;Robert De Niro;Male;380;Ruth Merrill;Annette Bening;Female;516;Bunny Baxter;George Wendt;Male;66606;Dorothy Nolan;Patricia Wettig;Female;33487;This compelling story vividly recreates Hollywood's infamous 'Blacklist Era'. The witch-hunt has begun and director David Merrill can revive his stalled career by testifying against friends who are suspected communists. Merrill's ex wife shares a whirlpool of scandals that draws them closer together while his chances for ever making movies again slips further away...
25598;The Indian Runner;Joe Roberts;David Morse;Male;52;Frank Roberts;Viggo Mortensen;Male;110;Maria;Valeria Golino;Female;3124;Dorothy;Patricia Arquette;Female;4687;Two brothers cannot overcome their opposite perceptions of life. One brother sees and feels bad in everyone and everything, subsequently he is violent, antisocial and unable to appreciate or enjoy the good things which his brother desperately tries to point out to him.
20978;My Father the Hero;André Arnel;Gérard Depardieu;Male;16927;"Véronique ""Véro"" Arnel";Marie Gillain;Female;54227;Christelle;Catherine Jacob;Female;19934;Irina;Charlotte de Turckheim;Female;258942;Veronique, living with her divorced mother, is going on holiday to Mauritius with her father. To impress a local boy, Benjamin, she manages to complicate the situation by making up stories about her father. She presents him as her lover, a mercenary and even a secret agent which gets her into trouble and then her father has to start playing along...
2125;Wedlock;Frank Warren;Rutger Hauer;Male;585;Tracy Riggs;Mimi Rogers;Female;13920;Noelle;Joan Chen;Female;6720;Sam;James Remar;Male;1736;A male prison escapee heads for his hidden loot, electronically attached to a female prisoner.
6463;Other People's Money;Lawrence Garfield;Danny DeVito;Male;518;Andrew Jorgenson;Gregory Peck;Male;8487;Kate Sullivan;Penelope Ann Miller;Female;14698;Bea Sullivan;Piper Laurie;Female;6721;When a corporate raider threatens a hostile takeover of a 'mom and pop' company, the patriarch of the company enlists the help of his wife's attractive daughter—who is a lawyer—to stop the takeover. However, the raider soon becomes infatuated with her, and enjoys the legal manoeuvring as he tries to win her heart.
59053;The Raffle;Francesca;Monica Bellucci;Female;28782;Antonio;Giulio Scarpati;Unknown;228761;Cesare;Massimo Ghini;Male;148251;;Elena Cantarone;Female;1089878;Francesca, an incredibly beautiful woman, after the death of her husband discovers his unfaithfulness and huge amount of debts he left. Cesare is Francesca's best friend, he is a solicitor. Following his advice Francesca starts selling all her goods, like the house, jewels, furs and finally also the yacht. By doing this she is able to survive for the rest of the year, but has no prospects for the future and every attempt to get a job fails. Finally she makes a decision to set up a lottery in which the prize is her.
4695;Pappa ante Portas;Heinrich Lohse;Vicco von Bülow;Male;36992;Renate Lohse;Evelyn Hamann;Female;41683;Gertrud Mielke;Ortrud Beginnen;Female;38992;Brigitte Mielke;Dagmar Biener;Female;41692;After ordering enough typewriting paper for 40 years, just to get discount, Heinrich Lohse is forced to retire.
2528;Madame Bovary;Emma Bovary;Isabelle Huppert;Female;17882;Charles Bovary;Jean-François Balmer;Male;35527;Rodolphe Boulanger;Christophe Malavoy;Male;24487;M. Homais;Jean Yanne;Male;24381;Bored with the limited and tedious nature of provincial life in 19th-century France, the fierce and sensual Emma Bovary finds herself in calamitous debt and purses scandalous sexual liaisons with absolute abandon. However, when her volatile lifestyle catches up to her, the lives of everyone around her are endangered.
2297;Kafka;Kafka;Jeremy Irons;Male;16940;Gabriela;Theresa Russell;Female;9207;Burgel;Joel Grey;Male;6748;Dr. Murnau;Ian Holm;Male;65;Kafka, an insurance worker gets embroiled in an underground group after a co-worker is murdered. The underground group is responsible for bombings all over town, attempting to thwart a secret organization that controls the major events in society. He eventually penetrates the secret organization and must confront them.
24734;K2;Taylor Brooks;Michael Biehn;Male;2712;Harold Jameson;Matt Craven;Male;13525;Lisa;Annie Grindlay;Female;99424;Man on Wheelchair;Blu Mankuma;Male;44150;They call it the savage mountain. 27 people have perished trying to reach the summit on K2, the world's second highest peak. A U.S. climbing team, funded by millionaire Clairborne is determined to conquer K2.
20645;Rhapsody in August;Kane (The Grandmother);Sachiko Murase;Female;86396;Tateo;Hidetaka Yoshioka;Male;111691;Tami;Tomoko Ôtakara;Female;554318;Minako;Mieko Suzuki;Unknown;550559;The story centers on an elderly hibakusha, who lost her husband in the 1945 atomic bombing of Nagasaki (60 thousand and 80 thousand human beings in Nagasaki), caring for her four grandchildren over the summer. She learns of a long-lost brother, Suzujiro, living in Hawaii who wants her to visit him before he dies.
20289;Rush;Jim Raynor;Jason Patric;Male;12261;Kristen Cates;Jennifer Jason Leigh;Female;10431;Dodd;Sam Elliott;Male;16431;Walker;Max Perlich;Male;7268;Undercover cop Jim Raynor (Jason Patric) is a seasoned veteran. His partner, Kristen Cates (Jennifer Jason Leigh), is lacking in experience, but he thinks she's tough enough to work his next case with him: a deep cover assignment to bring down the notoriously hard-to-capture drug lord Gaines (Gregg Allman). While their relationship turns romantic during the assignment, they also turn into junkies, and will have to battle their own addictions if they want to bring down Gaines once and for all.
19065;Pure Luck;Eugene Proctor;Martin Short;Male;519;Raymond Campanella;Danny Glover;Male;2047;Monosoff;Harry Shearer;Male;6008;Valerie Highsmith;Sheila Kelley;Female;68109;The daughter of a wealthy businessman has disappeared in Mexico, and all the efforts to find her have been unsuccessful. A psychologist, knowing that the girl has an ultra bad luck, persuades her father to send to Mexico one of his employees, an accountant with super bad luck, to find her. Perhaps he will be lucky, and his bad luck could help to find the unlucky girl.
17956;He Said, She Said;Dan Hanson;Kevin Bacon;Male;4724;"Lorraine ""Lorie"" Bryer";Elizabeth Perkins;Female;20;"Wallace ""Wally"" Thurman";Nathan Lane;Male;78729;Mark;Anthony LaPaglia;Male;57829;Womanising, right-wing Dan Hanson and quiet, liberal Lorie Bryer work for the Baltimore Sun. Rivals for the job of new writer of a vacant column, the paper ends up instead printing their very different opinions alongside each other, which leads to a similarly combative local TV show. At the same time their initial indifference to each other looks like it may evolve into something more romantic.
1358;A Brief History of Time;Self;Stephen Hawking;Male;39657;Self - Stephen Hawking's Mother;Isobel Hawking;Unknown;402118;Self - Stephen Hawking's Aunt;Janet Humphrey;Unknown;1399265;Self - Stephen Hawking's Sister;Mary Hawking;Unknown;1399266;This shows physicist Stephen Hawking's life as he deals with the ALS that renders him immobile and unable to speak without the use of a computer. Hawking's friends, family, classmates, and peers are interviewed not only about his theories but the man himself.
47423;Once a Thief;Red Bean Puddin / Joe;Chow Yun-Fat;Male;1619;James / Jim;Leslie Cheung;Male;69637;Red Bean / Cherie;Cherie Chung;Female;102880;Chu / Godfather;Paul Chu Kong;Male;67047;Three art thieves try to re-steal a painting after their crime boss double-crosses them.
24331;Scanners II: The New Order;David Kellum;David Hewlett;Male;5892;Julie Vale;Deborah Raffin;Female;87120;Commander John Forrester;Yvan Ponton;Male;90477;Alice Leonardo;Isabelle Mejias;Female;189624;A scanner discovers a plot by renegade elements in the city government to take power with the help of evil scanners.
22828;Homicide;Bobby Gold;Joe Mantegna;Male;3266;Tim Sullivan;William H. Macy;Male;3905;Lt. Senna;Vincent Guastaferro;Male;97068;Jilly Curran;J.J. Johnston;Male;89461;A Jewish homicide detective investigates a seemingly minor murder and falls in with a Zionist group as a result.
28859;Dolly Dearest;Marilyn Wade;Denise Crosby;Female;1743;Elliot Wade;Sam Bottoms;Male;8350;Karl Resnick;Rip Torn;Male;9626;Jimmy Wade;Chris Demetral;Male;76133;An American family moves to Mexico to fabricate dolls, but their toy factory happens to be next to a Sanzian grave and the toys come into possession of an old, malicious spirit.
14667;Dogfight;Eddie Birdlace;River Phoenix;Male;741;Rose Fenny;Lili Taylor;Female;3127;Berzin;Richard Panebianco;Male;176976;Oakie;Anthony Clark;Male;170773;"In the fall of 1963, Eddie Birdlace is an 18-year-old Marine Corps volunteer who is about to ship out with three of his buddies for a tour of duty in Vietnam. Planning a massive blowout for their last night in San Francisco, Eddie, his buddies, and a number of other Marines set up a contest they call a ""dogfight."""
60316;Food;;Ludvík Sváb;Unknown;551676;;Bedrich Glaser;Male;133556;;Jan Kraus;Male;136797;;Pavel Marek;Unknown;551677;BREAKFAST: After eating breakfast, a man is transformed into an elaborate dumb-waiter-style breakfast dispenser - and the same fate befalls the man who obtains breakfast from him. LUNCH: After failing to catch the waiter's eye, two would-be diners end up eating everything within reach. DINNER: Portraits of various meals made up of human organs.
50213;Une Époque Formidable…;Michel Berthier;Gérard Jugnot;Male;21171;'Toubib';Richard Bohringer;Male;1977;Juliette Berthier;Victoria Abril;Female;25256;'Crayon';Ticky Holgado;Male;13689;Michel Berthier, cadre supérieur d'une entreprise de matelasserie, vient d'être licencié. Comme il n'ose pas avouer la vérité à Juliette, sa compagne, il s'endette pour maintenir le niveau de la famille qu'il couvre de cadeaux. Mais il ne peut bientôt plus mentir et il décide alors de quitter la maison. Après avoir perdu son argent, sa voiture et ses chaussures, il rencontre Toubib, Mimosa et Crayon, trois «Sans Domicile Fixe» qui font leur toilette dans les lavabos de la gare de l'Est. Ils le prennent sous leur aile et l'entraînent à aller cambrioler son ancienne entreprise afin de se munir de duvets et de lits
31696;A Kiss Before Dying;Jonathan Corliss;Matt Dillon;Male;2876;Ellen / Dorothy Carlsson;Sean Young;Female;586;Thor Carlsson;Max von Sydow;Male;2201;Mrs. Corliss;Diane Ladd;Female;6587;Infatuated with the idea of becoming rich, college student Jonathan Corliss secretly dates Dorothy Carlsson to gain the approval of her wealthy father. When Dorothy tells Jonathan that she is pregnant and that her father will deny her inheritance if he finds out, Jonathan murders her, but he stages her death as a suicide. As Jonathan works his way onto Mr. Carlsson's payroll, Dorothy's twin sister, Ellen, investigates the apparent suicide.
20704;Necessary Roughness;Paul Blake;Scott Bakula;Male;2154;Coach Wally Rig;Robert Loggia;Male;1162;Dr. Suzanne Carter;Harley Jane Kozak;Female;27106;Dean Phillip Elias;Larry Miller;Male;1211;When the Texas Southern Armadillos football team is disqualified for cheating and poor grades, the University is forced to pick from a team that actually goes to school. Will they even win a single game?
1915;Manta, Manta;Bertie;Til Schweiger;Male;1844;Uschi;Tina Ruland;Female;19926;Klausi;Michael Kessler;Male;19927;Angie;Nadja Naidenow;Unknown;2289154;A not so clever guy called Bertie with a Opel Manta (a low budget European sports-coupe from the '80s) gets competition in a street race from a guy with a fast Mercedes, and another slick guy with a Ferrari tries to get his hands on Bertie's girlfriend.
32146;Body Parts;Bill Chrushank;Jeff Fahey;Male;20495;Dr. Agatha Webb;Lindsay Duncan;Female;30083;Karen Chrushank;Kim Delaney;Female;21216;Detective Sawchuck;Zakes Mokae;Male;47458;A criminal psychologist loses his arm in a car crash, and becomes one of three patients to have their missing limbs replaced by those belonging to an executed serial killer. One of them dies violently, and disturbing occurrences start happening to the surviving two.
47090;The Pit and the Pendulum;Torquemada;Lance Henriksen;Male;2714;Gomez;Stephen Lee;Male;91537;Dr. Huesos;William J. Norris;Unknown;138048;Mendoza;Mark Margolis;Male;1173;Set during the height of Spanish Inquisition. The beautiful and kind-hearted Maria is arrested as a witch when she inadvertently cries out in horror at the public whipping of a child. As Maria’s husband Antonio tries to save her, Torquemada, the Grand Inquisitor, determines to punish Maria with torture for the desire she inflames in him. Loosely based on Edgar Allen Poe's classic short story.
13644;All I Want for Christmas;Catherine O'Fallon;Harley Jane Kozak;Female;27106;Michael O'Fallon;Jamey Sheridan;Male;2977;Hallie O'Fallon;Thora Birch;Female;2155;Ethan O'Fallon;Ethan Embry;Male;58019;Two New York City children who launch a hilarious scheme to get what they most want this holiday season.
18886;Flight of the Intruder;Cmdr. Frank 'Dooke' Camparelli;Danny Glover;Male;2047;Lt. Cmdr. Virgil 'Tiger' Cole;Willem Dafoe;Male;5293;Lt. Jake 'Cool Hand' Grafton;Brad Johnson;Male;36067;Callie Joy;Rosanna Arquette;Female;2165;U.S. Navy pilot Lt. Jake Grafton and his bombardier buddy, Lt. Cmdr. Virgil Cole, are two soldiers embedded in the Vietnam War growing frustrated by the military's constraints on their missions. Despite the best efforts of their commanding officer, Cmdr. Frank Camparelli, to re-engage them, this disillusioned pair decide to take the war effort into their own hands with an explosive battle plan that could well get them court-martialed.
