MovieId;Title;Character1;PersonName1;Sex1;ActorId1;Character2;PersonName2;Sex2;ActorId2;Character3;PersonName3;Sex3;ActorId3;Character4;PersonName4;Sex4;ActorId4;Overview
11229;Freeway;Bob Wolverton;Kiefer Sutherland;Male;2628;Vanessa Julia Lutz;Reese Witherspoon;Female;368;Detective Mike Breer;Wolfgang Bodison;Male;68672;Detective Garnet Wallace;Dan Hedaya;Male;6486;Following the arrest of her mother, Ramona, young Vanessa Lutz decides to go in search of her estranged grandmother. On the way, she is given a ride by school counselor Bob Wolverton. During the journey, Lutz begins to realize that Bob is the notorious I-5 Killer and manages to escape by shooting him several times. Wounded but still very much alive, Bob pursues Lutz across the state in this modern retelling of Little Red Riding Hood.
10534;White Squall;"Christopher ""Skipper"" Sheldon";Jeff Bridges;Male;1229;Dr. Alice Sheldon;Caroline Goodall;Female;6692;McCrea;John Savage;Male;47879;Chuck Gieg;Scott Wolf;Male;24965;In 1960, a hardy group of prep school students boards an old-fashioned sailing ship. With Capt. Christopher Sheldon at the helm, the oceangoing voyage is intended to teach the boys fortitude and discipline. But the youthful crew are about to get some unexpected instruction in survival when they get caught in the clutches of a white squall storm.
17182;Eye for an Eye;Karen McCann;Sally Field;Female;35;Robert Doob;Kiefer Sutherland;Male;2628;Mack McCann;Ed Harris;Male;228;Dolly Green;Beverly D'Angelo;Female;821;It's fire and brimstone time as grieving mother Karen McCann takes justice into her own hands when a kangaroo court in Los Angeles fails to convict Robert Doob, the monster who raped and murdered her 17-year-old daughter.
15674;Sabrina the Teenage Witch;Sabrina Sawyer;Melissa Joan Hart;Female;78501;Aunt Hilda;Sherry Miller;Female;43301;Aunt Zelda;Charlene Fernetz;Female;96391;Marnie Littlefield;Michelle Beaudoin;Female;96392;A girl, sent by her parents to live with her two eccentric aunts, finds out on her sixteenth birthday that she is a witch.
9400;Set It Off;Stony;Jada Pinkett Smith;Female;9575;Cleo;Queen Latifah;Female;15758;Frankie;Vivica A. Fox;Female;2535;Tisean;Kimberly Elise;Female;55314;Four black women, all of whom have suffered for lack of money and at the hands of the majority, undertake to rob banks. While initially successful, a policeman who was involved in shooting one of the women's brothers is on their trail. As the women add to the loot, their tastes and interests begin to change and their suspicions of each other increase on the way to a climactic robbery.
11962;Joe's Apartment;Joe;Jerry O'Connell;Male;3035;Lily Dougherty;Megan Ward;Female;64999;Ralph Roach (voice);Billy West;Male;23679;Rodney Roach (voice);Reginald Hudlin;Male;68215;A nice guy has just moved to New York and discovers that he must share his run-down apartment with a couple thousand singing, dancing cockroaches.
36355;Flipper;Sandy Ricks;Elijah Wood;Male;109;Porter Ricks;Paul Hogan;Male;57147;Dirk Moran;Jonathan Banks;Male;783;Bounty Fisherman #1;Robert Deacon;Unknown;135571;Sandy Ricks is sent by his mom to Coral Key, a rustic island in the Florida keys, to spend the summer with his uncle Porter Ricks. Sandy dislikes everything about his new environment until a new friend comes into his life, a dolphin named Flipper, that brings uncle and nephew together and leads Sandy on the summer adventure of a lifetime.
25189;The Mirror Has Two Faces;Rose Morgan;Barbra Streisand;Female;10400;Gregory Larkin;Jeff Bridges;Male;1229;Hannah Morgan;Lauren Bacall;Female;7570;Henry Fine;George Segal;Male;18364;Rose Morgan, who still lives with her mother, is a professor of Romantic Literature who desperately longs for passion in her life. Gregory Larkin, a mathematics professor, has been burned by passionate relationships and longs for a sexless union based on friendship and respect.
9095;Mary Reilly;Mary Reilly;Julia Roberts;Female;1204;Dr. Henry Jekyll / Edward Hyde;John Malkovich;Male;6949;Mr. Poole;George Cole;Male;47722;Mary’s Father;Michael Gambon;Male;5658;A housemaid falls in love with Dr. Jekyll and his darkly mysterious counterpart, Mr. Hyde.
39148;Dragon Ball: The Path to Power;General Blue;Bin Shimada;Male;115790;Umigame;Daisuke Gouri;Male;122191;Oolong;Naoki Tatsuta;Male;122373;Son Goku;Masako Nozawa;Female;90496;A retelling of Dragon Ball's origin with a different take on the meeting of Goku, Bulma, and Kame-Sen'nin. It also retells the Red Ribbon Army story, but this time they find Goku rather than Goku finding them.
54113;The Swan Princess: Escape from Castle Mountain;Princess Odette (voice);Michelle Nicastro;Female;9260;Prince Derek (voice);Douglas Sills;Male;166645;Puffin (voice);Steve Vinovich;Male;88948;Lord Rogers (voice);Joseph Medrano;Male;558898;The first wedding anniversary of Princess Odette and Prince Derek is distracted by field fires set by Knuckles. His master Clavius, wants to conquer the world, and he needs to capture a giant orb to do that. Clavius kidnaps Queen Uberta and Odette with Derek have to save her.
26748;Lone Star;Sam Deeds;Chris Cooper;Male;2955;Buddy Deeds;Matthew McConaughey;Male;10297;Pilar;Elizabeth Peña;Female;7430;Charlie Wade;Kris Kristofferson;Male;10823;When the skeleton of his murdered predecessor is found, Sheriff Sam Deeds unearths many other long-buried secrets in his Texas border town.
26900;The Bandit;Baran;Şener Şen;Male;77349;Cumali;Uğur Yücel;Male;109085;Sedat;Özkan Uğur;Male;106787;Emel;Yeşim Salkım;Female;1258891;Baran the Bandit, released from prison after serving 35 years, searches for vengeance against his former best friend who betrayed him and stole his lover, teaming up with a young punk with his own demons along the way.
549;Basquiat;Jean-Michel Basquiat;Jeffrey Wright;Male;2954;Andy Warhol;David Bowie;Male;7487;Bruno Bischofberger;Dennis Hopper;Male;2778;Albert Milo;Gary Oldman;Male;64;The brief life of Jean Michel Basquiat, a world renowned New York street artist struggling with fame, drugs and his identity.
11306;Extreme Measures;Dr. Guy Luthan;Hugh Grant;Male;3291;Dr. Lawrence Myrick;Gene Hackman;Male;193;Jodie Trammel;Sarah Jessica Parker;Female;520;FBI Agent Frank Hare;David Morse;Male;52;Guy Luthan, a British doctor working at a hospital in New York, starts making unwelcome enquiries when the body of a man who died in his emergency room disappears. After the trail leads Luthan to the door of an eminent surgeon at the hospital, Luthan soon finds himself in extreme danger people who want the hospital's secret to remain undiscovered.
10938;Beautiful Thing;Sandra Gangel;Linda Henry;Female;42582;Jamie Gangel;Glen Berry;Male;67568;Steven Pearce;Scott Neal;Male;218689;Leah;Tameka Empson;Female;97434;Set during a long, hot summer on the Thamesmead Estate in Southeast London, three teenagers edge towards adulthood.
9568;The Dentist;Dr. Alan Feinstone;Corbin Bernsen;Male;21246;Brooke Feinstone;Linda Hoffman;Female;58042;Matt;Michael Stadvec;Male;58043;Detective Gibbs;Ken Foree;Male;15070;Dr. Feinstone has everything, a beautiful wife and a successful career in dentistry, but when he discovers his wife's affair, he realizes that behind every clean, white surface lies the stench of decay.
8866;The Truth About Cats & Dogs;Noelle;Uma Thurman;Female;139;Dr. Abby Barnes;Janeane Garofalo;Female;21197;Brian;Ben Chaplin;Male;21343;Ed;Jamie Foxx;Male;134;A successful veterinarian and radio show host with low self-esteem asks her model friend to impersonate her when a handsome man wants to see her.
9450;Brassed Off;Danny;Pete Postlethwaite;Male;4935;Gloria;Tara Fitzgerald;Female;47615;Andy Barrow;Ewan McGregor;Male;3061;Phil;Stephen Tompkinson;Male;47629;A Yorkshire coal mine is threatened with closure and the only hope is for the men to enter their Grimley Colliery Brass Band into a national competition. They believe they have no hope until Gloria appears carrying her Flugelhorn. At first mocked for being a woman, she soon becomes the only chance for the band to win.
11511;Kazaam;Kazaam;Shaquille O'Neal;Male;35806;Maxwell 'Max' Connor;Francis Capra;Male;17918;Alice Connor;Ally Walker;Female;18316;Carlos;Efren Ramirez;Male;20190;When Max fools a gang of local toughs, he finds himself in big trouble. Fleeing from the thugs, Max runs into an old warehouse and bumps into a boom box. By doing that, he manages to release Kazaam, a genie who has been held captive for thousands of years.
14646;Family Resemblances;Henri Ménard;Jean-Pierre Bacri;Male;28281;Denis;Jean-Pierre Darroussin;Male;28463;Yolande Ménard;Catherine Frot;Female;20080;Betty Ménard;Agnès Jaoui;Female;28279;An upper middle-class French family celebrates a birthday in a restaurant. In one evening and during one meal, family history, tensions, collective and separate grudges, delights, and memories both clash and coalesce.
10988;Diabolique;Nicole Horner;Sharon Stone;Female;4430;Mia Baran;Isabelle Adjani;Female;6553;Guy Baran;Chazz Palminteri;Male;9046;Det. Shirley Vogel;Kathy Bates;Female;8534;The wife and mistress of a cruel school master collaborate in a carefully planned and executed attempt to murder him. The plan goes well until the body, which has been strategically dumped, disappears. The strain starts to tell on the two women as a retired police investigator who is looking into the disappearance on a whim begins to think that they know more than they are telling, and their mental state is not helped when their victim is seen, apparently alive and well by one of the pupils.
36998;The Eighth Day;Harry;Daniel Auteuil;Male;6012;Georges;Pascal Duquenne;Male;534031;Julie;Miou-Miou;Female;4274;Bank manager;Henri Garcin;Male;27880;Georges has Down syndrome, living at a mental-institution, Harry is a busy businessman, giving lectures for young aspiring salesmen. He is successful in his business life, but his social life is a disaster since his wife left him and took their two children with her. This weekend his children came by train to meet him, but Harry, working as always, forgot to pick them up. Neither his wife or his children want to see him again and he is driving around on the country roads, anguished and angry. He almost runs over Georges, on the run from the institution since everybody else went home with their parents except him, whose mother is dead. Harry tries to get rid of Georges but he won't leave his new friend. Eventually a special friendship forms between the two of them, a friendship which makes Harry a different person.
19042;All Dogs Go to Heaven 2;Carface (voice);Ernest Borgnine;Male;7502;Anabelle, the Dog Goddess (voice);Bebe Neuwirth;Female;10739;Charles B. 'Charlie' Barkin (voice);Charlie Sheen;Male;6952;Chihuahua (voice);Hamilton Camp;Male;101606;Charlie and Itchy return to Earth to find Gabriel's Horn, but along the way meet up with a young boy named David, who ran away from home.
9460;Black Mask;Tsui Chik / Black Mask;Jet Li;Male;1336;Inspector 'Rock' Shek Wai-Ho;Lau Ching-wan;Male;940339;Tracy Lee;Karen Mok;Female;57831;Yeuk Laan;Françoise Yip;Female;10875;"Tsui Chik tries to lead a quiet life as a librarian. However, he is really a former test subject for a highly secretive supersoldier project and the instructor of a special commando unit dubbed ""701."" The 701 squad is used for many government missions, but after one of the agents kills a team of policemen in an uncontrollable rage, the government decides to abort the project and eliminate all the subjects. Tsui Chik helped the surviving 701 agents flee the extermination attempt. Having escaped, Tsui Chik went separate ways from his team. Later, he discovers that the rest of the team were responsible for a violent crime spree that was beyond the capability of the local police. He sets out to stop them, donning a disguise and using the superhero alias of ""Black Mask"". Having lost the ability to feel pain due to the surgery performed on the super-soldiers by the military, Black Mask is almost invulnerable."
10990;Mulholland Falls;Max Hoover;Nick Nolte;Male;1733;Katherine Hoover;Melanie Griffith;Female;29369;Elleroy Coolidge;Chazz Palminteri;Male;9046;Eddie Hall;Michael Madsen;Male;147;In 1950s Los Angeles, a special crime squad of the LAPD investigates the murder of a young woman.
3587;Bogus;Harriet Franklin;Whoopi Goldberg;Female;2395;Bogus;Gérard Depardieu;Male;16927;Albert;Haley Joel Osment;Male;9640;Penny;Andrea Martin;Female;8263;Recently orphaned, a young boy is taken in by his godmother who is shocked to realize that she can see the boy's imaginary friend: a flamboyant, French magician named Bogus.
6346;The Chamber;Adam Hall;Chris O'Donnell;Male;5577;Sam Cayhall;Gene Hackman;Male;193;Lee Cayhall Bowen;Faye Dunaway;Female;6450;E. Garner Goodman;Robert Prosky;Male;10360;Idealistic young attorney Adam Hall takes on the death row clemency case of his racist grandfather, Sam Cayhall, a former Ku Klux Klan member he has never met.
19963;Bernie;Marion;Claude Perron;Female;119199;Donald Willis;Roland Blanche;Male;24763;Bernie Noël;Albert Dupontel;Male;14606;Ramonda;Roland Bertin;Male;23735;Bernie, a 30 years old orphan, decides to leave his orphanage and find his parents. After an investigation, he meets Marion, a young heroin addict and falls in love with her. He believes that his family was victim of a plot and this is why they deserted him.
11062;City Hall;Mayor John Pappas;Al Pacino;Male;1158;Deputy Mayor Kevin Calhoun;John Cusack;Male;3036;Marybeth Cogan;Bridget Fonda;Female;2233;Frank Anselmo;Danny Aiello;Male;1004;The accidental shooting of a boy in New York leads to an investigation by the Deputy Mayor, and unexpectedly far-reaching consequences.
54471;Jaguar;Jean Campana;Jean Reno;Male;1003;François Perrin;Patrick Bruel;Male;73827;Wanu;Harrison Lowe;Unknown;150733;Maya;Patricia Velásquez;Female;18920;A shaman from the South American rain forest visits France for a public relations campaign. In a hotel's elevator in Paris he meets a French good-for-nothing named Perrin he's fascinated with. He follows Perrin to his flat and although Perrin is not very enthusiastic about so much interest in his person, he lets the shaman spend the night in his flat. After an official meeting on the next day being part of the PR campaign the shaman suffers from a heart attack. Hardly being able to speak and laying in a hospital bed he demands to see Perrin. The latter is not very interested in meeting the shaman again. However it looks like it is to late for animosities as the shaman and Perrin seem to be tied mentally somehow since they've met in the elevator.
16448;Waiting for Guffman;Corky St. Clair;Christopher Guest;Male;13524;Dr. Allan Pearl;Eugene Levy;Male;26510;Ron Albertson;Fred Willard;Male;20753;Sheila Albertson;Catherine O'Hara;Female;11514;Aspiring director Corky St. Clair and the marginally talented amateur cast of his hokey small-town musical production go overboard when they learn that Broadway theater agent Mort Guffman will be in attendance.
18975;The Adventures of Pinocchio;Geppetto;Martin Landau;Male;2641;Pinocchio;Jonathan Taylor Thomas;Male;53283;Leona;Geneviève Bujold;Female;35341;Lorenzini;Udo Kier;Male;1646;One of puppet-maker Geppetto's creations comes magically to life. This puppet, Pinocchio, has one major desire and that is to become a real boy someday. In order to accomplish this goal he has to learn to act responsibly. This film shows you the adventures on which he learns valuable lessons.
49763;Bad Moon;Janet Harrison;Mariel Hemingway;Female;10447;Uncle Ted;Michael Paré;Male;60650;Brett Harrison;Mason Gamble;Male;15252;"Jerry Mills (aka ""Flopsy"")";Hrothgar Mathews;Male;62912;One man's struggle to contain the curse he hides within... and his last-ditch attempt to free himself with the love of family. But when it looks as if he is losing his battle, and endangering all he holds most dear, the family dog, Thor, is the last hope for his family's survival... and the end to his Werewolf curse.
2074;Flirting with Disaster;Mel Coplin;Ben Stiller;Male;7399;Nancy Coplin;Patricia Arquette;Female;4687;Tina Kalb;Téa Leoni;Female;4939;Pearl Coplin;Mary Tyler Moore;Female;21277;Adopted as a child, new father Mel Colpin decides he cannot name his son until he knows his birth parents, and determines to make a cross-country quest to find them. Accompanied by his wife, Nancy, and an inept yet gorgeous adoption agent, Tina, he departs on an epic road trip that quickly devolves into a farce of mistaken identities, wrong turns, and overzealous and love-struck ATF agents.
39434;The Stendhal Syndrome;Det. Anna Manni;Asia Argento;Female;18514;Alfredo Grossi;Thomas Kretschmann;Male;3491;Marco Longhi;Marco Leonardi;Male;27643;Insp. Manetti;Luigi Diberti;Male;27432;A young policewoman slowly goes insane while tracking down an elusive serial rapist/killer through Italy when she herself becomes a victim of the brutal man's obsession.
11363;She's the One;Renee Donati Fitzpatrick;Jennifer Aniston;Female;4491;Hope;Maxine Bahns;Female;21398;Mickey Fitzpatrick;Edward Burns;Male;12833;Heather Davis;Cameron Diaz;Female;6941;Mickey, a free-spirited New York cabbie, and Francis, a materialistic Wall Street stockbroker, are extremely competitive and confused about women as a result of their father's influence. Though they disagree about everything, they have one thing in common: Mickey's ex-fiance Heather is Francis's secret love. Though both brothers have beautiful wives, Heather triggers their longtime sibling rivalry
47333;Jane Eyre;Young Jane Eyre;Anna Paquin;Female;10690;Jane Eyre;Charlotte Gainsbourg;Female;4273;Rochester;William Hurt;Male;227;Mrs. Fairfax;Joan Plowright;Female;23709;Jane Eyre is an orphan cast out as a young girl by her aunt, Mrs. Reed, and sent to be raised in a harsh charity school for girls. There she learns to be come a teacher and eventually seeks employment outside the school. Her advertisement is answered by the housekeeper of Thornfield Hall, Mrs. Fairfax.
9401;2 Days in the Valley;Dosmo Pizzo;Danny Aiello;Male;1004;Alvin Strayer;Jeff Daniels;Male;8447;Becky Foxx;Teri Hatcher;Female;10742;Helga Svelgen;Charlize Theron;Female;6885;In a sleepy bedroom community of LA's San Fernando Valley, the murder of a professional athlete by two hit men sets into motion a chain of events that puts the mundane lives of a dozen residents on a collision course. This clever tale tells the story of two hit men, a mistress, a nurse, a vindictive ex-wife, a wealthy art dealer and his lovelorn assistant, a suicidal writer and his dog, and a bitter cop and his partner.
21539;The Preacher's Wife;Dudley;Denzel Washington;Male;5292;Julia Biggs;Whitney Houston;Female;8851;Reverend Henry Biggs;Courtney B. Vance;Male;24047;Joe Hamilton;Gregory Hines;Male;66804;Good natured Reverend Henry Biggs finds that his marriage to choir mistress Julia is flagging, due to his constant absence caring for the deprived neighborhood they live in. On top of all this, his church is coming under threat from property developer Joe Hamilton. In desperation, Rev. Biggs prays to God for help - and help arrives in the form of an angel named Dudley.
17414;Dunston Checks In;Robert Grant;Jason Alexander;Male;1206;Mrs. Dubrow;Faye Dunaway;Female;6450;Kyle Grant;Eric Lloyd;Male;27564;Lord Rutledge;Rupert Everett;Male;4757;Hotel manager Robert Grant is forced by his boss to postpone his family vacation when a hotel critic checks in. Trouble is, the critic is really a villainous jewel thief with an orangutan assistant named Dunston. When Dunston gets loose and tries to escape a life of crime -- aided by Robert's sons -- havoc, hijinks and lots of laughs abound!
10548;When We Were Kings;Himself;Muhammad Ali;Male;65605;Himself;George Foreman;Male;65606;Himself;Don King;Male;65607;Himself;James Brown;Male;7172;"It's 1974. Muhammad Ali is 32 and thought by many to be past his prime. George Foreman is ten years younger and the heavyweight champion of the world. Promoter Don King wants to make a name for himself and offers both fighters five million dollars apiece to fight one another, and when they accept, King has only to come up with the money. He finds a willing backer in Mobutu Sese Suko, the dictator of Zaire, and the ""Rumble in the Jungle"" is set, including a musical festival featuring some of America's top black performers, like James Brown and B.B. King."
9302;Up Close & Personal;Warren Justice;Robert Redford;Male;4135;Tally Atwater;Michelle Pfeiffer;Female;1160;Marcia McGrath;Stockard Channing;Female;8893;Bucky Terranova;Joe Mantegna;Male;3266;Tally Atwater has a dream: to be a prime-time network newscaster. She pursues this dream with nothing but ambition, raw talent and a homemade demo tape. Warren Justice is a brilliant, hard edged, veteran newsman. He sees Tally has talent and becomes her mentor. Tally’s career takes a meteoric rise and she and Warren fall in love. The romance that results is as intense and revealing as television news itself. Yet, each breaking story, every videotaped crisis that brings them together, also threatens to drive them apart...
36758;The Portrait of a Lady;Isabel Archer;Nicole Kidman;Female;2227;Gilbert Osmond;John Malkovich;Male;6949;Madame Serena Merle;Barbara Hershey;Female;10767;Henrietta Stackpole;Mary-Louise Parker;Female;18248;Ms. Isabel Archer isn't afraid to challenge societal norms. Impressed by her free spirit, her kindhearted cousin writes her into his fatally ill father's will. Suddenly rich and independent, Isabelle ventures into the world, along the way befriending a cynical intellectual and romancing an art enthusiast. However, the advantage of her affluence is called into question when she realizes the extent to which her money colors her relationships.
18550;Fled;Piper;Laurence Fishburne;Male;2975;Dodge;Stephen Baldwin;Male;9045;Cora;Salma Hayek;Female;3136;Gibson;Will Patton;Male;883;During a routine prison work detail, convict Piper is chained to Dodge, a cyberhacker, when gunfire breaks out. Apparently, the attack is related to stolen money that the Mafia is after, and some computer files that somebody wants desperately to bury. The pair, who don't exactly enjoy each other's company, escape and must work together if they are to reach Atlanta alive. Luckily, they meet a woman who may be willing to help them.
15691;Doctor Who;The Doctor;Paul McGann;Male;47654;Bruce / The Master;Eric Roberts;Male;21315;Dr. Grace Holloway;Daphne Ashbrook;Female;80111;The Doctor;Sylvester McCoy;Male;80112;The Seventh Doctor becomes the Eighth. And on the streets of San Francisco – alongside new ally Grace Holloway - he battles the Master.
11112;The Associate;Laurel Ayres;Whoopi Goldberg;Female;2395;Sally Dugan;Dianne Wiest;Female;1902;Donald Fallon;Eli Wallach;Male;3265;Frank Peterson;Tim Daly;Male;68122;Laurel Ayres is a businesswoman trying to make it but unfortunately she works at a investment firm where she does all the work but all the senior investors like Frank Peterson grab all the credit. She then leaves and starts her own firm. While trying to find clients Laurel pretends that she has a male partner named Robert Cutty. And when she starts to do well all of her clients wants to meet Cutty which is difficult since he doesn't exist.
18203;Big Night;Cristiano;Marc Anthony;Male;47775;Primo;Tony Shalhoub;Male;4252;Secondo;Stanley Tucci;Male;2283;Man in Restaurant;Larry Block;Male;77254;Primo and Secondo, two immigrant brothers, pin their hopes on a banquet honoring Louis Prima to save their struggling restaurant.
3065;Mystery Science Theater 3000: The Movie;Mike Nelson;Michael J. Nelson;Male;30020;Dr. Clayton Forrester / Crow T. Robot;Trace Beaulieu;Unknown;30019;Gypsy;Jim Mallon;Male;30021;Tom Servo;Kevin Murphy;Male;30022;"The mad and evil scientist, Dr. Clayton Forrester, has created an evil little scheme that is bound to give him world global domination but first things first. He plans to torment Mike Nelson and the robots by sending them a real stinker of a film to watch called, ""This Island Earth."" He is convinced that this movie will drive them insane. Will this be the ultimate cheese that breaks the boys' spirits?"
12559;First Kid;Sam Simms;Sinbad;Male;57119;Luke Davenport;Brock Pierce;Male;72862;Dash;Blake Boyd;Male;72863;Woods;Timothy Busfield;Male;23881;Some say that to be the leader of a country is one of the loneliest jobs in the world. But being the child of a world leader can be doubly so. Constantly surrounded by security officers, restricted in movements and having almost every waking moment carefully monitored makes normalcy an impossibility. No one knows this better than young Luke Davenport, the son of U.S. President Davenport. He vents his loneliness, frustration and feelings of isolation from family and friends by being a brat to his private Secret Service agent. When the agent snaps from the strain in front of the First Lady, a new agent is assigned to Luke. He turns out to be the enormous Sam Simms, a bit of a rogue who managed to rise through the ranks by sheer determination rather than strict adherence to Secret-Service protocol. At first, Luke tries all his old tricks upon Sam. But instead of getting angry, Sam seems to actually understand.
9308;High School High;Richard Clark;Jon Lovitz;Male;16165;Victoria Chapell;Tia Carrere;Female;13445;Schuldirektorin Evelyn Doyle;Louise Fletcher;Female;7071;Griff McReynolds;Mekhi Phifer;Male;327;Richard Clark has just left the well-known Wellington Academy to teach at Marion Barry High School. Now, he will try to inspire the D-average students into making good grades and try to woo a fellow teacher.
25518;La Belle Verte;Mila;Coline Serreau;Female;35208;Max;Vincent Lindon;Male;5443;Mesaje;James Thiérrée;Male;46274;Macha;Marion Cotillard;Female;8293;As part of an intergalactic coalition, a well-meaning space alien volunteers to bring a message of self-actualization and harmony with nature to the one planet rejected by all her peers as incorrigible: Earth.
