MovieId;Title;Character1;PersonName1;Sex1;ActorId1;Character2;PersonName2;Sex2;ActorId2;Character3;PersonName3;Sex3;ActorId3;Character4;PersonName4;Sex4;ActorId4;Overview
1771;Captain America: The First Avenger;Steve Rogers / Captain America;Chris Evans;Male;16828;Colonel Chester Phillips;Tommy Lee Jones;Male;2176;Johann Schmidt / Red Skull;Hugo Weaving;Male;1331;Peggy Carter;Hayley Atwell;Female;39459;During World War II, Steve Rogers is a sickly man from Brooklyn who's transformed into super-soldier Captain America to aid in the war effort. Rogers must stop the Red Skull – Adolf Hitler's ruthless head of weaponry, and the leader of an organization that intends to use a mysterious device of untold powers for world domination.
10195;Thor;Thor Odinson;Chris Hemsworth;Male;74568;Jane Foster;Natalie Portman;Female;524;Loki;Tom Hiddleston;Male;91606;Odin;Anthony Hopkins;Male;4173;Against his father Odin's will, The Mighty Thor - a powerful but arrogant warrior god - recklessly reignites an ancient war. Thor is cast down to Earth and forced to live among humans as punishment. Once here, Thor learns what it takes to be a true hero when the most dangerous villain of his world sends the darkest forces of Asgard to invade Earth.
12445;Harry Potter and the Deathly Hallows: Part 2;Harry Potter;Daniel Radcliffe;Male;10980;Ron Weasley;Rupert Grint;Male;10989;Hermione Granger;Emma Watson;Female;10990;Lord Voldemort;Ralph Fiennes;Male;5469;Harry, Ron and Hermione continue their quest to vanquish the evil Voldemort once and for all. Just as things begin to look hopeless for the young wizards, Harry discovers a trio of magical objects that endow him with powers to rival Voldemort's formidable skills.
77338;The Intouchables;Philippe;François Cluzet;Male;33161;Yvonne;Anne Le Ny;Female;19370;Marcelle;Clotilde Mollet;Female;2411;Driss;Omar Sy;Male;78423;A true story of two men who should never have met – a quadriplegic aristocrat who was injured in a paragliding accident and a young man from the projects.
1865;Pirates of the Caribbean: On Stranger Tides;Captain Jack Sparrow;Johnny Depp;Male;85;Angélica;Penélope Cruz;Female;955;Captain Hector Barbossa;Geoffrey Rush;Male;118;"Captain Edward ""Blackbeard"" Teach";Ian McShane;Male;6972;Captain Jack Sparrow crosses paths with a woman from his past, and he's not sure if it's love -- or if she's a ruthless con artist who's using him to find the fabled Fountain of Youth. When she forces him aboard the Queen Anne's Revenge, the ship of the formidable pirate Blackbeard, Jack finds himself on an unexpected adventure in which he doesn't know who to fear more: Blackbeard or the woman from his past.
49538;X-Men: First Class;Charles Xavier (24 Years) / Professor X;James McAvoy;Male;5530;Erik Lehnsherr / Magneto;Michael Fassbender;Male;17288;Sebastian Shaw / Black King;Kevin Bacon;Male;4724;Moira MacTaggert;Rose Byrne;Female;9827;Before Charles Xavier and Erik Lensherr took the names Professor X and Magneto, they were two young men discovering their powers for the first time. Before they were arch-enemies, they were closest of friends, working together with other mutants (some familiar, some new), to stop the greatest threat the world has ever known.
82690;Wreck-It Ralph;Wreck-It Ralph (voice);John C. Reilly;Male;4764;Vanellope von Schweetz (voice);Sarah Silverman;Female;7404;Fix-It Felix (voice);Jack McBrayer;Male;58737;Sergeant Calhoun (voice);Jane Lynch;Female;43775;Wreck-It Ralph is the 9-foot-tall, 643-pound villain of an arcade video game named Fix-It Felix Jr., in which the game's titular hero fixes buildings that Ralph destroys. Wanting to prove he can be a good guy and not just a villain, Ralph escapes his game and lands in Hero's Duty, a first-person shooter where he helps the game's hero battle against alien invaders. He later enters Sugar Rush, a kart racing game set on tracks made of candies, cookies and other sweets. There, Ralph meets Vanellope von Schweetz who has learned that her game is faced with a dire threat that could affect the entire arcade, and one that Ralph may have inadvertently started.
64690;Drive;Driver;Ryan Gosling;Male;30614;Irene;Carey Mulligan;Female;36662;Shannon;Bryan Cranston;Male;17419;Bernie Rose;Albert Brooks;Male;13;Driver is a skilled Hollywood stuntman who moonlights as a getaway driver for criminals. Though he projects an icy exterior, lately he's been warming up to a pretty neighbor named Irene and her young son, Benicio. When Irene's husband gets out of jail, he enlists Driver's help in a million-dollar heist. The job goes horribly wrong, and Driver must risk his life to protect Irene and Benicio from the vengeful masterminds behind the robbery.
61791;Rise of the Planet of the Apes;Will Rodman;James Franco;Male;17051;Caesar;Andy Serkis;Male;1333;Caroline Aranha;Freida Pinto;Female;76792;Charles Rodman;John Lithgow;Male;12074;A highly intelligent chimpanzee named Caeser has been living a peaceful suburban life ever since he was born. But when he gets taken to a cruel primate facility, Caeser decides to revolt against those who have harmed him.
49530;In Time;Will Salas;Justin Timberlake;Male;12111;Sylvia Weis;Amanda Seyfried;Female;71070;Raymond Leon;Cillian Murphy;Male;2037;Rachel Salas;Olivia Wilde;Female;59315;In the not-too-distant future the aging gene has been switched off. To avoid overpopulation, time has become the currency and the way people pay for luxuries and necessities. The rich can live forever, while the rest try to negotiate for their immortality. A poor young man who comes into a fortune of time, though too late to help his mother from dying. He ends up on the run from a corrupt police force known as 'time keepers'.
51876;Limitless;Eddie Morra;Bradley Cooper;Male;51329;Carl Van Loon;Robert De Niro;Male;380;Lindy;Abbie Cornish;Female;37260;Gennady;Andrew Howard;Male;67206;"A paranoia-fueled action thriller about an unsuccessful writer whose life is transformed by a top-secret ""smart drug"" that allows him to use 100% of his brain and become a perfect version of himself. His enhanced abilities soon attract shadowy forces that threaten his new life in this darkly comic and provocative film."
58574;Sherlock Holmes: A Game of Shadows;Sherlock Holmes;Robert Downey Jr.;Male;3223;Dr. John Watson;Jude Law;Male;9642;Madam Simza Heron;Noomi Rapace;Female;87722;Professor James Moriarty;Jared Harris;Male;15440;There is a new criminal mastermind at large (Professor Moriarty) and not only is he Holmes’ intellectual equal, but his capacity for evil and lack of conscience may give him an advantage over the  detective.
45243;The Hangover Part II;Phil Wenneck;Bradley Cooper;Male;51329;Stu Price;Ed Helms;Male;27105;Alan Garner;Zach Galifianakis;Male;58225;Doug Billings;Justin Bartha;Male;21180;The Hangover crew heads to Thailand for Stu's wedding. After the disaster of a bachelor party in Las Vegas last year, Stu is playing it safe with a mellow pre-wedding brunch. However, nothing goes as planned and Bangkok is the perfect setting for another adventure with the rowdy group.
56292;Mission: Impossible - Ghost Protocol;Ethan Hunt;Tom Cruise;Male;500;Jane Carter;Paula Patton;Female;52851;"Benjamin ""Benji"" Dunn";Simon Pegg;Male;11108;William Brandt;Jeremy Renner;Male;17604;Ethan Hunt and his team are racing against time to track down a dangerous terrorist named Hendricks, who has gained access to Russian nuclear launch codes and is planning a strike on the United States. An attempt to stop him ends in an explosion causing severe destruction to the Kremlin and the IMF to be implicated in the bombing, forcing the President to disavow them. No longer being aided by the government, Ethan and his team chase Hendricks around the globe, although they might still be too late to stop a disaster.
50619;The Twilight Saga: Breaking Dawn - Part 1;Bella Swan;Kristen Stewart;Female;37917;Edward Cullen;Robert Pattinson;Male;11288;Jacob Black;Taylor Lautner;Male;84214;Alice Cullen;Ashley Greene;Female;45827;The new found married bliss of Bella Swan and vampire Edward Cullen is cut short when a series of betrayals and misfortunes threatens to destroy their world.
38356;Transformers: Dark of the Moon;Sam Witwicky;Shia LaBeouf;Male;10959;Carly;Rosie Huntington-Whiteley;Female;236048;Lennox;Josh Duhamel;Male;19536;Simmons;John Turturro;Male;1241;The Autobots continue to work for NEST, now no longer in secret. But after discovering a strange artifact during a mission in Chernobyl, it becomes apparent to Optimus Prime that the United States government has been less than forthright with them.
50646;Crazy, Stupid, Love.;Cal Weaver;Steve Carell;Male;4495;Emily Weaver;Julianne Moore;Female;1231;Hannah Weaver;Emma Stone;Female;54693;Jacob Palmer;Ryan Gosling;Male;30614;Cal Weaver is living the American dream. He has a good job, a beautiful house, great children and a beautiful wife, named Emily. Cal's seemingly perfect life unravels, however, when he learns that Emily has been unfaithful and wants a divorce. Over 40 and suddenly single, Cal is adrift in the fickle world of dating. Enter, Jacob Palmer, a self-styled player who takes Cal under his wing and teaches him how to be a hit with the ladies.
45612;Source Code;Colter Stevens;Jake Gyllenhaal;Male;131;Christina Warren;Michelle Monaghan;Female;11705;Colleen Goodwin;Vera Farmiga;Female;21657;Dr. Rutledge;Jeffrey Wright;Male;2954;When decorated soldier Captain Colter Stevens wakes up in the body of an unknown man, he discovers he's part of a mission to find the bomber of a Chicago commuter train.
50544;Friends with Benefits;Dylan Harper;Justin Timberlake;Male;12111;Jamie Rellis;Mila Kunis;Female;18973;Annie Harper;Jenna Elfman;Female;40279;Lorna;Patricia Clarkson;Female;1276;Dylan and Jamie think it's going to be easy to add the simple act of sex to their friendship, despite what Hollywood romantic comedies would have them believe. They soon discover however that getting physical really does always lead to complications.
51497;Fast Five;Dominic Toretto;Vin Diesel;Male;12835;Brian O'Conner;Paul Walker;Male;8167;Luke Hobbs;Dwayne Johnson;Male;18918;Mia Toretto;Jordana Brewster;Female;22123;Former cop Brian O'Conner partners with ex-con Dom Toretto on the opposite side of the law. Since Brian and Mia Toretto broke Dom out of custody, they've blown across many borders to elude authorities. Now backed into a corner in Rio de Janeiro, they must pull one last job in order to gain their freedom.
39254;Real Steel;Charlie Kenton;Hugh Jackman;Male;6968;Max Kenton;Dakota Goyo;Male;234479;Bailey Tallet;Evangeline Lilly;Female;19034;Ricky;Kevin Durand;Male;79072;Charlie Kenton is a washed-up fighter who retired from the ring when robots took over the sport. After his robot is trashed, he reluctantly teams up with his estranged son to rebuild and train an unlikely contender.
50014;The Help;"Eugenia ""Skeeter"" Phelan";Emma Stone;Female;54693;Aibileen Clark;Viola Davis;Female;19492;Minny Jackson;Octavia Spencer;Female;6944;Hilly Holbrook;Bryce Dallas Howard;Female;18997;"Aibileen Clark is a middle-aged African-American maid who has spent her life raising white children and has recently lost her only son, Minny Jackson is an African-American maid who has often offended her employers despite her family's struggles with money and her desperate need for jobs, and Eugenia ""Skeeter"" Phelan is a young white woman who has recently moved back home after graduating college to find out her childhood maid has mysteriously disappeared. These three stories intertwine to explain how life in Jackson, Mississippi revolves around ""the help"", yet they are always kept at a certain distance because of racial lines."
49013;Cars 2;Mater (voice);Larry the Cable Guy;Male;15897;Lightning McQueen (voice);Owen Wilson;Male;887;Finn McMissile (voice);Michael Caine;Male;3895;Holley Shiftwell (voice);Emily Mortimer;Female;1246;Star race car Lightning McQueen and his pal Mater head overseas to compete in the World Grand Prix race. But the road to the championship becomes rocky as Mater gets caught up in an intriguing adventure of his own: international espionage.
59436;Midnight in Paris;Gil;Owen Wilson;Male;887;Inez;Rachel McAdams;Female;53714;John;Kurt Fuller;Male;29685;Helen;Mimi Kennedy;Female;91495;A romantic comedy about a family traveling to the French capital for business. The party includes a young engaged couple forced to confront the illusion that a life different from their own is better.
44912;Green Lantern;Hal Jordan / Green Lantern;Ryan Reynolds;Male;10859;Carol Ferris;Blake Lively;Female;59175;Hector Hammond;Peter Sarsgaard;Male;133;Sinestro;Mark Strong;Male;2983;For centuries, a small but powerful force of warriors called the Green Lantern Corps has sworn to keep intergalactic order. Each Green Lantern wears a ring that grants him superpowers. But when a new enemy called Parallax threatens to destroy the balance of power in the Universe, their fate and the fate of Earth lie in the hands of the first human ever recruited.
44826;Hugo;Georges Méliès;Ben Kingsley;Male;2282;The Station Inspector;Sacha Baron Cohen;Male;6730;Hugo Cabret;Asa Butterfield;Male;77996;Isabelle;Chloë Grace Moretz;Female;56734;Orphaned and alone except for an uncle, Hugo Cabret lives in the walls of a train station in 1930s Paris. Hugo's job is to oil and maintain the station's clocks, but to him, his more important task is to protect a broken automaton and notebook left to him by his late father. Accompanied by the goddaughter of an embittered toy merchant, Hugo embarks on a quest to solve the mystery of the automaton and find a place he can call home.
65754;The Girl with the Dragon Tattoo;Mikael Blomkvist;Daniel Craig;Male;8784;Lisbeth Salander;Rooney Mara;Female;108916;Henrik Vanger;Christopher Plummer;Male;290;Martin Vanger;Stellan Skarsgård;Male;1640;This English-language adaptation of the Swedish novel by Stieg Larsson follows a disgraced journalist, Mikael Blomkvist, as he investigates the disappearance of a weary patriarch's niece from 40 years ago. He is aided by the pierced, tattooed, punk computer hacker named Lisbeth Salander. As they work together in the investigation, Blomkvist and Salander uncover immense corruption beyond anything they have ever imagined.
37686;Super 8;Joe Lamb;Joel Courtney;Male;518627;Alice Dainard;Elle Fanning;Female;18050;Charles Kaznyk;Riley Griffiths;Male;518628;Jackson Lamb;Kyle Chandler;Male;3497;In 1979 Ohio, several youngsters are making a zombie movie with a Super-8 camera. In the midst of filming, the friends witness a horrifying train derailment and are lucky to escape with their lives. They soon discover that the catastrophe was no accident, as a series of unexplained events and disappearances soon follows. Deputy Jackson Lamb, the father of one of the kids, searches for the terrifying truth behind the crash.
49444;Kung Fu Panda 2;Po (voice);Jack Black;Male;70851;Tigress (voice);Angelina Jolie;Female;11701;Shifu (voice);Dustin Hoffman;Male;4483;Lord Shen (voice);Gary Oldman;Male;64;Po is now living his dream as The Dragon Warrior, protecting the Valley of Peace alongside his friends and fellow kung fu masters, The Furious Five - Tigress, Crane, Mantis, Viper and Monkey. But Po’s new life of awesomeness is threatened by the emergence of a formidable villain, who plans to use a secret, unstoppable weapon to conquer China and destroy kung fu. It is up to Po and The Furious Five to journey across China to face this threat and vanquish it. But how can Po stop a weapon that can stop kung fu? He must look to his past and uncover the secrets of his mysterious origins, only then will he be able to unlock the strength he needs to succeed.
46195;Rio;Blu (voice);Jesse Eisenberg;Male;44735;Jewel (voice);Anne Hathaway;Female;1813;Linda (voice);Leslie Mann;Female;41087;Alice / Goose (voice);Jane Lynch;Female;43775;Captured by smugglers when he was just a hatchling, a macaw named Blu never learned to fly and lives a happily domesticated life in Minnesota with his human friend, Linda. Blu is thought to be the last of his kind, but when word comes that Jewel, a lone female, lives in Rio de Janeiro, Blu and Linda go to meet her. Animal smugglers kidnap Blu and Jewel, but the pair soon escape and begin a perilous adventure back to freedom -- and Linda.
51540;Horrible Bosses;Nick Hendricks;Jason Bateman;Male;23532;Dale Arbus;Charlie Day;Male;95101;Kurt Buckman;Jason Sudeikis;Male;58224;Dave Harken;Kevin Spacey;Male;1979;For Nick, Kurt and Dale, the only thing that would make the daily grind more tolerable would be to grind their intolerable bosses into dust. Quitting is not an option, so, with the benefit of a few-too-many drinks and some dubious advice from a hustling ex-con, the three friends devise a convoluted and seemingly foolproof plan to rid themselves of their respective employers... permanently.
44896;Rango;Rango (voice);Johnny Depp;Male;85;Beans (Voice);Isla Fisher;Female;52848;Mayor Tortoise John (voice);Ned Beatty;Male;13726;Rattlesnake Jake (voice);Bill Nighy;Male;2440;When Rango, a lost family pet, accidentally winds up in the gritty, gun-slinging town of Dirt, the less-than-courageous lizard suddenly finds he stands out. Welcomed as the last hope the town has been waiting for, new Sheriff Rango is forced to play his new role to the hilt.
39538;Contagion;Leonora Orantes;Marion Cotillard;Female;8293;Mitch Emhoff;Matt Damon;Male;1892;Ellis Cheever;Laurence Fishburne;Male;2975;Alan Krumwiede;Jude Law;Male;9642;As an epidemic of a lethal airborne virus - that kills within days - rapidly grows, the worldwide medical community races to find a cure and control the panic that spreads faster than the virus itself.
39513;Paul;Paul (voice);Seth Rogen;Male;19274;Graeme Willy;Simon Pegg;Male;11108;Clive Gollings;Nick Frost;Male;11109;Special Agent Lorenzo Zoil;Jason Bateman;Male;23532;For the past 60 years, a space-traveling smart-ass named Paul has been locked up in a top-secret military base, advising world leaders about his kind. But when he worries he’s outlived his usefulness and the dissection table is drawing uncomfortably close, Paul escapes on the first RV that passes by his compound in Area 51. Fortunately, it contains the two earthlings who are most likely to rescue and harbor an alien on the run.
50546;Just Go with It;Danny Maccabee;Adam Sandler;Male;19292;Katherine Murphy;Jennifer Aniston;Female;4491;Devlin Adams;Nicole Kidman;Female;2227;Eddie Simms;Nick Swardson;Male;32907;A plastic surgeon, romancing a much younger schoolteacher, enlists his loyal assistant to pretend to be his soon to be ex-wife, in order to cover up a careless lie. When more lies backfire, the assistant's kids become involved, and everyone heads off for a weekend in Hawaii that will change all their lives.
17578;The Adventures of Tintin;Tintin (voice);Jamie Bell;Male;478;Sakharine / Red Rackham (voice);Daniel Craig;Male;8784;Captain Haddock / Sir Francis Haddock (voice);Andy Serkis;Male;1333;Thomson (voice);Nick Frost;Male;11109;Intrepid young reporter, Tintin, and his loyal dog, Snowy, are thrust into a world of high adventure when they discover a ship carrying an explosive secret. As Tintin is drawn into a centuries-old mystery, Ivan Ivanovitch Sakharine suspects him of stealing a priceless treasure. Tintin and Snowy, with the help of salty, cantankerous Captain Haddock and bumbling detectives, Thompson and Thomson, travel half the world, one step ahead of their enemies, as Tintin endeavors to find the Unicorn, a sunken ship that may hold a vast fortune, but also an ancient curse.
49849;Cowboys & Aliens;Jake Lonergan;Daniel Craig;Male;8784;Woodrow Dolarhyde;Harrison Ford;Male;3;Ella Swenson;Olivia Wilde;Female;59315;Doc;Sam Rockwell;Male;6807;A stranger stumbles into the desert town of Absolution with no memory of his past and a futuristic shackle around his wrist. With the help of mysterious beauty Ella and the iron-fisted Colonel Dolarhyde, he finds himself leading an unlikely posse of cowboys, outlaws, and Apache warriors against a common enemy from beyond this world in an epic showdown for survival.
52449;Bad Teacher;Elizabeth Halsey;Cameron Diaz;Female;6941;Scott Delacorte;Justin Timberlake;Male;12111;Russell Gettis;Jason Segel;Male;41088;Amy Squirrel;Lucy Punch;Female;66446;A lazy, incompetent middle school teacher who hates her job and her students is forced to return to her job to make enough money for a boob job after her rich fiancé dumps her.
46529;I Am Number Four;John Smith / Number Four;Alex Pettyfer;Male;61363;Sarah Hart;Dianna Agron;Female;141687;Number Six / Maren Elizabeth;Teresa Palmer;Female;20374;Henri Smith;Timothy Olyphant;Male;18082;A teenage fugitive with an incredible secret races to stay one step ahead of the mysterious forces seeking destroy him in this sci-fi action thriller. With three dead and one on the run, the race to find the elusive Number Four begins. Outwardly normal teen John Smith never gets too comfortable in the same identity, and along with his guardian, Henri, he is constantly moving from town to town. With each passing day, John gains a stronger grasp on his extraordinary new powers, and his bond to the beings that share his fantastic fate grows stronger.
41630;No Strings Attached;Emma Kurtzman;Natalie Portman;Female;524;Adam Franklin;Ashton Kutcher;Male;18976;Alvin Franklin;Kevin Kline;Male;8945;Dr. Stephen Metzner;Cary Elwes;Male;2130;Emma is a busy doctor who sets up a seemingly perfect arrangement when she offers her best friend Adam a relationship with one rule: No strings attached. But when a fling becomes a thing, can sex friends stay best friends?
60308;Moneyball;Billy Beane;Brad Pitt;Male;287;Peter Brand;Jonah Hill;Male;21007;Art Howe;Philip Seymour Hoffman;Male;1233;Scott Hatteberg;Chris Pratt;Male;73457;The story of Oakland Athletics general manager Billy Beane's successful attempt to put together a baseball team on a budget, by employing computer-generated analysis to draft his players.
23629;Sucker Punch;Baby Doll;Emily Browning;Female;70456;Sweet Pea;Abbie Cornish;Female;37260;Rocket;Jena Malone;Female;20089;Blondie;Vanessa Hudgens;Female;67599;A young girl is institutionalized by her abusive stepfather. Retreating to an alternative reality as a coping strategy, she envisions a plan which will help her escape from the mental facility.
38050;The Adjustment Bureau;David Norris;Matt Damon;Male;1892;Elise Sellas;Emily Blunt;Female;5081;Richardson;John Slattery;Male;21134;Harry Mitchell;Anthony Mackie;Male;53650;A man glimpses the future Fate has planned for him – and chooses to fight for his own destiny. Battling the powerful Adjustment Bureau across, under and through the streets of New York, he risks his destined greatness to be with the only woman he's ever loved.
55721;Bridesmaids;Annie Walker;Kristen Wiig;Female;41091;Lillian Donovan;Maya Rudolph;Female;52792;Helen Harris;Rose Byrne;Female;9827;Rita;Wendi McLendon-Covey;Female;63234;Annie's life is a mess. But when she finds out her lifetime best friend is engaged, she simply must serve as Lillian's maid of honor. Though lovelorn and broke, Annie bluffs her way through the expensive and bizarre rituals. With one chance to get it perfect, she’ll show Lillian and her bridesmaids just how far you’ll go for someone you love.
59440;Warrior;Brendan Conlon;Joel Edgerton;Male;33192;Tommy Conlon;Tom Hardy;Male;2524;Tess Conlon;Jennifer Morrison;Female;41421;Frank Campana;Frank Grillo;Male;81685;The youngest son of an alcoholic former boxer returns home, where he's trained by his father for competition in a mixed martial arts tournament – a path that puts the fighter on a collision course with his estranged, older brother.
51828;One Day;Emma Morley;Anne Hathaway;Female;1813;Dexter Mayhew;Jim Sturgess;Male;38941;Callum O'Neill;Tom Mison;Male;75073;Tilly Shaw;Jodie Whittaker;Female;66431;A romantic comedy centered on Dexter and Emma, who first meet during their graduation in 1988 and proceed to keep in touch regularly. The film follows what they do on July 15 annually, usually doing something together.
63311;The Skin I Live In;Dr. Robert Ledgard;Antonio Banderas;Male;3131;Vera Cruz;Elena Anaya;Female;3623;Marilia;Marisa Paredes;Female;954;Vicente;Jan Cornet;Male;440879;A brilliant plastic surgeon creates a synthetic skin that withstands any kind of damage. His guinea pig: a mysterious and volatile woman who holds the key to his obsession.
48138;Unknown;Dr. Martin Harris;Liam Neeson;Male;3896;Gina;Diane Kruger;Female;9824;Elizabeth Harris;January Jones;Female;31717;Martin B.;Aidan Quinn;Male;18992;A man awakens from a coma, only to discover that someone has taken on his identity and that no one, (not even his wife), believes him. With the help of a young woman, he sets out to prove who he is.
41513;The Smurfs;Gargamel;Hank Azaria;Male;5587;Patrick Winslow;Neil Patrick Harris;Male;41686;Grace Winslow;Jayma Mays;Female;34195;Odile Anjelou;Sofía Vergara;Female;63522;When the evil wizard Gargamel chases the tiny blue Smurfs out of their village, they tumble from their magical world and into ours -- in fact, smack dab in the middle of Central Park. Just three apples high and stuck in the Big Apple, the Smurfs must find a way to get back to their village before Gargamel tracks them down.
40807;50/50;Adam Lerner;Joseph Gordon-Levitt;Male;24045;Kyle Hirons;Seth Rogen;Male;19274;Katherine McKay;Anna Kendrick;Female;84223;Rachael;Bryce Dallas Howard;Female;18997;Inspired by a true story, a comedy centered on a 27-year-old guy who learns of his cancer diagnosis and his subsequent struggle to beat the disease.
