MovieId;Title;Character1;PersonName1;Sex1;ActorId1;Character2;PersonName2;Sex2;ActorId2;Character3;PersonName3;Sex3;ActorId3;Character4;PersonName4;Sex4;ActorId4;Overview
329;Jurassic Park;Dr. Alan Grant;Sam Neill;Male;4783;Dr. Ellie Sattler;Laura Dern;Female;4784;Dr. Ian Malcolm;Jeff Goldblum;Male;4785;John Hammond;Richard Attenborough;Male;4786;A wealthy entrepreneur secretly creates a theme park featuring living dinosaurs drawn from prehistoric DNA. Before opening day, he invites a team of experts and his two eager grandchildren to experience the park and help calm anxious investors. However, the park is anything but amusing as the security systems go off-line and the dinosaurs escape.
424;Schindler's List;Oskar Schindler;Liam Neeson;Male;3896;Itzhak Stern;Ben Kingsley;Male;2282;Amon Göth;Ralph Fiennes;Male;5469;Emilie Schindler;Caroline Goodall;Female;6692;The true story of how businessman Oskar Schindler saved over a thousand Jewish lives from the Nazis while they worked as slaves in his factory during World War II.
9479;The Nightmare Before Christmas;Jack Skellington (voice);Chris Sarandon;Male;14541;Jack Skellington (singing) / Barrel / Clown with the Tear away Face (voice);Danny Elfman;Male;531;Sally / Shock (voice);Catherine O'Hara;Female;11514;Oogie Boogie (voice);Ken Page;Male;95758;Tired of scaring humans every October 31 with the same old bag of tricks, Jack Skellington, the spindly king of Halloween Town, kidnaps Santa Claus and plans to deliver shrunken heads and other ghoulish gifts to children on Christmas morning. But as Christmas approaches, Jack's rag-doll girlfriend, Sally, tries to foil his misguided plans.
137;Groundhog Day;Phil Connors;Bill Murray;Male;1532;Rita Hanson;Andie MacDowell;Female;1533;Larry;Chris Elliott;Male;1534;Ned Ryerson;Stephen Tobolowsky;Male;537;A narcissistic TV weatherman, along with his attractive-but-distant producer, and his mawkish cameraman, is sent to report on Groundhog Day in the small town of Punxsutawney, where he finds himself repeating the same day over and over.
788;Mrs. Doubtfire;Daniel Hillard / Mrs. Doubtfire;Robin Williams;Male;2157;Miranda Hillard;Sally Field;Female;35;Stu;Pierce Brosnan;Male;517;Lydia Hillard;Lisa Jakub;Female;8987;Loving but irresponsible dad Daniel Hillard, estranged from his exasperated spouse, is crushed by a court order allowing only weekly visits with his kids. When Daniel learns his ex needs a housekeeper, he gets the job -- disguised as an English nanny. Soon he becomes not only his children's best pal but the kind of parent he should have been from the start.
9800;Philadelphia;Andrew Beckett;Tom Hanks;Male;31;Joe Miller;Denzel Washington;Male;5292;Charles Wheeler;Jason Robards;Male;4765;Belinda Conine;Mary Steenburgen;Female;2453;Two competing lawyers join forces to sue a prestigious law firm for AIDS discrimination. As their unlikely friendship develops their courage overcomes the prejudice and corruption of their powerful adversaries.
5503;The Fugitive;Dr. Richard Kimble;Harrison Ford;Male;3;Deputy Marshal Samuel Gerard;Tommy Lee Jones;Male;2176;Deputy Marashal Cosmo Renfro;Joe Pantoliano;Male;532;Dr. Anne Eastman;Julianne Moore;Female;1231;Wrongfully convicted of murdering his wife and sentenced to death, Richard Kimble escapes from the law in an attempt to find the real killer and clear his name.
1587;What's Eating Gilbert Grape;Gilbert Grape;Johnny Depp;Male;85;Arnie Grape;Leonardo DiCaprio;Male;6193;Becky;Juliette Lewis;Female;3196;Betty Carver;Mary Steenburgen;Female;2453;Gilbert Grape is a small-town young man with a lot of responsibility. Chief among his concerns are his mother, who is so overweight that she can't leave the house, and his mentally impaired younger brother, Arnie, who has a knack for finding trouble. Settled into a job at a grocery store and an ongoing affair with local woman Betty Carver, Gilbert finally has his life shaken up by the free-spirited Becky.
9739;Demolition Man;John Spartan;Sylvester Stallone;Male;16483;Simon Phoenix;Wesley Snipes;Male;10814;Lt. Lenina Huxley;Sandra Bullock;Female;18277;Dr. Raymond Cocteau;Nigel Hawthorne;Male;15788;Simon Phoenix, a violent criminal cryogenically frozen in 1996, escapes during a parole hearing in 2032 in the utopia of San Angeles. Police are incapable of dealing with his violent ways and turn to his captor, who had also been cryogenically frozen after being wrongfully accused of killing 30 innocent people while apprehending Phoenix.
37094;Falling Down;D-Fens;Michael Douglas;Male;3392;Prendergast;Robert Duvall;Male;3087;Beth;Barbara Hershey;Female;10767;Sandra;Rachel Ticotin;Female;10768;"On the day of his daughter's birthday, William ""D-Fens"" Foster is trying to get to the home of his estranged ex-wife to see his daughter. His car breaks down, so he leaves his car in a traffic jam in Los Angeles and decides to walk. He goes to a convenience store and tries to get some change for a phone call, but the Korean owner does not oblige, tipping Foster over the edge. The unstable Foster, so frustrated with the various flaws he sees in society, begins to psychotically and violently lash out against them."
6075;Carlito's Way;Carlito Brigante;Al Pacino;Male;1158;David Kleinfeld;Sean Penn;Male;2228;Gail;Penelope Ann Miller;Female;14698;Benny Blanco;John Leguizamo;Male;5723;A Puerto-Rican ex-con, just released from prison, pledges to stay away from drugs and violence despite the pressure around him, and lead a better life outside NYC.
2758;Addams Family Values;Morticia Addams;Anjelica Huston;Female;5657;Gomez Addams;Raúl Juliá;Male;27888;Uncle Fester Addams;Christopher Lloyd;Male;1062;Debbie Jellinsky;Joan Cusack;Female;3234;"Siblings Wednesday and Pugsley Addams will stop at nothing to get rid of Pubert, the new baby boy adored by parents Gomez and Morticia. Things go from bad to worse when the new ""black widow"" nanny, Debbie Jellinsky, launches her plan to add Fester to her collection of dead husbands."
10439;Hocus Pocus;Winifred 'Winnie' Sanderson;Bette Midler;Female;73931;Sarah Sanderson;Sarah Jessica Parker;Female;520;Mary Sanderson;Kathy Najimy;Female;11074;Max Dennison;Omri Katz;Male;65309;After 300 years of slumber, three sister witches are accidentally resurrected in Salem on Halloween night, and it is up to three kids and their newfound feline friend to put an end to the witches' reign of terror once and for all.
319;True Romance;Clarence Worley;Christian Slater;Male;2224;Alabama Whitman;Patricia Arquette;Female;4687;Dick Ritchie;Michael Rapaport;Male;4688;Elliot Blitzer;Bronson Pinchot;Male;4689;Clarence marries hooker Alabama, steals cocaine from her pimp, and tries to sell it in Hollywood, while the owners of the coke try to reclaim it.
9593;Last Action Hero;Jack Slater / Himself;Arnold Schwarzenegger;Male;1100;Danny Madigan;Austin O'Brien;Male;58119;Whitney / Meredith;Bridgette Wilson;Female;20751;John Practice;F. Murray Abraham;Male;1164;Danny is obsessed with a fictional movie character action hero Jack Slater. When a magical ticket transports him into Jack's latest adventure, Danny finds himself in a world where movie magic and reality collide. Now it's up to Danny to save the life of his hero and new friend.
9350;Cliffhanger;Gabe Walker;Sylvester Stallone;Male;16483;Eric Qualen;John Lithgow;Male;12074;Hal Tucker;Michael Rooker;Male;12132;Jessie Deighan;Janine Turner;Female;51580;A year after losing his friend in a tragic 4,000-foot fall, former ranger Gabe Walker and his partner, Hal, are called to return to the same peak to rescue a group of stranded climbers, only to learn the climbers are actually thieving hijackers who are looking for boxes full of money.
858;Sleepless in Seattle;Sam Baldwin;Tom Hanks;Male;31;Annie Reed;Meg Ryan;Female;5344;Jonah Baldwin;Ross Malinger;Male;12928;Suzy;Rita Wilson;Female;12931;Desperate to find his dad Sam a date, a young boy calls into a radio show and catches the attention of Annie, a journalist who wants to meet Sam atop the Empire State Building.
8005;Robin Hood: Men in Tights;Robin Hood;Cary Elwes;Male;2130;Prince John;Richard Lewis;Male;6105;Sheriff of Rotingham;Roger Rees;Male;16407;Maid Marian;Amy Yasbeck;Female;1219;Robin Hood comes home after fighting in the Crusades to learn that the noble King Richard is in exile and that the despotic King John now rules England, with the help of the Sheriff of Rottingham. Robin Hood assembles a band of fellow patriots to do battle with King John and the Sheriff.
1607;A Bronx Tale;Lorenzo Anello;Robert De Niro;Male;380;Sonny LoSpecchio;Chazz Palminteri;Male;9046;"Calogero ""C"" Anello (Age 17)";Lillo Brancato;Male;17917;"Calogero ""C"" Anello (Age 9)";Francis Capra;Male;17918;Set in the Bronx during the tumultuous 1960s, an adolescent boy is torn between his honest, working-class father and a violent yet charismatic crime boss. Complicating matters is the youngster's growing attraction - forbidden in his neighborhood - for a beautiful black girl.
9571;Dazed and Confused;Randall 'Pink' Floyd;Jason London;Male;52474;Ron Slater;Rory Cochrane;Male;51792;Mitch Kramer;Wiley Wiggins;Male;56934;Don Dawson;Sasha Jenson;Male;58000;"The adventures of a group of Texas teens on their last day of school in 1976, centering on student Randall Floyd, who moves easily among stoners, jocks and geeks. Floyd is a star athlete, but he also likes smoking weed, which presents a conundrum when his football coach demands he sign a ""no drugs"" pledge."
864;Cool Runnings;Derice Bannock;Leon;Male;12974;Sanka Coffie;Doug E. Doug;Male;12975;Junior Bevil;Rawle D. Lewis;Male;12976;Yul Brenner;Malik Yoba;Male;12977;When a Jamaican sprinter is disqualified from the Olympic Games, he enlists the help of a dishonored coach to start the first Jamaican Bobsled Team.
11687;The Visitors;Godefroy de Papincourt;Jean Reno;Male;1003;Jacquouille la Fripouille / Jacquard;Christian Clavier;Male;28781;Frénégonde de Pouille / Béatrice de Montmirail;Valérie Lemercier;Female;62531;Ginette la clocharde;Marie-Anne Chazel;Female;64913;This outrageous time-travel comedy follows the misadventures of a wacky medieval knight (Jean Reno) and his faithful servant when they are accidentally transported to contemporary times by a senile sorcerer. Mayhem rules as these 12th-century visitors try adapting to the wildly confusing modern world. To avoid being stuck here for good, however, they soon begin an all-out cosmic assault on their former castle -- now a luxury hotel -- in their quest to return to the past.
37233;The Firm;Mitch McDeere;Tom Cruise;Male;500;Abby McDeere;Jeanne Tripplehorn;Female;10478;Avery Tolar;Gene Hackman;Male;193;Oliver Lambert;Hal Holbrook;Male;11066;Mitch McDeere is a young man with a promising future in Law. About to sit his Bar exam, he is approached by 'The Firm' and made an offer he doesn't refuse. Seduced by the money and gifts showered on him, he is totally oblivious to the more sinister side of his company. Then, two Associates are murdered. The FBI contact him, asking him for information and suddenly his life is ruined. He has a choice - work with the FBI, or stay with the Firm. Either way he will lose his life as he knows it. Mitch figures the only way out is to follow his own plan...
11969;Tombstone;Wyatt Earp;Kurt Russell;Male;6856;Doc Holliday;Val Kilmer;Male;5576;Virgil Earp;Sam Elliott;Male;16431;Morgan Earp;Bill Paxton;Male;2053;Legendary marshal Wyatt Earp, now a weary gunfighter, joins his brothers Morgan and Virgil to pursue their collective fortune in the thriving mining town of Tombstone. But Earp is forced to don a badge again and get help from his notorious pal Doc Holliday when a gang of renegade brigands and rustlers begins terrorizing the town.
9255;Hot Shots! Part Deux;Topper Harley;Charlie Sheen;Male;6952;President Thomas 'Tug' Benson;Lloyd Bridges;Male;2177;Ramada Rodham Hayman;Valeria Golino;Female;3124;Col. Denton Walters;Richard Crenna;Male;16554;Topper Harley is found to be working as an odd-job-man in a monastery. The CIA want him to lead a rescue mission into Iraq, to rescue the last rescue team, who went in to rescue the last rescue team—who went in to rescue hostages left behind after Desert Storm.
1634;Free Willy;Jesse;Jason James Richter;Male;18259;Rae Lindley;Lori Petty;Female;15309;Randolph Johnson;August Schellenberg;Male;18260;Glen Greenwood;Michael Madsen;Male;147;When maladjusted orphan Jesse vandalizes a theme park, he is placed with foster parents and must work at the park to make amends. There he meets Willy, a young Orca whale who has been separated from his family. Sensing kinship, they form a bond and, with the help of kindly whale trainer Rae Lindley, develop a routine of tricks. However, greedy park owner Dial soon catches wind of the duo and makes plans to profit from them.
6279;Sister Act 2: Back in the Habit;Deloris Van Cartier;Whoopi Goldberg;Female;2395;Sister Mary Patrick;Kathy Najimy;Female;11074;Rita Louise Watson;Lauryn Hill;Female;4244;Florence Watson;Sheryl Lee Ralph;Female;33613;Deloris Van Cartier is again asked to don the nun's habit to help a run-down Catholic school, presided over by Mother Superior. And if trying to reach out to a class full of uninterested students wasn't bad enough, the sisters discover that the school is due to be closed by the unscrupulous chief of a local authority.
7984;In the Name of the Father;Gerry Conlon;Daniel Day-Lewis;Male;11856;Giuseppe Conlon;Pete Postlethwaite;Male;4935;Gareth Peirce;Emma Thompson;Female;7056;Paul Hill;John Lynch;Male;28743;A small time thief from Belfast, Gerry Conlon, is falsely implicated in the IRA bombing of a pub that kills several people while he is in London. He and his four friends are coerced by British police into confessing their guilt. Gerry's father and other relatives in London are also implicated in the crime. He spends fifteen years in prison with his father trying to prove his innocence.
9559;A Perfect World;Robert 'Butch' Haynes;Kevin Costner;Male;1269;Chief Red Garnett;Clint Eastwood;Male;190;Sally Gerber;Laura Dern;Female;4784;Phillip 'Buzz' Perry;T.J. Lowther;Male;64025;A kidnapped boy strikes up a friendship with his captor: an escaped convict on the run from the law, headed by an honorable U.S. Marshal.
108;Three Colors: Blue;Julie Vignon;Juliette Binoche;Female;1137;Olivier;Benoît Régent;Unknown;1138;Sandrine;Florence Pernel;Female;1139;Lucille;Charlotte Véry;Unknown;1140;Julie is haunted by her grief after living through a tragic auto wreck that claimed the life of her composer husband and young daughter. Her initial reaction is to withdraw from her relationships, lock herself in her apartment and suppress her pain. But avoiding human interactions on the bustling streets of Paris proves impossible, and she eventually meets up with Olivier, an old friend who harbors a secret love for her, and who could draw her back to reality.
9386;In the Line of Fire;Secret Service Agent Frank Horrigan;Clint Eastwood;Male;190;Mitch Leary;John Malkovich;Male;6949;Secret Service Agent Lilly Raines;Rene Russo;Female;14343;Secret Service Agent Al D'Andrea;Dylan McDermott;Male;32597;"Veteran Secret Service agent Frank Horrigan is a man haunted by his failure to save President Kennedy while serving protection detail in Dallas. Thirty years later, a man calling himself ""Booth"" threatens the life of the current President, forcing Horrigan to come back to protection detail to confront the ghosts from his past."
9944;The Pelican Brief;Darby Shaw;Julia Roberts;Female;1204;Gray Grantham;Denzel Washington;Male;5292;Thomas Callahan;Sam Shepard;Male;9880;Gavin Vereek;John Heard;Male;11512;Two Supreme Court Justices have been assassinated. One lone law student has stumbled upon the truth. An investigative journalist wants her story. Everybody else wants her dead.
12139;Dennis the Menace;George Wilson;Walter Matthau;Male;6837;Dennis Mitchell;Mason Gamble;Male;15252;Martha Wilson;Joan Plowright;Female;23709;Switchblade Sam;Christopher Lloyd;Male;1062;Mr. Wilson's ever-present annoyance comes in the form of one mischievous kid named Dennis. But he'll need Dennis's tricks to uncover a collection of gold coins that go missing when a shady drifter named Switchblade Sam comes to town.
7305;Alive;Nando Parrado;Ethan Hawke;Male;569;Antonio Balbi;Vincent Spano;Male;147119;Roberto Canessa;Josh Hamilton;Male;52419;Carlitos Páez;Bruce Ramsay;Male;7039;The amazing, true story of a Uruguayan rugby team's plane that crashed in the middle of the Andes mountains, and their immense will to survive and pull through alive, forced to do anything and everything they could to stay alive on meager rations and through the freezing cold.
713;The Piano;Ada McGrath;Holly Hunter;Female;18686;George Baines;Harvey Keitel;Male;1037;Alisdair Stewart;Sam Neill;Male;4783;Flora McGrath;Anna Paquin;Female;10690;After a long voyage from Scotland, pianist Ada McGrath and her young daughter, Flora, are left with all their belongings, including a piano, on a New Zealand beach. Ada, who has been mute since childhood, has been sold into marriage to a local man named Alisdair Stewart. Making little attempt to warm up to Alisdair, Ada soon becomes intrigued by his Maori-friendly acquaintance, George Baines, leading to tense, life-altering conflicts.
4478;Indecent Proposal;John Gage;Robert Redford;Male;4135;Diana Murphy;Demi Moore;Female;3416;David Murphy;Woody Harrelson;Male;57755;Mr. Shackleford;Seymour Cassel;Male;5950;John Gage offers a down-on-his-luck yuppie husband $1 million for the opportunity to spend the night with the man's wife.
1245;The Remains of the Day;James Stevens;Anthony Hopkins;Male;4173;Miss Kenton;Emma Thompson;Female;7056;Lord Darlington;James Fox;Male;1292;Jack Lewis;Christopher Reeve;Male;20006;A rule bound head butler's world of manners and decorum in the household he maintains is tested by the arrival of a housekeeper who falls in love with him in post-WWI Britain. The possibility of romance and his master's cultivation of ties with the Nazi cause challenge his carefully maintained veneer of servitude.
5550;RoboCop 3;RoboCop;Robert John Burke;Male;31512;Officer Anne Lewis;Nancy Allen;Female;44038;Casey Wong;Mario Machado;Male;44050;Nikkos Mom;Jodi Long;Female;44059;The mega corporation Omni Consumer Products is still bent on creating their pet project, Delta City, to replace the rotting city of Detroit. Unfortunately, the inhabitants of the area have no intention of abandoning their homes simply for desires of the company. To this end, OCP have decided to force them to leave by employing a ruthless mercenary army to attack and harass them. An underground resistance begins and in this fight, Robocop must decide where his loyalties lie.
9607;Super Mario Bros.;Mario Mario;Bob Hoskins;Male;382;Luigi Mario;John Leguizamo;Male;5723;King Koopa;Dennis Hopper;Male;2778;Princess Daisy;Samantha Mathis;Female;20767;Mario and Luigi, plumbers from Brooklyn, find themselves in an alternate universe where evolved dinosaurs live in hi-tech squalor. They're the only hope to save our universe from invasion by the dino dictator, Koopa.
9702;Bound by Honor;Miklo;Damian Chapa;Male;58646;Cruz;Jesse Borrego;Male;58647;Paco;Benjamin Bratt;Male;4589;Montana;Enrique Castillo;Male;16427;"Based on the true life experiences of poet Jimmy Santiago Baca, the film focuses on half-brothers Paco and Cruz, and their bi-racial cousin Miklo. It opens in 1972, as the three are members of an East L.A. gang known as the ""Vatos Locos"", and the story focuses on how a violent crime and the influence of narcotics alter their lives. Miklo is incarcerated and sent to San Quentin, where he makes a ""home"" for himself. Cruz becomes an exceptional artist, but a heroin addiction overcomes him with tragic results. Paco becomes a cop and an enemy to his ""carnal"", Miklo."
11528;The Sandlot;Scotty Smalls;Tom Guiry;Male;4729;Benjamin Franklin Rodriguez;Mike Vitar;Male;69738;Mr. Mertle;James Earl Jones;Male;15152;Mom;Karen Allen;Female;650;During a summer of friendship and adventure, one boy becomes a part of the gang, nine boys become a team and their leader becomes a legend by confronting the terrifying mystery beyond the right field wall.
2019;Hard Target;Chance Boudreaux;Jean-Claude Van Damme;Male;15111;Pik van Cleef;Arnold Vosloo;Male;16743;Emil Fouchon;Lance Henriksen;Male;2714;Natasha Binder;Yancy Butler;Female;20759;When a woman's father goes missing, she enlists a local to aid in her search.  The pair soon discover that her father has died at the hands of a wealthy sportsman who hunts homeless men as a form of recreation.
10440;Manhattan Murder Mystery;Larry Lipton;Woody Allen;Male;1243;Carol Lipton;Diane Keaton;Female;3092;Paul House;Jerry Adler;Male;24292;Ted;Alan Alda;Male;21278;A middle-aged couple suspects foul play when their neighbor's wife suddenly drops dead.
11982;Look Who's Talking Now!;James Ubriacco;John Travolta;Male;8891;Mollie Ubriacco;Kirstie Alley;Female;1796;Samantha;Lysette Anthony;Female;12812;Daphne (voice);Diane Keaton;Female;3092;When Samantha LeBon hatches a scheme to spend a romantic Christmas with her new employee -- the unsuspecting, blithesome James -- his wife, their kids and their two dogs, Rocks and Daphne, must rescue him before he makes a terrible mistake.
10436;The Age of Innocence;Newland Archer;Daniel Day-Lewis;Male;11856;Ellen Olenska;Michelle Pfeiffer;Female;1160;May Welland;Winona Ryder;Female;1920;Louisa van der Luyden;Alexis Smith;Female;65284;Tale of 19th century New York high society in which a young lawyer falls in love with a woman separated from her husband, while he is engaged to the woman's cousin.
6878;Homeward Bound: The Incredible Journey;Chance (voice);Michael J. Fox;Male;521;Sassy (voice);Sally Field;Female;35;Shadow (voice);Don Ameche;Male;18156;Laura Burnford-Seaver;Kim Greist;Female;387;Remake of the popular Disney classic, this time featuring some well known voices as two dogs and a cat trek across America encountering all sorts of adventures in the quest to be reunited with their owners.
8873;Wayne's World 2;Wayne Campbell;Mike Myers;Male;12073;Garth Algar;Dana Carvey;Male;56159;Bobby Cahn;Christopher Walken;Male;4690;Cassandra Wong;Tia Carrere;Female;13445;"A message from Jim Morrison in a dream prompts cable access TV stars Wayne and Garth to put on a rock concert, ""Waynestock,"" with Aerosmith as headliners. But amid the preparations, Wayne frets that a record producer is putting the moves on his girlfriend, Cassandra, while Garth handles the advances of mega-babe Honey Hornee."
14919;Batman: Mask of the Phantasm;Batman / Bruce Wayne (voice);Kevin Conroy;Male;34947;Andrea Beaumont (voice);Dana Delany;Female;65002;Arthur Reeves (voice);Hart Bochner;Male;7678;Phantasm / Carl Beaumont (voice);Stacy Keach;Male;825;When a powerful criminal, who is connected to Bruce Wayne's ex-girlfriend, blames the Dark Knight for killing a crime lord, Batman decides to fight against him.
10438;Beethoven's 2nd;George Newton;Charles Grodin;Male;28164;Alice Newton;Bonnie Hunt;Female;5149;Ryce Newton;Nicholle Tom;Female;35241;Ted Newton;Christopher Castile;Male;65299;Beethoven is back -- and this time, he has a whole brood with him now that he's met his canine match, Missy, and fathered a family. The only problem is that Missy's owner, Regina, wants to sell the puppies and tear the clan apart. It's up to Beethoven and the Newton kids to save the day and keep everyone together.
8092;This Boy's Life;Dwight Hansen;Robert De Niro;Male;380;Caroline Wolff Hansen;Ellen Barkin;Female;6913;Tobias Wolff;Leonardo DiCaprio;Male;6193;Roy;Chris Cooper;Male;2955;When a son and mother move to Seattle in hopes for a better life, the mother meets a seemingly polite man. Things go south when the man turns out to be abusive, endangering their lives. As the mother struggles to maintain hope in an impossible situation, the son has plans to escape.
9272;The Good Son;Henry Evans;Macaulay Culkin;Male;11510;Mark Evans;Elijah Wood;Male;109;Susan Evans;Wendy Crewson;Female;19957;Jack Evans;David Morse;Male;52;A young boy stays with his aunt and uncle, and befriends his cousin who's the same age. But his cousin begins showing increasing signs of psychotic behavior.
10057;The Three Musketeers;Aramis;Charlie Sheen;Male;6952;Athos;Kiefer Sutherland;Male;2628;D'Artagnan;Chris O'Donnell;Male;5577;Porthos;Oliver Platt;Male;17485;D'Artagnan travels to Paris hoping to become a musketeer, one of the French king's elite bodyguards, only to discover that the corps has been disbanded by conniving Cardinal Richelieu, who secretly hopes to usurp the throne. Fortunately, Athos, Porthos and Aramis have refused to lay down their weapons and continue to protect their king. D'Artagnan joins with the rogues to expose Richelieu's plot against the crown.
531;The Wrong Trousers;Wallace (voice);Peter Sallis;Male;7317;Gromit (voice);Peter Hawkins;Male;1215088;;;Unknown;0;;;Unknown;0;Wallace rents out Gromit's former bedroom to a penguin, who takes up an interest in the techno pants created by Wallace. However, Gromit later learns that the penguin is a wanted criminal.
11236;The Secret Garden;Mary Lennox;Kate Maberly;Female;13010;Colin Craven;Heydon Prowse;Male;68689;Dickon;Andrew Knott;Male;55468;Mrs. Medlock;Maggie Smith;Female;10978;A young British girl born and reared in India loses her neglectful parents in an earthquake. She is returned to England to live at her uncle's castle. Her uncle is very distant due to the loss of his wife ten years before. Neglected once again, she begins exploring the estate and discovers a garden that has been locked and neglected. Aided by one of the servants' boys, she begins restoring the garden, and eventually discovers some other secrets of the manor.
