MovieId;Title;Character1;PersonName1;Sex1;ActorId1;Character2;PersonName2;Sex2;ActorId2;Character3;PersonName3;Sex3;ActorId3;Character4;PersonName4;Sex4;ActorId4;Overview
28155;It Lives Again;Eugene Scott;Frederic Forrest;Male;8351;Jody Scott;Kathleen Lloyd;Female;99885;Frank Davis;John P. Ryan;Male;15213;Mr. Mallory;John Marley;Male;3142;An epidemic of mutant monster babies sweeps America.
53206;Happy Days;Kazim;Münir Özkul;Male;556048;Saadet;Adile Naşit;Female;97274;Ziya;Şener Şen;Male;77349;;;Unknown;0;Years after a divorce divides their family in half, six siblings encounter each other by chance and try to get their parents back together.
117894;Duro pero seguro;María Nicolasa Cruz;María Elena Velasco;Female;1043938;Armando Flores;Jorge Lavat;Male;140602;Don Fulgencio;Ángel Garasa;Male;942880;Director Alejandro Ramírez;Alfredo Varela;Male;1043508;Nicolasa sells tacos near a movie studio and her popularity threatens the restaurant's own studies. She drops the food when seeing actor Armando performing and the director expels her out.
40081;Crippled Avengers;Black Tiger Dao Tian-Du;Chen Kuan-tai;Male;88351;Chen Shuen;Philip Kwok Chun-Fung;Male;229303;Blacksmith Wei Jia-Jie;Lo Meng;Male;240155;Hu Ah-Kue;Sun Chien;Male;240151;A group of martial artists seek revenge after being crippled by Tu Tin-To, a martial arts master, and his son.
99306;The Flintstones Meet Rockula and Frankenstone;Fred Flintstone;Henry Corden;Male;106102;Wilma Flintstone;Jean Vander Pyl;Female;145257;Barney Rubble;Mel Blanc;Male;33923;Betty Rubble;Gay Autterson;Unknown;148110;"The Flintstones and Rubbles win a trip on ""Make a Deal or Don't"" to Count Rockula's castle in Rocksylvania where they have an unpleasant meeting with the Count and his servant Frankenstone."
42206;In a Year with 13 Moons;Erwin/Elvira Weishaupt;Volker Spengler;Male;32422;Zora la rouge;Ingrid Caven;Female;45195;Anton Saitz;Gottfried John;Male;3757;Irene Weishaupt;Elisabeth Trissenaar;Female;9931;Elvira Weishaupt, once a burly working-class butcher named Erwin, has made an enormous sacrifice for love. She has undergone a sex change for a romantic interest who has abandoned her, and she now must struggle to reconcile her past life with her present identity.
27521;The Boys in Company C;Pfc / Sgt. Tyrone Washington;Stan Shaw;Male;16936;Pvt. Billy Ray Pike;Andrew Stevens;Male;21479;Pvt. Alvin Foster / Narrator;James Canning;Male;11785;Pvt. Vinnie Fazio;Michael Lembeck;Male;15045;Disheartened by futile combat, appalled by the corruption of their South Vietnamese ally, and constantly endangered by the incompetence of their own company commander, the young men find a possible way out of the war. They are told that if they purposely lose a soccer game against a South Vietnamese team, they can spend the rest of their tour playing exhibition games behind the lines.
55685;To Be Twenty;Lia;Gloria Guida;Female;227317;Tina;Lilli Carati;Female;132571;Rico;Ray Lovelock;Male;105337;Riccetto;Vincenzo Crocitti;Male;129065;Lia and Tina are two beautiful girls who meet and realize that they have a lot in common. They are both young, beautiful and pissed off, so they decide to hitchhike their way to Rome to find Nazariota's commune, a place to stay for free and have all the sex they want... or so they think. Things don't go as they have planned though, and soon they become involved in prostitution, the police and an aggressive gang.
49854;A Pink Christmas;;;Unknown;0;;;Unknown;0;;;Unknown;0;;;Unknown;0;It's holiday time, and while New York City bustles with yuletide celebrations, the Pink Panther suffers one misadventure after another... all in hopes of finding a warm heart and a warm meal! Finally, the Panther learns the true meaning of Christmas... and friendship.
41426;Jubilee;Queen Elizabeth I / Bod;Jenny Runacre;Female;39027;Crabs (as Little Nell);Nell Campbell;Unknown;13476;Mad;Toyah Willcox;Female;126534;Amyl Nitrite;Jordan;Female;79647;Queen Elizabeth I visits late twentieth-century Britain to find a depressing landscape where life has changed since her time.
38731;An Unmarried Woman;Erica Benton;Jill Clayburgh;Female;20362;Saul Kaplan;Alan Bates;Male;27554;Martin Benton;Michael Murphy;Male;4776;Charlie;Cliff Gorman;Male;19183;A wealthy woman from Manhattan's Upper East Side struggles to deal with her new identity and her sexuality after her husband of 16 years leaves her for a younger woman.
166680;Avalanche;David Shelby;Rock Hudson;Male;18735;Caroline Brace;Mia Farrow;Female;12021;Nick Thorne;Robert Forster;Male;5694;Florence Shelby;Jeanette Nolan;Female;7520;After an avalanche of snow crashes into their ski resort, a holiday at a winter wonderland turns into a game of survival for a group of vacationers.
32052;Go Tell the Spartans;Maj. Asa Barker;Burt Lancaster;Male;13784;Cpl. Courcey;Craig Wasson;Male;62893;Capt. Alfred Olivetti;Marc Singer;Male;35350;Lt. Raymond Hamilton;Joe Unger;Male;13661;"Go Tell the Spartans is a 1978 American war film based on Daniel Ford's 1967 novel ""Incident at Muc Wa."" It tells the story about U.S. Army military advisers during the early part of the Vietnam War. Led my Major Asa Barker, these advisers and their South Vietnamese counterparts defend the village of Muc Wa against multiple attacks by Viet-Cong guerrillas."
69069;The Chant of Jimmie Blacksmith;Jimmie Blacksmith;Tom E. Lewis;Male;125533;Mort Blacksmith;Freddy Reynolds;Unknown;555671;Farrell;Ray Barrett;Male;34657;Rev. Neville;Jack Thompson;Male;12536;The true story of a part aboriginal man who finds the pressure of adapting to white culture intolerable, and as a result snaps in a violent and horrific manner.
42201;Comes a Horseman;Frank 'Buck' Athearn;James Caan;Male;3085;Ella Connors;Jane Fonda;Female;6352;Jacob 'J.W.' Ewing;Jason Robards;Male;4765;Neil Atkinson;George Grizzard;Male;72056;Ella Connors is a single woman who gets pressured to sell her failing cattle farm to her corrupt ex suitor, Jacob Ewing. She asks for help from her neighbor, Frank Athearn. As Ella and Frank fight back through stampedes, jealousy, betrayal, and sabotage...they eventually find love.
107008;School Teacher in the House;Luisa De Dominicis;Edwige Fenech;Female;44434;Ferdinando Bonci Marinotti;Renzo Montagnani;Male;11190;Ottavio (figlio di Amedeo);Alvaro Vitali;Male;38593;Marcello Busatti;Marco Gelardini;Unknown;1041221;Luisa De Dominicus is a Milanese piano teacher who moves to Lucca to be with the man she loves: Ferdinando 'Bonci' Marinotti, a city councilman campaigning for mayor on a platform of moral values. She is of the belief that Fernando is single, living with his ailing mother. This, of course, is far from the case.  The boys living in her apartment building mistakenly believe Luisa is a call-girl who uses piano teaching as a cover for her true profession, and word soon spreads among the building's dirty old men. The resourceful boys drill a well-concealed hole in the wall between Signorina Luisa's flat and the bedroom of the landlord's son, Marcello Busatti, allowing them a spectacular view of their spectacular neighbor.  Marcello quickly becomes infatuated with Luisa, but is also conflicted regarding her supposed profession. Eventually Luisa learns of Fernando's philandering nature, and after a vigorous misunderstanding, satisfies Marcello's unrequited lust/love.
39555;You Are Not Alone;Bo;Anders Agensø;Male;123134;Kim;Peter Bjerg;Male;123135;Andersen;Jørn Faurschou;Male;123136;Kim's Father;Ove Sprogøe;Male;47151;Young teenager Bo is too sensitive for the hothouse atmosphere of a boarding school run by a cold, unfeeling would-be man of the cloth. Lonely and scared, he finds a soulmate in the headmaster's son with whom he forms a bond of friendship... that slowly grows into something more.
40060;The Manitou;Harry Erskine;Tony Curtis;Male;3150;John Singing Rock;Michael Ansara;Male;16074;Karen Tandy;Susan Strasberg;Female;30043;Amelia Crusoe;Stella Stevens;Female;7631;A psychic's girlfriend finds out that a lump on her back is a growing reincarnation of a 400 year-old demonic Native American spirit.
125244;The Wind in the Willows;Narrator (voice);Basil Rathbone;Male;8727;J. Thaddeus Toad (voice);Eric Blore;Male;30184;Cyril Proudbottom (voice);J. Pat O'Malley;Male;22602;Angus McBadger (voice);Campbell Grant;Unknown;1095778;This animated fairy tale for kids tells the classic story of a dapper, automobile loving fellow named Mr. Toad, whose passion becomes a problem when he's framed for stealing cars by a band of rogue weasels.
123592;Fearless Coward;Mülayim Sert (Bombacı Mülayim);Kemal Sunal;Male;97272;Ayı Abbas;Turgut Özatay;Male;145728;Amorti Kazım;Yavuz Şeker;Unknown;1296130;Gaddar Kerim;Hikmet Taşdemir;Male;1127954;He is a civil servant in the bland state office. His whole life changes when his reports get mixed up in the hospital and he gets news that he's going to die very soon.
67897;Pilgrim's Progress;Evangelist;Liam Neeson;Male;3896;;Maurice O'Callaghan;Unknown;549617;;Peter Thomas;Unknown;219176;;Ronnie Irvine;Unknown;549618;Journey with Pilgrim, as John Bunyan's famous allegory leaps from its pages to a movie. You'll experience the Slough of Despond, Hill of Difficulty, Vanity Fair, Meet Pliable, Mr Obstinate, Worldly Wiseman, Evangelist, Mr Interpreter, and Pilgrim's constant foe, Apollyon. Follow Pilgrim to the cross, and ultimately to the Celestial City. A powerful visualization of the Christian life.
44698;The Evil;C.J. Arnold;Richard Crenna;Male;16554;Dr. Caroline Arnold;Joanna Pettet;Female;51315;Prof. Raymond Guy;Andrew Prine;Male;15668;Mary Harper;Cassie Yates;Female;47457;Shortly after moving into a dark, brooding mansion, a psychologist and his co-workers are terrorized by a horrible evil being.
42215;The Legacy;Margaret Walsh;Katharine Ross;Female;9594;Pete Danner;Sam Elliott;Male;16431;Clive Jackson;Roger Daltrey;Male;47096;Jason Mountolive;John Standing;Male;11282;A couple attempts to unravel a sinister plot within the English countryside estate of a dying man who has gathered an eclectic and notable group of house guests.
20087;Adele Hasn't Had Her Dinner Yet;detektiv Nick Carter;Michal Dočolomanský;Male;85571;komisař Ledvina;Rudolf Hrušínský;Male;73557;baron Rupert von Kratzmar;Miloš Kopecký;Male;93426;profesor Albín Boček;Ladislav Pešek;Male;548108;When famous detective Nick Carter visits Prague, he becomes involved in strange case of a missing dog and even stranger carnivorous plant. He becomes convinced that he is standing against his greatest enemy, the Gardener, who supposedly died years ago in a swamp...
116312;The National Shotgun;Jaume Canivell;José 'Saza' Sazatornil;Male;144515;Marqués de Leguineche;Luis Escobar;Male;1013000;Luis José;José Luis López Vázquez;Male;231170;Álvaro;Antonio Ferrandis;Male;144516;A catalan manufacturer of intercoms travels to Madrid, accompanied by his mistress, to attend a hunt that he has organized. Its main purpose is to mix with people of high society to improve their business. All seems well until the owner of the farm shows full authority over James, who is the real organizer of the meeting. The celebration is diverse characters who live next to absurd situations.
30888;The Coming of Sin;Lorna;Patricia Granada;Female;1382500;Triana;Lidia Zuazo;Unknown;1382501;Chico;Rafael Machado;Unknown;1382502;;Lea Candle;Unknown;1382505;A superstitious servant girl - who has foreboding nightmares about a naked man on horseback - comes to live with a solitary female artist at her country chateau. As the artist takes the girl under her wing, a sensuous relationship develops between them.
2186;Within the Woods;Bruce;Bruce Campbell;Male;11357;Ellen;Ellen Sandweiss;Female;11462;Scotty;Scott Spiegel;Male;11641;Shelly;Mary Valenti;Female;22385;The low budget film starring the young Bruce Campbell that influenced the Evil Dead films.
372439;Picardía mexicana;;Vicente Fernández;Male;950214;;Héctor Suárez;Male;589801;;Adalberto Martínez;Male;1043939;;Jacqueline Andere;Female;139573;An academic tags along among a crew of rowdy delivery-truck drivers, taking notes on their colorful and idiomatic use of language.
35976;The End;Wendell Sonny Lawson;Burt Reynolds;Male;16475;Marlon Borunki;Dom DeLuise;Male;6844;Mary Ellen;Sally Field;Female;35;Dr. Waldo Kling;Strother Martin;Male;8260;Wendell Lawson has only six months to live. Not wanting to endure his last few months of life waiting for the end, he decides to take matters into his own hands and enlists the help of a delusional mental patient to help him commit suicide.
31941;Who'll Stop the Rain;Ray Hicks;Nick Nolte;Male;1733;Marge Converse;Tuesday Weld;Female;4514;John Converse;Michael Moriarty;Male;21030;Antheil;Anthony Zerbe;Male;2516;John, a disillusioned Vietnam War journalist, turns to heroin smuggling. He cons Ray, an equally burnt out veteran into delivering the drugs stateside to his wife. Everything soon falls apart and Ray ends up on the run with John's wife trying to evade crooked narcotics agents.
24429;The Brink's Job;Tony Pino;Peter Falk;Male;2314;Joe McGinnis;Peter Boyle;Male;1039;Vinnie Costa;Allen Garfield;Male;922;Specs O'Keefe;Warren Oates;Male;8255;In 1950, a group of unlikely criminal masterminds commits the robbery of the century. Led by Tony Pino (Peter Falk), a petty thief fresh out of prison, and Joe McGinnis (Peter Boyle), who specializes in planning lucrative capers, the gang robs Brink's main office in Boston of more than $2 million. However, things begin to go awry when the FBI gets involved, the cops start cracking down on the gang and McGinnis refuses to hand over the loot...
3425;A Simple Story;Marie;Romy Schneider;Female;6250;Georges;Bruno Cremer;Male;32364;Serge;Claude Brasseur;Male;1958;Gabrielle;Arlette Bonnard;Unknown;21172;Marie is pregnant, but her relationship with her partner Serge is at an end. She decides to abort the child, and then separates from Serge. After a short while she regains contact with her ex-husband, her affection for each other rekindles and Marie decides to continue her pregnancy - although she knows she will continue to be alone.
111469;Girlfriends;Susan Weinblatt;Melanie Mayron;Female;83313;Rabbi Gold;Eli Wallach;Male;3265;Bar Mitzvah Boy;Adam Cohen;Unknown;3087655;Anne Munroe;Anita Skinner;Unknown;104348;A photographer and her best friend are roommates. She is stuck with small-change shooting jobs and dreams of success. When her roommate decides to get married and leave, she feels hurt and has to learn how to deal with living alone.
50541;Ice Castles;Nick Peterson;Robby Benson;Male;15048;Alexis Winston;Lynn-Holly Johnson;Female;10502;Beulah Smith;Colleen Dewhurst;Female;10559;Marcus Winston;Tom Skerritt;Male;4139;A young girl is on top of the world until a tragic accident dashes her hopes and dreams of becoming a world-class figure skater. Only with the help of those who love her can she prove to the world — and herself — that she still has the potential to realize her dreams.
23739;Circle of Iron;The Blind Man / Monkeyman / Death / Changsha;David Carradine;Male;141;Cord;Jeff Cooper;Male;90539;Zetan;Christopher Lee;Male;113;White Robe;Roddy McDowall;Male;7505;In a mystical desert kingdom, young martial arts fighter Cord loses a contest to determine who will journey to take the powerful Book of All Knowedge from Zetan, an evil wizard. Despite his lack of a sponsor, Cord's rule-breaking nature leads him to try retrieving the book anyway. Help is offered by a mysterious blind man who gives advice as Cord fights his way through multiple opponents, discovering more about himself as he gets closer to Zetan.
12592;The Olsen Gang Goes to War;Egon Olsen;Ove Sprogøe;Male;47151;Benny Frandsen;Morten Grunwald;Male;69180;Kjeld Jensen;Poul Bundgaard;Male;69181;Yvonne Jensen;Kirsten Walther;Female;69186;Some criminal EU ministers plan to turn Denmark into a gigantic fair ground and holiday paradise. Egon gets his hand at some important documents which could both make him rich and take care of Denmark's future.
36759;Sgt. Pepper's Lonely Hearts Club Band;Billy Shears;Peter Frampton;Male;562708;Mark Henderson;Barry Gibb;Male;66885;Dave Henderson;Robin Gibb;Male;66886;Bob Henderson;Maurice Gibb;Male;66887;A small town band makes it big, but loses track of their roots, as they get caught up into the big-time machinations of the music biz. Now, they must thwart a plot to destroy their home town. Built around the music of The Beatles, this musical uses some big name groups like Peter Frampton and Aerosmith.
9640;Mission Galactica: The Cylon Attack;Captain Apollo;Richard Hatch;Male;543132;Lieutenant Starbuck;Dirk Benedict;Male;58264;Cmdr. Adama;Lorne Greene;Male;40181;Lieutenant Boomer;Herbert Jefferson Jr.;Male;58265;Running low on fuel, the Battlestar Galactica receives the help of the supposedly lost Battlestar Pegasus which is taking the offensive with the Cylons.
225925;Spider-Man Strikes Back;Peter Parker / Spider-Man;Nicholas Hammond;Male;29095;J. Jonah Jameson;Robert F. Simon;Male;106506;Gale Hoffman;JoAnna Cameron;Female;130327;Captain Barbera;Michael Pataki;Male;15993;At the New York State University, one of Peter Parker's tutors has accidentally given three students all the materials they need to create an atomic bomb. While Peter Parker tries to find out what's happened, the police suspect him of the crime, and Peter has to deal with an attractive journalist determined to get an interview with Spider-Man. Then dastardly millionaire Mr. White shows up, and will stop at nothing to get his hands on the atomic bomb. Spider-Man must defeat this scheming villain and stop him blowing up the World Trade Centre.
130027;El arracadas;;Vicente Fernández;Male;950214;;Fernando Almada;Male;100573;;Roberto Cañedo;Male;31224;;Patricia Rivera;Female;963016;Mariano Landeros is sworn by his mother to look for the murderer of his father at all costs, the proof would bring that Doroteo Carrillo earring snatched his mother when it happened the asesinato.Mariano part unstoppably to find the murderer finding in the way love, hate and violence.
102283;Full Circle;Julia Lofting;Mia Farrow;Female;12021;Magnus Lofting;Keir Dullea;Male;245;Mark Berkeley;Tom Conti;Male;71010;Lily Lofting;Jill Bennett;Female;10504;After the death of her daughter, Julia Lofting, a wealthy housewife, moves to London to re-start her life. All seems well until she is haunted by the sadness of losing her own child and the ghosts of other children.
80838;Bekçiler Kralı;Bekçi Şaban Özgüneş;Kemal Sunal;Male;97272;Zehra;Semra Türel;Female;590524;Hulusi;Reha Yurdakul;Male;571439;Bakkal;Alpay İzer;Male;590526;
52281;The Man with Number 100;Şaban;Kemal Sunal;Male;97272;Ayşe;Oya Aydoğan;Female;145715;Şaban'ın Annesi;Leman Akçatepe;Female;1888426;Şaban'ın Babası;Ali Şen;Male;590773;A poor young man chosen by a advertising company, and they made him a public hero to make him advertise poor quality products that no one buy.
45691;The Adventures of Picasso;Picasso;Gösta Ekman;Male;66790;Don Jose;Hans Alfredson;Male;70069;Dona Maria;Margaretha Krook;Female;11917;Dolores;Lena Olin;Female;5313;Already in his childhood, Pablo Picasso shows talent for painting and is sent to the Academy of Arts in Madrid. He becomes a painter but has to live in Paris in poverty. But one day he is discovered by a rich American millionaire and starts to earn money. But he wastes his talent by painting plates. He meets the famous people of the 1920s, Gertrude Stein, Alice B. Toklas, Appolinaire, Hitler and Churchill.
40980;Heroes of the East;Ho Tao;Gordon Liu Chia-Hui;Male;240171;Yumiko Koda;Yuka Mizuno;Unknown;125135;Chow Kan;Cheng Kang-Yeh;Male;83359;Takeno, Japanese ninjutsu expert;Yasuaki Kurata;Male;26756;Gordon Liu stars as a Chinese martial arts student struggling to relate to his new Japanese wife. When a series of martial misunderstandings spirals into an international incident, he's forced to take on seven of Japan's most powerful martial arts masters, each an expert in a different discipline, ranging from karate to samurai to ninjitsu.
39340;Behind Convent Walls;Sister Veronica;Marina Pierro;Female;239337;Sister Clara;Ligia Branice;Female;589138;Abbess Flavia Orsini;Gabriella Giacobbe;Unknown;50746;Sister Martina;Loredana Martínez;Unknown;589139;A zealous, handsome priest, who is the confessor for a convent full of women, encourages the equally zealous abbess of the institution to enforce strict rules on these unfortunate women. At the same time, a particularly disturbed nun manages to poison herself and many of the other novitiates in yet another scandal which is covered up by church authorities.
63435;Fingers;Jimmy Fingers;Harvey Keitel;Male;1037;Carol;Tisa Farrow;Female;43203;Dreems;Jim Brown;Male;4774;Ben;Michael V. Gazzo;Male;3172;A wanna-be concert pianist spends his days making a living by collecting debts for his Mafioso father, a lifestyle that could eventually ruin his dreams of a musical career.
72204;The Flying Ship;Zabava (voice);Tatyana Shabelnikova;Female;565314;Ivan (voice);Mikhail Boyarskiy;Unknown;238487;Tsar (voice);Garri Bardin;Male;143722;Polkan (voice);Rogvold Sukhoverko;Male;1449416;Poor chimney sweep Ivan and Princess Zabava fall in love with each other. They dream of their future happy life, but the difference in their social status and the treacherous Polkan, who dreams of marrying a royal daughter and becoming a ruler, stand in their way. To avoid marriage with the royal adviser, Zabava informs that she will marry only the one who can build a flying ship. Now Ivan has to solve this problem by all means.
49583;Dossier 51;Dominique Auphal/51;François Marthouret;Male;25116;Esculape 1;Roger Planchon;Male;38504;Hadès;Patrick Chesnais;Male;7275;Vénus;Jean Martin;Male;39953;"French diplomat Dominique Auphal is put under surveillance by an unnamed secret service. They wish to find a weakness in his life in order to control him politically. Auphal becomes ""File no. 51"": his private life is spied, analysed and commented."
29817;Fairy Tales;Prince;Don Sparks;Male;104942;Sirus;Sy Richardson;Male;58623;Sleeping Beauty;Linnea Quigley;Female;97619;Gussie Gander;Brenda Fogarty;Female;104947;On his twenty-first birthday, the Prince goes on a quest that takes him across the land searching for the one woman that gets him sexually excited, Princess Sleeping Beauty.
27201;Corvette Summer;Kenneth W. Dantley Jr.;Mark Hamill;Male;2;Vanessa;Annie Potts;Female;8873;Ed McGrath;Eugene Roche;Male;35370;Plain Clothes Police Lecturer;William Bryant;Male;97281;Ken loves to design and build exotic cars. When the High School shop class project car, a fully tricked out dream Corvette, is stolen, he begins searching for it. His search leads him to Las Vegas, where Vanessa, a teenaged prostitute wannabe, helps him try to track it down.
8128;The Sorcerer's Apprentice;vypravěč (voice);Luděk Munzar;Male;227399;havran / čaroděj (voice);Jaroslav Moučka;Male;227400;Krabat (Narrator) (voice);Christian Brückner;Male;278152;Master (voice);Friedrich Schütter;Male;26332;Krabat, a beggar boy, is lured to become an apprentice to an evil, one-eyed sorcerer. With a number of other boys, he works at the sorcerer's mill while learning black magic. Every Christmas one of the boys has to face the master in a magical duel, where the boy never stands a chance because the master is the only person who is allowed to use a secret spell: The Koraktor.
45695;A Wedding;Katherine 'Tulip' Brenner;Carol Burnett;Female;14837;Dino Sloan Corelli;Desi Arnaz Jr.;Male;146713;Rita Billingsley;Geraldine Chaplin;Female;400;Dr. Jules Meecham;Howard Duff;Male;44846;Muffin's wedding to Dino Corelli is to be a big affair. Except the ageing priest isn't too sure of the ceremony, only the families actually turn up as the Corelli Italian connection is suspect, security guards watch the gifts rather over-zealously, and Dino's grandma expires in bed just as the reception starts. Could be quite an occasion.
18735;Magnificent Bodyguards;Ting Chung;Jackie Chan;Male;18897;Tsang;James Tien Chuen;Male;62427;Chang;Bruce Leung Siu-Lung;Male;576408;Lady Nan;Wang Ping;Female;88104;Chan is asked by a young, wealthy lady to take her sick brother to a particular doctor in order to be cured. To reach this doctor, Chan and a handful of travelling companions must pass through bandit-infested wild country. They meet and kung-fu-fight several gangs of thugs along the way.
77128;Absolution;Father Goddard;Richard Burton;Male;5341;Benjamin 'Benjie' Stanfield;Dominic Guard;Male;16274;Arthur Dyson;David Bradley;Male;1357431;Blakey;Billy Connolly;Male;9188;At a Catholic boys' school, domineering disciplinarian Father Goddard rules over his pupils with an iron hand. When one of his teenage charges confesses to murder, the dogmatic but deeply repressed Goddard finds his faith challenged and his life spiralling dangerously out of control.  Also starring Billy Connolly (in his first feature-film role), Dominic Guard ,Kes star Dai Bradley, and the inimitable Brian Glover, and written by the great Anthony Shaffer, Absolution is one of British cinema’s most underrated chillers, not least for a towering central performance by Burton.
52809;Brothers Till We Die;Vincenzo Marazzi 'Il Gobbo' / Sergio Marazzi 'Er Monnezza';Tomas Milian;Male;21708;Commissario Sarti;Pino Colizzi;Unknown;24747;Maria - prostitute;Isa Danieli;Female;1014911;Milo Dragovic 'Albanese';Salvatore Borgese;Male;49458;Vincenzo 'hunchback' plans a robbery on a armored police van with his gang. Once the job is done, his gang try to kill him and absconds with the loot. Vincenzo hides in the sewers before looking up his friend Monezza who the police later interrogate for his involvement with vincenzo. Meanwhile, Vincenzo is getting revenge on his gang by killing them off one at the time in his various brutal ways.
