MovieId;Title;Character1;PersonName1;Sex1;ActorId1;Character2;PersonName2;Sex2;ActorId2;Character3;PersonName3;Sex3;ActorId3;Character4;PersonName4;Sex4;ActorId4;Overview
11379;The Adventures of Buckaroo Banzai Across the 8th Dimension;Buckaroo Banzai;Peter Weller;Male;27811;Lord John Whorfin;John Lithgow;Male;12074;Penny Priddy;Ellen Barkin;Female;6913;New Jersey;Jeff Goldblum;Male;4785;Adventurer/surgeon/rock musician Buckaroo Banzai and his band of men, the Hong Kong Cavaliers, take on evil alien invaders from the 8th dimension.
11899;The Muppets Take Manhattan;Kermit the Frog / Rowlf / Dr. Teeth / Waldorf / Swedish Chef / Ernie / Granny / Horse & Carriage Rider / Link Hogthrob / The Newsman (voice);Jim Henson;Male;55983;Miss Piggy / Fozzie / Animal / Bert / Cookie Monster / Ocean Breeze Soap Board Member / Sam the Eagle (voice);Frank Oz;Male;7908;Gonzo / Chester - Rat / Bill - Frog / Zoot / Beauregard / Dog / Dr. Bunsen Honeydew / Penguin (voice);Dave Goelz;Male;64181;Rizzo the Rat / Gill - Frog / Baby Kermit / Chicken / College Student in Audience / Dog / Lew Zealand (voice);Steve Whitmire;Male;64180;When the Muppets graduate from Danhurst College, they take their song-filled senior revue to New York City, only to learn that it isn't easy to find a producer who's willing to back a show starring a frog and a pig. Of course, Kermit the Frog and Miss Piggy won't take no for an answer, launching a search for someone to take them to Broadway.
13763;Purple Rain;The Kid;Prince;Male;21037;Apollonia;Apollonia Kotero;Female;191104;Morris;Morris Day;Male;57907;Mother;Olga Karlatos;Female;50744;A victim of his own anger, the Kid is a Minneapolis musician on the rise with his band, the Revolution, escaping a tumultuous home life through music. While trying to avoid making the same mistakes as his truculent father, the Kid navigates the club scene and a rocky relationship with a captivating singer, Apollonia. But another musician, Morris, looks to steal the Kid's spotlight -- and his girl.
10606;The Philadelphia Experiment;David Herdeg;Michael Paré;Male;60650;Allison Hayes;Nancy Allen;Female;44038;Dr. James Longstreet;Eric Christmas;Male;4976;Jim Parker;Bobby Di Cicco;Male;27516;"Based on an ""actual event"" that took place in 1943. About a US Navy Destroyer Escort that disappeared from the Philadelphia Naval Shipyard, and sent two men 40 years into the future to 1984."
11205;Wheels on Meals;Thomas;Jackie Chan;Male;18897;Moby;Sammo Hung;Male;62410;David;Yuen Biao;Male;62414;Sylvia;Lola Forner;Female;67690;Cousins Thomas and David, owners of a mobile restaurant, team up with their friend Moby, a bumbling private detective, to save the beautiful Sylvia, a pickpocket.
52744;Falling in Love;Frank Raftis;Robert De Niro;Male;380;Molly Gilmore;Meryl Streep;Female;5064;Ed Lasky;Harvey Keitel;Male;1037;Ann Raftis;Jane Kaczmarek;Female;27725;During shopping for Christmas, Frank and Molly run into each other. This fleeting short moment will start to change their lives, when they recognize each other months later in the train home and have a good time together. Although both are married and Frank has two little kids, they meet more and more often, their friendship becoming the most precious thing in their lives.
18462;Night of the Comet;Regina;Catherine Mary Stewart;Female;55266;Hector;Robert Beltran;Male;50880;Samantha;Kelli Maroney;Female;83151;Doris;Sharon Farrell;Female;19434;"Two girls from the Valley wake up to find that a passing comet has eradicated their world and left behind a mysterious red-dust and a pack of cannibal mutants. With the help of a friendly truck driver, the girls save the earth from a villainous ""think tank,"" karate chop their way through flesh-eating zombies, and, of course, find time to go to the mall."
10631;All of Me;Roger Cobb;Steve Martin;Male;67773;Edwina Cutwater;Lily Tomlin;Female;10437;Terry Hoskins;Victoria Tennant;Female;21618;Peggy Schuyler;Madolyn Smith Osborne;Female;66079;Just before stubborn millionaire Edwina Cutwater dies, she asks her uptight lawyer, Roger Cobb to amend her will so that her soul will pass to the young, vibrant Terry Hoskins – but the spiritual transference goes awry. Edwina enters Roger's body instead, forcing him to battle Edwina for control of his own being.
11707;Tightrope;Capt. Wes Block;Clint Eastwood;Male;190;Beryl Thibodeaux;Geneviève Bujold;Female;35341;Det. Molinari;Dan Hedaya;Male;6486;Amanda Block;Alison Eastwood;Female;389;Wes Block is a detective who's put on the case of a serial killer. His victims are young and pretty women, which he rapes and murders. The murders are getting personal when the killer chooses victims who are acquaintances of Block. Even his daughters are threatened.
27414;Silent Night, Deadly Night;Mother Superior;Lilyan Chauvin;Female;2072;Sister Margaret;Gilmer McCormick;Female;91981;Pamela;Toni Nero;Unknown;97715;Billy Chapman (age 18);Robert Brian Wilson;Male;97716;Little Billy witnesses his parents being brutally murdered by Santa. Years later, when he has to fill in for an absent in-store Santa Claus, his childhood trauma materializes once again.
13189;A Christmas Carol;Ebenezer Scrooge;George C. Scott;Male;862;Fred Holywell / Narrator;Roger Rees;Male;16407;Bob Cratchit;David Warner;Male;2076;Mrs. Cratchit;Susannah York;Female;13326;A bitter old miser who makes excuses for his uncaring nature learns real compassion when three ghosts visit him on Christmas Eve.
1884;The Ewok Adventure;Mace Towani;Eric Walker;Male;19757;Wicket W. Warrick;Warwick Davis;Male;11184;Catarine Towani;Fionnula Flanagan;Female;58068;Jeremitt Towani;Guy Boyd;Male;19752;The Towani family civilian shuttlecraft crashes on the forest moon of Endor. The four Towani's are separated. Jermitt and Catarine, the mother and father are captured by the giant Gorax, and Mace and Cindel, the son and daughter, are missing when they are captured. The next day, the Ewok Deej is looking for his two sons when they find Cindel all alone in the shuttle (Mace and Cindel were looking for the transmitter to send a distress call), when Mace appears with his emergency blaster. Eventually, the four-year old Cindel is able to convince the teenage Mace that the Ewoks are nice. Then, the Ewoks and the Towani's go on an adventure to find the elder Towanis.
11950;Cannonball Run II;J.J. McClure;Burt Reynolds;Male;16475;Victor Prinzim;Dom DeLuise;Male;6844;Jamie Blake;Dean Martin;Male;4299;Morris Fenderbaum;Sammy Davis Jr.;Male;20156;The original characters from the first Cannonball Run movie compete in an illegal race across the country once more in various cars and trucks.
11905;The Company of Wolves;Rosaleen;Sarah Patterson;Female;70882;Granny;Angela Lansbury;Female;14730;Father;David Warner;Male;2076;Old Priest;Graham Crowden;Male;10654;An adaptation of Angela Carter's fairy tales. Young Rosaleen dreams of a village in the dark woods, where Granny tells her cautionary tales in which innocent maidens are tempted by wolves who are hairy on the inside. As Rosaleen grows into womanhood, will the wolves come for her too?
13924;The Adventures of André and Wally B.;;;Unknown;0;;;Unknown;0;;;Unknown;0;;;Unknown;0;There's nothing like a restful nap in a pleasant wooded valley. But when André awakens and is greeted by a pesky yellow-and-black striped insect with a nasty stinger, he ends up taking a quick (and painful) hike.
19673;Sexmission;Albert;Olgierd Łukaszewicz;Male;66469;Maks;Jerzy Stuhr;Male;1148;Lamia;Bożena Stryjkówna;Female;87233;Emma;Bogusława Pawelec;Female;87234;Two scientists are chosen as guinea pigs for a time experiment: they are placed in hibernation and should be brought back to life after three years. In the meantime, however, World War III breaks out and life has been wiped off the surface of Earth. When they wake up, it turns out that not only 50 years have passed but also that they are the only living specimens of the male sex in a new, underground society composed exclusively of women.
15927;A Passage to India;Adela Quested;Judy Davis;Female;351;Dr. Aziz H. Ahmed;Victor Banerjee;Male;78951;Mrs. Moore;Peggy Ashcroft;Female;3672;Richard Fielding;James Fox;Male;1292;Set during the period of growing influence of the Indian independence movement in the British Raj, the story begins with the arrival in India of a British woman, Miss Adela Quested, who is joining her fiancé, a city magistrate named Ronny Heaslop. She and Ronny's mother, Mrs. Moore, befriend an Indian doctor, Aziz H. Ahmed.
24099;Dreamscape;Alex Gardner;Dennis Quaid;Male;6065;Doctor Paul Novotny;Max von Sydow;Male;2201;Bob Blair;Christopher Plummer;Male;290;The President;Eddie Albert;Male;11998;A government funded project looks into using psychics to enter people's dreams, with some mechanical help. When a subject dies in their sleep from a heart attack, Alex Gardner becomes suspicious that another of the psychics is killing people in the dreams somehow and that is causing them to die in real life. He must find a way to stop the abuse of the power to enter dreams.
23730;C.H.U.D.;George Cooper;John Heard;Male;11512;A.J. 'The Reverend' Shepherd;Daniel Stern;Male;11511;Captain Bosch;Christopher Curry;Male;90519;Lauren Daniels;Kim Greist;Female;387;A rash of bizarre murders in New York City seems to point to a group of grotesquely deformed vagrants living in the sewers. A courageous policeman, a photo journalist and his girlfriend, and a nutty bum, who seems to know a lot about the creatures, band together to try and determine what the creatures are and how to stop them.
17835;Threads;Ruth Beckett;Karen Meagher;Female;82414;Jimmy Kemp;Reece Dinsdale;Male;81598;Mr. Kemp;David Brierly;Male;252533;Mrs. Kemp;Rita May;Female;118612;Documentary style account of a nuclear holocaust and its effect on the working class city of Sheffield, England, and the eventual long run effects of nuclear war on civilization.
10260;My New Partner;René Boirond;Philippe Noiret;Male;24366;François Lesbuche;Thierry Lhermitte;Male;21177;Simone;Régine;Female;32105;Natasha;Grace de Capitani;Female;35202;My New Partner is a 1984 French comedy film directed by Claude Zidi, starring Philippe Noiret and Thierry Lhermitte. Noiret plays a streetwise Paris policeman who takes kickbacks from the minor criminals on his beat to allow them to continue. At the start of the film, his partner is busted for corruption and he narrowly escapes. He is assigned an idealistic new partner fresh from police academy. He sets out to corrupt his new partner and, after a slow start, succeeds spectacularly.
9507;Runaway;Jack R. Ramsay;Tom Selleck;Male;15112;Officer Karen Thompson;Cynthia Rhodes;Female;724;Dr. Charles Luther;Gene Simmons;Male;57756;Jackie Rogers;Kirstie Alley;Female;1796;In the near future, a police officer specializes in malfunctioning robots. When a robot turns out to have been programmed to kill, he begins to uncover a homicidal plot to create killer robots... and his son becomes a target.
24128;Stop Making Sense;Vocals and Guitar;David Byrne;Male;3078;Bass, Percussion and Vocals;Tina Weymouth;Female;91229;Guitar, Keyboards and Vocals;Jerry Harrison;Male;91233;Drums and Vocals;Chris Frantz;Unknown;91230;"A concert film documenting Talking Heads at the height of their popularity, on tour for their 1983 album ""Speaking in Tongues."" The band takes the stage one by one and is joined by a cadre of guest musicians for a career-spanning and cinematic performance that features creative choreography and visuals."
8221;What Have I Done to Deserve This?;Gloria;Carmen Maura;Female;2744;Polo;Luis Hostalot;Male;24924;Profesor kendo;Ryo Hiruma;Unknown;3256077;Antonio;Ángel de Andrés López;Male;35353;A henpecked housewife ekes out a meager existence, surrounded by a host of colorful characters: her ungrateful husband, her delinquent sons, her headstrong mother-in-law, and her sex worker neighbor, among others.
16806;Johnny Dangerously;John Kelly (aka Johnny Dangerously);Michael Keaton;Male;2232;Jocko Dundee;Peter Boyle;Male;1039;Tommy Kelly;Griffin Dunne;Male;2171;Lil;Marilu Henner;Female;21619;An honest, goodhearted man is forced to turn to a life of crime to finance his neurotic mother's skyrocketing medical bills.
271;Ronia, The Robber's Daughter;Ronja;Hanna Zetterberg;Female;3851;Birk;Dan Håfström;Male;3852;Mattis;Börje Ahlstedt;Male;3853;Lovis;Lena Nyman;Female;3854;Ronya lives happily in her father's castle until she comes across a new playmate, Birk, in the nearby dark forest. The two explore the wilderness, braving dangerous Witchbirds and Rump-Gnomes. But when their families find out Birk and Ronja have been playing together, they forbid them to see each other again. Indeed, their fathers are competing robber chieftains and bitter enemies. Now the two spunky children must try to tear down the barriers that have kept their families apart for so long.
43560;Vacanze in America;Peo Colombo;Jerry Calà;Unknown;70027;Don Buro (Frà Rodolfo da Ceprano);Christian De Sica;Male;69036;Alessio Liberatore;Claudio Amendola;Male;23961;Antonella;Antonella Interlenghi;Female;38763;A group of students from the San Crispino school for boys take a holiday in the United States, traveling from New York to Los Angeles. Young Father Don Buro has great difficulty controlling the youngsters, especially trouble making ex-student Peo, and finds himself distracted by the attractive single mother of one of the boys.
23111;Moscow on the Hudson;Vladimir Ivanoff;Robin Williams;Male;2157;Lucia Lombardo;María Conchita Alonso;Female;2051;Lionel Witherspoon;Cleavant Derricks;Male;90180;Orlando Ramirez;Alejandro Rey;Male;83851;A Russian circus visits the US. A clown wants to defect, but doesn't have the nerve. His saxophone playing friend however comes to the decision to defect in the middle of Bloomingdales. He is befriended by the black security guard and falls in love with the Italian immigrant from behind the perfume counter. We follow his life as he works his way through the American dream and tries to find work as a musician.
9063;The Element of Crime;Fisher;Michael Elphick;Male;1821;Osborne;Esmond Knight;Male;56875;Kim;Me Me Lai;Female;56876;Kramer;Jerold Wells;Male;13465;Fisher, an ex-detective, decides to take one final case when a mysterious serial killer claims the lives of several young girls. Fisher, unable to find the culprit, turns to Osbourne, a writer who was once respected for his contributions to the field of criminology. Fisher begins to use Osbourne's technique, which involves empathizing with serial killers, however, as the detective becomes increasingly engrossed in this method, things take a disturbing turn.
19621;The Hit;Braddock;John Hurt;Male;5049;Willie Parker;Terence Stamp;Male;28641;Myron;Tim Roth;Male;3129;Maggie;Laura del Sol;Female;103670;"Ex-gangster Willie Parker has betrayed his former ""colleagues"" and now lives in Spain where he thinks he can hide from their vengeance..."
22160;Against All Odds;Terry Brogan;Jeff Bridges;Male;1229;Jessie Wyler;Rachel Ward;Female;36042;Jake Wise;James Woods;Male;4512;Hank Sully;Alex Karras;Male;73234;She was a beautiful fugitive. Fleeing from corruption. From power. He was a professional athlete past his prime. Hired to find her, he grew to love her. Love turned to obsession. Obsession turned to murder. And now the price of freedom might be nothing less than their lives.
55976;Marche à l'ombre;Denis;Michel Blanc;Male;21175;François;Gérard Lanvin;Male;70165;Mathilde;Sophie Duez;Female;236135;l'inspecteur de police receleur;François Berléand;Male;7693;Two friends, one a musician the other constantly depressed wander around Greece and France till they get to Paris without a penny to their name. Here they spend nights in the underground, and squat in houses with the African immigrants. One day they both fall in love with Mathilde a blond dancer and follow her to New York.
5677;Trancers;Trooper Jack Deth;Tim Thomerson;Male;29712;Leena;Helen Hunt;Female;9994;Hap Ashby;Biff Manard;Male;44790;Martin Whistler / Detective Weisling;Michael Stefani;Male;44791;Angel City trooper Jack Deth is sent back in time from 2247 to 1985 L.A. to inhabit the body of his ancestor. Deth's assignment is to find his archenemy, Whistler, who turns people into zombies, before the fiend is able to kill all the ancestors of the future's governing council.
16969;City Heat;Lieutenant Speer;Clint Eastwood;Male;190;Mike Murphy;Burt Reynolds;Male;16475;Addy;Jane Alexander;Female;13724;Caroline Howley;Madeline Kahn;Female;29803;Set in Kansas City in 1933, Eastwood plays a police lieutenant known simply by his last name, Speer. Reynolds plays a former cop turned private eye named Mike Murphy. Both Speer and Murphy served on the force together and were once good friends, but are now bitter enemies. When Murphy's partner is slain they team up again to fight the mob.
10179;The Ice Pirates;Jason;Robert Urich;Male;64119;Princess Karina;Mary Crosby;Female;18465;Roscoe;Michael D. Roberts;Male;5146;Maida;Anjelica Huston;Female;5657;The time is the distant future, where by far the most precious commodity in the galaxy is water. The last surviving water planet was somehow removed to the unreachable centre of the galaxy at the end of the galactic trade wars. The galaxy is ruled by an evil emperor (John Carradine) presiding over a trade oligarchy that controls all mining and sale of ice from asteroids and comets.
26178;Razorback;Carl Winters;Gregory Harrison;Male;29370;Sarah Cameron;Arkie Whiteley;Female;94785;Jake Cullen;Bill Kerr;Male;70753;Benny Baker;Chris Haywood;Male;3070;In the Australian outback a vicious wild boar kills and causes havoc to a small community.
26522;A Soldier's Story;Captain Davenport;Howard Rollins;Male;95621;Sergeant Waters;Adolph Caesar;Male;13313;Private Wilkie;Art Evans;Male;56183;Corporal Ellis;Robert Townsend;Male;68750;In a rural town in Louisiana, a black Master Sergeant is found shot to death just outside the local Army Base. Military lawyer, Captain Davenport—also a black man—is sent from Washington to conduct an investigation. Facing an uncooperative chain of command and fearful black troops, Davenport must battle with deceit and prejudice in order to find out exactly who really did kill the Master Sergeant.
14347;Blame It on Rio;Matthew Hollins;Michael Caine;Male;3895;Jennifer Lyons;Michelle Johnson;Female;17225;Victor Lyons;Joseph Bologna;Male;46946;Nicole 'Nikki' Hollis;Demi Moore;Female;3416;Matthew Hollis is man on holiday in Rio with his best friend. Both men have teenage daughters with them. When Matthew falls for his best friend's amorous daughter named Jennifer, they embark on a secret, if slightly one-sided relationship. Jennifer's father is furious when he finds out about the 'older man' in his daughter's life, and sets out to hunt him down with the aid of Matthew!
19596;Electric Dreams;Miles Harding;Lenny Von Dohlen;Male;15799;Madeline Robistat;Virginia Madsen;Female;12519;Bill;Maxwell Caulfield;Male;101908;Edgar (voice);Bud Cort;Male;4971;Miles buys himself a state-of-the-art computer that starts expressing thoughts and emotions after a having champagne spilled down on him. Things start getting out of hand when both Miles and Edgar, how the computer calls himself, fall in love with Madeline, an attractive neighbour.
59040;I due carabinieri;Glauco Sperandio;Enrico Montesano;Male;21237;Marino Spada;Carlo Verdone;Male;89193;Adalberto Occhipinti;Massimo Boldi;Male;69037;Rita;Paola Onofri;Female;120109;Two deadbeat friends barely pass the entrance exam for the Carabinieri, the national gendarmerie of Italy, but love for the same woman gets in the way.
27171;The Lonely Guy;Larry;Steve Martin;Male;67773;Warren;Charles Grodin;Male;28164;Iris;Judith Ivey;Female;19239;Jack;Steve Lawrence;Male;126683;A writer for a greeting card company learns the true meaning of loneliness when he comes home to find his girlfriend in bed with another man.
24264;Sheena;Sheena;Tanya Roberts;Female;10660;Vic Casey;Ted Wass;Male;151192;"Fletcher (""Fletch"")";Donovan Scott;Male;57350;Shaman;Elizabeth of Toro;Unknown;91474;Sheena's parents are killed while on Safari. She is raised by the mystical witch woman of an African tribe. When her foster mother is framed for the murder of a political leader, Sheena and a newsman, Vic Casey, are forced to flee while pursued by the mercenaries hired by the real killer, who hopes to assume power. Sheena's ability to talk to the animals and knowledge of jungle lore give them a chance against the high tech weapons of the mercenaries.
15259;Breakin';Kelly / Special K;Lucinda Dickey;Female;81895;Ozone;Adolfo Quinones;Male;81896;Turbo;Michael Chambers;Unknown;57392;Franco;Ben Lokey;Unknown;128128;A struggling young dancer joins forces with two breakdancers and together they become a street sensation.
72664;The Vultures;Sgt. Pierre Augagneur;Jean-Paul Belmondo;Male;3829;Adjudant Édouard Mahuzard;Michel Constantin;Male;24495;Béral;Jacques Villeret;Male;35323;Boissier;Michel Creton;Male;25038;April 5, 1943: a battalion of the Foreign Legion arrives in El Ksour, Tunisia, to escort a fortune in gold bars to the home front. A German ambush awaits, and all but four die. Thanks to the street smarts of Sergeant Augagneur, the Legionnaires successfully counter attack. The bank manager and his seductive wife arrive, and so does a German lieutenant, whom the French arrest. Augagneur wants to steal the gold, warrant officer Mahuzard wants to do his duty. A series of alliances form and break apart, the group dwindles in number, and the gold heads south toward Betahoua. But in whose possession?
57922;Thus Spoke Bellavista;Prof. Bellavista;Luciano De Crescenzo;Male;28259;Dott. Cazzaniga;Renato Scarpa;Male;14149;Il tassista;Tommaso Bianco;Male;287863;Il barista;Giovanni Attanasio;Male;1174520;"In Naples, Professor Bellavista is a retired man, passionate about the philosophy and thought of Ancient Greece. Every day, in his luxurious apartment, he teaches his lessons of life to the poor-nothing (his friends), who are dazzled by his reasoning. One day, however, the quiet life of the building of Bellavista will be disturbed by the arrival of a director of Milan. Between Naples and Milan there contrast, because the Neapolitans are accustomed to enjoy a quiet life, always based on the ""philosophy of pleasure and delay"", while the northern Italians are very strict and punctual."
40061;Happy Easter;Stephane Margelle;Jean-Paul Belmondo;Male;3829;Julie;Sophie Marceau;Female;1957;Sophie Margelle;Marie Laforêt;Female;39644;Marlène Chataigneau, la mère de Julie;Rosy Varte;Female;3537;Chronic serial womanizer Stephane Margelle drops his wife Sophie off at the airport so she can go away for Easter weekend.  He immediately picks up beautiful young Julie, who has just had a fight with her married boyfriend.  He gets her back to his apartment and is preparing for a sexy weekend, when his wife suddenly returns home.  He makes up a bizarre, on-the-spot, spur-of-the-moment story that the gorgeous girl is actually his long-lost daughter.  Julie plays along, but this leads to a whole series of increasingly ridiculous lies and comical situations (such as when her real mother shows up).
13681;Places in the Heart;Edna Spalding;Sally Field;Female;35;Margaret Lomax;Lindsay Crouse;Female;32225;Mr. Will;John Malkovich;Male;6949;Moze;Danny Glover;Male;2047;In 1930s Texas, a widow and her family fight to save their home by harvesting cotton.
48677;Cloak & Dagger;Davey Osborne;Henry Thomas;Male;9976;Jack Flack / Hal Osborne;Dabney Coleman;Male;12850;Rice;Michael Murphy;Male;4776;Kim Gardener;Christina Nigra;Female;192204;11-year-old Davey's mother is dead and his father doesn't spend nearly enough time with him. So the boy loses himself in video games--and even has an imaginary friend, a super-resourceful secret agent. When he accidentally comes into possession of a spy group's secret plans, and winds up on the run from them, he must learn to rely on himself and his imaginary pal to save his skin. But, in the end, Dad proves to be his real hero.
40814;Crimes of Passion;Joanna Crane / China Blue;Kathleen Turner;Female;3391;Reverend Peter Shayne;Anthony Perkins;Male;7301;Donny Hopper;Bruce Davison;Male;52374;Amy Grady;Annie Potts;Female;8873;Joanna Crane lives a double life. During the day she works as fashion designer but during the night she is the high class prostitute China Blue. As she is accused for industrial spying, Bobby Grady is hired to shadow her. However, they fall in love.  Meanwhile a psychopathic preacher starts stalking her.
32081;The Pope of Greenwich Village;Paulie;Eric Roberts;Male;21315;Charlie;Mickey Rourke;Male;2295;Diane;Daryl Hannah;Female;589;Mrs. Ritter;Geraldine Page;Female;41283;"Charlie and his troublesome cousin Paulie decide to steal $150000 in order to back a ""sure thing"" race horse that Paulie has inside information on. The aftermath of the robbery gets them into serious trouble with the local Mafia boss and the corrupt New York City police department."
421467;The Return of Godzilla;Goro Maki;Ken Tanaka;Male;72398;Naoko Okumura;Yasuko Sawaguchi;Female;19591;Professor Makoto Hayashida;Yōsuke Natsuki;Male;131201;Prime Minister Seiki Mitamura;Keiju Kobayashi;Male;70324;After a fishing boat is attacked, the sole surviving crew member realizes it is none other than a resurrected Godzilla. However, efforts to bring the story to light are suppressed by the Japanese government amid growing political tensions between the United States and the Soviet Union, who are both willing to bomb Japan to stop the monster.
