MovieId;Title;Character1;PersonName1;Sex1;ActorId1;Character2;PersonName2;Sex2;ActorId2;Character3;PersonName3;Sex3;ActorId3;Character4;PersonName4;Sex4;ActorId4;Overview
32334;Love and Pigeons;Vasja;Aleksandr Mikhaylov;Male;96516;Nadja;Nina Doroshina;Female;109116;Dyadya Mitya;Sergei Yursky;Male;86727;Granny Shura;Natalya Tenyakova;Female;109119;One of the most favorite Soviet comedies, a screen version of the play of the same name by Vladimir Gurkin. Each of us knows the story of Vasily, who went to the resort, succumbed to the charms of a femme fatale Raisa Zakharovna, but could not withstand two weeks of urban life, and returned to his family, where he waited for love and pigeons.
52109;Love Streams;Sarah Lawson;Gena Rowlands;Female;4800;Robert Harmon;John Cassavetes;Male;11147;Susan;Diahnne Abbott;Female;1041;Jack Lawson;Seymour Cassel;Male;5950;Two closely-bound, emotionally wounded siblings reunite after years apart.
24749;Iceman;Dr. Stanley Shephard;Timothy Hutton;Male;16327;Dr. Diane Brady;Lindsay Crouse;Female;32225;Charlie;John Lone;Male;11389;Whitman;Josef Sommer;Male;14792;A  team of Arctic researchers find a 40,000 year-old man frozen in ice and bring him back to life. Anthropologist Dr. Stanley Shephard wants to befriend the Iceman and learn about the man's past while Dr. Diane Brady and her surgical team want to discover the secret that will allow man to live in a frozen state.
31939;Another Country;Guy Bennett;Rupert Everett;Male;4757;Tommy Judd;Colin Firth;Male;5472;Barclay;Michael Jenn;Male;62106;Delahay;Robert Addie;Male;78525;In Moscow in 1983, an American journalist interviews Guy Bennett, who recalls his last year at public school, fifty years before, and how it contributed to him becoming a spy.
44645;Bruce Lee: The Legend;Self (archive footage);Bruce Lee;Male;19429;Self - Narrator (voice);James B. Nicholson;Unknown;2103203;Self - Bruce Lee's Father (archive footage);Lee Hoi-Chuen;Male;131168;Self;Raymond Chow Man-Wai;Male;46323;The Official Golden Harvest tribute to the Master of the Martial Arts Film, Bruce Lee.
38557;The River;Tom Garvey;Mel Gibson;Male;2461;Mae Garvey;Sissy Spacek;Female;5606;Joe Wade;Scott Glenn;Male;349;Harve Stanley;Billy Green Bush;Male;35090;Farming family battles severe storms, a bank threatening to reposses their farm, and other hard times in a battle to save and hold on to their farm.
16551;Rhinestone;Nick;Sylvester Stallone;Male;16483;Jake Ferris;Dolly Parton;Female;67274;Noah Ferris;Richard Farnsworth;Male;5605;Freddie Ugo;Ron Leibman;Male;5372;After a big-time country singer brags that she can turn anybody in to a country-singin' star, she's out to prove she can live up to her talk when she recruits a cab-driver as a country singer. He's scheduled to sing at a big-time NYC country night club and she puts her ample powers to work in preparing her protege.
14673;Savage Streets;Brenda;Linda Blair;Female;37366;Principal Underwood;John Vernon;Male;17580;Jake;Robert Dryer;Male;77148;Heather;Linnea Quigley;Female;97619;A teenage vigilante seeks revenge on a group of violent thugs who raped her handicapped sister and murdered her best friend.
63418;Boy Meets Girl;Alex;Denis Lavant;Male;27978;Mireille;Mireille Perrier;Female;53905;Helen;Carroll Brooks;Unknown;237198;Maite;Maïté Nahyr;Female;545428;Paris by night. Alex, 22, wants to become a filmmaker. He is fascinated by first times and his girlfriend, Florence, has just left him for his best friend, Thomas. First break-up, first attempted murder: Alex tries to strangle Thomas, but gives up and wanders the streets. That evening, Mireille, a girl from provincial France who has come up to Paris to make commercials, is left by her boyfriend. Alex witnesses this separation. These two tormented souls run into each other at a party...
11221;Best Defense;Wylie Cooper;Dudley Moore;Male;56819;Lieutenant T.M. Landry;Eddie Murphy;Male;776;Laura Cooper;Kate Capshaw;Female;689;Steve Loparino;George Dzundza;Male;10477;Wylie is a lazy engineer. Landry is a Sergeant specialising in Armour. They have never met but their lives become entangled when Landry must take the tank Wylie designed into combat. Wylie is waiting for his employer to go out of business when he meets another engineer who gives him a disk with the plans for a system that will save his employer. The other engineer is dead moments later leaving Wylie with the disk and credit for the design. Suddenly Wylie is no longer a hack, but the saviour of his company and finds his life is no longer the same.
11308;The Hotel New Hampshire;John Berry;Rob Lowe;Male;2879;Frannie Berry;Jodie Foster;Female;1038;Frank Berry;Paul McCrane;Male;32393;Mr. Win Berry;Beau Bridges;Male;2222;The film talks about a family that weathers all sorts of disasters and keeps going in spite of it all. It is noted for its wonderful assortment of oddball characters.
75877;The Holy Innocents;Paco, El Bajo;Alfredo Landa;Male;230884;Régula;Terele Pávez;Female;66816;Nieves;Belén Ballesteros;Unknown;579822;Quirce;Juan Sachez;Unknown;579823;"Somewhere in the spanish country, in the 60s. Paco and his wife Régula are very poor. They work as tenant farmers for a very wealthy landowner. They have 3 children. One is backward. The others can not got to school because the master ""needs"" their work. When Regula's brother is fired from where he has worked for 61 years, he settles down at their little place... An attack against the archaism of the spanish country of the 60s."
33138;The Times of Harvey Milk;Himself (archive footage);Harvey Milk;Male;110168;Narrator (voice);Harvey Fierstein;Male;7420;Herself;Anne Kronenberg;Unknown;1780067;Herself;Tory Hartmann;Unknown;1780068;Harvey Milk was an outspoken human rights activist and one of the first openly gay U.S. politicians elected to public office, even after his assassination in 1978, he continues to inspire disenfranchised people around the world.
28148;Ninja III: The Domination;Yamada;Sho Kosugi;Male;99846;Christie;Lucinda Dickey;Female;81895;Billy Secord;Jordan Bennett;Male;99847;Black Ninja;David Chung;Male;99848;A female aerobic instructor is possessed by the soul of a fallen ninja when coming to his aid. The spirit seeks revenge on those who killed him and uses the instructor's body to carry out his mission. The only way the spirit will leave her body is with the help of another ninja.
83223;Rats: Night of Terror;Kurt;Ottaviano Dell'Acqua;Male;68330;Chocolate;Geretta Geretta;Female;1041366;Taurus;Massimo Vanni;Male;45580;Video;Gianni Franco;Unknown;100954;One hundred years after a nuclear war has devastated the planet, society has been reborn into two factions, the underground society and the scavangers above in the wastelands. A group of scavangers on bikes come across a town infested with flesh eating rats, and soon the gore is spilling everywhere.
27102;Full Moon in Paris;Louise;Pascale Ogier;Female;96967;Remi;Tchéky Karyo;Male;10698;Octave;Fabrice Luchini;Male;28255;Camille;Virginie Thévenet;Female;18484;Louise is dissatisfied with her mundane life in a bleak Parisian new-town. She rents a pied-à-terre in the city so she can experience independence.
106380;Taipei Story;Chin;Chin Tsai;Female;1618084;Lung;Hou Hsiao-hsien;Male;64992;Ch'en;Wu Nien-Jen;Male;143036;Ling;Lin Hsiu-Ling;Female;1591117;A young woman urgently seeks to navigate the maze of contemporary Taipei and find a future. She hopes that her boyfriend Lung is the key to the future, but Lung is stuck in a past that combines baseball and traditional loyalty that leads him to squander his nest egg bailing her father out of financial trouble.
42394;Pinot simple flic;Robert Pinot;Gérard Jugnot;Male;21171;Josyane Krawczyk;Fanny Bastien;Female;24930;Tony;Patrick Fierry;Male;24562;Rochu;Pierre Mondy;Male;24387;The film starts in the 13th arrondissement of Paris in 1984. Robert Pinot is a police officer as ordinary as clumsy. One day, he stops a certain Josyane, a young drug addict who is also doubled as a pickpocket, nicknamed Marylou. Having discovered that she comes from the same village, Nanteuil, then him, he takes compassion for the young girl and decides to take her under his wing to keep her away from Tony, a dangerous dealer with whom she is in love.
63360;The Initiation;Kelly Fairchild;Daphne Zuniga;Female;14668;Frances Fairchild;Vera Miles;Female;7303;Dwight Fairchild;Clu Gulager;Male;62019;Peter;James Read;Male;56456;Kelly, a young woman, has been plagued by nightmares of a burning man her entire life. Upon entering college, she pledges a sorority that forces them to perform an initiation night prank. With several of her friends, she breaks into a store and unfortunately discovers that it is impossible to exit from the building after it is entered illegally. Trapped in a new nightmare, Kelly must fight for survival.
17667;Beat Street;Kenny Kirkland;Guy Davis;Male;82217;Tracy Carlson;Rae Dawn Chong;Female;13312;Carmen Cararro;Saundra Santiago;Female;171135;Himself;Doug E. Fresh;Male;217536;An aspiring DJ, from the South Bronx, and his best friend, a promoter, try to get into show business by exposing people to hip-hop music and culture.
1803;Angel;Molly 'Angel' Stewart;Donna Wilkes;Female;16201;Lt. Andrews;Cliff Gorman;Male;19183;Mosler;Susan Tyrrell;Female;59369;Mae;Dick Shawn;Male;19178;15 year-old Molly Stewart is a prep school honor student who moonlights as a Hollywood prostitute. After a serial killer begins stalking and murdering some of her street friends, she becomes a target herself.
19400;Gwendoline;Gwendoline;Tawny Kitaen;Female;72055;Willard;Brent Huff;Male;84648;Beth;Zabou Breitman;Female;54675;The Queen;Bernadette Lafont;Female;28254;A beautiful woman hires an intrepid adventurer to help find her father, who has disappeared in the jungle while searching for a rare and priceless butterfly. Along the way they run into cannibals, a race of Amazon warriors and all the usual attractions one would expect to find in a lost jungle.
77762;Winter in Prostokvashino;Uncle Fyodor (voice);Mariya Vinogradova;Female;86836;Matroskin the Cat (voice);Oleg Tabakov;Male;99282;Sharik the Dog (voice);Lev Durov;Male;86847;Mother (voice);Valentina Talyzina;Female;86666;A third movie about Fyodor and his friends from the Prostokvashino village and their adventures - this time during the winter.
5896;Bolero;Lida MacGillivery;Bo Derek;Female;37995;Cotton;George Kennedy;Male;12950;Catalina;Ana Obregón;Female;46422;Paloma;Olivia d'Abo;Female;46423;Follows the tale of a young woman’s sexual awakening and subsequent journey around the world in pursuit of her ideal lover. Encounters include an Arabian sheik and a Spanish bullfighter. Her friend and butler accompany her and help to arrange her couplings.
17464;Breakin' 2: Electric Boogaloo;Kelly;Lucinda Dickey;Female;81895;Ozone;Adolfo Quinones;Male;81896;Turbo;Michael Chambers;Unknown;57392;Byron;Harry Caesar;Male;18894;"The dance crew from ""Breakin'"" bands together to save a community center from a greedy developer bent on building a shopping center in its place."
77673;The Vengeance of the Winged Serpent;Loulou Dupin;Coluche;Male;11214;Jackie;Josiane Balasko;Female;35137;Ratoff;Philippe Khorsand;Male;24464;la concierge;Jackie Sardou;Female;26877;An international intrigue with terrorists threatening to blow up the presidents of the most powerful countries.
28054;Suburbia;Jack Diddley;Chris Pedersen;Male;11890;Evan Johnson;Bill Coyne;Unknown;99485;Sheila;Jennifer Clay;Unknown;99486;Skinner;Timothy O'Brien;Unknown;99487;When household tensions and a sense of worthlessness overcome Evan, he finds escape when he clings with the orphans of a throw-away society. The runaways hold on to each other like a family until a tragedy tears them apart.
26889;The Brother from Another Planet;The Brother;Joe Morton;Male;3977;West Indian Woman;Rosanna Carter;Female;96536;Hispanic Man;Ray Ramirez;Male;74839;Haitian Man;Yves Rene;Unknown;96537;An alien slave crash-lands in New York City while being pursued by two Men in Black bounty hunters. His attempt to find a place for himself on Earth parallels that of the immigrant experience.
37296;Protocol;Sunny;Goldie Hawn;Female;18892;Michael Ransome;Chris Sarandon;Male;14541;Emir;Richard Romanus;Male;2557;Nawaf Al Kabeer;Andre Gregory;Male;109470;A Washington waitress saves the Emir of Ohtar's life, launching her diplomatic career and a scandal.
43967;Urusei Yatsura: Beautiful Dreamer;Ataru Moroboshi;Toshio Furukawa;Male;85286;Lum;Fumi Hirano;Female;129960;Mendou;Akira Kamiya;Male;54690;Ten;Kazuko Sugiyama;Female;114913;As the perpetually lecherous Ataru and his friends prepare for a carnival at Tomobiki High School, they gradually realize the days are literally repeating themselves. Any effort to break the pattern dumps them back where they started.
42102;A Sunday in the Country;Iréne;Sabine Azéma;Female;20851;Monsieur Ladmiral;Louis Ducreux;Unknown;17893;Gonzague;Michel Aumont;Male;21170;Mercedes;Monique Chaumette;Female;36315;In France, before WWI. As every Sunday, an old painter living in the country is visited by his son Gonzague, coming with his wife and his three children. Then his daugther Irene arrives. She is always in a hurry, she lives alone and does not come so often... An intimist chronicle in which what is not shown, what is guessed, is more important than how it looks, dealing with what each character expects of life.
28692;Up the Creek;Bob McGraw;Tim Matheson;Male;21561;Heather Merriweather;Jennifer Runyon;Female;101652;Gonzer;Stephen Furst;Male;52304;Tozer;James B. Sikking;Male;65568;Bob McGraw is in his 12th year of college, goofing his way through life. Bob, Irwing, Gonzer and Max are the four losers forced and bribed to represent their university in an intercollegiate raft race. Forced and bribed into this role, they make some friends, the lovely Heather Merriweather, but mostly enemies, among others a whole team of marines, and preppy IVY-leaguers determined to win.
25010;The Flamingo Kid;Jeffrey Willis;Matt Dillon;Male;2876;Arthur Willis;Héctor Elizondo;Male;1210;Ruth Willis;Molly McCarthy;Female;108729;Nikki Willis;Martha Gehman;Female;79007;Brooklyn teenager Jeffrey Willis, thoroughly unhappy with his modest homestead, embraces the other-world aspects of his summer job at the posh Flamingo Club. He spurns his father in favor of the patronage of smooth-talking Phil Brody and is seduced by the ample bikini charms of club member Carla Samson. But thanks to a couple of late-summer hard lessons, the teen eventually realizes that family should always come first.
53426;The Evil That Men Do;Holland;Charles Bronson;Male;4960;Dr. Hector Lomelin;José Ferrer;Male;12515;Rhiana Hidalgo / Nancy;Theresa Saldana;Female;17652;Dr. Clement Molloch;Joseph Maher;Male;20626;Professional killer Holland is forced out of retirement to break a Central American government's political torture ring when one of his friends, a Latin American journalist, is killed. The murderer, Doctor Clement Molloch, is the master sadist behind the political torture of innocent victims. Posing as a journalist, Holland lures Molloch out of his fortress-like headquarters by using his murdered friend's wife and daughter as bait. When Holland kidnaps Molloch's sister, the doctor is led on a wild chase that takes him to an abandoned opal mine where he finally comes face to face with Holland.
41089;Under the Volcano;Geoffrey Firmin;Albert Finney;Male;3926;Yvonne Firmin;Jacqueline Bisset;Female;14061;Hugh Firmin;Anthony Andrews;Male;26659;Dr. Vigil;Ignacio López Tarso;Male;116992;Against a background of war breaking out in Europe and the Mexican fiesta Day of Death, we are taken through one day in the life of Geoffrey Firmin, a British consul living in alcoholic disrepair and obscurity in a small southern Mexican town in 1939. The Consul's self-destructive behaviour, perhaps a metaphor for a menaced civilization, is a source of perplexity and sadness to his nomadic, idealistic half-brother, Hugh, and his ex-wife, Yvonne, who has returned with hopes of healing Geoffrey and their broken marriage.
20894;Guest from the Future;Alisa Selezneva;Natasha Guseva;Female;3372811;Kolya Gerasimov;Alyosha Fomkin;Male;3372812;Fima Korolev;Ilya Naumov;Male;1577876;Julia Gribkova;Maryana Ionesyan;Female;1577875;"6-grader Kolya Gerasimov discovers a time machine in a basement of an old house in Moscow and gets transferred into the 21st century. There he is allowed to look around. Accidentally, Kolya witnesses two space pirates who arrive from Saturn and later try to steal a device called a ""Mielophone"" (which can read thoughts) from Alisa Seleznyova - a girl that performs experiments with this device and animals. Kolya manages to save the device from the pirates and brings it back to the 20th century. But both pirates and Alisa get there too. Alisa knows where Kolya studies but doesn't know what he looks like. Pirates saw Kolya, but don't know anything about him. Written by Boris Shafir"
43558;Taste of the Sea 2: One Year Later;Tea;Eleonora Giorgi;Female;24612;Gianni;Gianni Ansaldi;Unknown;224301;Uberto;Mauro Di Francesco;Male;120633;Paolo;Angelo Cannavacciolo;Unknown;224300;
21871;Tank;Zack;James Garner;Male;16896;LaDonna;Shirley Jones;Female;60158;Billy;C. Thomas Howell;Male;2878;Elliott;Mark Herrier;Male;64222;After relocating his family - and his prized restored Sherman tank - to a small Georgia town, Sargeant Major Zack Carey butts heads with the local sheriff. Zack doesn't agree with the ways of the local police, and when the sheriff goes after Zack's son, it's time for Zack to roll out the Sherman tank and wage a little war of his own.
47359;Racing with the Moon;Henry 'Hopper' Nash;Sean Penn;Male;2228;Nicky / Bud;Nicolas Cage;Male;2963;Caddie Winger;Elizabeth McGovern;Female;4513;Mr. Nash;John Karlen;Male;30048;In a small coastal California town, Henry and Nicky are pals from blue collar families with only a short time before they ship off to World War II. Henry begins romancing new-to-town Caddie Winger, believing her to be wealthy. Mischievous and irresponsible, Nicky gets into trouble which forces the other two to become involved, testing their relationship, as well as the friendship between the boys.
31601;Teachers;Alex Jurel;Nick Nolte;Male;1733;Lisa Hammond;JoBeth Williams;Female;10080;Roger Rubell;Judd Hirsch;Male;6167;Eddie Pilikian;Ralph Macchio;Male;2877;A teacher tries to overcome his frustration teaching a high-school that seems to be full of flunkies.
31401;The Broken Landlord;Ağa;Şener Şen;Male;77349;Kekec Salman;Erdal Özyağcılar;Male;97276;Zana;Füsun Demirel;Female;142780;Hirpit Ali;Atilla Yiğit;Unknown;1383712;The landowner (Agha) of the Haraptar village marries off his old father with the young and beautiful Kiraz. But on the nuptial night, his father dies and everthing starts to go bad for the Agha. Due to the long drought and provocations of Kekec Salman (big brother of Kiraz), the peasants steal the crops and run away to Istanbul. Without the peasants and crops, Agha is also forced to sell the village and move to Istanbul. But he cannot keep up with the big city life and consumes all his money and belongings. Agha's wife and relatives leave him during this downfall.
20561;28 Up;Herself;Lynn Johnson;Female;2190885;Himself;Tony Walker;Male;560309;Herself;Jacqueline Bassett;Female;556916;Himself;Bruce Balden;Male;556915;Just two years away from turning 30, participants in Michael Apted's documentary series are facing serious questions of identity and purpose, wondering whether they've found their place in the world.
14774;Cheech & Chong's The Corsican Brothers;Corsican Brother;Cheech Marin;Male;11159;Corsican Brother;Tommy Chong;Male;63208;The Evil Fuckaire;Roy Dotrice;Male;4002;Princess I;Shelby Chong;Female;87152;Two brothers who can feel each others' pain and pleasure mess up the French revolution.
14132;Macross: Do You Remember Love?;Lynn Minmay (voice);Mari Iijima;Female;76394;Hikaru Ichijyo (voice);Arihiro Hase;Male;76395;Misa Hayase (voice);Mika Doi;Female;76396;Roy Focker (voice);Akira Kamiya;Male;54690;"It is A.D. 2009 and the human race is caught in a war between giant humanoids, male Zentrans and female Meltrans. Returning from the edge of our solar system after making a space fold, the SDF-1 Macross makes the long journey back to Earth with survivors of South Ataria Island. ""Macross: Do You Remember Love?"" is an alternate re-telling of the events that occurred in the original 1982 TV series."
11539;Don Camillo;Don Camillo;Terence Hill;Male;15140;Peppone;Colin Blakely;Male;13329;Jo Magro;Mimsy Farmer;Female;36938;Smilzo;Andy Luotto;Male;69785;A priest helps the small town he's stationed in to resolve conflicts by working together.
326853;Hermelinda Linda;;Evita Muñoz;Female;587901;;Julio Aldama;Male;1033128;;Julio Aldama Jr.;Male;963606;;Queta Lavat;Female;1520751;Live action feature based on the Mexican comic about the exploits of a witch living in the outskirts of 'Bondojia', when a ruthless small time politician tries to steal their land in order to build a luxurious condo.
18680;Fear City;Matt Rossi;Tom Berenger;Male;13022;Al Wheeler;Billy Dee Williams;Male;3799;Nicky Parzeno;Jack Scalia;Male;58792;Loretta;Melanie Griffith;Female;29369;Strippers in Manhattan are being stalked and murdered by a psycho. A hard-nosed police detective and a conflicted ex-boxer-turned-private-eye, hired by the strip club owners, set out to find him before he strikes again.
21989;Hot Dog... The Movie;Dan O'Callahan;David Naughton;Male;14463;Sylvia Fonda;Shannon Tweed;Female;45379;Harkin Banks;Patrick Houser;Male;1218958;Sunny;Tracy Smith;Female;173136;When a hopeful young American hot-dogger goes pole-to-pole with an arrogant Austrian pro, the snow really starts to fly! But as hot as it is on the mountain, it gets even hotter off when the pro's ex-girlfriend sets her eyes on the new blood. Who'll win the competition and the girl? Only a race to end all races can determine which skier can really cut the mustard!
255745;Peter Knife;Pedro Navaja;Andrés García;Male;104134;El cumbias;Sergio Goyri;Male;942038;Micky Inflaus;Adalberto Martínez;Male;1043939;Rosa;Maribel Guardia;Female;974801;Based on the international hit song, Pedro Navaja (Peter the Knife) is the story of the coolest, street smart hustler ever to walk the streets of Mexico City. The police are after him, his rivals are after him, and all the while the most beautiful women of Mexico are in the cup of his hand.  - Written by Echo Bridge Home Entertainment
32520;The 8 Diagram Pole Fighter;Yang No. 5;Gordon Liu Chia-Hui;Male;240171;Yang No. 8 (as Ying Hung Wai);Kara Hui;Female;84205;Yang No. 6;Alexander Fu Sheng;Male;244430;Yeh Li-Lin;Johnny Wang Lung-Wei;Male;240174;The Yangs are betrayed by a government official conspiring with the Mongols. All of the Yang family males except the 5th and 6th brother are killed. Fu Sheng loses his mind after the death of his family, while the other brother takes refuge in a Buddhist temple.
18446;Swing Shift;Kay Walsh;Goldie Hawn;Female;18892;Lucky Lockhart;Kurt Russell;Male;6856;Hazel Zanussi;Christine Lahti;Female;77133;Biscuits Toohey;Fred Ward;Male;10430;In 1941 America Kay and her husband are happy enough until he enlists after Pearl Harbor. Against his wishes, his wife takes a job at the local aircraft plant where she meets Hazel, the singer from across the way the two soon become firm friends and with the other girls become increasingly expert workers. As the war drags on Kay finally dates her trumpet playing foreman and life gets complicated
61968;Airwolf: The Movie;Stringfellow Hawke;Jan-Michael Vincent;Male;83037;Dominic Santini;Ernest Borgnine;Male;7502;Archangel;Alex Cord;Male;45206;Dr. Charles Henry Moffet;David Hemmings;Male;15196;Airwolf is capable of supersonic speeds, invisible to radar and armed with ultra state-of-the-art hardware. Airwolf is the most awesome aerial weapon ever developed. When the helicopter is stolen by Libyan mercenaries, Michael Archangel, Project director for the CIA, enlists the help of Vietnam veteran Stringfellow Hawke and his closest friend Dominic Santini, to attempt to recover the Airwolf. The mission throws them into the midst of Middle Eastern violence and destruction, where they come face to face with danger, romance and intrigue in their battle to re-possess the deadliest aerial weapon ever used.
39978;The Twin;Matthias Duval / Mathieu Duval;Pierre Richard;Male;24501;"Elisabeth ""Betty"" Kerner";Camilla More;Female;22050;"Elizabeth ""Liz"" Kerner";Carey More;Female;563576;Ernest Volpinex;Jean-Pierre Kalfon;Male;16350;Matthias Duval is in love, but he can't choose between the two twin sisters Betty and Liz Kerner. To pick up the two sisters, he invents his own twin brother and will play both characters.
24453;The Razor's Edge;Larry Darrell;Bill Murray;Male;1532;Sophie MacDonald;Theresa Russell;Female;9207;Isabel Bradley;Catherine Hicks;Female;2022;Elliott Templeton;Denholm Elliott;Male;656;An American WWI vet undertakes a spiritual quest that takes him from Paris to Nepal to the Himalayas and back to his hometown. Upon his return, he discovers he is not the only one who has changed.
