MovieId;Title;Character1;PersonName1;Sex1;ActorId1;Character2;PersonName2;Sex2;ActorId2;Character3;PersonName3;Sex3;ActorId3;Character4;PersonName4;Sex4;ActorId4;Overview
21845;Rookie of the Year;Henry Rowengartner;Thomas Ian Nicholas;Male;21403;Becky;Colombe Jacobsen-Derstine;Female;9658;Chet Steadman;Gary Busey;Male;2048;Martinella;Albert Hall;Male;8354;"12-year-old Henry Rowengartner, whose late father was a minor league baseball player, grew up dreaming of playing baseball, despite his physical shortcomings. After Henry's arm is broken while trying to catch a baseball at school, the tendon in that arm heals too tightly, allowing Henry to throw pitches that are as fast as 103 mph. Henry is spotted at nearby Wrigley Field by Larry ""Fish"" Fisher, the general manager of the struggling Chicago Cubs, after Henry throws an opponent's home-run ball all the way from the outfield bleachers back to the catcher, and it seems that Henry may be the pitcher that team owner Bob Carson has been praying for."
507;Killing Zoe;Zed;Eric Stoltz;Male;7036;Zoe;Julie Delpy;Female;1146;Eric;Jean-Hugues Anglade;Male;7037;François;Tai Thai;Male;7038;Zed is an American vault-cracker who travels to Paris to meet up with his old friend Eric. Eric and his gang have planned to raid the only bank in the city which is open on Bastille day. After offering his services, Zed soon finds himself trapped in a situation beyond his control when heroin abuse, poor planning and a call-girl named Zoe all conspire to turn the robbery into a very bloody siege.
1987;Benny's Video;Benny;Arno Frisch;Male;20449;Mutter;Angela Winkler;Female;10255;Vater;Ulrich Mühe;Male;8196;Mädchen;Ingrid Stassner;Unknown;20450;A 14-year-old video enthusiast is so caught up in film fantasy that he can no longer relate to the real world, to such an extent that he commits murder and records an on-camera confession for his parents.
51980;Germinal;'La Maheude';Miou-Miou;Female;4274;Étienne Lantier;Renaud;Male;2189;Vincent Maheu, aka Bonnemort;Jean Carmet;Male;24540;Catherine Maheu;Judith Henry;Female;136757;It's mid 19th century, north of France. The story of a coal miner's town. They are exploited by the mine's owner. One day the decide to go on strike, and then the authorities repress them
6;Judgment Night;Frank Wyatt;Emilio Estevez;Male;2880;Mike Peterson;Cuba Gooding Jr.;Male;9777;Fallon;Denis Leary;Male;5724;John Wyatt;Stephen Dorff;Male;10822;While racing to a boxing match, Frank, Mike, John and Rey get more than they bargained for. A wrong turn lands them directly in the path of Fallon, a vicious, wise-cracking drug lord. After accidentally witnessing Fallon murder a disloyal henchman, the four become his unwilling prey in a savage game of cat and mouse as they are mercilessly stalked through the urban jungle in this taut suspense drama.
23210;Six Degrees of Separation;Louisa Kittredge;Stockard Channing;Female;8893;John Kittredge;Donald Sutherland;Male;55636;Paul;Will Smith;Male;2888;Geoffrey Miller;Ian McKellen;Male;1327;The story of a young, gay, black, con artist who, posing as the son of Sidney Poitier, cunningly maneuvers his way into the lives of a white, upper-class New York family.
10443;Fearless;Max Klein;Jeff Bridges;Male;1229;Laura Klein;Isabella Rossellini;Female;6588;Carla Rodrigo;Rosie Perez;Female;4810;Brillstein;Tom Hulce;Male;3999;After a terrible air disaster, survivor Max Klein emerges a changed person. Unable to connect to his former life or to wife Laura, he feels godlike and invulnerable. When psychologist Bill Perlman is unable to help Max, he has Max meet another survivor, Carla Rodrigo, who is wracked with grief and guilt since her baby died in the crash which she and Max survived.
31578;Body Bags;The Coroner;John Carpenter;Male;11770;Bill;Robert Carradine;Male;62036;Anne;Alex Datcher;Female;46924;Pete;David Naughton;Male;14463;Three tales, each more terrifying than the last. . . . A woman who is stalked by an axe-weilding maniac . . . a man who pays the ultimate price for a beautiful head of hair . . . and a vision of life—seen through the eyes of a killer.
2149;Body of Evidence;Rebeca Carlson;Madonna;Female;3125;Frank Dulaney;Willem Dafoe;Male;5293;Sharon Dulaney;Julianne Moore;Female;1231;Joanne Braslow;Anne Archer;Female;10427;When an elderly millionaire is found dead with cocaine in his system, his will leaves $8 million to Rebecca Carlson, who was having an affair with him. District attorney Robert Garrett decides to prosecute Rebecca, arguing that she deliberately engaged in wild sex with the old man to overexcite him and lead to his premature death. Defense attorney Frank Dulaney defends Rebecca in court while getting sucked into a dangerous affair with her.
10655;Gettysburg;Col. Joshua Chamberlain;Jeff Daniels;Male;8447;Lieut. Gen. James Longstreet;Tom Berenger;Male;13022;Gen. Robert E. Lee;Martin Sheen;Male;8349;Brig. Gen. John Buford;Sam Elliott;Male;16431;In the summer of 1863, General Robert E. Lee leads the Confederate Army of Northern Virginia into Gettysburg, Pennsylvania with the goal of marching through to Washington, D.C. The Union Army of the Potomac, under the command of General George G. Meade, forms a defensive position to confront the rebel forces in what will prove to be the decisive battle of the American Civil War.
8494;Weekend at Bernie's II;Larry Wilson;Andrew McCarthy;Male;37041;Richard Parker;Jonathan Silverman;Male;55265;Bernie Lomax;Terry Kiser;Male;55267;Claudia;Troy Byer;Female;42974;Everybody's favorite stiff is back! Working fools Larry Wilson and Richard Parker have uncovered a dirty, little secret: Their former boss, Bernie Lomax, embezzled $2 million and placed it in a safe deposit box in the Caribbean. Now, the boys are ready to go after the loot, but they can't do it alone -- they need poor Bernie's help. Can the buddies give their ex-boss new life?
10427;Red Rock West;Michael Williams;Nicolas Cage;Male;2963;Lyle from Dallas;Dennis Hopper;Male;2778;Suzanne Brown;Lara Flynn Boyle;Female;6684;Wayne Brown;J. T. Walsh;Male;22131;When a promised job for Texan Michael fails to materialise in Wyoming, Mike is mistaken by Wayne to be the hitman he hired to kill his unfaithful wife, Suzanne. Mike takes full advantage of the situation, collects the money and runs. During his getaway, things go wrong, and soon get worse when he runs into the real hitman, Lyle.
13203;Son in Law;Crawl;Pauly Shore;Male;64998;Rebecca Warner;Carla Gugino;Female;17832;Walter Warner;Lane Smith;Male;65019;Tracy;Tiffani Thiessen;Female;19187;Country girl Rebecca has spent most of her life on a farm in South Dakota, and, when she goes away to college in Los Angeles, Rebecca immediately feels out of place in the daunting urban setting. She is befriended by a savvy party animal named Crawl, who convinces the ambivalent Rebecca to stay in the city. When Thanksgiving break rolls around, Rebecca, no longer an innocent farm girl, invites Crawl back to South Dakota, where he pretends to be her fiancé.
12780;Iron Monkey;Dr. Yang / Iron Monkey;Yu Rongguang;Male;120725;Wong Kei-ying;Donnie Yen;Male;1341;Miss Orchid;Jean Wang;Female;73472;Wong Fei-Hung;Angie Tsang Sze-Man;Unknown;130517;"Iron Monkey is a Hong Kong variation of Robin Hood. Corrupt officials of a Chinese village are robbed by a masked bandit known as ""Iron Monkey"", named after a benevolent deity. When all else fails, the Governor forces a traveling physician into finding the bandit. The arrival of an evil Shaolin monk, brings the physician and Iron Monkey together to battle the corrupt government."
15765;What's Love Got to Do with It;Anna Mae Bullock / Tina Turner;Angela Bassett;Female;9780;Ike Turner;Laurence Fishburne;Male;2975;Jackie;Vanessa Bell Calloway;Female;100653;Zelma Bullock;Jenifer Lewis;Female;15899;"What's Love Got to Do with It is a 1993 American biographical film directed by Brian Gibson, based on the life of Tina Turner. The film stars Angela Bassett as Tina Turner and Laurence Fishburne as Ike Turner.  The screenplay was adapted by Kate Lanier from the book I, Tina co-written by Turner with Kurt Loder. Both Ike and Tina assigned rights to Lanier for their lives to be dramatized in the film. The film's soundtrack featured the hit song ""I Don't Wanna Fight"", which went to number one in seven countries."
8223;Kika;Kika;Verónica Forqué;Female;54146;Andrea Caracortada;Victoria Abril;Female;25256;Nicholas Pierce;Peter Coyote;Male;9979;Juana;Rossy de Palma;Female;25258;Kika, a happy-go-lucky, naïve cosmetologist, is called to the mansion of Nicholas Pierce, an American writer, to make-up the corpse of his stepson, Ramón, a fashion photographer with voyeuristic tendencies. He was however merely catatonic and suddenly awoke feeling he owns her his life regained. Ramón eventually proposes to Kika and they might have lived happily ever after but first they have to cope with Kika's torrid affair with Nicholas, the traumatic and suspicious suicide of Ramón's mother, and the intrusive gaze of a scarred exploitative tabloid-TV star (and Ramón's former psychologist), Andrea Caracortada.
10445;Shadowlands;C. S. 'Jack' Lewis;Anthony Hopkins;Male;4173;Joy Gresham;Debra Winger;Female;26513;Warnie Lewis;Edward Hardwicke;Male;3545;Christopher Riley;John Wood;Male;8937;C.S. Lewis, a world-renowned writer and professor, leads a passionless life until he meets spirited poet Joy Gresham
14135;Bad Boy Bubby;Bubby;Nicholas Hope;Male;81172;Pop;Ralph Cotterill;Male;97331;Mum;Claire Benito;Female;559315;Yobbo;Syd Brisbane;Male;112705;Bad Boy Bubby is just that: a bad boy. So bad, in fact, that his mother has kept him locked in their house for his entire thirty years, convincing him that the air outside is poisonous. After a visit from his estranged father, circumstances force Bubby into the waiting world, a place which is just as unusual to him as he is to the world.
31642;Heaven & Earth;Steve Butler;Tommy Lee Jones;Male;2176;Paul;Robert John Burke;Male;31512;Big Mike;Timothy Carhart;Male;17396;Young Sergeant;Tim Guinee;Male;40275;Le Ly lives in a small Vietnamese village whose serenity is shattered when war breaks out. Caught between the Viet Cong and the South Vietnamese army, the village is all but destroyed. After being both brutalized and raped, Le Ly resolves to flee. She leaves for the city, surviving desperate situations, but surviving nonetheless. Eventually she meets a U.S. Marine named Steve Butler who treats her kindly and tells her he would like to be married -- maybe to her.
25389;Matinee;Lawrence Woolsey;John Goodman;Male;1230;Ruth Corday / Carole;Cathy Moriarty;Female;14702;Gene Loomis;Simon Fenton;Male;75789;Stan;Omri Katz;Male;65309;A showman introduces a small coastal town to a unique movie experience and capitalises on the Cuban Missile crisis hysteria with a kitschy horror extravaganza combining film effects, stage props and actors in rubber suits in this salute to the B-movie.
35588;Geronimo: An American Legend;Lt. Charles Gatewood;Jason Patric;Male;12261;Geronimo;Wes Studi;Male;15853;Brig. Gen. George Crook;Gene Hackman;Male;193;Chief of Scouts Al Sieber;Robert Duvall;Male;3087;The Apache Indians have reluctantly agreed to settle on a US Government approved reservation. Not all the Apaches are able to adapt to the life of corn farmers. One in particular, Geronimo, is restless. Pushed over the edge by broken promises and necessary actions by the government, Geronimo and thirty or so other warriors form an attack team which humiliates the government by evading capture, while reclaiming what is rightfully theirs.
8291;Poetic Justice;Justice;Janet Jackson;Female;54421;Lucky;Tupac Shakur;Male;54422;Iesha;Regina King;Female;9788;Chicago;Joe Torry;Male;54423;Still grieving after the murder of her boyfriend, hairdresser Justice writes poetry to deal with the pain of her loss. Unable to get to Oakland to attend a convention because of her broken-down car, Justice gets a lift with her friend, Iesha and Iesha's postal worker boyfriend, Chicago. Along for the ride is Chicago's co-worker, Lucky, to whom Justice grows close after some initial problems. But is she ready to open her heart again?
11143;Tai-Chi Master;Shang Jun Biao;Jet Li;Male;1336;Qiu Xue (Falling Snow);Michelle Yeoh;Female;1620;Dong Tian Biao;Chin Siu-Ho;Male;544797;Head Master;Yue Hoi;Male;1059241;Falsely accused for cheating in a martial arts competition, two boyhood friends are banished from their Shaolin Temple and go their separate ways. As adults, they join opposing sides in a civil war. When one betrays the other, they settle their differences mano-a-mano.
2047;The Real McCoy;Karen McCoy;Kim Basinger;Female;326;J.T. Barker;Val Kilmer;Male;5576;Jack Schmidt;Terence Stamp;Male;28641;Guard;David Dwyer;Male;21084;Karen McCoy is released from prison with nothing but the clothes on her back. Before being incarcerated Karen was the bank robber of her time, but now she wishes for nothing more than to settle down and start a new life. Unfortunately between a dirty parole officer, old business partners, and an idiot ex-husband she will have to do the unthinkable in order to save her son.
10419;Swing Kids;Peter Müller;Robert Sean Leonard;Male;2692;Thomas Berger;Christian Bale;Male;3894;Arvid;Frank Whaley;Male;11805;Frau Müller;Barbara Hershey;Female;10767;The story of a close-knit group of young kids in Nazi Germany who listen to banned swing music from the US. Soon dancing and fun leads to more difficult choices as the Nazi's begin tightening the grip on Germany. Each member of the group is forced to face some tough choices about right, wrong, and survival.
18215;Boxing Helena;Dr. Nick Cavanaugh;Julian Sands;Male;6104;Helena;Sherilyn Fenn;Female;6681;Ray O'Malley;Bill Paxton;Male;2053;Dr. Lawrence Augustine;Art Garfunkel;Male;64928;A top surgeon is besotted with a beautiful woman who once rebuffed him. Unable to come to terms with life without her, he tries to convince her that they need each other. She has other ideas, but a horrific accident leaves her at his mercy.
16130;La Classe américaine;Dubbing Voice (voice);Christine Delaroche;Female;28146;Dubbing Voice (voice);Évelyne Grandjean;Female;1373156;Dubbing Voice (voice);Marc Cassot;Male;590963;Dubbing Voice (voice);Patrick Guillemin;Male;24469;George Abitbol, the classiest man in the world, dies tragically during a cruise. With his last breath, he whispers: “Shitty world.” The director of an American newspaper, wondering about the meaning of these intriguing final words, asks his three best investigators, Dave, Peter and Steven, to solve the mystery… (16 French actors dub scenes from various Warner Bros. films to create a parody of Citizen Kane, 1941.)
31022;Aftermath;Forensic;Pep Tosar;Male;935934;Cadáver Vin;Xevi Collellmir;Unknown;1068684;Médico #2;Jordi Tarrida;Unknown;1681778;Watchman;Ángel Tarris;Unknown;1681779;When the others leave for the night, the last mortician begins to fondle the corpses. He quickly moves to the corpse of a young woman who died in a car crash.
46828;Son of the Pink Panther;Gendarme Jacques Gambrelli;Roberto Benigni;Male;4818;Police Commisioner Charles Dreyfus;Herbert Lom;Male;14503;Maria Gambrelli;Claudia Cardinale;Female;4959;Queen;Shabana Azmi;Female;85672;The eighth and last of the Pink Panther series. The illegitimate son of Inspector Clouseau is on the case of the kidnapped Princess Yasmin.
41659;My Life;Bob Jones;Michael Keaton;Male;2232;Gail Jones;Nicole Kidman;Female;2227;Paul Ivanovich;Bradley Whitford;Male;11367;Theresa;Queen Latifah;Female;15758;It seems that Bob Jones has everything a man could want, namely a fulfilling job and a beautiful, pregnant wife, Gail. But Bob's life is turned upside-down when he is diagnosed with cancer and given four months to live -- not even enough time to see his first child's birth. To cleanse himself of demons in his remaining days, Bob makes a video diary, hoping to pass along some wisdom to his future child. Along the way, he discovers a lot about himself.
26333;Untamed Heart;Adam;Christian Slater;Male;2224;Caroline;Marisa Tomei;Female;3141;Cindy;Rosie Perez;Female;4810;Howard;Kyle Secor;Male;40258;Caroline, a young waitress who seems to have bad taste in men, is on her way home one night when thugs attempt to rape her. Adam, the mysterious busboy who works at the same diner, helps fight off the assailants, and she begins a relationship with him -- but not all their fellow Minnesotans are happy for them. Meanwhile, the couple face their own difficulties when Caroline finds about Adam's past, including his unique health condition.
9409;Another Stakeout;Det. Chris Lecce;Richard Dreyfuss;Male;3037;Det. Bill Reimers;Emilio Estevez;Male;2880;A.D.A. Gina Garrett;Rosie O'Donnell;Female;12929;Brian O'Hara;Dennis Farina;Male;1117;Chris and Bill are called upon for their excellent surveillance record to stakeout a lakeside home where a Mafia trial witness is believed to be heading or already hiding.
40508;3 Ninjas Knuckle Up;Grandpa;Victor Wong;Male;11395;Jack;Charles Napier;Male;16119;Rocky;Michael Treanor;Male;80280;Colt;Max Elliott Slade;Male;8187;Rocky, Colt and TumTum must battle an evil wealthy toxic waste dumper in order to save a local Indian tribe and their friend Joe. The 3 Ninjas must help find Joe's father and find a secret disk that contains evidence that could stop the toxic landfill that is destroying the Indian community. However the town is owned by the rich man and he controls the police and even the mayor. They must fight a motorcycle gang and renegade cowboys in this non-stop ninja adventure.
9261;The Wedding Banquet;Mrs. Gao;Gua Ah-leh;Female;57057;Mr. Gao;Lung Sihung;Male;1623;Wei-Wei;May Chin;Female;57056;Wai-Tung Gao;Winston Chao;Male;57054;A Taiwanese-American man is happily settled in New York with his American boyfriend. He plans a marriage of convenience to a Chinese woman in order to keep his parents off his back and to get the woman a green card. Chaos follows when his parents arrive in New York for the wedding.
17189;Battle Angel;Alita / Gally (voice);Miki Ito;Female;122660;Daisuke Ido (voice);Shunsuke Kariya;Unknown;144942;Yuugo (voice);Kappei Yamaguchi;Male;68472;Chiren (voice);Mami Koyama;Female;1680;In his travels as a bounty hunter, Hunter-Warrior and cyborg healer Ido one day discovers and repairs the remnants of a cyborg whom he names Gally. Though possessing the body of a young woman, Gally now embodies Ido's most sophisticated and lethal cybernetic skills. The preternaturally strong, amnesiac Gally begins to forge a life for herself in a world where every day is a struggle for survival.
1413;M. Butterfly;René Gallimard;Jeremy Irons;Male;16940;Song Liling;John Lone;Male;11389;Jeanne Gallimard;Barbara Sukowa;Female;23378;Ambassador Toulon;Ian Richardson;Male;385;In 1960s China, French diplomat Rene Gallimard falls in love with an opera singer, Song Liling - but Song is not at all who Gallimard thinks.
44435;Trauma;David Parsons;Christopher Rydell;Male;111702;Aura Petrescu;Asia Argento;Female;18514;Adriana Petrescu;Piper Laurie;Female;6721;Dr. Judd;Frederic Forrest;Male;8351;An anorexic young woman escapes from a psychiatric clinic and meets a young man who wants to help. She is caught and returned to her parents, who are soon beheaded by a garrotting stranger making the rounds about town, apparently striking only when it rains. The orphaned young woman and her new lover launch their own investigation and are endangered when a link is discovered with the victims and a particular operation performed years before.
34723;The Adventures of Huck Finn;Huck Finn;Elijah Wood;Male;109;Jim;Courtney B. Vance;Male;24047;The Duke;Robbie Coltrane;Male;1923;The King;Jason Robards;Male;4765;Mischievous Huck Finn is unnerved when his father, reemerging after years away, kidnaps him in an attempt to take away a $600 inheritance from his late mother. Fearing for his life, Huck fakes his own death and escapes. He soon runs into his friend, Jim, a slave fleeing his master. Together, the pair embarks on a raft journey down the Mississippi River, staying ahead of pursuers who blame the slave for Huck's alleged murder.
6593;Godzilla vs. Mechagodzilla II;Kazuma Aoki;Masahiro Takashima;Male;50653;Azusa Gojo;Ryoko Sano;Female;50654;Miki Saegusa;Megumi Odaka;Female;50655;Professor Omae;Yūsuke Kawazu;Male;50656;The U.N.G.C.C. (United Nations Godzilla Countermeasure Center) recovers the remains of Mecha-King Ghidorah and construct Mechagodzilla as a countermeasure against Godzilla. Meanwhile, a giant egg is discovered along with a new monster called Rodan. The egg is soon found to be none other than an infant Godzillasaurus.
15797;Only the Strong;Louis Stevens;Mark Dacascos;Male;18702;Silverio;Paco Christian Prieto;Male;1181001;Dianna;Stacey Travis;Female;31714;Orlando Aliveres;Richard Coca;Male;157609;Former Green Beret Louis Stevens returns to his hometown of Miami after completing military service in Brazil, only to learn that his old high school has become a haven for gangs and drug dealers. After Stevens uses his capoeira skills to kick several drug dealers off of the school property, Kerrigan, one of Stevens' old teachers, sees the impact that Stevens has on the students. Kerrigan gives him the task of teaching Capoeira to a handful of the worst at-risk students at the school.
19552;The Scent of Green Papaya;Mui Age 20;Trần Nữ Yên Khê;Female;113388;Mui Age 10;Man San Lu;Female;151165;La mère;Thi Loc Truong;Female;1275912;La vieille;Nguyen Anh Hoa;Unknown;1118628;A Vietnamese servant girl, Mui, observes lives within two different Saigon families: the first, a woman textile seller with three boys and a frequently absent husband, the second, a handsome young pianist with his fiancée.
10619;Once Upon a Chinese Fighter;Wong Fei Hung;Jet Li;Male;1336;Aunt 13;Rosamund Kwan;Female;65987;Leung Foon;Max Mok Siu-Chung;Male;65992;Kwai Geuk-Chat (Club Foot);Xiong Xin-Xin;Male;131732;Master Wong and his disciples enroll in the 'Dancing Lion Competition' to stop an assassination plot and to battle an arrogant, deceitful opponent.
19371;Mr. Nanny;Sean Armstrong;Hulk Hogan;Male;16620;Thanatos;David Johansen;Male;57116;Kate Mason;Madeline Zima;Female;84613;Alex Mason Jr.;Robert Hy Gorman;Unknown;84598;A former pro-wrestler is hired to be the bodyguard/nanny for a couple of bratty kids whose inventor father is being stalked by a rival.
74004;Pretty Princess;Marco;Raoul Bova;Male;5412;principessa Sofia/Lisa;Barbara Snellenburg;Unknown;263787;principe Massimiliano;David Warner;Male;2076;regina Cristina;Susannah York;Female;13326;A princess from a Nordic European country is obligated to marry the boy her family chose. She escapes and discovers love in the arms of a beautiful swimming teacher.
25466;Mutant Action;Ramon Yarritu;Antonio Resines;Male;37569;Alex Abadie;Álex Angulo;Male;3813;Patricia Orujo;Frédérique Feder;Female;1354;Juan Abadie;Juan Viadas;Male;93830;Waging war against all things glamorous and beautiful, crippled terrorists Acción Mutante plot a series of attacks on society's elite, and attempt the kidnapping of a wealthy socialite at her elaborate wedding reception.
32764;71 Fragments of a Chronology of Chance;Marian Radu;Gabriel Cosmin Urdes;Male;150573;Max;Lukas Miko;Male;150574;Tomek;Otto Grünmandl;Male;61471;Inge Brunner;Anne Bennent;Female;37069;71 scenes revolving around multiple Viennese residents who are by chance involved with a senseless gun slaughter on Christmas Eve.
11244;The Meteor Man;Jefferson Reed;Robert Townsend;Male;68750;Mrs. Reed;Marla Gibbs;Female;68751;Michael;Eddie Griffin;Male;62842;Ted Reed;Robert Guillaume;Male;8294;One night Jefferson Reed gets hit in the chest by a souped-up chunk of meteor. So he can fly, but he's scared of heights. He can master the information in any book ... for about thirty seconds. Now his friends and family want him to protect their community from the dreaded Golden Lords.
2625;Mr. Jones;Mr. Jones;Richard Gere;Male;1205;Dr. Elizabeth 'Libbie' Bowen;Lena Olin;Female;5313;Dr. Catherine Holland;Anne Bancroft;Female;10774;Dr. Patrick Shaye;Tom Irwin;Male;27544;The story about the relationship between a manic depressive man, Mr Jones, and the female doctor who takes more than a professional interest in his treatment.
12574;Cop and ½;Nick McKenna;Burt Reynolds;Male;16475;Devon Butler;Norman D. Golden II;Male;72885;Rachel;Ruby Dee;Female;15532;Captain Rubio;Holland Taylor;Female;11318;When a pint-sized 8-year-old kid witnesses a murder he offers to help the police, if they make him a cop, too. Saddled with this streetwise sidekick, a hardboiled cop is forced to take his new partner seriously as they race the clock to bring the bad guys to justice.
2088;Romeo Is Bleeding;Jack Grimaldi;Gary Oldman;Male;64;Mona Demarkov;Lena Olin;Female;5313;Natalie Grimaldi;Annabella Sciorra;Female;18750;Sheri;Juliette Lewis;Female;3196;A corrupt cop gets in over his head when he tries to assassinate a beautiful Russian hit-woman.
34024;King of the Hill;Aaron Kurlander;Jesse Bradford;Male;17772;Mr. Kurlander;Jeroen Krabbé;Male;1924;Mrs. Kurlander;Lisa Eichhorn;Female;28950;Miss Mathey;Karen Allen;Female;650;Based on the Depression-era bildungsroman memoir of writer A. E. Hotchner, the film follows the story of a boy struggling to survive on his own in a hotel in St. Louis after his mother is committed to a sanatorium with tuberculosis. His father, a German immigrant and traveling salesman working for the Hamilton Watch Company, is off on long trips from which the boy cannot be certain he will return.
